profiler_out/cutlass3x_sm90_tensorop_gemm_f16_f16_f32_f16_f16_tt_1/4096x5120x4096.log



=============================
  Problem ID: 1

        Provider: [1;37mCUTLASS[0m
   OperationKind: [1;37mgemm[0m
       Operation: cutlass3x_sm90_tensorop_gemm_f16_f16_f32_f16_f16_128x128x64_2x1x1_0_ttn_align8

          Status: [1;37mSuccess[0m
    Verification: [1;37mON[0m
     Disposition: [1;32mPassed[0m

reference_device: Passed
          cuBLAS: Not run
           cuDNN: Not run

       Arguments: --gemm_kind=universal --m=4096 --n=5120 --k=4096 --A=f16:row --B=f16:row --C=f16:column --D=f16:column  \
                  --alpha=1 --beta=0 --split_k_mode=serial --split_k_slices=1 --batch_count=1 --raster_order=along_n  \
                  --runtime_input_datatype_a=invalid --runtime_input_datatype_b=invalid --use_pdl=false --enable_sm90_mixed_dtype_shuffle_test=false  \
                  --swizzle_size=1 --op_class=tensorop --accum=f32 --cta_m=128 --cta_n=128 --cta_k=64 --cluster_m=1 --cluster_n=1  \
                  --cluster_k=1 --cluster_m_fallback=0 --cluster_n_fallback=0 --cluster_k_fallback=0 --stages=7 --warps_m=4  \
                  --warps_n=2 --warps_k=1 --inst_m=64 --inst_n=128 --inst_k=16 --min_cc=90 --max_cc=90

           Bytes: 117440512  bytes
           FLOPs: 171840634880  flops
           FLOPs/Byte: 1463

         Runtime: 0.257456  ms
          Memory: 424.83 GiB/s

            Math: 667456 GFLOP/s



=============================
  Problem ID: 1

        Provider: [1;37mCUTLASS[0m
   OperationKind: [1;37mgemm[0m
       Operation: cutlass3x_sm90_tensorop_gemm_f16_f16_f32_f16_f16_128x128x64_2x1x1_0_ttn_align8_warpspecialized_epi_nosmem

          Status: [1;37mSuccess[0m
    Verification: [1;37mON[0m
     Disposition: [1;32mPassed[0m

reference_device: Passed
          cuBLAS: Not run
           cuDNN: Not run

       Arguments: --gemm_kind=universal --m=4096 --n=5120 --k=4096 --A=f16:row --B=f16:row --C=f16:column --D=f16:column  \
                  --alpha=1 --beta=0 --split_k_mode=serial --split_k_slices=1 --batch_count=1 --raster_order=along_n  \
                  --runtime_input_datatype_a=invalid --runtime_input_datatype_b=invalid --use_pdl=false --enable_sm90_mixed_dtype_shuffle_test=false  \
                  --swizzle_size=2 --op_class=tensorop --accum=f32 --cta_m=128 --cta_n=128 --cta_k=64 --cluster_m=1 --cluster_n=1  \
                  --cluster_k=1 --cluster_m_fallback=0 --cluster_n_fallback=0 --cluster_k_fallback=0 --stages=7 --warps_m=4  \
                  --warps_n=1 --warps_k=1 --inst_m=64 --inst_n=128 --inst_k=16 --min_cc=90 --max_cc=90

           Bytes: 117440512  bytes
           FLOPs: 171840634880  flops
           FLOPs/Byte: 1463

         Runtime: 0.286758  ms
          Memory: 381.42 GiB/s

            Math: 599254 GFLOP/s



=============================
  Problem ID: 1

        Provider: [1;37mCUTLASS[0m
   OperationKind: [1;37mgemm[0m
       Operation: cutlass3x_sm90_tensorop_gemm_f16_f16_f32_f16_f16_128x128x64_2x1x1_0_ttn_align8_warpspecialized_pingpong_epi_tma

          Status: [1;37mSuccess[0m
    Verification: [1;37mON[0m
     Disposition: [1;32mPassed[0m

reference_device: Passed
          cuBLAS: Not run
           cuDNN: Not run

       Arguments: --gemm_kind=universal --m=4096 --n=5120 --k=4096 --A=f16:row --B=f16:row --C=f16:column --D=f16:column  \
                  --alpha=1 --beta=0 --split_k_mode=serial --split_k_slices=1 --batch_count=1 --raster_order=along_n  \
                  --runtime_input_datatype_a=invalid --runtime_input_datatype_b=invalid --use_pdl=false --enable_sm90_mixed_dtype_shuffle_test=false  \
                  --swizzle_size=1 --op_class=tensorop --accum=f32 --cta_m=128 --cta_n=128 --cta_k=64 --cluster_m=1 --cluster_n=1  \
                  --cluster_k=1 --cluster_m_fallback=0 --cluster_n_fallback=0 --cluster_k_fallback=0 --stages=6 --warps_m=4  \
                  --warps_n=1 --warps_k=1 --inst_m=64 --inst_n=128 --inst_k=16 --min_cc=90 --max_cc=90

           Bytes: 117440512  bytes
           FLOPs: 171840634880  flops
           FLOPs/Byte: 1463

         Runtime: 0.246494  ms
          Memory: 443.722 GiB/s

            Math: 697138 GFLOP/s



=============================
  Problem ID: 1

        Provider: [1;37mCUTLASS[0m
   OperationKind: [1;37mgemm[0m
       Operation: cutlass3x_sm90_tensorop_gemm_f16_f16_f32_f16_f16_128x128x64_2x1x1_0_ttn_align8_warpspecialized_pingpong_epi_nosmem

          Status: [1;37mSuccess[0m
    Verification: [1;37mON[0m
     Disposition: [1;32mPassed[0m

reference_device: Passed
          cuBLAS: Not run
           cuDNN: Not run

       Arguments: --gemm_kind=universal --m=4096 --n=5120 --k=4096 --A=f16:row --B=f16:row --C=f16:column --D=f16:column  \
                  --alpha=1 --beta=0 --split_k_mode=serial --split_k_slices=1 --batch_count=1 --raster_order=along_n  \
                  --runtime_input_datatype_a=invalid --runtime_input_datatype_b=invalid --use_pdl=false --enable_sm90_mixed_dtype_shuffle_test=false  \
                  --swizzle_size=2 --op_class=tensorop --accum=f32 --cta_m=128 --cta_n=128 --cta_k=64 --cluster_m=1 --cluster_n=1  \
                  --cluster_k=1 --cluster_m_fallback=0 --cluster_n_fallback=0 --cluster_k_fallback=0 --stages=7 --warps_m=4  \
                  --warps_n=1 --warps_k=1 --inst_m=64 --inst_n=128 --inst_k=16 --min_cc=90 --max_cc=90

           Bytes: 117440512  bytes
           FLOPs: 171840634880  flops
           FLOPs/Byte: 1463

         Runtime: 0.246151  ms
          Memory: 444.34 GiB/s

            Math: 698110 GFLOP/s



=============================
  Problem ID: 1

        Provider: [1;37mCUTLASS[0m
   OperationKind: [1;37mgemm[0m
       Operation: cutlass3x_sm90_tensorop_gemm_f16_f16_f32_f16_f16_128x128x64_2x1x1_0_ttn_align8_warpspecialized_cooperative_epi_nosmem

          Status: [1;37mSuccess[0m
    Verification: [1;37mON[0m
     Disposition: [1;32mPassed[0m

reference_device: Passed
          cuBLAS: Not run
           cuDNN: Not run

       Arguments: --gemm_kind=universal --m=4096 --n=5120 --k=4096 --A=f16:row --B=f16:row --C=f16:column --D=f16:column  \
                  --alpha=1 --beta=0 --split_k_mode=serial --split_k_slices=1 --batch_count=1 --raster_order=along_n  \
                  --runtime_input_datatype_a=invalid --runtime_input_datatype_b=invalid --use_pdl=false --enable_sm90_mixed_dtype_shuffle_test=false  \
                  --swizzle_size=1 --op_class=tensorop --accum=f32 --cta_m=128 --cta_n=128 --cta_k=64 --cluster_m=1 --cluster_n=1  \
                  --cluster_k=1 --cluster_m_fallback=0 --cluster_n_fallback=0 --cluster_k_fallback=0 --stages=7 --warps_m=4  \
                  --warps_n=2 --warps_k=1 --inst_m=64 --inst_n=128 --inst_k=16 --min_cc=90 --max_cc=90

           Bytes: 117440512  bytes
           FLOPs: 171840634880  flops
           FLOPs/Byte: 1463

         Runtime: 0.257497  ms
          Memory: 424.762 GiB/s

            Math: 667349 GFLOP/s



=============================
  Problem ID: 1

        Provider: [1;37mCUTLASS[0m
   OperationKind: [1;37mgemm[0m
       Operation: cutlass3x_sm90_tensorop_gemm_f16_f16_f32_f16_f16_128x128x64_2x1x1_0_ttn_align8_warpspecialized_cooperative_epi_tma

          Status: [1;37mSuccess[0m
    Verification: [1;37mON[0m
     Disposition: [1;32mPassed[0m

reference_device: Passed
          cuBLAS: Not run
           cuDNN: Not run

       Arguments: --gemm_kind=universal --m=4096 --n=5120 --k=4096 --A=f16:row --B=f16:row --C=f16:column --D=f16:column  \
                  --alpha=1 --beta=0 --split_k_mode=serial --split_k_slices=1 --batch_count=1 --raster_order=along_n  \
                  --runtime_input_datatype_a=invalid --runtime_input_datatype_b=invalid --use_pdl=false --enable_sm90_mixed_dtype_shuffle_test=false  \
                  --swizzle_size=1 --op_class=tensorop --accum=f32 --cta_m=128 --cta_n=128 --cta_k=64 --cluster_m=1 --cluster_n=1  \
                  --cluster_k=1 --cluster_m_fallback=0 --cluster_n_fallback=0 --cluster_k_fallback=0 --stages=6 --warps_m=4  \
                  --warps_n=2 --warps_k=1 --inst_m=64 --inst_n=128 --inst_k=16 --min_cc=90 --max_cc=90

           Bytes: 117440512  bytes
           FLOPs: 171840634880  flops
           FLOPs/Byte: 1463

         Runtime: 0.241506  ms
          Memory: 452.887 GiB/s

            Math: 711537 GFLOP/s



=============================
  Problem ID: 1

        Provider: [1;37mCUTLASS[0m
   OperationKind: [1;37mgemm[0m
       Operation: cutlass3x_sm90_tensorop_gemm_f16_f16_f32_f16_f16_128x128x64_2x1x1_0_ttn_align8_stream_k_warpspecialized_cooperative_epi_nosmem

          Status: [1;37mSuccess[0m
    Verification: [1;37mON[0m
     Disposition: [1;32mPassed[0m

reference_device: Passed
          cuBLAS: Not run
           cuDNN: Not run

       Arguments: --gemm_kind=universal --m=4096 --n=5120 --k=4096 --A=f16:row --B=f16:row --C=f16:column --D=f16:column  \
                  --alpha=1 --beta=0 --split_k_mode=serial --split_k_slices=1 --batch_count=1 --raster_order=along_n  \
                  --runtime_input_datatype_a=invalid --runtime_input_datatype_b=invalid --use_pdl=false --enable_sm90_mixed_dtype_shuffle_test=false  \
                  --swizzle_size=1 --op_class=tensorop --accum=f32 --cta_m=128 --cta_n=128 --cta_k=64 --cluster_m=1 --cluster_n=1  \
                  --cluster_k=1 --cluster_m_fallback=0 --cluster_n_fallback=0 --cluster_k_fallback=0 --stages=7 --warps_m=4  \
                  --warps_n=2 --warps_k=1 --inst_m=64 --inst_n=128 --inst_k=16 --min_cc=90 --max_cc=90

           Bytes: 117440512  bytes
           FLOPs: 171840634880  flops
           FLOPs/Byte: 1463

         Runtime: 0.263629  ms
          Memory: 414.883 GiB/s

            Math: 651828 GFLOP/s



=============================
  Problem ID: 1

        Provider: [1;37mCUTLASS[0m
   OperationKind: [1;37mgemm[0m
       Operation: cutlass3x_sm90_tensorop_gemm_f16_f16_f32_f16_f16_128x128x64_2x1x1_0_ttn_align8_stream_k_warpspecialized_cooperative_epi_tma

          Status: [1;37mSuccess[0m
    Verification: [1;37mON[0m
     Disposition: [1;32mPassed[0m

reference_device: Passed
          cuBLAS: Not run
           cuDNN: Not run

       Arguments: --gemm_kind=universal --m=4096 --n=5120 --k=4096 --A=f16:row --B=f16:row --C=f16:column --D=f16:column  \
                  --alpha=1 --beta=0 --split_k_mode=serial --split_k_slices=1 --batch_count=1 --raster_order=along_n  \
                  --runtime_input_datatype_a=invalid --runtime_input_datatype_b=invalid --use_pdl=false --enable_sm90_mixed_dtype_shuffle_test=false  \
                  --swizzle_size=1 --op_class=tensorop --accum=f32 --cta_m=128 --cta_n=128 --cta_k=64 --cluster_m=1 --cluster_n=1  \
                  --cluster_k=1 --cluster_m_fallback=0 --cluster_n_fallback=0 --cluster_k_fallback=0 --stages=6 --warps_m=4  \
                  --warps_n=2 --warps_k=1 --inst_m=64 --inst_n=128 --inst_k=16 --min_cc=90 --max_cc=90

           Bytes: 117440512  bytes
           FLOPs: 171840634880  flops
           FLOPs/Byte: 1463

         Runtime: 0.253417  ms
          Memory: 431.6 GiB/s

            Math: 678094 GFLOP/s



=============================
  Problem ID: 1

        Provider: [1;37mCUTLASS[0m
   OperationKind: [1;37mgemm[0m
       Operation: cutlass3x_sm90_tensorop_gemm_f16_f16_f32_f16_f16_128x16x64_1x8x1_0_ttn_align8

          Status: [1;37mSuccess[0m
    Verification: [1;37mON[0m
     Disposition: [1;32mPassed[0m

reference_device: Passed
          cuBLAS: Not run
           cuDNN: Not run

       Arguments: --gemm_kind=universal --m=4096 --n=5120 --k=4096 --A=f16:row --B=f16:row --C=f16:column --D=f16:column  \
                  --alpha=1 --beta=0 --split_k_mode=serial --split_k_slices=1 --batch_count=1 --raster_order=along_m  \
                  --runtime_input_datatype_a=invalid --runtime_input_datatype_b=invalid --use_pdl=false --enable_sm90_mixed_dtype_shuffle_test=false  \
                  --swizzle_size=8 --op_class=tensorop --accum=f32 --cta_m=128 --cta_n=16 --cta_k=64 --cluster_m=1 --cluster_n=1  \
                  --cluster_k=1 --cluster_m_fallback=0 --cluster_n_fallback=0 --cluster_k_fallback=0 --stages=12 --warps_m=4  \
                  --warps_n=2 --warps_k=1 --inst_m=64 --inst_n=16 --inst_k=16 --min_cc=90 --max_cc=90

           Bytes: 117440512  bytes
           FLOPs: 171840634880  flops
           FLOPs/Byte: 1463

         Runtime: 0.809229  ms
          Memory: 135.16 GiB/s

            Math: 212351 GFLOP/s



=============================
  Problem ID: 1

        Provider: [1;37mCUTLASS[0m
   OperationKind: [1;37mgemm[0m
       Operation: cutlass3x_sm90_tensorop_gemm_f16_f16_f32_f16_f16_128x16x64_1x8x1_0_ttn_align8_warpspecialized_epi_nosmem

          Status: [1;37mSuccess[0m
    Verification: [1;37mON[0m
     Disposition: [1;32mPassed[0m

reference_device: Passed
          cuBLAS: Not run
           cuDNN: Not run

       Arguments: --gemm_kind=universal --m=4096 --n=5120 --k=4096 --A=f16:row --B=f16:row --C=f16:column --D=f16:column  \
                  --alpha=1 --beta=0 --split_k_mode=serial --split_k_slices=1 --batch_count=1 --raster_order=along_n  \
                  --runtime_input_datatype_a=invalid --runtime_input_datatype_b=invalid --use_pdl=false --enable_sm90_mixed_dtype_shuffle_test=false  \
                  --swizzle_size=2 --op_class=tensorop --accum=f32 --cta_m=128 --cta_n=16 --cta_k=64 --cluster_m=1 --cluster_n=1  \
                  --cluster_k=1 --cluster_m_fallback=0 --cluster_n_fallback=0 --cluster_k_fallback=0 --stages=12 --warps_m=4  \
                  --warps_n=1 --warps_k=1 --inst_m=64 --inst_n=16 --inst_k=16 --min_cc=90 --max_cc=90

           Bytes: 117440512  bytes
           FLOPs: 171840634880  flops
           FLOPs/Byte: 1463

         Runtime: 0.761948  ms
          Memory: 143.547 GiB/s

            Math: 225528 GFLOP/s



=============================
  Problem ID: 1

        Provider: [1;37mCUTLASS[0m
   OperationKind: [1;37mgemm[0m
       Operation: cutlass3x_sm90_tensorop_gemm_f16_f16_f32_f16_f16_128x16x64_1x8x1_0_ttn_align8_warpspecialized_pingpong_epi_tma

          Status: [1;37mSuccess[0m
    Verification: [1;37mON[0m
     Disposition: [1;32mPassed[0m

reference_device: Passed
          cuBLAS: Not run
           cuDNN: Not run

       Arguments: --gemm_kind=universal --m=4096 --n=5120 --k=4096 --A=f16:row --B=f16:row --C=f16:column --D=f16:column  \
                  --alpha=1 --beta=0 --split_k_mode=serial --split_k_slices=1 --batch_count=1 --raster_order=along_m  \
                  --runtime_input_datatype_a=invalid --runtime_input_datatype_b=invalid --use_pdl=false --enable_sm90_mixed_dtype_shuffle_test=false  \
                  --swizzle_size=4 --op_class=tensorop --accum=f32 --cta_m=128 --cta_n=16 --cta_k=64 --cluster_m=1 --cluster_n=1  \
                  --cluster_k=1 --cluster_m_fallback=0 --cluster_n_fallback=0 --cluster_k_fallback=0 --stages=12 --warps_m=4  \
                  --warps_n=1 --warps_k=1 --inst_m=64 --inst_n=16 --inst_k=16 --min_cc=90 --max_cc=90

           Bytes: 117440512  bytes
           FLOPs: 171840634880  flops
           FLOPs/Byte: 1463

         Runtime: 0.631734  ms
          Memory: 173.135 GiB/s

            Math: 272014 GFLOP/s



=============================
  Problem ID: 1

        Provider: [1;37mCUTLASS[0m
   OperationKind: [1;37mgemm[0m
       Operation: cutlass3x_sm90_tensorop_gemm_f16_f16_f32_f16_f16_128x16x64_1x8x1_0_ttn_align8_warpspecialized_pingpong_epi_nosmem

          Status: [1;37mSuccess[0m
    Verification: [1;37mON[0m
     Disposition: [1;32mPassed[0m

reference_device: Passed
          cuBLAS: Not run
           cuDNN: Not run

       Arguments: --gemm_kind=universal --m=4096 --n=5120 --k=4096 --A=f16:row --B=f16:row --C=f16:column --D=f16:column  \
                  --alpha=1 --beta=0 --split_k_mode=serial --split_k_slices=1 --batch_count=1 --raster_order=along_m  \
                  --runtime_input_datatype_a=invalid --runtime_input_datatype_b=invalid --use_pdl=false --enable_sm90_mixed_dtype_shuffle_test=false  \
                  --swizzle_size=8 --op_class=tensorop --accum=f32 --cta_m=128 --cta_n=16 --cta_k=64 --cluster_m=1 --cluster_n=1  \
                  --cluster_k=1 --cluster_m_fallback=0 --cluster_n_fallback=0 --cluster_k_fallback=0 --stages=12 --warps_m=4  \
                  --warps_n=1 --warps_k=1 --inst_m=64 --inst_n=16 --inst_k=16 --min_cc=90 --max_cc=90

           Bytes: 117440512  bytes
           FLOPs: 171840634880  flops
           FLOPs/Byte: 1463

         Runtime: 0.633237  ms
          Memory: 172.724 GiB/s

            Math: 271368 GFLOP/s



=============================
  Problem ID: 1

        Provider: [1;37mCUTLASS[0m
   OperationKind: [1;37mgemm[0m
       Operation: cutlass3x_sm90_tensorop_gemm_f16_f16_f32_f16_f16_128x16x64_1x8x1_0_ttn_align8_warpspecialized_cooperative_epi_nosmem

          Status: [1;37mSuccess[0m
    Verification: [1;37mON[0m
     Disposition: [1;32mPassed[0m

reference_device: Passed
          cuBLAS: Not run
           cuDNN: Not run

       Arguments: --gemm_kind=universal --m=4096 --n=5120 --k=4096 --A=f16:row --B=f16:row --C=f16:column --D=f16:column  \
                  --alpha=1 --beta=0 --split_k_mode=serial --split_k_slices=1 --batch_count=1 --raster_order=along_m  \
                  --runtime_input_datatype_a=invalid --runtime_input_datatype_b=invalid --use_pdl=false --enable_sm90_mixed_dtype_shuffle_test=false  \
                  --swizzle_size=8 --op_class=tensorop --accum=f32 --cta_m=128 --cta_n=16 --cta_k=64 --cluster_m=1 --cluster_n=1  \
                  --cluster_k=1 --cluster_m_fallback=0 --cluster_n_fallback=0 --cluster_k_fallback=0 --stages=12 --warps_m=4  \
                  --warps_n=2 --warps_k=1 --inst_m=64 --inst_n=16 --inst_k=16 --min_cc=90 --max_cc=90

           Bytes: 117440512  bytes
           FLOPs: 171840634880  flops
           FLOPs/Byte: 1463

         Runtime: 0.808016  ms
          Memory: 135.362 GiB/s

            Math: 212670 GFLOP/s



=============================
  Problem ID: 1

        Provider: [1;37mCUTLASS[0m
   OperationKind: [1;37mgemm[0m
       Operation: cutlass3x_sm90_tensorop_gemm_f16_f16_f32_f16_f16_128x16x64_1x8x1_0_ttn_align8_warpspecialized_cooperative_epi_tma

          Status: [1;37mSuccess[0m
    Verification: [1;37mON[0m
     Disposition: [1;32mPassed[0m

reference_device: Passed
          cuBLAS: Not run
           cuDNN: Not run

       Arguments: --gemm_kind=universal --m=4096 --n=5120 --k=4096 --A=f16:row --B=f16:row --C=f16:column --D=f16:column  \
                  --alpha=1 --beta=0 --split_k_mode=serial --split_k_slices=1 --batch_count=1 --raster_order=along_m  \
                  --runtime_input_datatype_a=invalid --runtime_input_datatype_b=invalid --use_pdl=false --enable_sm90_mixed_dtype_shuffle_test=false  \
                  --swizzle_size=1 --op_class=tensorop --accum=f32 --cta_m=128 --cta_n=16 --cta_k=64 --cluster_m=1 --cluster_n=1  \
                  --cluster_k=1 --cluster_m_fallback=0 --cluster_n_fallback=0 --cluster_k_fallback=0 --stages=12 --warps_m=4  \
                  --warps_n=2 --warps_k=1 --inst_m=64 --inst_n=16 --inst_k=16 --min_cc=90 --max_cc=90

           Bytes: 117440512  bytes
           FLOPs: 171840634880  flops
           FLOPs/Byte: 1463

         Runtime: 0.822827  ms
          Memory: 132.926 GiB/s

            Math: 208842 GFLOP/s



=============================
  Problem ID: 1

        Provider: [1;37mCUTLASS[0m
   OperationKind: [1;37mgemm[0m
       Operation: cutlass3x_sm90_tensorop_gemm_f16_f16_f32_f16_f16_128x16x64_1x8x1_0_ttn_align8_stream_k_warpspecialized_cooperative_epi_nosmem

          Status: [1;37mSuccess[0m
    Verification: [1;37mON[0m
     Disposition: [1;32mPassed[0m

reference_device: Passed
          cuBLAS: Not run
           cuDNN: Not run

       Arguments: --gemm_kind=universal --m=4096 --n=5120 --k=4096 --A=f16:row --B=f16:row --C=f16:column --D=f16:column  \
                  --alpha=1 --beta=0 --split_k_mode=serial --split_k_slices=1 --batch_count=1 --raster_order=along_m  \
                  --runtime_input_datatype_a=invalid --runtime_input_datatype_b=invalid --use_pdl=false --enable_sm90_mixed_dtype_shuffle_test=false  \
                  --swizzle_size=8 --op_class=tensorop --accum=f32 --cta_m=128 --cta_n=16 --cta_k=64 --cluster_m=1 --cluster_n=1  \
                  --cluster_k=1 --cluster_m_fallback=0 --cluster_n_fallback=0 --cluster_k_fallback=0 --stages=12 --warps_m=4  \
                  --warps_n=2 --warps_k=1 --inst_m=64 --inst_n=16 --inst_k=16 --min_cc=90 --max_cc=90

           Bytes: 117440512  bytes
           FLOPs: 171840634880  flops
           FLOPs/Byte: 1463

         Runtime: 0.79001  ms
          Memory: 138.448 GiB/s

            Math: 217517 GFLOP/s



=============================
  Problem ID: 1

        Provider: [1;37mCUTLASS[0m
   OperationKind: [1;37mgemm[0m
       Operation: cutlass3x_sm90_tensorop_gemm_f16_f16_f32_f16_f16_128x16x64_1x8x1_0_ttn_align8_stream_k_warpspecialized_cooperative_epi_tma

          Status: [1;37mSuccess[0m
    Verification: [1;37mON[0m
     Disposition: [1;32mPassed[0m

reference_device: Passed
          cuBLAS: Not run
           cuDNN: Not run

       Arguments: --gemm_kind=universal --m=4096 --n=5120 --k=4096 --A=f16:row --B=f16:row --C=f16:column --D=f16:column  \
                  --alpha=1 --beta=0 --split_k_mode=serial --split_k_slices=1 --batch_count=1 --raster_order=along_m  \
                  --runtime_input_datatype_a=invalid --runtime_input_datatype_b=invalid --use_pdl=false --enable_sm90_mixed_dtype_shuffle_test=false  \
                  --swizzle_size=4 --op_class=tensorop --accum=f32 --cta_m=128 --cta_n=16 --cta_k=64 --cluster_m=1 --cluster_n=1  \
                  --cluster_k=1 --cluster_m_fallback=0 --cluster_n_fallback=0 --cluster_k_fallback=0 --stages=12 --warps_m=4  \
                  --warps_n=2 --warps_k=1 --inst_m=64 --inst_n=16 --inst_k=16 --min_cc=90 --max_cc=90

           Bytes: 117440512  bytes
           FLOPs: 171840634880  flops
           FLOPs/Byte: 1463

         Runtime: 0.807735  ms
          Memory: 135.41 GiB/s

            Math: 212744 GFLOP/s



=============================
  Problem ID: 1

        Provider: [1;37mCUTLASS[0m
   OperationKind: [1;37mgemm[0m
       Operation: cutlass3x_sm90_tensorop_gemm_f16_f16_f32_f16_f16_64x64x256_1x1x1_0_ttn_align8

          Status: [1;37mSuccess[0m
    Verification: [1;37mON[0m
     Disposition: [1;32mPassed[0m

reference_device: Passed
          cuBLAS: Not run
           cuDNN: Not run

       Arguments: --gemm_kind=universal --m=4096 --n=5120 --k=4096 --A=f16:row --B=f16:row --C=f16:column --D=f16:column  \
                  --alpha=1 --beta=0 --split_k_mode=serial --split_k_slices=1 --batch_count=1 --raster_order=along_n  \
                  --runtime_input_datatype_a=invalid --runtime_input_datatype_b=invalid --use_pdl=false --enable_sm90_mixed_dtype_shuffle_test=false  \
                  --swizzle_size=4 --op_class=tensorop --accum=f32 --cta_m=64 --cta_n=64 --cta_k=256 --cluster_m=1 --cluster_n=1  \
                  --cluster_k=1 --cluster_m_fallback=0 --cluster_n_fallback=0 --cluster_k_fallback=0 --stages=3 --warps_m=4  \
                  --warps_n=1 --warps_k=1 --inst_m=64 --inst_n=64 --inst_k=16 --min_cc=90 --max_cc=90

           Bytes: 117440512  bytes
           FLOPs: 171840634880  flops
           FLOPs/Byte: 1463

         Runtime: 0.497895  ms
          Memory: 219.675 GiB/s

            Math: 345134 GFLOP/s



=============================
  Problem ID: 1

        Provider: [1;37mCUTLASS[0m
   OperationKind: [1;37mgemm[0m
       Operation: cutlass3x_sm90_tensorop_gemm_f16_f16_f32_f16_f16_64x64x256_1x1x1_0_ttn_align8_warpspecialized_epi_nosmem

          Status: [1;37mSuccess[0m
    Verification: [1;37mON[0m
     Disposition: [1;32mPassed[0m

reference_device: Passed
          cuBLAS: Not run
           cuDNN: Not run

       Arguments: --gemm_kind=universal --m=4096 --n=5120 --k=4096 --A=f16:row --B=f16:row --C=f16:column --D=f16:column  \
                  --alpha=1 --beta=0 --split_k_mode=serial --split_k_slices=1 --batch_count=1 --raster_order=along_m  \
                  --runtime_input_datatype_a=invalid --runtime_input_datatype_b=invalid --use_pdl=false --enable_sm90_mixed_dtype_shuffle_test=false  \
                  --swizzle_size=2 --op_class=tensorop --accum=f32 --cta_m=64 --cta_n=64 --cta_k=256 --cluster_m=1 --cluster_n=1  \
                  --cluster_k=1 --cluster_m_fallback=0 --cluster_n_fallback=0 --cluster_k_fallback=0 --stages=3 --warps_m=4  \
                  --warps_n=1 --warps_k=1 --inst_m=64 --inst_n=64 --inst_k=16 --min_cc=90 --max_cc=90

           Bytes: 117440512  bytes
           FLOPs: 171840634880  flops
           FLOPs/Byte: 1463

         Runtime: 0.613133  ms
          Memory: 178.387 GiB/s

            Math: 280266 GFLOP/s



=============================
  Problem ID: 1

        Provider: [1;37mCUTLASS[0m
   OperationKind: [1;37mgemm[0m
       Operation: cutlass3x_sm90_tensorop_gemm_f16_f16_f32_f16_f16_64x64x256_1x1x1_0_ttn_align8_warpspecialized_pingpong_epi_tma

          Status: [1;37mSuccess[0m
    Verification: [1;37mON[0m
     Disposition: [1;32mPassed[0m

reference_device: Passed
          cuBLAS: Not run
           cuDNN: Not run

       Arguments: --gemm_kind=universal --m=4096 --n=5120 --k=4096 --A=f16:row --B=f16:row --C=f16:column --D=f16:column  \
                  --alpha=1 --beta=0 --split_k_mode=serial --split_k_slices=1 --batch_count=1 --raster_order=along_n  \
                  --runtime_input_datatype_a=invalid --runtime_input_datatype_b=invalid --use_pdl=false --enable_sm90_mixed_dtype_shuffle_test=false  \
                  --swizzle_size=4 --op_class=tensorop --accum=f32 --cta_m=64 --cta_n=64 --cta_k=256 --cluster_m=1 --cluster_n=1  \
                  --cluster_k=1 --cluster_m_fallback=0 --cluster_n_fallback=0 --cluster_k_fallback=0 --stages=3 --warps_m=4  \
                  --warps_n=1 --warps_k=1 --inst_m=64 --inst_n=64 --inst_k=16 --min_cc=90 --max_cc=90

           Bytes: 117440512  bytes
           FLOPs: 171840634880  flops
           FLOPs/Byte: 1463

         Runtime: 0.497567  ms
          Memory: 219.819 GiB/s

            Math: 345362 GFLOP/s



=============================
  Problem ID: 1

        Provider: [1;37mCUTLASS[0m
   OperationKind: [1;37mgemm[0m
       Operation: cutlass3x_sm90_tensorop_gemm_f16_f16_f32_f16_f16_64x64x256_1x1x1_0_ttn_align8_warpspecialized_pingpong_epi_nosmem

          Status: [1;37mSuccess[0m
    Verification: [1;37mON[0m
     Disposition: [1;32mPassed[0m

reference_device: Passed
          cuBLAS: Not run
           cuDNN: Not run

       Arguments: --gemm_kind=universal --m=4096 --n=5120 --k=4096 --A=f16:row --B=f16:row --C=f16:column --D=f16:column  \
                  --alpha=1 --beta=0 --split_k_mode=serial --split_k_slices=1 --batch_count=1 --raster_order=along_n  \
                  --runtime_input_datatype_a=invalid --runtime_input_datatype_b=invalid --use_pdl=false --enable_sm90_mixed_dtype_shuffle_test=false  \
                  --swizzle_size=4 --op_class=tensorop --accum=f32 --cta_m=64 --cta_n=64 --cta_k=256 --cluster_m=1 --cluster_n=1  \
                  --cluster_k=1 --cluster_m_fallback=0 --cluster_n_fallback=0 --cluster_k_fallback=0 --stages=3 --warps_m=4  \
                  --warps_n=1 --warps_k=1 --inst_m=64 --inst_n=64 --inst_k=16 --min_cc=90 --max_cc=90

           Bytes: 117440512  bytes
           FLOPs: 171840634880  flops
           FLOPs/Byte: 1463

         Runtime: 0.496877  ms
          Memory: 220.125 GiB/s

            Math: 345842 GFLOP/s



=============================
  Problem ID: 1

        Provider: [1;37mCUTLASS[0m
   OperationKind: [1;37mgemm[0m
       Operation: cutlass3x_sm90_tensorop_gemm_f16_f16_f32_f16_f16_128x16x64_4x2x1_0_ttn_align8

          Status: [1;37mSuccess[0m
    Verification: [1;37mON[0m
     Disposition: [1;32mPassed[0m

reference_device: Passed
          cuBLAS: Not run
           cuDNN: Not run

       Arguments: --gemm_kind=universal --m=4096 --n=5120 --k=4096 --A=f16:row --B=f16:row --C=f16:column --D=f16:column  \
                  --alpha=1 --beta=0 --split_k_mode=serial --split_k_slices=1 --batch_count=1 --raster_order=along_m  \
                  --runtime_input_datatype_a=invalid --runtime_input_datatype_b=invalid --use_pdl=false --enable_sm90_mixed_dtype_shuffle_test=false  \
                  --swizzle_size=4 --op_class=tensorop --accum=f32 --cta_m=128 --cta_n=16 --cta_k=64 --cluster_m=1 --cluster_n=1  \
                  --cluster_k=1 --cluster_m_fallback=0 --cluster_n_fallback=0 --cluster_k_fallback=0 --stages=12 --warps_m=4  \
                  --warps_n=2 --warps_k=1 --inst_m=64 --inst_n=16 --inst_k=16 --min_cc=90 --max_cc=90

           Bytes: 117440512  bytes
           FLOPs: 171840634880  flops
           FLOPs/Byte: 1463

         Runtime: 0.846566  ms
          Memory: 129.198 GiB/s

            Math: 202985 GFLOP/s



=============================
  Problem ID: 1

        Provider: [1;37mCUTLASS[0m
   OperationKind: [1;37mgemm[0m
       Operation: cutlass3x_sm90_tensorop_gemm_f16_f16_f32_f16_f16_128x16x64_4x2x1_0_ttn_align8_warpspecialized_epi_nosmem

          Status: [1;37mSuccess[0m
    Verification: [1;37mON[0m
     Disposition: [1;32mPassed[0m

reference_device: Passed
          cuBLAS: Not run
           cuDNN: Not run

       Arguments: --gemm_kind=universal --m=4096 --n=5120 --k=4096 --A=f16:row --B=f16:row --C=f16:column --D=f16:column  \
                  --alpha=1 --beta=0 --split_k_mode=serial --split_k_slices=1 --batch_count=1 --raster_order=along_n  \
                  --runtime_input_datatype_a=invalid --runtime_input_datatype_b=invalid --use_pdl=false --enable_sm90_mixed_dtype_shuffle_test=false  \
                  --swizzle_size=8 --op_class=tensorop --accum=f32 --cta_m=128 --cta_n=16 --cta_k=64 --cluster_m=1 --cluster_n=1  \
                  --cluster_k=1 --cluster_m_fallback=0 --cluster_n_fallback=0 --cluster_k_fallback=0 --stages=12 --warps_m=4  \
                  --warps_n=1 --warps_k=1 --inst_m=64 --inst_n=16 --inst_k=16 --min_cc=90 --max_cc=90

           Bytes: 117440512  bytes
           FLOPs: 171840634880  flops
           FLOPs/Byte: 1463

         Runtime: 1.20547  ms
          Memory: 90.732 GiB/s

            Math: 142550 GFLOP/s



=============================
  Problem ID: 1

        Provider: [1;37mCUTLASS[0m
   OperationKind: [1;37mgemm[0m
       Operation: cutlass3x_sm90_tensorop_gemm_f16_f16_f32_f16_f16_128x16x64_4x2x1_0_ttn_align8_warpspecialized_pingpong_epi_tma

          Status: [1;37mSuccess[0m
    Verification: [1;37mON[0m
     Disposition: [1;32mPassed[0m

reference_device: Passed
          cuBLAS: Not run
           cuDNN: Not run

       Arguments: --gemm_kind=universal --m=4096 --n=5120 --k=4096 --A=f16:row --B=f16:row --C=f16:column --D=f16:column  \
                  --alpha=1 --beta=0 --split_k_mode=serial --split_k_slices=1 --batch_count=1 --raster_order=along_n  \
                  --runtime_input_datatype_a=invalid --runtime_input_datatype_b=invalid --use_pdl=false --enable_sm90_mixed_dtype_shuffle_test=false  \
                  --swizzle_size=1 --op_class=tensorop --accum=f32 --cta_m=128 --cta_n=16 --cta_k=64 --cluster_m=1 --cluster_n=1  \
                  --cluster_k=1 --cluster_m_fallback=0 --cluster_n_fallback=0 --cluster_k_fallback=0 --stages=12 --warps_m=4  \
                  --warps_n=1 --warps_k=1 --inst_m=64 --inst_n=16 --inst_k=16 --min_cc=90 --max_cc=90

           Bytes: 117440512  bytes
           FLOPs: 171840634880  flops
           FLOPs/Byte: 1463

         Runtime: 0.839898  ms
          Memory: 130.224 GiB/s

            Math: 204597 GFLOP/s



=============================
  Problem ID: 1

        Provider: [1;37mCUTLASS[0m
   OperationKind: [1;37mgemm[0m
       Operation: cutlass3x_sm90_tensorop_gemm_f16_f16_f32_f16_f16_128x16x64_4x2x1_0_ttn_align8_warpspecialized_pingpong_epi_nosmem

          Status: [1;37mSuccess[0m
    Verification: [1;37mON[0m
     Disposition: [1;32mPassed[0m

reference_device: Passed
          cuBLAS: Not run
           cuDNN: Not run

       Arguments: --gemm_kind=universal --m=4096 --n=5120 --k=4096 --A=f16:row --B=f16:row --C=f16:column --D=f16:column  \
                  --alpha=1 --beta=0 --split_k_mode=serial --split_k_slices=1 --batch_count=1 --raster_order=along_n  \
                  --runtime_input_datatype_a=invalid --runtime_input_datatype_b=invalid --use_pdl=false --enable_sm90_mixed_dtype_shuffle_test=false  \
                  --swizzle_size=2 --op_class=tensorop --accum=f32 --cta_m=128 --cta_n=16 --cta_k=64 --cluster_m=1 --cluster_n=1  \
                  --cluster_k=1 --cluster_m_fallback=0 --cluster_n_fallback=0 --cluster_k_fallback=0 --stages=12 --warps_m=4  \
                  --warps_n=1 --warps_k=1 --inst_m=64 --inst_n=16 --inst_k=16 --min_cc=90 --max_cc=90

           Bytes: 117440512  bytes
           FLOPs: 171840634880  flops
           FLOPs/Byte: 1463

         Runtime: 0.846123  ms
          Memory: 129.266 GiB/s

            Math: 203092 GFLOP/s



=============================
  Problem ID: 1

        Provider: [1;37mCUTLASS[0m
   OperationKind: [1;37mgemm[0m
       Operation: cutlass3x_sm90_tensorop_gemm_f16_f16_f32_f16_f16_128x16x64_4x2x1_0_ttn_align8_warpspecialized_cooperative_epi_nosmem

          Status: [1;37mSuccess[0m
    Verification: [1;37mON[0m
     Disposition: [1;32mPassed[0m

reference_device: Passed
          cuBLAS: Not run
           cuDNN: Not run

       Arguments: --gemm_kind=universal --m=4096 --n=5120 --k=4096 --A=f16:row --B=f16:row --C=f16:column --D=f16:column  \
                  --alpha=1 --beta=0 --split_k_mode=serial --split_k_slices=1 --batch_count=1 --raster_order=along_m  \
                  --runtime_input_datatype_a=invalid --runtime_input_datatype_b=invalid --use_pdl=false --enable_sm90_mixed_dtype_shuffle_test=false  \
                  --swizzle_size=4 --op_class=tensorop --accum=f32 --cta_m=128 --cta_n=16 --cta_k=64 --cluster_m=1 --cluster_n=1  \
                  --cluster_k=1 --cluster_m_fallback=0 --cluster_n_fallback=0 --cluster_k_fallback=0 --stages=12 --warps_m=4  \
                  --warps_n=2 --warps_k=1 --inst_m=64 --inst_n=16 --inst_k=16 --min_cc=90 --max_cc=90

           Bytes: 117440512  bytes
           FLOPs: 171840634880  flops
           FLOPs/Byte: 1463

         Runtime: 0.850585  ms
          Memory: 128.588 GiB/s

            Math: 202026 GFLOP/s



=============================
  Problem ID: 1

        Provider: [1;37mCUTLASS[0m
   OperationKind: [1;37mgemm[0m
       Operation: cutlass3x_sm90_tensorop_gemm_f16_f16_f32_f16_f16_128x16x64_4x2x1_0_ttn_align8_warpspecialized_cooperative_epi_tma

          Status: [1;37mSuccess[0m
    Verification: [1;37mON[0m
     Disposition: [1;32mPassed[0m

reference_device: Passed
          cuBLAS: Not run
           cuDNN: Not run

       Arguments: --gemm_kind=universal --m=4096 --n=5120 --k=4096 --A=f16:row --B=f16:row --C=f16:column --D=f16:column  \
                  --alpha=1 --beta=0 --split_k_mode=serial --split_k_slices=1 --batch_count=1 --raster_order=along_m  \
                  --runtime_input_datatype_a=invalid --runtime_input_datatype_b=invalid --use_pdl=false --enable_sm90_mixed_dtype_shuffle_test=false  \
                  --swizzle_size=8 --op_class=tensorop --accum=f32 --cta_m=128 --cta_n=16 --cta_k=64 --cluster_m=1 --cluster_n=1  \
                  --cluster_k=1 --cluster_m_fallback=0 --cluster_n_fallback=0 --cluster_k_fallback=0 --stages=12 --warps_m=4  \
                  --warps_n=2 --warps_k=1 --inst_m=64 --inst_n=16 --inst_k=16 --min_cc=90 --max_cc=90

           Bytes: 117440512  bytes
           FLOPs: 171840634880  flops
           FLOPs/Byte: 1463

         Runtime: 0.869691  ms
          Memory: 125.763 GiB/s

            Math: 197588 GFLOP/s



=============================
  Problem ID: 1

        Provider: [1;37mCUTLASS[0m
   OperationKind: [1;37mgemm[0m
       Operation: cutlass3x_sm90_tensorop_gemm_f16_f16_f32_f16_f16_128x16x64_4x2x1_0_ttn_align8_stream_k_warpspecialized_cooperative_epi_nosmem

          Status: [1;37mSuccess[0m
    Verification: [1;37mON[0m
     Disposition: [1;32mPassed[0m

reference_device: Passed
          cuBLAS: Not run
           cuDNN: Not run

       Arguments: --gemm_kind=universal --m=4096 --n=5120 --k=4096 --A=f16:row --B=f16:row --C=f16:column --D=f16:column  \
                  --alpha=1 --beta=0 --split_k_mode=serial --split_k_slices=1 --batch_count=1 --raster_order=along_n  \
                  --runtime_input_datatype_a=invalid --runtime_input_datatype_b=invalid --use_pdl=false --enable_sm90_mixed_dtype_shuffle_test=false  \
                  --swizzle_size=1 --op_class=tensorop --accum=f32 --cta_m=128 --cta_n=16 --cta_k=64 --cluster_m=1 --cluster_n=1  \
                  --cluster_k=1 --cluster_m_fallback=0 --cluster_n_fallback=0 --cluster_k_fallback=0 --stages=12 --warps_m=4  \
                  --warps_n=2 --warps_k=1 --inst_m=64 --inst_n=16 --inst_k=16 --min_cc=90 --max_cc=90

           Bytes: 117440512  bytes
           FLOPs: 171840634880  flops
           FLOPs/Byte: 1463

         Runtime: 0.865966  ms
          Memory: 126.304 GiB/s

            Math: 198438 GFLOP/s



=============================
  Problem ID: 1

        Provider: [1;37mCUTLASS[0m
   OperationKind: [1;37mgemm[0m
       Operation: cutlass3x_sm90_tensorop_gemm_f16_f16_f32_f16_f16_128x16x64_4x2x1_0_ttn_align8_stream_k_warpspecialized_cooperative_epi_tma

          Status: [1;37mSuccess[0m
    Verification: [1;37mON[0m
     Disposition: [1;32mPassed[0m

reference_device: Passed
          cuBLAS: Not run
           cuDNN: Not run

       Arguments: --gemm_kind=universal --m=4096 --n=5120 --k=4096 --A=f16:row --B=f16:row --C=f16:column --D=f16:column  \
                  --alpha=1 --beta=0 --split_k_mode=serial --split_k_slices=1 --batch_count=1 --raster_order=along_m  \
                  --runtime_input_datatype_a=invalid --runtime_input_datatype_b=invalid --use_pdl=false --enable_sm90_mixed_dtype_shuffle_test=false  \
                  --swizzle_size=8 --op_class=tensorop --accum=f32 --cta_m=128 --cta_n=16 --cta_k=64 --cluster_m=1 --cluster_n=1  \
                  --cluster_k=1 --cluster_m_fallback=0 --cluster_n_fallback=0 --cluster_k_fallback=0 --stages=12 --warps_m=4  \
                  --warps_n=2 --warps_k=1 --inst_m=64 --inst_n=16 --inst_k=16 --min_cc=90 --max_cc=90

           Bytes: 117440512  bytes
           FLOPs: 171840634880  flops
           FLOPs/Byte: 1463

         Runtime: 0.887122  ms
          Memory: 123.292 GiB/s

            Math: 193706 GFLOP/s



=============================
  Problem ID: 1

        Provider: [1;37mCUTLASS[0m
   OperationKind: [1;37mgemm[0m
       Operation: cutlass3x_sm90_tensorop_gemm_f16_f16_f32_f16_f16_128x128x128_1x8x1_0_ttn_align8

          Status: [1;37mSuccess[0m
    Verification: [1;37mON[0m
     Disposition: [1;32mPassed[0m

reference_device: Passed
          cuBLAS: Not run
           cuDNN: Not run

       Arguments: --gemm_kind=universal --m=4096 --n=5120 --k=4096 --A=f16:row --B=f16:row --C=f16:column --D=f16:column  \
                  --alpha=1 --beta=0 --split_k_mode=serial --split_k_slices=1 --batch_count=1 --raster_order=along_m  \
                  --runtime_input_datatype_a=invalid --runtime_input_datatype_b=invalid --use_pdl=false --enable_sm90_mixed_dtype_shuffle_test=false  \
                  --swizzle_size=1 --op_class=tensorop --accum=f32 --cta_m=128 --cta_n=128 --cta_k=128 --cluster_m=1  \
                  --cluster_n=1 --cluster_k=1 --cluster_m_fallback=0 --cluster_n_fallback=0 --cluster_k_fallback=0 --stages=3  \
                  --warps_m=4 --warps_n=2 --warps_k=1 --inst_m=64 --inst_n=128 --inst_k=16 --min_cc=90 --max_cc=90

           Bytes: 117440512  bytes
           FLOPs: 171840634880  flops
           FLOPs/Byte: 1463

         Runtime: 0.277926  ms
          Memory: 393.54 GiB/s

            Math: 618297 GFLOP/s



=============================
  Problem ID: 1

        Provider: [1;37mCUTLASS[0m
   OperationKind: [1;37mgemm[0m
       Operation: cutlass3x_sm90_tensorop_gemm_f16_f16_f32_f16_f16_128x128x128_1x8x1_0_ttn_align8_warpspecialized_epi_nosmem

          Status: [1;37mSuccess[0m
    Verification: [1;37mON[0m
     Disposition: [1;32mPassed[0m

reference_device: Passed
          cuBLAS: Not run
           cuDNN: Not run

       Arguments: --gemm_kind=universal --m=4096 --n=5120 --k=4096 --A=f16:row --B=f16:row --C=f16:column --D=f16:column  \
                  --alpha=1 --beta=0 --split_k_mode=serial --split_k_slices=1 --batch_count=1 --raster_order=along_n  \
                  --runtime_input_datatype_a=invalid --runtime_input_datatype_b=invalid --use_pdl=false --enable_sm90_mixed_dtype_shuffle_test=false  \
                  --swizzle_size=8 --op_class=tensorop --accum=f32 --cta_m=128 --cta_n=128 --cta_k=128 --cluster_m=1  \
                  --cluster_n=1 --cluster_k=1 --cluster_m_fallback=0 --cluster_n_fallback=0 --cluster_k_fallback=0 --stages=3  \
                  --warps_m=4 --warps_n=1 --warps_k=1 --inst_m=64 --inst_n=128 --inst_k=16 --min_cc=90 --max_cc=90

           Bytes: 117440512  bytes
           FLOPs: 171840634880  flops
           FLOPs/Byte: 1463

         Runtime: 0.283001  ms
          Memory: 386.482 GiB/s

            Math: 607208 GFLOP/s



=============================
  Problem ID: 1

        Provider: [1;37mCUTLASS[0m
   OperationKind: [1;37mgemm[0m
       Operation: cutlass3x_sm90_tensorop_gemm_f16_f16_f32_f16_f16_128x128x128_1x8x1_0_ttn_align8_warpspecialized_pingpong_epi_tma

          Status: [1;37mSuccess[0m
    Verification: [1;37mON[0m
     Disposition: [1;32mPassed[0m

reference_device: Passed
          cuBLAS: Not run
           cuDNN: Not run

       Arguments: --gemm_kind=universal --m=4096 --n=5120 --k=4096 --A=f16:row --B=f16:row --C=f16:column --D=f16:column  \
                  --alpha=1 --beta=0 --split_k_mode=serial --split_k_slices=1 --batch_count=1 --raster_order=along_m  \
                  --runtime_input_datatype_a=invalid --runtime_input_datatype_b=invalid --use_pdl=false --enable_sm90_mixed_dtype_shuffle_test=false  \
                  --swizzle_size=1 --op_class=tensorop --accum=f32 --cta_m=128 --cta_n=128 --cta_k=128 --cluster_m=1  \
                  --cluster_n=1 --cluster_k=1 --cluster_m_fallback=0 --cluster_n_fallback=0 --cluster_k_fallback=0 --stages=3  \
                  --warps_m=4 --warps_n=1 --warps_k=1 --inst_m=64 --inst_n=128 --inst_k=16 --min_cc=90 --max_cc=90

           Bytes: 117440512  bytes
           FLOPs: 171840634880  flops
           FLOPs/Byte: 1463

         Runtime: 0.259891  ms
          Memory: 420.849 GiB/s

            Math: 661202 GFLOP/s



=============================
  Problem ID: 1

        Provider: [1;37mCUTLASS[0m
   OperationKind: [1;37mgemm[0m
       Operation: cutlass3x_sm90_tensorop_gemm_f16_f16_f32_f16_f16_128x128x128_1x8x1_0_ttn_align8_warpspecialized_pingpong_epi_nosmem

          Status: [1;37mSuccess[0m
    Verification: [1;37mON[0m
     Disposition: [1;32mPassed[0m

reference_device: Passed
          cuBLAS: Not run
           cuDNN: Not run

       Arguments: --gemm_kind=universal --m=4096 --n=5120 --k=4096 --A=f16:row --B=f16:row --C=f16:column --D=f16:column  \
                  --alpha=1 --beta=0 --split_k_mode=serial --split_k_slices=1 --batch_count=1 --raster_order=along_m  \
                  --runtime_input_datatype_a=invalid --runtime_input_datatype_b=invalid --use_pdl=false --enable_sm90_mixed_dtype_shuffle_test=false  \
                  --swizzle_size=1 --op_class=tensorop --accum=f32 --cta_m=128 --cta_n=128 --cta_k=128 --cluster_m=1  \
                  --cluster_n=1 --cluster_k=1 --cluster_m_fallback=0 --cluster_n_fallback=0 --cluster_k_fallback=0 --stages=3  \
                  --warps_m=4 --warps_n=1 --warps_k=1 --inst_m=64 --inst_n=128 --inst_k=16 --min_cc=90 --max_cc=90

           Bytes: 117440512  bytes
           FLOPs: 171840634880  flops
           FLOPs/Byte: 1463

         Runtime: 0.260691  ms
          Memory: 419.559 GiB/s

            Math: 659175 GFLOP/s



=============================
  Problem ID: 1

        Provider: [1;37mCUTLASS[0m
   OperationKind: [1;37mgemm[0m
       Operation: cutlass3x_sm90_tensorop_gemm_f16_f16_f32_f16_f16_128x128x128_1x8x1_0_ttn_align8_warpspecialized_cooperative_epi_nosmem

          Status: [1;37mSuccess[0m
    Verification: [1;37mON[0m
     Disposition: [1;32mPassed[0m

reference_device: Passed
          cuBLAS: Not run
           cuDNN: Not run

       Arguments: --gemm_kind=universal --m=4096 --n=5120 --k=4096 --A=f16:row --B=f16:row --C=f16:column --D=f16:column  \
                  --alpha=1 --beta=0 --split_k_mode=serial --split_k_slices=1 --batch_count=1 --raster_order=along_m  \
                  --runtime_input_datatype_a=invalid --runtime_input_datatype_b=invalid --use_pdl=false --enable_sm90_mixed_dtype_shuffle_test=false  \
                  --swizzle_size=1 --op_class=tensorop --accum=f32 --cta_m=128 --cta_n=128 --cta_k=128 --cluster_m=1  \
                  --cluster_n=1 --cluster_k=1 --cluster_m_fallback=0 --cluster_n_fallback=0 --cluster_k_fallback=0 --stages=3  \
                  --warps_m=4 --warps_n=2 --warps_k=1 --inst_m=64 --inst_n=128 --inst_k=16 --min_cc=90 --max_cc=90

           Bytes: 117440512  bytes
           FLOPs: 171840634880  flops
           FLOPs/Byte: 1463

         Runtime: 0.277501  ms
          Memory: 394.142 GiB/s

            Math: 619242 GFLOP/s



=============================
  Problem ID: 1

        Provider: [1;37mCUTLASS[0m
   OperationKind: [1;37mgemm[0m
       Operation: cutlass3x_sm90_tensorop_gemm_f16_f16_f32_f16_f16_128x128x128_1x8x1_0_ttn_align8_warpspecialized_cooperative_epi_tma

          Status: [1;37mSuccess[0m
    Verification: [1;37mON[0m
     Disposition: [1;32mPassed[0m

reference_device: Passed
          cuBLAS: Not run
           cuDNN: Not run

       Arguments: --gemm_kind=universal --m=4096 --n=5120 --k=4096 --A=f16:row --B=f16:row --C=f16:column --D=f16:column  \
                  --alpha=1 --beta=0 --split_k_mode=serial --split_k_slices=1 --batch_count=1 --raster_order=along_m  \
                  --runtime_input_datatype_a=invalid --runtime_input_datatype_b=invalid --use_pdl=false --enable_sm90_mixed_dtype_shuffle_test=false  \
                  --swizzle_size=1 --op_class=tensorop --accum=f32 --cta_m=128 --cta_n=128 --cta_k=128 --cluster_m=1  \
                  --cluster_n=1 --cluster_k=1 --cluster_m_fallback=0 --cluster_n_fallback=0 --cluster_k_fallback=0 --stages=3  \
                  --warps_m=4 --warps_n=2 --warps_k=1 --inst_m=64 --inst_n=128 --inst_k=16 --min_cc=90 --max_cc=90

           Bytes: 117440512  bytes
           FLOPs: 171840634880  flops
           FLOPs/Byte: 1463

         Runtime: 0.26735  ms
          Memory: 409.108 GiB/s

            Math: 642755 GFLOP/s



=============================
  Problem ID: 1

        Provider: [1;37mCUTLASS[0m
   OperationKind: [1;37mgemm[0m
       Operation: cutlass3x_sm90_tensorop_gemm_f16_f16_f32_f16_f16_128x128x128_1x8x1_0_ttn_align8_stream_k_warpspecialized_cooperative_epi_nosmem

          Status: [1;37mSuccess[0m
    Verification: [1;37mON[0m
     Disposition: [1;32mPassed[0m

reference_device: Passed
          cuBLAS: Not run
           cuDNN: Not run

       Arguments: --gemm_kind=universal --m=4096 --n=5120 --k=4096 --A=f16:row --B=f16:row --C=f16:column --D=f16:column  \
                  --alpha=1 --beta=0 --split_k_mode=serial --split_k_slices=1 --batch_count=1 --raster_order=along_m  \
                  --runtime_input_datatype_a=invalid --runtime_input_datatype_b=invalid --use_pdl=false --enable_sm90_mixed_dtype_shuffle_test=false  \
                  --swizzle_size=1 --op_class=tensorop --accum=f32 --cta_m=128 --cta_n=128 --cta_k=128 --cluster_m=1  \
                  --cluster_n=1 --cluster_k=1 --cluster_m_fallback=0 --cluster_n_fallback=0 --cluster_k_fallback=0 --stages=3  \
                  --warps_m=4 --warps_n=2 --warps_k=1 --inst_m=64 --inst_n=128 --inst_k=16 --min_cc=90 --max_cc=90

           Bytes: 117440512  bytes
           FLOPs: 171840634880  flops
           FLOPs/Byte: 1463

         Runtime: 0.288445  ms
          Memory: 379.188 GiB/s

            Math: 595747 GFLOP/s



=============================
  Problem ID: 1

        Provider: [1;37mCUTLASS[0m
   OperationKind: [1;37mgemm[0m
       Operation: cutlass3x_sm90_tensorop_gemm_f16_f16_f32_f16_f16_128x128x128_1x8x1_0_ttn_align8_stream_k_warpspecialized_cooperative_epi_tma

          Status: [1;37mSuccess[0m
    Verification: [1;37mON[0m
     Disposition: [1;32mPassed[0m

reference_device: Passed
          cuBLAS: Not run
           cuDNN: Not run

       Arguments: --gemm_kind=universal --m=4096 --n=5120 --k=4096 --A=f16:row --B=f16:row --C=f16:column --D=f16:column  \
                  --alpha=1 --beta=0 --split_k_mode=serial --split_k_slices=1 --batch_count=1 --raster_order=along_m  \
                  --runtime_input_datatype_a=invalid --runtime_input_datatype_b=invalid --use_pdl=false --enable_sm90_mixed_dtype_shuffle_test=false  \
                  --swizzle_size=1 --op_class=tensorop --accum=f32 --cta_m=128 --cta_n=128 --cta_k=128 --cluster_m=1  \
                  --cluster_n=1 --cluster_k=1 --cluster_m_fallback=0 --cluster_n_fallback=0 --cluster_k_fallback=0 --stages=3  \
                  --warps_m=4 --warps_n=2 --warps_k=1 --inst_m=64 --inst_n=128 --inst_k=16 --min_cc=90 --max_cc=90

           Bytes: 117440512  bytes
           FLOPs: 171840634880  flops
           FLOPs/Byte: 1463

         Runtime: 0.274075  ms
          Memory: 399.069 GiB/s

            Math: 626984 GFLOP/s



=============================
  Problem ID: 1

        Provider: [1;37mCUTLASS[0m
   OperationKind: [1;37mgemm[0m
       Operation: cutlass3x_sm90_tensorop_gemm_f16_f16_f32_f16_f16_128x128x128_8x1x1_0_ttn_align8

          Status: [1;37mSuccess[0m
    Verification: [1;37mON[0m
     Disposition: [1;32mPassed[0m

reference_device: Passed
          cuBLAS: Not run
           cuDNN: Not run

       Arguments: --gemm_kind=universal --m=4096 --n=5120 --k=4096 --A=f16:row --B=f16:row --C=f16:column --D=f16:column  \
                  --alpha=1 --beta=0 --split_k_mode=serial --split_k_slices=1 --batch_count=1 --raster_order=along_n  \
                  --runtime_input_datatype_a=invalid --runtime_input_datatype_b=invalid --use_pdl=false --enable_sm90_mixed_dtype_shuffle_test=false  \
                  --swizzle_size=2 --op_class=tensorop --accum=f32 --cta_m=128 --cta_n=128 --cta_k=128 --cluster_m=1  \
                  --cluster_n=1 --cluster_k=1 --cluster_m_fallback=0 --cluster_n_fallback=0 --cluster_k_fallback=0 --stages=3  \
                  --warps_m=4 --warps_n=2 --warps_k=1 --inst_m=64 --inst_n=128 --inst_k=16 --min_cc=90 --max_cc=90

           Bytes: 117440512  bytes
           FLOPs: 171840634880  flops
           FLOPs/Byte: 1463

         Runtime: 0.280824  ms
          Memory: 389.479 GiB/s

            Math: 611916 GFLOP/s



=============================
  Problem ID: 1

        Provider: [1;37mCUTLASS[0m
   OperationKind: [1;37mgemm[0m
       Operation: cutlass3x_sm90_tensorop_gemm_f16_f16_f32_f16_f16_128x128x128_8x1x1_0_ttn_align8_warpspecialized_epi_nosmem

          Status: [1;37mSuccess[0m
    Verification: [1;37mON[0m
     Disposition: [1;32mPassed[0m

reference_device: Passed
          cuBLAS: Not run
           cuDNN: Not run

       Arguments: --gemm_kind=universal --m=4096 --n=5120 --k=4096 --A=f16:row --B=f16:row --C=f16:column --D=f16:column  \
                  --alpha=1 --beta=0 --split_k_mode=serial --split_k_slices=1 --batch_count=1 --raster_order=along_m  \
                  --runtime_input_datatype_a=invalid --runtime_input_datatype_b=invalid --use_pdl=false --enable_sm90_mixed_dtype_shuffle_test=false  \
                  --swizzle_size=2 --op_class=tensorop --accum=f32 --cta_m=128 --cta_n=128 --cta_k=128 --cluster_m=1  \
                  --cluster_n=1 --cluster_k=1 --cluster_m_fallback=0 --cluster_n_fallback=0 --cluster_k_fallback=0 --stages=3  \
                  --warps_m=4 --warps_n=1 --warps_k=1 --inst_m=64 --inst_n=128 --inst_k=16 --min_cc=90 --max_cc=90

           Bytes: 117440512  bytes
           FLOPs: 171840634880  flops
           FLOPs/Byte: 1463

         Runtime: 0.307703  ms
          Memory: 355.456 GiB/s

            Math: 558463 GFLOP/s



=============================
  Problem ID: 1

        Provider: [1;37mCUTLASS[0m
   OperationKind: [1;37mgemm[0m
       Operation: cutlass3x_sm90_tensorop_gemm_f16_f16_f32_f16_f16_128x128x128_8x1x1_0_ttn_align8_warpspecialized_pingpong_epi_tma

          Status: [1;37mSuccess[0m
    Verification: [1;37mON[0m
     Disposition: [1;32mPassed[0m

reference_device: Passed
          cuBLAS: Not run
           cuDNN: Not run

       Arguments: --gemm_kind=universal --m=4096 --n=5120 --k=4096 --A=f16:row --B=f16:row --C=f16:column --D=f16:column  \
                  --alpha=1 --beta=0 --split_k_mode=serial --split_k_slices=1 --batch_count=1 --raster_order=along_n  \
                  --runtime_input_datatype_a=invalid --runtime_input_datatype_b=invalid --use_pdl=false --enable_sm90_mixed_dtype_shuffle_test=false  \
                  --swizzle_size=2 --op_class=tensorop --accum=f32 --cta_m=128 --cta_n=128 --cta_k=128 --cluster_m=1  \
                  --cluster_n=1 --cluster_k=1 --cluster_m_fallback=0 --cluster_n_fallback=0 --cluster_k_fallback=0 --stages=3  \
                  --warps_m=4 --warps_n=1 --warps_k=1 --inst_m=64 --inst_n=128 --inst_k=16 --min_cc=90 --max_cc=90

           Bytes: 117440512  bytes
           FLOPs: 171840634880  flops
           FLOPs/Byte: 1463

         Runtime: 0.262314  ms
          Memory: 416.962 GiB/s

            Math: 655095 GFLOP/s



=============================
  Problem ID: 1

        Provider: [1;37mCUTLASS[0m
   OperationKind: [1;37mgemm[0m
       Operation: cutlass3x_sm90_tensorop_gemm_f16_f16_f32_f16_f16_128x128x128_8x1x1_0_ttn_align8_warpspecialized_pingpong_epi_nosmem

          Status: [1;37mSuccess[0m
    Verification: [1;37mON[0m
     Disposition: [1;32mPassed[0m

reference_device: Passed
          cuBLAS: Not run
           cuDNN: Not run

       Arguments: --gemm_kind=universal --m=4096 --n=5120 --k=4096 --A=f16:row --B=f16:row --C=f16:column --D=f16:column  \
                  --alpha=1 --beta=0 --split_k_mode=serial --split_k_slices=1 --batch_count=1 --raster_order=along_n  \
                  --runtime_input_datatype_a=invalid --runtime_input_datatype_b=invalid --use_pdl=false --enable_sm90_mixed_dtype_shuffle_test=false  \
                  --swizzle_size=2 --op_class=tensorop --accum=f32 --cta_m=128 --cta_n=128 --cta_k=128 --cluster_m=1  \
                  --cluster_n=1 --cluster_k=1 --cluster_m_fallback=0 --cluster_n_fallback=0 --cluster_k_fallback=0 --stages=3  \
                  --warps_m=4 --warps_n=1 --warps_k=1 --inst_m=64 --inst_n=128 --inst_k=16 --min_cc=90 --max_cc=90

           Bytes: 117440512  bytes
           FLOPs: 171840634880  flops
           FLOPs/Byte: 1463

         Runtime: 0.263857  ms
          Memory: 414.524 GiB/s

            Math: 651264 GFLOP/s



=============================
  Problem ID: 1

        Provider: [1;37mCUTLASS[0m
   OperationKind: [1;37mgemm[0m
       Operation: cutlass3x_sm90_tensorop_gemm_f16_f16_f32_f16_f16_128x128x128_8x1x1_0_ttn_align8_warpspecialized_cooperative_epi_nosmem

          Status: [1;37mSuccess[0m
    Verification: [1;37mON[0m
     Disposition: [1;32mPassed[0m

reference_device: Passed
          cuBLAS: Not run
           cuDNN: Not run

       Arguments: --gemm_kind=universal --m=4096 --n=5120 --k=4096 --A=f16:row --B=f16:row --C=f16:column --D=f16:column  \
                  --alpha=1 --beta=0 --split_k_mode=serial --split_k_slices=1 --batch_count=1 --raster_order=along_n  \
                  --runtime_input_datatype_a=invalid --runtime_input_datatype_b=invalid --use_pdl=false --enable_sm90_mixed_dtype_shuffle_test=false  \
                  --swizzle_size=2 --op_class=tensorop --accum=f32 --cta_m=128 --cta_n=128 --cta_k=128 --cluster_m=1  \
                  --cluster_n=1 --cluster_k=1 --cluster_m_fallback=0 --cluster_n_fallback=0 --cluster_k_fallback=0 --stages=3  \
                  --warps_m=4 --warps_n=2 --warps_k=1 --inst_m=64 --inst_n=128 --inst_k=16 --min_cc=90 --max_cc=90

           Bytes: 117440512  bytes
           FLOPs: 171840634880  flops
           FLOPs/Byte: 1463

         Runtime: 0.280905  ms
          Memory: 389.367 GiB/s

            Math: 611740 GFLOP/s



=============================
  Problem ID: 1

        Provider: [1;37mCUTLASS[0m
   OperationKind: [1;37mgemm[0m
       Operation: cutlass3x_sm90_tensorop_gemm_f16_f16_f32_f16_f16_128x128x128_8x1x1_0_ttn_align8_warpspecialized_cooperative_epi_tma

          Status: [1;37mSuccess[0m
    Verification: [1;37mON[0m
     Disposition: [1;32mPassed[0m

reference_device: Passed
          cuBLAS: Not run
           cuDNN: Not run

       Arguments: --gemm_kind=universal --m=4096 --n=5120 --k=4096 --A=f16:row --B=f16:row --C=f16:column --D=f16:column  \
                  --alpha=1 --beta=0 --split_k_mode=serial --split_k_slices=1 --batch_count=1 --raster_order=along_n  \
                  --runtime_input_datatype_a=invalid --runtime_input_datatype_b=invalid --use_pdl=false --enable_sm90_mixed_dtype_shuffle_test=false  \
                  --swizzle_size=2 --op_class=tensorop --accum=f32 --cta_m=128 --cta_n=128 --cta_k=128 --cluster_m=1  \
                  --cluster_n=1 --cluster_k=1 --cluster_m_fallback=0 --cluster_n_fallback=0 --cluster_k_fallback=0 --stages=3  \
                  --warps_m=4 --warps_n=2 --warps_k=1 --inst_m=64 --inst_n=128 --inst_k=16 --min_cc=90 --max_cc=90

           Bytes: 117440512  bytes
           FLOPs: 171840634880  flops
           FLOPs/Byte: 1463

         Runtime: 0.270905  ms
          Memory: 403.739 GiB/s

            Math: 634321 GFLOP/s



=============================
  Problem ID: 1

        Provider: [1;37mCUTLASS[0m
   OperationKind: [1;37mgemm[0m
       Operation: cutlass3x_sm90_tensorop_gemm_f16_f16_f32_f16_f16_128x128x128_8x1x1_0_ttn_align8_stream_k_warpspecialized_cooperative_epi_nosmem

          Status: [1;37mSuccess[0m
    Verification: [1;37mON[0m
     Disposition: [1;32mPassed[0m

reference_device: Passed
          cuBLAS: Not run
           cuDNN: Not run

       Arguments: --gemm_kind=universal --m=4096 --n=5120 --k=4096 --A=f16:row --B=f16:row --C=f16:column --D=f16:column  \
                  --alpha=1 --beta=0 --split_k_mode=serial --split_k_slices=1 --batch_count=1 --raster_order=along_n  \
                  --runtime_input_datatype_a=invalid --runtime_input_datatype_b=invalid --use_pdl=false --enable_sm90_mixed_dtype_shuffle_test=false  \
                  --swizzle_size=2 --op_class=tensorop --accum=f32 --cta_m=128 --cta_n=128 --cta_k=128 --cluster_m=1  \
                  --cluster_n=1 --cluster_k=1 --cluster_m_fallback=0 --cluster_n_fallback=0 --cluster_k_fallback=0 --stages=3  \
                  --warps_m=4 --warps_n=2 --warps_k=1 --inst_m=64 --inst_n=128 --inst_k=16 --min_cc=90 --max_cc=90

           Bytes: 117440512  bytes
           FLOPs: 171840634880  flops
           FLOPs/Byte: 1463

         Runtime: 0.28942  ms
          Memory: 377.911 GiB/s

            Math: 593742 GFLOP/s



=============================
  Problem ID: 1

        Provider: [1;37mCUTLASS[0m
   OperationKind: [1;37mgemm[0m
       Operation: cutlass3x_sm90_tensorop_gemm_f16_f16_f32_f16_f16_128x128x128_8x1x1_0_ttn_align8_stream_k_warpspecialized_cooperative_epi_tma

          Status: [1;37mSuccess[0m
    Verification: [1;37mON[0m
     Disposition: [1;32mPassed[0m

reference_device: Passed
          cuBLAS: Not run
           cuDNN: Not run

       Arguments: --gemm_kind=universal --m=4096 --n=5120 --k=4096 --A=f16:row --B=f16:row --C=f16:column --D=f16:column  \
                  --alpha=1 --beta=0 --split_k_mode=serial --split_k_slices=1 --batch_count=1 --raster_order=along_n  \
                  --runtime_input_datatype_a=invalid --runtime_input_datatype_b=invalid --use_pdl=false --enable_sm90_mixed_dtype_shuffle_test=false  \
                  --swizzle_size=2 --op_class=tensorop --accum=f32 --cta_m=128 --cta_n=128 --cta_k=128 --cluster_m=1  \
                  --cluster_n=1 --cluster_k=1 --cluster_m_fallback=0 --cluster_n_fallback=0 --cluster_k_fallback=0 --stages=3  \
                  --warps_m=4 --warps_n=2 --warps_k=1 --inst_m=64 --inst_n=128 --inst_k=16 --min_cc=90 --max_cc=90

           Bytes: 117440512  bytes
           FLOPs: 171840634880  flops
           FLOPs/Byte: 1463

         Runtime: 0.276685  ms
          Memory: 395.305 GiB/s

            Math: 621070 GFLOP/s



=============================
  Problem ID: 1

        Provider: [1;37mCUTLASS[0m
   OperationKind: [1;37mgemm[0m
       Operation: cutlass3x_sm90_tensorop_gemm_f16_f16_f32_f16_f16_128x128x128_4x1x1_0_ttn_align8

          Status: [1;37mSuccess[0m
    Verification: [1;37mON[0m
     Disposition: [1;32mPassed[0m

reference_device: Passed
          cuBLAS: Not run
           cuDNN: Not run

       Arguments: --gemm_kind=universal --m=4096 --n=5120 --k=4096 --A=f16:row --B=f16:row --C=f16:column --D=f16:column  \
                  --alpha=1 --beta=0 --split_k_mode=serial --split_k_slices=1 --batch_count=1 --raster_order=along_n  \
                  --runtime_input_datatype_a=invalid --runtime_input_datatype_b=invalid --use_pdl=false --enable_sm90_mixed_dtype_shuffle_test=false  \
                  --swizzle_size=4 --op_class=tensorop --accum=f32 --cta_m=128 --cta_n=128 --cta_k=128 --cluster_m=1  \
                  --cluster_n=1 --cluster_k=1 --cluster_m_fallback=0 --cluster_n_fallback=0 --cluster_k_fallback=0 --stages=3  \
                  --warps_m=4 --warps_n=2 --warps_k=1 --inst_m=64 --inst_n=128 --inst_k=16 --min_cc=90 --max_cc=90

           Bytes: 117440512  bytes
           FLOPs: 171840634880  flops
           FLOPs/Byte: 1463

         Runtime: 0.279315  ms
          Memory: 391.584 GiB/s

            Math: 615223 GFLOP/s



=============================
  Problem ID: 1

        Provider: [1;37mCUTLASS[0m
   OperationKind: [1;37mgemm[0m
       Operation: cutlass3x_sm90_tensorop_gemm_f16_f16_f32_f16_f16_128x128x128_4x1x1_0_ttn_align8_warpspecialized_epi_nosmem

          Status: [1;37mSuccess[0m
    Verification: [1;37mON[0m
     Disposition: [1;32mPassed[0m

reference_device: Passed
          cuBLAS: Not run
           cuDNN: Not run

       Arguments: --gemm_kind=universal --m=4096 --n=5120 --k=4096 --A=f16:row --B=f16:row --C=f16:column --D=f16:column  \
                  --alpha=1 --beta=0 --split_k_mode=serial --split_k_slices=1 --batch_count=1 --raster_order=along_n  \
                  --runtime_input_datatype_a=invalid --runtime_input_datatype_b=invalid --use_pdl=false --enable_sm90_mixed_dtype_shuffle_test=false  \
                  --swizzle_size=1 --op_class=tensorop --accum=f32 --cta_m=128 --cta_n=128 --cta_k=128 --cluster_m=1  \
                  --cluster_n=1 --cluster_k=1 --cluster_m_fallback=0 --cluster_n_fallback=0 --cluster_k_fallback=0 --stages=3  \
                  --warps_m=4 --warps_n=1 --warps_k=1 --inst_m=64 --inst_n=128 --inst_k=16 --min_cc=90 --max_cc=90

           Bytes: 117440512  bytes
           FLOPs: 171840634880  flops
           FLOPs/Byte: 1463

