profiler_out/cutlass3x_sm90_tensorop_gemm_f16_f16_f32_f16_f16_tt_1/4096x5120x4096.gemm.csv
Problem,Provider,OperationKind,Operation,Disposition,Status,gemm_kind,m,n,k,A,B,C,D,alpha,beta,split_k_mode,split_k_slices,batch_count,raster_order,runtime_input_datatype_a,runtime_input_datatype_b,use_pdl,enable_sm90_mixed_dtype_shuffle_test,swizzle_size,op_class,accum,cta_m,cta_n,cta_k,cluster_m,cluster_n,cluster_k,cluster_m_fallback,cluster_n_fallback,cluster_k_fallback,stages,warps_m,warps_n,warps_k,inst_m,inst_n,inst_k,min_cc,max_cc,Bytes,Flops,Flops/Byte,Runtime,GB/s,GFLOPs
1,CUTLASS,gemm,cutlass3x_sm90_tensorop_gemm_f16_f16_f32_f16_f16_128x128x64_2x1x1_0_ttn_align8,passed,success,universal,4096,5120,4096,f16:row,f16:row,f16:column,f16:column,1,0,serial,1,1,along_n,invalid,invalid,false,false,1,tensorop,f32,128,128,64,1,1,1,0,0,0,7,4,2,1,64,128,16,90,90,117440512,171840634880,1463,0.257456,424.83,667456
1,CUTLASS,gemm,cutlass3x_sm90_tensorop_gemm_f16_f16_f32_f16_f16_128x128x64_2x1x1_0_ttn_align8_warpspecialized_epi_nosmem,passed,success,universal,4096,5120,4096,f16:row,f16:row,f16:column,f16:column,1,0,serial,1,1,along_n,invalid,invalid,false,false,2,tensorop,f32,128,128,64,1,1,1,0,0,0,7,4,1,1,64,128,16,90,90,117440512,171840634880,1463,0.286758,381.42,599254
1,CUTLASS,gemm,cutlass3x_sm90_tensorop_gemm_f16_f16_f32_f16_f16_128x128x64_2x1x1_0_ttn_align8_warpspecialized_pingpong_epi_tma,passed,success,universal,4096,5120,4096,f16:row,f16:row,f16:column,f16:column,1,0,serial,1,1,along_n,invalid,invalid,false,false,1,tensorop,f32,128,128,64,1,1,1,0,0,0,6,4,1,1,64,128,16,90,90,117440512,171840634880,1463,0.246494,443.722,697138
1,CUTLASS,gemm,cutlass3x_sm90_tensorop_gemm_f16_f16_f32_f16_f16_128x128x64_2x1x1_0_ttn_align8_warpspecialized_pingpong_epi_nosmem,passed,success,universal,4096,5120,4096,f16:row,f16:row,f16:column,f16:column,1,0,serial,1,1,along_n,invalid,invalid,false,false,2,tensorop,f32,128,128,64,1,1,1,0,0,0,7,4,1,1,64,128,16,90,90,117440512,171840634880,1463,0.246151,444.34,698110
1,CUTLASS,gemm,cutlass3x_sm90_tensorop_gemm_f16_f16_f32_f16_f16_128x128x64_2x1x1_0_ttn_align8_warpspecialized_cooperative_epi_nosmem,passed,success,universal,4096,5120,4096,f16:row,f16:row,f16:column,f16:column,1,0,serial,1,1,along_n,invalid,invalid,false,false,1,tensorop,f32,128,128,64,1,1,1,0,0,0,7,4,2,1,64,128,16,90,90,117440512,171840634880,1463,0.257497,424.762,667349
1,CUTLASS,gemm,cutlass3x_sm90_tensorop_gemm_f16_f16_f32_f16_f16_128x128x64_2x1x1_0_ttn_align8_warpspecialized_cooperative_epi_tma,passed,success,universal,4096,5120,4096,f16:row,f16:row,f16:column,f16:column,1,0,serial,1,1,along_n,invalid,invalid,false,false,1,tensorop,f32,128,128,64,1,1,1,0,0,0,6,4,2,1,64,128,16,90,90,117440512,171840634880,1463,0.241506,452.887,711537
1,CUTLASS,gemm,cutlass3x_sm90_tensorop_gemm_f16_f16_f32_f16_f16_128x128x64_2x1x1_0_ttn_align8_stream_k_warpspecialized_cooperative_epi_nosmem,passed,success,universal,4096,5120,4096,f16:row,f16:row,f16:column,f16:column,1,0,serial,1,1,along_n,invalid,invalid,false,false,1,tensorop,f32,128,128,64,1,1,1,0,0,0,7,4,2,1,64,128,16,90,90,117440512,171840634880,1463,0.263629,414.883,651828
1,CUTLASS,gemm,cutlass3x_sm90_tensorop_gemm_f16_f16_f32_f16_f16_128x128x64_2x1x1_0_ttn_align8_stream_k_warpspecialized_cooperative_epi_tma,passed,success,universal,4096,5120,4096,f16:row,f16:row,f16:column,f16:column,1,0,serial,1,1,along_n,invalid,invalid,false,false,1,tensorop,f32,128,128,64,1,1,1,0,0,0,6,4,2,1,64,128,16,90,90,117440512,171840634880,1463,0.253417,431.6,678094
1,CUTLASS,gemm,cutlass3x_sm90_tensorop_gemm_f16_f16_f32_f16_f16_128x16x64_1x8x1_0_ttn_align8,passed,success,universal,4096,5120,4096,f16:row,f16:row,f16:column,f16:column,1,0,serial,1,1,along_m,invalid,invalid,false,false,8,tensorop,f32,128,16,64,1,1,1,0,0,0,12,4,2,1,64,16,16,90,90,117440512,171840634880,1463,0.809229,135.16,212351
1,CUTLASS,gemm,cutlass3x_sm90_tensorop_gemm_f16_f16_f32_f16_f16_128x16x64_1x8x1_0_ttn_align8_warpspecialized_epi_nosmem,passed,success,universal,4096,5120,4096,f16:row,f16:row,f16:column,f16:column,1,0,serial,1,1,along_n,invalid,invalid,false,false,2,tensorop,f32,128,16,64,1,1,1,0,0,0,12,4,1,1,64,16,16,90,90,117440512,171840634880,1463,0.761948,143.547,225528
1,CUTLASS,gemm,cutlass3x_sm90_tensorop_gemm_f16_f16_f32_f16_f16_128x16x64_1x8x1_0_ttn_align8_warpspecialized_pingpong_epi_tma,passed,success,universal,4096,5120,4096,f16:row,f16:row,f16:column,f16:column,1,0,serial,1,1,along_m,invalid,invalid,false,false,4,tensorop,f32,128,16,64,1,1,1,0,0,0,12,4,1,1,64,16,16,90,90,117440512,171840634880,1463,0.631734,173.135,272014
1,CUTLASS,gemm,cutlass3x_sm90_tensorop_gemm_f16_f16_f32_f16_f16_128x16x64_1x8x1_0_ttn_align8_warpspecialized_pingpong_epi_nosmem,passed,success,universal,4096,5120,4096,f16:row,f16:row,f16:column,f16:column,1,0,serial,1,1,along_m,invalid,invalid,false,false,8,tensorop,f32,128,16,64,1,1,1,0,0,0,12,4,1,1,64,16,16,90,90,117440512,171840634880,1463,0.633237,172.724,271368
1,CUTLASS,gemm,cutlass3x_sm90_tensorop_gemm_f16_f16_f32_f16_f16_128x16x64_1x8x1_0_ttn_align8_warpspecialized_cooperative_epi_nosmem,passed,success,universal,4096,5120,4096,f16:row,f16:row,f16:column,f16:column,1,0,serial,1,1,along_m,invalid,invalid,false,false,8,tensorop,f32,128,16,64,1,1,1,0,0,0,12,4,2,1,64,16,16,90,90,117440512,171840634880,1463,0.808016,135.362,212670
1,CUTLASS,gemm,cutlass3x_sm90_tensorop_gemm_f16_f16_f32_f16_f16_128x16x64_1x8x1_0_ttn_align8_warpspecialized_cooperative_epi_tma,passed,success,universal,4096,5120,4096,f16:row,f16:row,f16:column,f16:column,1,0,serial,1,1,along_m,invalid,invalid,false,false,1,tensorop,f32,128,16,64,1,1,1,0,0,0,12,4,2,1,64,16,16,90,90,117440512,171840634880,1463,0.822827,132.926,208842
1,CUTLASS,gemm,cutlass3x_sm90_tensorop_gemm_f16_f16_f32_f16_f16_128x16x64_1x8x1_0_ttn_align8_stream_k_warpspecialized_cooperative_epi_nosmem,passed,success,universal,4096,5120,4096,f16:row,f16:row,f16:column,f16:column,1,0,serial,1,1,along_m,invalid,invalid,false,false,8,tensorop,f32,128,16,64,1,1,1,0,0,0,12,4,2,1,64,16,16,90,90,117440512,171840634880,1463,0.79001,138.448,217517
1,CUTLASS,gemm,cutlass3x_sm90_tensorop_gemm_f16_f16_f32_f16_f16_128x16x64_1x8x1_0_ttn_align8_stream_k_warpspecialized_cooperative_epi_tma,passed,success,universal,4096,5120,4096,f16:row,f16:row,f16:column,f16:column,1,0,serial,1,1,along_m,invalid,invalid,false,false,4,tensorop,f32,128,16,64,1,1,1,0,0,0,12,4,2,1,64,16,16,90,90,117440512,171840634880,1463,0.807735,135.41,212744
1,CUTLASS,gemm,cutlass3x_sm90_tensorop_gemm_f16_f16_f32_f16_f16_64x64x256_1x1x1_0_ttn_align8,passed,success,universal,4096,5120,4096,f16:row,f16:row,f16:column,f16:column,1,0,serial,1,1,along_n,invalid,invalid,false,false,4,tensorop,f32,64,64,256,1,1,1,0,0,0,3,4,1,1,64,64,16,90,90,117440512,171840634880,1463,0.497895,219.675,345134
1,CUTLASS,gemm,cutlass3x_sm90_tensorop_gemm_f16_f16_f32_f16_f16_64x64x256_1x1x1_0_ttn_align8_warpspecialized_epi_nosmem,passed,success,universal,4096,5120,4096,f16:row,f16:row,f16:column,f16:column,1,0,serial,1,1,along_m,invalid,invalid,false,false,2,tensorop,f32,64,64,256,1,1,1,0,0,0,3,4,1,1,64,64,16,90,90,117440512,171840634880,1463,0.613133,178.387,280266
1,CUTLASS,gemm,cutlass3x_sm90_tensorop_gemm_f16_f16_f32_f16_f16_64x64x256_1x1x1_0_ttn_align8_warpspecialized_pingpong_epi_tma,passed,success,universal,4096,5120,4096,f16:row,f16:row,f16:column,f16:column,1,0,serial,1,1,along_n,invalid,invalid,false,false,4,tensorop,f32,64,64,256,1,1,1,0,0,0,3,4,1,1,64,64,16,90,90,117440512,171840634880,1463,0.497567,219.819,345362
1,CUTLASS,gemm,cutlass3x_sm90_tensorop_gemm_f16_f16_f32_f16_f16_64x64x256_1x1x1_0_ttn_align8_warpspecialized_pingpong_epi_nosmem,passed,success,universal,4096,5120,4096,f16:row,f16:row,f16:column,f16:column,1,0,serial,1,1,along_n,invalid,invalid,false,false,4,tensorop,f32,64,64,256,1,1,1,0,0,0,3,4,1,1,64,64,16,90,90,117440512,171840634880,1463,0.496877,220.125,345842
1,CUTLASS,gemm,cutlass3x_sm90_tensorop_gemm_f16_f16_f32_f16_f16_128x16x64_4x2x1_0_ttn_align8,passed,success,universal,4096,5120,4096,f16:row,f16:row,f16:column,f16:column,1,0,serial,1,1,along_m,invalid,invalid,false,false,4,tensorop,f32,128,16,64,1,1,1,0,0,0,12,4,2,1,64,16,16,90,90,117440512,171840634880,1463,0.846566,129.198,202985
1,CUTLASS,gemm,cutlass3x_sm90_tensorop_gemm_f16_f16_f32_f16_f16_128x16x64_4x2x1_0_ttn_align8_warpspecialized_epi_nosmem,passed,success,universal,4096,5120,4096,f16:row,f16:row,f16:column,f16:column,1,0,serial,1,1,along_n,invalid,invalid,false,false,8,tensorop,f32,128,16,64,1,1,1,0,0,0,12,4,1,1,64,16,16,90,90,117440512,171840634880,1463,1.20547,90.732,142550
1,CUTLASS,gemm,cutlass3x_sm90_tensorop_gemm_f16_f16_f32_f16_f16_128x16x64_4x2x1_0_ttn_align8_warpspecialized_pingpong_epi_tma,passed,success,universal,4096,5120,4096,f16:row,f16:row,f16:column,f16:column,1,0,serial,1,1,along_n,invalid,invalid,false,false,1,tensorop,f32,128,16,64,1,1,1,0,0,0,12,4,1,1,64,16,16,90,90,117440512,171840634880,1463,0.839898,130.224,204597
1,CUTLASS,gemm,cutlass3x_sm90_tensorop_gemm_f16_f16_f32_f16_f16_128x16x64_4x2x1_0_ttn_align8_warpspecialized_pingpong_epi_nosmem,passed,success,universal,4096,5120,4096,f16:row,f16:row,f16:column,f16:column,1,0,serial,1,1,along_n,invalid,invalid,false,false,2,tensorop,f32,128,16,64,1,1,1,0,0,0,12,4,1,1,64,16,16,90,90,117440512,171840634880,1463,0.846123,129.266,203092
1,CUTLASS,gemm,cutlass3x_sm90_tensorop_gemm_f16_f16_f32_f16_f16_128x16x64_4x2x1_0_ttn_align8_warpspecialized_cooperative_epi_nosmem,passed,success,universal,4096,5120,4096,f16:row,f16:row,f16:column,f16:column,1,0,serial,1,1,along_m,invalid,invalid,false,false,4,tensorop,f32,128,16,64,1,1,1,0,0,0,12,4,2,1,64,16,16,90,90,117440512,171840634880,1463,0.850585,128.588,202026
1,CUTLASS,gemm,cutlass3x_sm90_tensorop_gemm_f16_f16_f32_f16_f16_128x16x64_4x2x1_0_ttn_align8_warpspecialized_cooperative_epi_tma,passed,success,universal,4096,5120,4096,f16:row,f16:row,f16:column,f16:column,1,0,serial,1,1,along_m,invalid,invalid,false,false,8,tensorop,f32,128,16,64,1,1,1,0,0,0,12,4,2,1,64,16,16,90,90,117440512,171840634880,1463,0.869691,125.763,197588
1,CUTLASS,gemm,cutlass3x_sm90_tensorop_gemm_f16_f16_f32_f16_f16_128x16x64_4x2x1_0_ttn_align8_stream_k_warpspecialized_cooperative_epi_nosmem,passed,success,universal,4096,5120,4096,f16:row,f16:row,f16:column,f16:column,1,0,serial,1,1,along_n,invalid,invalid,false,false,1,tensorop,f32,128,16,64,1,1,1,0,0,0,12,4,2,1,64,16,16,90,90,117440512,171840634880,1463,0.865966,126.304,198438
1,CUTLASS,gemm,cutlass3x_sm90_tensorop_gemm_f16_f16_f32_f16_f16_128x16x64_4x2x1_0_ttn_align8_stream_k_warpspecialized_cooperative_epi_tma,passed,success,universal,4096,5120,4096,f16:row,f16:row,f16:column,f16:column,1,0,serial,1,1,along_m,invalid,invalid,false,false,8,tensorop,f32,128,16,64,1,1,1,0,0,0,12,4,2,1,64,16,16,90,90,117440512,171840634880,1463,0.887122,123.292,193706
1,CUTLASS,gemm,cutlass3x_sm90_tensorop_gemm_f16_f16_f32_f16_f16_128x128x128_1x8x1_0_ttn_align8,passed,success,universal,4096,5120,4096,f16:row,f16:row,f16:column,f16:column,1,0,serial,1,1,along_m,invalid,invalid,false,false,1,tensorop,f32,128,128,128,1,1,1,0,0,0,3,4,2,1,64,128,16,90,90,117440512,171840634880,1463,0.277926,393.54,618297
1,CUTLASS,gemm,cutlass3x_sm90_tensorop_gemm_f16_f16_f32_f16_f16_128x128x128_1x8x1_0_ttn_align8_warpspecialized_epi_nosmem,passed,success,universal,4096,5120,4096,f16:row,f16:row,f16:column,f16:column,1,0,serial,1,1,along_n,invalid,invalid,false,false,8,tensorop,f32,128,128,128,1,1,1,0,0,0,3,4,1,1,64,128,16,90,90,117440512,171840634880,1463,0.283001,386.482,607208
1,CUTLASS,gemm,cutlass3x_sm90_tensorop_gemm_f16_f16_f32_f16_f16_128x128x128_1x8x1_0_ttn_align8_warpspecialized_pingpong_epi_tma,passed,success,universal,4096,5120,4096,f16:row,f16:row,f16:column,f16:column,1,0,serial,1,1,along_m,invalid,invalid,false,false,1,tensorop,f32,128,128,128,1,1,1,0,0,0,3,4,1,1,64,128,16,90,90,117440512,171840634880,1463,0.259891,420.849,661202
1,CUTLASS,gemm,cutlass3x_sm90_tensorop_gemm_f16_f16_f32_f16_f16_128x128x128_1x8x1_0_ttn_align8_warpspecialized_pingpong_epi_nosmem,passed,success,universal,4096,5120,4096,f16:row,f16:row,f16:column,f16:column,1,0,serial,1,1,along_m,invalid,invalid,false,false,1,tensorop,f32,128,128,128,1,1,1,0,0,0,3,4,1,1,64,128,16,90,90,117440512,171840634880,1463,0.260691,419.559,659175
1,CUTLASS,gemm,cutlass3x_sm90_tensorop_gemm_f16_f16_f32_f16_f16_128x128x128_1x8x1_0_ttn_align8_warpspecialized_cooperative_epi_nosmem,passed,success,universal,4096,5120,4096,f16:row,f16:row,f16:column,f16:column,1,0,serial,1,1,along_m,invalid,invalid,false,false,1,tensorop,f32,128,128,128,1,1,1,0,0,0,3,4,2,1,64,128,16,90,90,117440512,171840634880,1463,0.277501,394.142,619242
1,CUTLASS,gemm,cutlass3x_sm90_tensorop_gemm_f16_f16_f32_f16_f16_128x128x128_1x8x1_0_ttn_align8_warpspecialized_cooperative_epi_tma,passed,success,universal,4096,5120,4096,f16:row,f16:row,f16:column,f16:column,1,0,serial,1,1,along_m,invalid,invalid,false,false,1,tensorop,f32,128,128,128,1,1,1,0,0,0,3,4,2,1,64,128,16,90,90,117440512,171840634880,1463,0.26735,409.108,642755
1,CUTLASS,gemm,cutlass3x_sm90_tensorop_gemm_f16_f16_f32_f16_f16_128x128x128_1x8x1_0_ttn_align8_stream_k_warpspecialized_cooperative_epi_nosmem,passed,success,universal,4096,5120,4096,f16:row,f16:row,f16:column,f16:column,1,0,serial,1,1,along_m,invalid,invalid,false,false,1,tensorop,f32,128,128,128,1,1,1,0,0,0,3,4,2,1,64,128,16,90,90,117440512,171840634880,1463,0.288445,379.188,595747
1,CUTLASS,gemm,cutlass3x_sm90_tensorop_gemm_f16_f16_f32_f16_f16_128x128x128_1x8x1_0_ttn_align8_stream_k_warpspecialized_cooperative_epi_tma,passed,success,universal,4096,5120,4096,f16:row,f16:row,f16:column,f16:column,1,0,serial,1,1,along_m,invalid,invalid,false,false,1,tensorop,f32,128,128,128,1,1,1,0,0,0,3,4,2,1,64,128,16,90,90,117440512,171840634880,1463,0.274075,399.069,626984
1,CUTLASS,gemm,cutlass3x_sm90_tensorop_gemm_f16_f16_f32_f16_f16_128x128x128_8x1x1_0_ttn_align8,passed,success,universal,4096,5120,4096,f16:row,f16:row,f16:column,f16:column,1,0,serial,1,1,along_n,invalid,invalid,false,false,2,tensorop,f32,128,128,128,1,1,1,0,0,0,3,4,2,1,64,128,16,90,90,117440512,171840634880,1463,0.280824,389.479,611916
1,CUTLASS,gemm,cutlass3x_sm90_tensorop_gemm_f16_f16_f32_f16_f16_128x128x128_8x1x1_0_ttn_align8_warpspecialized_epi_nosmem,passed,success,universal,4096,5120,4096,f16:row,f16:row,f16:column,f16:column,1,0,serial,1,1,along_m,invalid,invalid,false,false,2,tensorop,f32,128,128,128,1,1,1,0,0,0,3,4,1,1,64,128,16,90,90,117440512,171840634880,1463,0.307703,355.456,558463
1,CUTLASS,gemm,cutlass3x_sm90_tensorop_gemm_f16_f16_f32_f16_f16_128x128x128_8x1x1_0_ttn_align8_warpspecialized_pingpong_epi_tma,passed,success,universal,4096,5120,4096,f16:row,f16:row,f16:column,f16:column,1,0,serial,1,1,along_n,invalid,invalid,false,false,2,tensorop,f32,128,128,128,1,1,1,0,0,0,3,4,1,1,64,128,16,90,90,117440512,171840634880,1463,0.262314,416.962,655095
1,CUTLASS,gemm,cutlass3x_sm90_tensorop_gemm_f16_f16_f32_f16_f16_128x128x128_8x1x1_0_ttn_align8_warpspecialized_pingpong_epi_nosmem,passed,success,universal,4096,5120,4096,f16:row,f16:row,f16:column,f16:column,1,0,serial,1,1,along_n,invalid,invalid,false,false,2,tensorop,f32,128,128,128,1,1,1,0,0,0,3,4,1,1,64,128,16,90,90,117440512,171840634880,1463,0.263857,414.524,651264
1,CUTLASS,gemm,cutlass3x_sm90_tensorop_gemm_f16_f16_f32_f16_f16_128x128x128_8x1x1_0_ttn_align8_warpspecialized_cooperative_epi_nosmem,passed,success,universal,4096,5120,4096,f16:row,f16:row,f16:column,f16:column,1,0,serial,1,1,along_n,invalid,invalid,false,false,2,tensorop,f32,128,128,128,1,1,1,0,0,0,3,4,2,1,64,128,16,90,90,117440512,171840634880,1463,0.280905,389.367,611740
1,CUTLASS,gemm,cutlass3x_sm90_tensorop_gemm_f16_f16_f32_f16_f16_128x128x128_8x1x1_0_ttn_align8_warpspecialized_cooperative_epi_tma,passed,success,universal,4096,5120,4096,f16:row,f16:row,f16:column,f16:column,1,0,serial,1,1,along_n,invalid,invalid,false,false,2,tensorop,f32,128,128,128,1,1,1,0,0,0,3,4,2,1,64,128,16,90,90,117440512,171840634880,1463,0.270905,403.739,634321
1,CUTLASS,gemm,cutlass3x_sm90_tensorop_gemm_f16_f16_f32_f16_f16_128x128x128_8x1x1_0_ttn_align8_stream_k_warpspecialized_cooperative_epi_nosmem,passed,success,universal,4096,5120,4096,f16:row,f16:row,f16:column,f16:column,1,0,serial,1,1,along_n,invalid,invalid,false,false,2,tensorop,f32,128,128,128,1,1,1,0,0,0,3,4,2,1,64,128,16,90,90,117440512,171840634880,1463,0.28942,377.911,593742
1,CUTLASS,gemm,cutlass3x_sm90_tensorop_gemm_f16_f16_f32_f16_f16_128x128x128_8x1x1_0_ttn_align8_stream_k_warpspecialized_cooperative_epi_tma,passed,success,universal,4096,5120,4096,f16:row,f16:row,f16:column,f16:column,1,0,serial,1,1,along_n,invalid,invalid,false,false,2,tensorop,f32,128,128,128,1,1,1,0,0,0,3,4,2,1,64,128,16,90,90,117440512,171840634880,1463,0.276685,395.305,621070
1,CUTLASS,gemm,cutlass3x_sm90_tensorop_gemm_f16_f16_f32_f16_f16_128x128x128_4x1x1_0_ttn_align8,passed,success,universal,4096,5120,4096,f16:row,f16:row,f16:column,f16:column,1,0,serial,1,1,along_n,invalid,invalid,false,false,4,tensorop,f32,128,128,128,1,1,1,0,0,0,3,4,2,1,64,128,16,90,90,117440512,171840634880,1463,0.279315,391.584,615223
1,CUTLASS,gemm,cutlass3x_sm90_tensorop_gemm_f16_f16_f32_f16_f16_128x128x128_4x1x1_0_ttn_align8_warpspecialized_epi_nosmem,passed,success,universal,4096,5120,4096,f16:row,f16:row,f16:column,f16:column,1,0,serial,1,1,along_n,invalid,invalid,false,false,1,tensorop,f32,128,128,128,1,1,1,0,0,0,3,4,1,1,64,128,16,90,90,117440512,171840634880,1463,0.299737,364.903,573305
1,CUTLASS,gemm,cutlass3x_sm90_tensorop_gemm_f16_f16_f32_f16_f16_128x128x128_4x1x1_0_ttn_align8_warpspecialized_pingpong_epi_tma,passed,success,universal,4096,5120,4096,f16:row,f16:row,f16:column,f16:column,1,0,serial,1,1,along_n,invalid,invalid,false,false,4,tensorop,f32,128,128,128,1,1,1,0,0,0,3,4,1,1,64,128,16,90,90,117440512,171840634880,1463,0.258741,422.72,664142
1,CUTLASS,gemm,cutlass3x_sm90_tensorop_gemm_f16_f16_f32_f16_f16_128x128x128_4x1x1_0_ttn_align8_warpspecialized_pingpong_epi_nosmem,passed,success,universal,4096,5120,4096,f16:row,f16:row,f16:column,f16:column,1,0,serial,1,1,along_n,invalid,invalid,false,false,4,tensorop,f32,128,128,128,1,1,1,0,0,0,3,4,1,1,64,128,16,90,90,117440512,171840634880,1463,0.256977,425.621,668700
1,CUTLASS,gemm,cutlass3x_sm90_tensorop_gemm_f16_f16_f32_f16_f16_128x128x128_4x1x1_0_ttn_align8_warpspecialized_cooperative_epi_nosmem,passed,success,universal,4096,5120,4096,f16:row,f16:row,f16:column,f16:column,1,0,serial,1,1,along_n,invalid,invalid,false,false,4,tensorop,f32,128,128,128,1,1,1,0,0,0,3,4,2,1,64,128,16,90,90,117440512,171840634880,1463,0.275212,397.422,624395
1,CUTLASS,gemm,cutlass3x_sm90_tensorop_gemm_f16_f16_f32_f16_f16_128x128x128_4x1x1_0_ttn_align8_warpspecialized_cooperative_epi_tma,passed,success,universal,4096,5120,4096,f16:row,f16:row,f16:column,f16:column,1,0,serial,1,1,along_n,invalid,invalid,false,false,4,tensorop,f32,128,128,128,1,1,1,0,0,0,3,4,2,1,64,128,16,90,90,117440512,171840634880,1463,0.266432,410.518,644971
1,CUTLASS,gemm,cutlass3x_sm90_tensorop_gemm_f16_f16_f32_f16_f16_128x128x128_4x1x1_0_ttn_align8_stream_k_warpspecialized_cooperative_epi_nosmem,passed,success,universal,4096,5120,4096,f16:row,f16:row,f16:column,f16:column,1,0,serial,1,1,along_n,invalid,invalid,false,false,4,tensorop,f32,128,128,128,1,1,1,0,0,0,3,4,2,1,64,128,16,90,90,117440512,171840634880,1463,0.280912,389.356,611723
1,CUTLASS,gemm,cutlass3x_sm90_tensorop_gemm_f16_f16_f32_f16_f16_128x128x128_4x1x1_0_ttn_align8_stream_k_warpspecialized_cooperative_epi_tma,passed,success,universal,4096,5120,4096,f16:row,f16:row,f16:column,f16:column,1,0,serial,1,1,along_n,invalid,invalid,false,false,4,tensorop,f32,128,128,128,1,1,1,0,0,0,3,4,2,1,64,128,16,90,90,117440512,171840634880,1463,0.276482,395.595,621526
1,CUTLASS,gemm,cutlass3x_sm90_tensorop_gemm_f16_f16_f32_f16_f16_128x128x128_1x4x1_0_ttn_align8,passed,success,universal,4096,5120,4096,f16:row,f16:row,f16:column,f16:column,1,0,serial,1,1,along_m,invalid,invalid,false,false,2,tensorop,f32,128,128,128,1,1,1,0,0,0,3,4,2,1,64,128,16,90,90,117440512,171840634880,1463,0.270558,404.257,635134
1,CUTLASS,gemm,cutlass3x_sm90_tensorop_gemm_f16_f16_f32_f16_f16_128x128x128_1x4x1_0_ttn_align8_warpspecialized_epi_nosmem,passed,success,universal,4096,5120,4096,f16:row,f16:row,f16:column,f16:column,1,0,serial,1,1,along_m,invalid,invalid,false,false,1,tensorop,f32,128,128,128,1,1,1,0,0,0,3,4,1,1,64,128,16,90,90,117440512,171840634880,1463,0.290245,376.836,592053
1,CUTLASS,gemm,cutlass3x_sm90_tensorop_gemm_f16_f16_f32_f16_f16_128x128x128_1x4x1_0_ttn_align8_warpspecialized_pingpong_epi_tma,passed,success,universal,4096,5120,4096,f16:row,f16:row,f16:column,f16:column,1,0,serial,1,1,along_m,invalid,invalid,false,false,2,tensorop,f32,128,128,128,1,1,1,0,0,0,3,4,1,1,64,128,16,90,90,117440512,171840634880,1463,0.251924,434.158,682112
1,CUTLASS,gemm,cutlass3x_sm90_tensorop_gemm_f16_f16_f32_f16_f16_128x128x128_1x4x1_0_ttn_align8_warpspecialized_pingpong_epi_nosmem,passed,success,universal,4096,5120,4096,f16:row,f16:row,f16:column,f16:column,1,0,serial,1,1,along_m,invalid,invalid,false,false,2,tensorop,f32,128,128,128,1,1,1,0,0,0,3,4,1,1,64,128,16,90,90,117440512,171840634880,1463,0.253788,430.969,677102
1,CUTLASS,gemm,cutlass3x_sm90_tensorop_gemm_f16_f16_f32_f16_f16_128x128x128_1x4x1_0_ttn_align8_warpspecialized_cooperative_epi_nosmem,passed,success,universal,4096,5120,4096,f16:row,f16:row,f16:column,f16:column,1,0,serial,1,1,along_m,invalid,invalid,false,false,2,tensorop,f32,128,128,128,1,1,1,0,0,0,3,4,2,1,64,128,16,90,90,117440512,171840634880,1463,0.270301,404.642,635739
1,CUTLASS,gemm,cutlass3x_sm90_tensorop_gemm_f16_f16_f32_f16_f16_128x128x128_1x4x1_0_ttn_align8_warpspecialized_cooperative_epi_tma,passed,success,universal,4096,5120,4096,f16:row,f16:row,f16:column,f16:column,1,0,serial,1,1,along_m,invalid,invalid,false,false,2,tensorop,f32,128,128,128,1,1,1,0,0,0,3,4,2,1,64,128,16,90,90,117440512,171840634880,1463,0.258804,422.617,663979
1,CUTLASS,gemm,cutlass3x_sm90_tensorop_gemm_f16_f16_f32_f16_f16_128x128x128_1x4x1_0_ttn_align8_stream_k_warpspecialized_cooperative_epi_nosmem,passed,success,universal,4096,5120,4096,f16:row,f16:row,f16:column,f16:column,1,0,serial,1,1,along_m,invalid,invalid,false,false,2,tensorop,f32,128,128,128,1,1,1,0,0,0,3,4,2,1,64,128,16,90,90,117440512,171840634880,1463,0.281604,388.4,610221
1,CUTLASS,gemm,cutlass3x_sm90_tensorop_gemm_f16_f16_f32_f16_f16_128x128x128_1x4x1_0_ttn_align8_stream_k_warpspecialized_cooperative_epi_tma,passed,success,universal,4096,5120,4096,f16:row,f16:row,f16:column,f16:column,1,0,serial,1,1,along_m,invalid,invalid,false,false,2,tensorop,f32,128,128,128,1,1,1,0,0,0,3,4,2,1,64,128,16,90,90,117440512,171840634880,1463,0.265895,411.347,646273
1,CUTLASS,gemm,cutlass3x_sm90_tensorop_gemm_f16_f16_f32_f16_f16_128x128x128_2x1x1_0_ttn_align8,passed,success,universal,4096,5120,4096,f16:row,f16:row,f16:column,f16:column,1,0,serial,1,1,along_n,invalid,invalid,false,false,2,tensorop,f32,128,128,128,1,1,1,0,0,0,3,4,2,1,64,128,16,90,90,117440512,171840634880,1463,0.285785,382.718,601294
1,CUTLASS,gemm,cutlass3x_sm90_tensorop_gemm_f16_f16_f32_f16_f16_128x128x128_2x1x1_0_ttn_align8_warpspecialized_epi_nosmem,passed,success,universal,4096,5120,4096,f16:row,f16:row,f16:column,f16:column,1,0,serial,1,1,along_m,invalid,invalid,false,false,4,tensorop,f32,128,128,128,1,1,1,0,0,0,3,4,1,1,64,128,16,90,90,117440512,171840634880,1463,0.322884,338.744,532205
1,CUTLASS,gemm,cutlass3x_sm90_tensorop_gemm_f16_f16_f32_f16_f16_128x128x128_2x1x1_0_ttn_align8_warpspecialized_pingpong_epi_tma,passed,success,universal,4096,5120,4096,f16:row,f16:row,f16:column,f16:column,1,0,serial,1,1,along_n,invalid,invalid,false,false,2,tensorop,f32,128,128,128,1,1,1,0,0,0,3,4,1,1,64,128,16,90,90,117440512,171840634880,1463,0.271796,402.416,632241
1,CUTLASS,gemm,cutlass3x_sm90_tensorop_gemm_f16_f16_f32_f16_f16_128x128x128_2x1x1_0_ttn_align8_warpspecialized_pingpong_epi_nosmem,passed,success,universal,4096,5120,4096,f16:row,f16:row,f16:column,f16:column,1,0,serial,1,1,along_n,invalid,invalid,false,false,2,tensorop,f32,128,128,128,1,1,1,0,0,0,3,4,1,1,64,128,16,90,90,117440512,171840634880,1463,0.274547,398.384,625907
1,CUTLASS,gemm,cutlass3x_sm90_tensorop_gemm_f16_f16_f32_f16_f16_128x128x128_2x1x1_0_ttn_align8_warpspecialized_cooperative_epi_nosmem,passed,success,universal,4096,5120,4096,f16:row,f16:row,f16:column,f16:column,1,0,serial,1,1,along_n,invalid,invalid,false,false,2,tensorop,f32,128,128,128,1,1,1,0,0,0,3,4,2,1,64,128,16,90,90,117440512,171840634880,1463,0.285427,383.198,602047
1,CUTLASS,gemm,cutlass3x_sm90_tensorop_gemm_f16_f16_f32_f16_f16_128x128x128_2x1x1_0_ttn_align8_warpspecialized_cooperative_epi_tma,passed,success,universal,4096,5120,4096,f16:row,f16:row,f16:column,f16:column,1,0,serial,1,1,along_n,invalid,invalid,false,false,2,tensorop,f32,128,128,128,1,1,1,0,0,0,3,4,2,1,64,128,16,90,90,117440512,171840634880,1463,0.277335,394.379,619615
1,CUTLASS,gemm,cutlass3x_sm90_tensorop_gemm_f16_f16_f32_f16_f16_128x128x128_2x1x1_0_ttn_align8_stream_k_warpspecialized_cooperative_epi_nosmem,passed,success,universal,4096,5120,4096,f16:row,f16:row,f16:column,f16:column,1,0,serial,1,1,along_n,invalid,invalid,false,false,2,tensorop,f32,128,128,128,1,1,1,0,0,0,3,4,2,1,64,128,16,90,90,117440512,171840634880,1463,0.290776,376.149,590973
1,CUTLASS,gemm,cutlass3x_sm90_tensorop_gemm_f16_f16_f32_f16_f16_128x128x128_2x1x1_0_ttn_align8_stream_k_warpspecialized_cooperative_epi_tma,passed,success,universal,4096,5120,4096,f16:row,f16:row,f16:column,f16:column,1,0,serial,1,1,along_n,invalid,invalid,false,false,2,tensorop,f32,128,128,128,1,1,1,0,0,0,3,4,2,1,64,128,16,90,90,117440512,171840634880,1463,0.282905,386.614,607415
1,CUTLASS,gemm,cutlass3x_sm90_tensorop_gemm_f16_f16_f32_f16_f16_128x128x128_1x2x1_0_ttn_align8,passed,success,universal,4096,5120,4096,f16:row,f16:row,f16:column,f16:column,1,0,serial,1,1,along_m,invalid,invalid,false,false,4,tensorop,f32,128,128,128,1,1,1,0,0,0,3,4,2,1,64,128,16,90,90,117440512,171840634880,1463,0.274277,398.775,626521
1,CUTLASS,gemm,cutlass3x_sm90_tensorop_gemm_f16_f16_f32_f16_f16_128x128x128_1x2x1_0_ttn_align8_warpspecialized_epi_nosmem,passed,success,universal,4096,5120,4096,f16:row,f16:row,f16:column,f16:column,1,0,serial,1,1,along_n,invalid,invalid,false,false,1,tensorop,f32,128,128,128,1,1,1,0,0,0,3,4,1,1,64,128,16,90,90,117440512,171840634880,1463,0.275803,396.57,623057
1,CUTLASS,gemm,cutlass3x_sm90_tensorop_gemm_f16_f16_f32_f16_f16_128x128x128_1x2x1_0_ttn_align8_warpspecialized_pingpong_epi_tma,passed,success,universal,4096,5120,4096,f16:row,f16:row,f16:column,f16:column,1,0,serial,1,1,along_m,invalid,invalid,false,false,4,tensorop,f32,128,128,128,1,1,1,0,0,0,3,4,1,1,64,128,16,90,90,117440512,171840634880,1463,0.244523,447.299,702758
1,CUTLASS,gemm,cutlass3x_sm90_tensorop_gemm_f16_f16_f32_f16_f16_128x128x128_1x2x1_0_ttn_align8_warpspecialized_pingpong_epi_nosmem,passed,success,universal,4096,5120,4096,f16:row,f16:row,f16:column,f16:column,1,0,serial,1,1,along_m,invalid,invalid,false,false,4,tensorop,f32,128,128,128,1,1,1,0,0,0,3,4,1,1,64,128,16,90,90,117440512,171840634880,1463,0.245706,445.147,699376
1,CUTLASS,gemm,cutlass3x_sm90_tensorop_gemm_f16_f16_f32_f16_f16_128x128x128_1x2x1_0_ttn_align8_warpspecialized_cooperative_epi_nosmem,passed,success,universal,4096,5120,4096,f16:row,f16:row,f16:column,f16:column,1,0,serial,1,1,along_m,invalid,invalid,false,false,2,tensorop,f32,128,128,128,1,1,1,0,0,0,3,4,2,1,64,128,16,90,90,117440512,171840634880,1463,0.269923,405.208,636629
1,CUTLASS,gemm,cutlass3x_sm90_tensorop_gemm_f16_f16_f32_f16_f16_128x128x128_1x2x1_0_ttn_align8_warpspecialized_cooperative_epi_tma,passed,success,universal,4096,5120,4096,f16:row,f16:row,f16:column,f16:column,1,0,serial,1,1,along_m,invalid,invalid,false,false,4,tensorop,f32,128,128,128,1,1,1,0,0,0,3,4,2,1,64,128,16,90,90,117440512,171840634880,1463,0.248468,440.197,691599
1,CUTLASS,gemm,cutlass3x_sm90_tensorop_gemm_f16_f16_f32_f16_f16_128x128x128_1x2x1_0_ttn_align8_stream_k_warpspecialized_cooperative_epi_nosmem,passed,success,universal,4096,5120,4096,f16:row,f16:row,f16:column,f16:column,1,0,serial,1,1,along_m,invalid,invalid,false,false,2,tensorop,f32,128,128,128,1,1,1,0,0,0,3,4,2,1,64,128,16,90,90,117440512,171840634880,1463,0.282717,386.871,607818
1,CUTLASS,gemm,cutlass3x_sm90_tensorop_gemm_f16_f16_f32_f16_f16_128x128x128_1x2x1_0_ttn_align8_stream_k_warpspecialized_cooperative_epi_tma,passed,success,universal,4096,5120,4096,f16:row,f16:row,f16:column,f16:column,1,0,serial,1,1,along_m,invalid,invalid,false,false,4,tensorop,f32,128,128,128,1,1,1,0,0,0,3,4,2,1,64,128,16,90,90,117440512,171840634880,1463,0.254626,429.552,674876
1,CUTLASS,gemm,cutlass3x_sm90_tensorop_gemm_f16_f16_f32_f16_f16_128x16x64_2x4x1_0_ttn_align8,passed,success,universal,4096,5120,4096,f16:row,f16:row,f16:column,f16:column,1,0,serial,1,1,along_m,invalid,invalid,false,false,8,tensorop,f32,128,16,64,1,1,1,0,0,0,12,4,2,1,64,16,16,90,90,117440512,171840634880,1463,0.816777,133.911,210389
1,CUTLASS,gemm,cutlass3x_sm90_tensorop_gemm_f16_f16_f32_f16_f16_128x16x64_2x4x1_0_ttn_align8_warpspecialized_epi_nosmem,passed,success,universal,4096,5120,4096,f16:row,f16:row,f16:column,f16:column,1,0,serial,1,1,along_m,invalid,invalid,false,false,1,tensorop,f32,128,16,64,1,1,1,0,0,0,12,4,1,1,64,16,16,90,90,117440512,171840634880,1463,0.996356,109.775,172469
1,CUTLASS,gemm,cutlass3x_sm90_tensorop_gemm_f16_f16_f32_f16_f16_128x16x64_2x4x1_0_ttn_align8_warpspecialized_pingpong_epi_tma,passed,success,universal,4096,5120,4096,f16:row,f16:row,f16:column,f16:column,1,0,serial,1,1,along_m,invalid,invalid,false,false,8,tensorop,f32,128,16,64,1,1,1,0,0,0,12,4,1,1,64,16,16,90,90,117440512,171840634880,1463,0.745702,146.674,230441
1,CUTLASS,gemm,cutlass3x_sm90_tensorop_gemm_f16_f16_f32_f16_f16_128x16x64_2x4x1_0_ttn_align8_warpspecialized_pingpong_epi_nosmem,passed,success,universal,4096,5120,4096,f16:row,f16:row,f16:column,f16:column,1,0,serial,1,1,along_m,invalid,invalid,false,false,8,tensorop,f32,128,16,64,1,1,1,0,0,0,12,4,1,1,64,16,16,90,90,117440512,171840634880,1463,0.758042,144.286,226690
1,CUTLASS,gemm,cutlass3x_sm90_tensorop_gemm_f16_f16_f32_f16_f16_128x16x64_2x4x1_0_ttn_align8_warpspecialized_cooperative_epi_nosmem,passed,success,universal,4096,5120,4096,f16:row,f16:row,f16:column,f16:column,1,0,serial,1,1,along_m,invalid,invalid,false,false,8,tensorop,f32,128,16,64,1,1,1,0,0,0,12,4,2,1,64,16,16,90,90,117440512,171840634880,1463,0.816617,133.937,210430
1,CUTLASS,gemm,cutlass3x_sm90_tensorop_gemm_f16_f16_f32_f16_f16_128x16x64_2x4x1_0_ttn_align8_warpspecialized_cooperative_epi_tma,passed,success,universal,4096,5120,4096,f16:row,f16:row,f16:column,f16:column,1,0,serial,1,1,along_m,invalid,invalid,false,false,8,tensorop,f32,128,16,64,1,1,1,0,0,0,12,4,2,1,64,16,16,90,90,117440512,171840634880,1463,0.843813,129.62,203648
1,CUTLASS,gemm,cutlass3x_sm90_tensorop_gemm_f16_f16_f32_f16_f16_128x16x64_2x4x1_0_ttn_align8_stream_k_warpspecialized_cooperative_epi_nosmem,passed,success,universal,4096,5120,4096,f16:row,f16:row,f16:column,f16:column,1,0,serial,1,1,along_m,invalid,invalid,false,false,8,tensorop,f32,128,16,64,1,1,1,0,0,0,12,4,2,1,64,16,16,90,90,117440512,171840634880,1463,0.815104,134.185,210821
1,CUTLASS,gemm,cutlass3x_sm90_tensorop_gemm_f16_f16_f32_f16_f16_128x16x64_2x4x1_0_ttn_align8_stream_k_warpspecialized_cooperative_epi_tma,passed,success,universal,4096,5120,4096,f16:row,f16:row,f16:column,f16:column,1,0,serial,1,1,along_m,invalid,invalid,false,false,8,tensorop,f32,128,16,64,1,1,1,0,0,0,12,4,2,1,64,16,16,90,90,117440512,171840634880,1463,0.851454,128.457,201820
1,CUTLASS,gemm,cutlass3x_sm90_tensorop_gemm_f16_f16_f32_f16_f16_128x16x64_4x1x1_0_ttn_align8,passed,success,universal,4096,5120,4096,f16:row,f16:row,f16:column,f16:column,1,0,serial,1,1,along_n,invalid,invalid,false,false,1,tensorop,f32,128,16,64,1,1,1,0,0,0,12,4,2,1,64,16,16,90,90,117440512,171840634880,1463,1.43172,76.394,120024
1,CUTLASS,gemm,cutlass3x_sm90_tensorop_gemm_f16_f16_f32_f16_f16_128x16x64_4x1x1_0_ttn_align8_warpspecialized_epi_nosmem,passed,success,universal,4096,5120,4096,f16:row,f16:row,f16:column,f16:column,1,0,serial,1,1,along_n,invalid,invalid,false,false,8,tensorop,f32,128,16,64,1,1,1,0,0,0,12,4,1,1,64,16,16,90,90,117440512,171840634880,1463,1.55337,70.4112,110624
1,CUTLASS,gemm,cutlass3x_sm90_tensorop_gemm_f16_f16_f32_f16_f16_128x16x64_4x1x1_0_ttn_align8_warpspecialized_pingpong_epi_tma,passed,success,universal,4096,5120,4096,f16:row,f16:row,f16:column,f16:column,1,0,serial,1,1,along_n,invalid,invalid,false,false,1,tensorop,f32,128,16,64,1,1,1,0,0,0,12,4,1,1,64,16,16,90,90,117440512,171840634880,1463,1.42563,76.7202,120536
1,CUTLASS,gemm,cutlass3x_sm90_tensorop_gemm_f16_f16_f32_f16_f16_128x16x64_4x1x1_0_ttn_align8_warpspecialized_pingpong_epi_nosmem,passed,success,universal,4096,5120,4096,f16:row,f16:row,f16:column,f16:column,1,0,serial,1,1,along_n,invalid,invalid,false,false,1,tensorop,f32,128,16,64,1,1,1,0,0,0,12,4,1,1,64,16,16,90,90,117440512,171840634880,1463,1.43366,76.2909,119862
1,CUTLASS,gemm,cutlass3x_sm90_tensorop_gemm_f16_f16_f32_f16_f16_128x16x64_4x1x1_0_ttn_align8_warpspecialized_cooperative_epi_nosmem,passed,success,universal,4096,5120,4096,f16:row,f16:row,f16:column,f16:column,1,0,serial,1,1,along_n,invalid,invalid,false,false,1,tensorop,f32,128,16,64,1,1,1,0,0,0,12,4,2,1,64,16,16,90,90,117440512,171840634880,1463,1.43598,76.1675,119668
1,CUTLASS,gemm,cutlass3x_sm90_tensorop_gemm_f16_f16_f32_f16_f16_128x16x64_4x1x1_0_ttn_align8_warpspecialized_cooperative_epi_tma,passed,success,universal,4096,5120,4096,f16:row,f16:row,f16:column,f16:column,1,0,serial,1,1,along_n,invalid,invalid,false,false,1,tensorop,f32,128,16,64,1,1,1,0,0,0,12,4,2,1,64,16,16,90,90,117440512,171840634880,1463,1.42854,76.564,120291
1,CUTLASS,gemm,cutlass3x_sm90_tensorop_gemm_f16_f16_f32_f16_f16_128x16x64_4x1x1_0_ttn_align8_stream_k_warpspecialized_cooperative_epi_nosmem,passed,success,universal,4096,5120,4096,f16:row,f16:row,f16:column,f16:column,1,0,serial,1,1,along_n,invalid,invalid,false,false,1,tensorop,f32,128,16,64,1,1,1,0,0,0,12,4,2,1,64,16,16,90,90,117440512,171840634880,1463,1.45942,74.944,117746
1,CUTLASS,gemm,cutlass3x_sm90_tensorop_gemm_f16_f16_f32_f16_f16_128x16x64_4x1x1_0_ttn_align8_stream_k_warpspecialized_cooperative_epi_tma,passed,success,universal,4096,5120,4096,f16:row,f16:row,f16:column,f16:column,1,0,serial,1,1,along_n,invalid,invalid,false,false,1,tensorop,f32,128,16,64,1,1,1,0,0,0,12,4,2,1,64,16,16,90,90,117440512,171840634880,1463,1.4528,75.2858,118283
1,CUTLASS,gemm,cutlass3x_sm90_tensorop_gemm_f16_f16_f32_f16_f16_128x16x64_1x4x1_0_ttn_align8,passed,success,universal,4096,5120,4096,f16:row,f16:row,f16:column,f16:column,1,0,serial,1,1,along_m,invalid,invalid,false,false,8,tensorop,f32,128,16,64,1,1,1,0,0,0,12,4,2,1,64,16,16,90,90,117440512,171840634880,1463,0.786806,139.011,218403
1,CUTLASS,gemm,cutlass3x_sm90_tensorop_gemm_f16_f16_f32_f16_f16_128x16x64_1x4x1_0_ttn_align8_warpspecialized_epi_nosmem,passed,success,universal,4096,5120,4096,f16:row,f16:row,f16:column,f16:column,1,0,serial,1,1,along_n,invalid,invalid,false,false,1,tensorop,f32,128,16,64,1,1,1,0,0,0,12,4,1,1,64,16,16,90,90,117440512,171840634880,1463,0.815376,134.141,210750
1,CUTLASS,gemm,cutlass3x_sm90_tensorop_gemm_f16_f16_f32_f16_f16_128x16x64_1x4x1_0_ttn_align8_warpspecialized_pingpong_epi_tma,passed,success,universal,4096,5120,4096,f16:row,f16:row,f16:column,f16:column,1,0,serial,1,1,along_m,invalid,invalid,false,false,8,tensorop,f32,128,16,64,1,1,1,0,0,0,12,4,1,1,64,16,16,90,90,117440512,171840634880,1463,0.656075,166.711,261922
1,CUTLASS,gemm,cutlass3x_sm90_tensorop_gemm_f16_f16_f32_f16_f16_128x16x64_1x4x1_0_ttn_align8_warpspecialized_pingpong_epi_nosmem,passed,success,universal,4096,5120,4096,f16:row,f16:row,f16:column,f16:column,1,0,serial,1,1,along_m,invalid,invalid,false,false,8,tensorop,f32,128,16,64,1,1,1,0,0,0,12,4,1,1,64,16,16,90,90,117440512,171840634880,1463,0.658998,165.972,260761
1,CUTLASS,gemm,cutlass3x_sm90_tensorop_gemm_f16_f16_f32_f16_f16_128x16x64_1x4x1_0_ttn_align8_warpspecialized_cooperative_epi_nosmem,passed,success,universal,4096,5120,4096,f16:row,f16:row,f16:column,f16:column,1,0,serial,1,1,along_m,invalid,invalid,false,false,8,tensorop,f32,128,16,64,1,1,1,0,0,0,12,4,2,1,64,16,16,90,90,117440512,171840634880,1463,0.78696,138.984,218360
1,CUTLASS,gemm,cutlass3x_sm90_tensorop_gemm_f16_f16_f32_f16_f16_128x16x64_1x4x1_0_ttn_align8_warpspecialized_cooperative_epi_tma,passed,success,universal,4096,5120,4096,f16:row,f16:row,f16:column,f16:column,1,0,serial,1,1,along_m,invalid,invalid,false,false,4,tensorop,f32,128,16,64,1,1,1,0,0,0,12,4,2,1,64,16,16,90,90,117440512,171840634880,1463,0.790022,138.445,217514
1,CUTLASS,gemm,cutlass3x_sm90_tensorop_gemm_f16_f16_f32_f16_f16_128x16x64_1x4x1_0_ttn_align8_stream_k_warpspecialized_cooperative_epi_nosmem,passed,success,universal,4096,5120,4096,f16:row,f16:row,f16:column,f16:column,1,0,serial,1,1,along_n,invalid,invalid,false,false,8,tensorop,f32,128,16,64,1,1,1,0,0,0,12,4,2,1,64,16,16,90,90,117440512,171840634880,1463,0.787542,138.882,218199
1,CUTLASS,gemm,cutlass3x_sm90_tensorop_gemm_f16_f16_f32_f16_f16_128x16x64_1x4x1_0_ttn_align8_stream_k_warpspecialized_cooperative_epi_tma,passed,success,universal,4096,5120,4096,f16:row,f16:row,f16:column,f16:column,1,0,serial,1,1,along_m,invalid,invalid,false,false,4,tensorop,f32,128,16,64,1,1,1,0,0,0,12,4,2,1,64,16,16,90,90,117440512,171840634880,1463,0.802922,136.221,214019
1,CUTLASS,gemm,cutlass3x_sm90_tensorop_gemm_f16_f16_f32_f16_f16_128x16x64_2x2x1_0_ttn_align8,passed,success,universal,4096,5120,4096,f16:row,f16:row,f16:column,f16:column,1,0,serial,1,1,along_n,invalid,invalid,false,false,8,tensorop,f32,128,16,64,1,1,1,0,0,0,12,4,2,1,64,16,16,90,90,117440512,171840634880,1463,0.936631,116.775,183467
1,CUTLASS,gemm,cutlass3x_sm90_tensorop_gemm_f16_f16_f32_f16_f16_128x16x64_2x2x1_0_ttn_align8_warpspecialized_epi_nosmem,passed,success,universal,4096,5120,4096,f16:row,f16:row,f16:column,f16:column,1,0,serial,1,1,along_n,invalid,invalid,false,false,4,tensorop,f32,128,16,64,1,1,1,0,0,0,12,4,1,1,64,16,16,90,90,117440512,171840634880,1463,1.13817,96.0975,150980
1,CUTLASS,gemm,cutlass3x_sm90_tensorop_gemm_f16_f16_f32_f16_f16_128x16x64_2x2x1_0_ttn_align8_warpspecialized_pingpong_epi_tma,passed,success,universal,4096,5120,4096,f16:row,f16:row,f16:column,f16:column,1,0,serial,1,1,along_n,invalid,invalid,false,false,8,tensorop,f32,128,16,64,1,1,1,0,0,0,12,4,1,1,64,16,16,90,90,117440512,171840634880,1463,0.9304,117.557,184695
1,CUTLASS,gemm,cutlass3x_sm90_tensorop_gemm_f16_f16_f32_f16_f16_128x16x64_2x2x1_0_ttn_align8_warpspecialized_pingpong_epi_nosmem,passed,success,universal,4096,5120,4096,f16:row,f16:row,f16:column,f16:column,1,0,serial,1,1,along_n,invalid,invalid,false,false,8,tensorop,f32,128,16,64,1,1,1,0,0,0,12,4,1,1,64,16,16,90,90,117440512,171840634880,1463,0.93334,117.187,184114
1,CUTLASS,gemm,cutlass3x_sm90_tensorop_gemm_f16_f16_f32_f16_f16_128x16x64_2x2x1_0_ttn_align8_warpspecialized_cooperative_epi_nosmem,passed,success,universal,4096,5120,4096,f16:row,f16:row,f16:column,f16:column,1,0,serial,1,1,along_m,invalid,invalid,false,false,8,tensorop,f32,128,16,64,1,1,1,0,0,0,12,4,2,1,64,16,16,90,90,117440512,171840634880,1463,0.935684,116.893,183653
1,CUTLASS,gemm,cutlass3x_sm90_tensorop_gemm_f16_f16_f32_f16_f16_128x16x64_2x2x1_0_ttn_align8_warpspecialized_cooperative_epi_tma,passed,success,universal,4096,5120,4096,f16:row,f16:row,f16:column,f16:column,1,0,serial,1,1,along_n,invalid,invalid,false,false,8,tensorop,f32,128,16,64,1,1,1,0,0,0,12,4,2,1,64,16,16,90,90,117440512,171840634880,1463,0.945482,115.682,181749
1,CUTLASS,gemm,cutlass3x_sm90_tensorop_gemm_f16_f16_f32_f16_f16_128x16x64_2x2x1_0_ttn_align8_stream_k_warpspecialized_cooperative_epi_nosmem,passed,success,universal,4096,5120,4096,f16:row,f16:row,f16:column,f16:column,1,0,serial,1,1,along_m,invalid,invalid,false,false,8,tensorop,f32,128,16,64,1,1,1,0,0,0,12,4,2,1,64,16,16,90,90,117440512,171840634880,1463,0.939034,116.476,182997
1,CUTLASS,gemm,cutlass3x_sm90_tensorop_gemm_f16_f16_f32_f16_f16_128x16x64_2x2x1_0_ttn_align8_stream_k_warpspecialized_cooperative_epi_tma,passed,success,universal,4096,5120,4096,f16:row,f16:row,f16:column,f16:column,1,0,serial,1,1,along_n,invalid,invalid,false,false,8,tensorop,f32,128,16,64,1,1,1,0,0,0,12,4,2,1,64,16,16,90,90,117440512,171840634880,1463,0.951534,114.946,180593
1,CUTLASS,gemm,cutlass3x_sm90_tensorop_gemm_f16_f16_f32_f16_f16_128x16x64_1x1x1_0_ttn_align8,passed,success,universal,4096,5120,4096,f16:row,f16:row,f16:column,f16:column,1,0,serial,1,1,along_n,invalid,invalid,false,false,1,tensorop,f32,128,16,64,1,1,1,0,0,0,12,4,2,1,64,16,16,90,90,117440512,171840634880,1463,1.25463,87.1773,136966
1,CUTLASS,gemm,cutlass3x_sm90_tensorop_gemm_f16_f16_f32_f16_f16_128x16x64_1x1x1_0_ttn_align8_warpspecialized_epi_nosmem,passed,success,universal,4096,5120,4096,f16:row,f16:row,f16:column,f16:column,1,0,serial,1,1,along_n,invalid,invalid,false,false,1,tensorop,f32,128,16,64,1,1,1,0,0,0,12,4,1,1,64,16,16,90,90,117440512,171840634880,1463,1.47288,74.2591,116670
1,CUTLASS,gemm,cutlass3x_sm90_tensorop_gemm_f16_f16_f32_f16_f16_128x16x64_1x1x1_0_ttn_align8_warpspecialized_pingpong_epi_tma,passed,success,universal,4096,5120,4096,f16:row,f16:row,f16:column,f16:column,1,0,serial,1,1,along_n,invalid,invalid,false,false,1,tensorop,f32,128,16,64,1,1,1,0,0,0,12,4,1,1,64,16,16,90,90,117440512,171840634880,1463,1.24893,87.5749,137590
1,CUTLASS,gemm,cutlass3x_sm90_tensorop_gemm_f16_f16_f32_f16_f16_128x16x64_1x1x1_0_ttn_align8_warpspecialized_pingpong_epi_nosmem,passed,success,universal,4096,5120,4096,f16:row,f16:row,f16:column,f16:column,1,0,serial,1,1,along_n,invalid,invalid,false,false,1,tensorop,f32,128,16,64,1,1,1,0,0,0,12,4,1,1,64,16,16,90,90,117440512,171840634880,1463,1.28822,84.9037,133393
1,CUTLASS,gemm,cutlass3x_sm90_tensorop_gemm_f16_f16_f32_f16_f16_128x16x64_1x1x1_0_ttn_align8_warpspecialized_cooperative_epi_nosmem,passed,success,universal,4096,5120,4096,f16:row,f16:row,f16:column,f16:column,1,0,serial,1,1,along_n,invalid,invalid,false,false,1,tensorop,f32,128,16,64,1,1,1,0,0,0,12,4,2,1,64,16,16,90,90,117440512,171840634880,1463,1.24468,87.874,138060
1,CUTLASS,gemm,cutlass3x_sm90_tensorop_gemm_f16_f16_f32_f16_f16_128x16x64_1x1x1_0_ttn_align8_warpspecialized_cooperative_epi_tma,passed,success,universal,4096,5120,4096,f16:row,f16:row,f16:column,f16:column,1,0,serial,1,1,along_n,invalid,invalid,false,false,1,tensorop,f32,128,16,64,1,1,1,0,0,0,12,4,2,1,64,16,16,90,90,117440512,171840634880,1463,1.17646,92.9695,146066
1,CUTLASS,gemm,cutlass3x_sm90_tensorop_gemm_f16_f16_f32_f16_f16_128x16x64_1x1x1_0_ttn_align8_stream_k_warpspecialized_cooperative_epi_nosmem,passed,success,universal,4096,5120,4096,f16:row,f16:row,f16:column,f16:column,1,0,serial,1,1,along_n,invalid,invalid,false,false,1,tensorop,f32,128,16,64,1,1,1,0,0,0,12,4,2,1,64,16,16,90,90,117440512,171840634880,1463,1.31792,82.9908,130388
1,CUTLASS,gemm,cutlass3x_sm90_tensorop_gemm_f16_f16_f32_f16_f16_128x16x64_1x1x1_0_ttn_align8_stream_k_warpspecialized_cooperative_epi_tma,passed,success,universal,4096,5120,4096,f16:row,f16:row,f16:column,f16:column,1,0,serial,1,1,along_n,invalid,invalid,false,false,1,tensorop,f32,128,16,64,1,1,1,0,0,0,12,4,2,1,64,16,16,90,90,117440512,171840634880,1463,1.25025,87.4823,137445
1,CUTLASS,gemm,cutlass3x_sm90_tensorop_gemm_f16_f16_f32_f16_f16_128x16x64_2x1x1_0_ttn_align8,passed,success,universal,4096,5120,4096,f16:row,f16:row,f16:column,f16:column,1,0,serial,1,1,along_n,invalid,invalid,false,false,1,tensorop,f32,128,16,64,1,1,1,0,0,0,12,4,2,1,64,16,16,90,90,117440512,171840634880,1463,1.4283,76.5771,120311
1,CUTLASS,gemm,cutlass3x_sm90_tensorop_gemm_f16_f16_f32_f16_f16_128x16x64_2x1x1_0_ttn_align8_warpspecialized_epi_nosmem,passed,success,universal,4096,5120,4096,f16:row,f16:row,f16:column,f16:column,1,0,serial,1,1,along_m,invalid,invalid,false,false,1,tensorop,f32,128,16,64,1,1,1,0,0,0,12,4,1,1,64,16,16,90,90,117440512,171840634880,1463,1.51209,72.3335,113644
1,CUTLASS,gemm,cutlass3x_sm90_tensorop_gemm_f16_f16_f32_f16_f16_128x16x64_2x1x1_0_ttn_align8_warpspecialized_pingpong_epi_tma,passed,success,universal,4096,5120,4096,f16:row,f16:row,f16:column,f16:column,1,0,serial,1,1,along_n,invalid,invalid,false,false,1,tensorop,f32,128,16,64,1,1,1,0,0,0,12,4,1,1,64,16,16,90,90,117440512,171840634880,1463,1.41114,77.5083,121774
1,CUTLASS,gemm,cutlass3x_sm90_tensorop_gemm_f16_f16_f32_f16_f16_128x16x64_2x1x1_0_ttn_align8_warpspecialized_pingpong_epi_nosmem,passed,success,universal,4096,5120,4096,f16:row,f16:row,f16:column,f16:column,1,0,serial,1,1,along_n,invalid,invalid,false,false,1,tensorop,f32,128,16,64,1,1,1,0,0,0,12,4,1,1,64,16,16,90,90,117440512,171840634880,1463,1.43163,76.3987,120031
1,CUTLASS,gemm,cutlass3x_sm90_tensorop_gemm_f16_f16_f32_f16_f16_128x16x64_2x1x1_0_ttn_align8_warpspecialized_cooperative_epi_nosmem,passed,success,universal,4096,5120,4096,f16:row,f16:row,f16:column,f16:column,1,0,serial,1,1,along_n,invalid,invalid,false,false,1,tensorop,f32,128,16,64,1,1,1,0,0,0,12,4,2,1,64,16,16,90,90,117440512,171840634880,1463,1.43814,76.053,119488
1,CUTLASS,gemm,cutlass3x_sm90_tensorop_gemm_f16_f16_f32_f16_f16_128x16x64_2x1x1_0_ttn_align8_warpspecialized_cooperative_epi_tma,passed,success,universal,4096,5120,4096,f16:row,f16:row,f16:column,f16:column,1,0,serial,1,1,along_n,invalid,invalid,false,false,1,tensorop,f32,128,16,64,1,1,1,0,0,0,12,4,2,1,64,16,16,90,90,117440512,171840634880,1463,1.43214,76.3718,119989
1,CUTLASS,gemm,cutlass3x_sm90_tensorop_gemm_f16_f16_f32_f16_f16_128x16x64_2x1x1_0_ttn_align8_stream_k_warpspecialized_cooperative_epi_nosmem,passed,success,universal,4096,5120,4096,f16:row,f16:row,f16:column,f16:column,1,0,serial,1,1,along_n,invalid,invalid,false,false,1,tensorop,f32,128,16,64,1,1,1,0,0,0,12,4,2,1,64,16,16,90,90,117440512,171840634880,1463,1.43372,76.2877,119857
1,CUTLASS,gemm,cutlass3x_sm90_tensorop_gemm_f16_f16_f32_f16_f16_128x16x64_2x1x1_0_ttn_align8_stream_k_warpspecialized_cooperative_epi_tma,passed,success,universal,4096,5120,4096,f16:row,f16:row,f16:column,f16:column,1,0,serial,1,1,along_n,invalid,invalid,false,false,1,tensorop,f32,128,16,64,1,1,1,0,0,0,12,4,2,1,64,16,16,90,90,117440512,171840634880,1463,1.43081,76.4427,120100
1,CUTLASS,gemm,cutlass3x_sm90_tensorop_gemm_f16_f16_f32_f16_f16_128x16x64_1x2x1_0_ttn_align8,passed,success,universal,4096,5120,4096,f16:row,f16:row,f16:column,f16:column,1,0,serial,1,1,along_m,invalid,invalid,false,false,8,tensorop,f32,128,16,64,1,1,1,0,0,0,12,4,2,1,64,16,16,90,90,117440512,171840634880,1463,0.898276,121.761,191301
1,CUTLASS,gemm,cutlass3x_sm90_tensorop_gemm_f16_f16_f32_f16_f16_128x16x64_1x2x1_0_ttn_align8_warpspecialized_epi_nosmem,passed,success,universal,4096,5120,4096,f16:row,f16:row,f16:column,f16:column,1,0,serial,1,1,along_n,invalid,invalid,false,false,1,tensorop,f32,128,16,64,1,1,1,0,0,0,12,4,1,1,64,16,16,90,90,117440512,171840634880,1463,0.934354,117.059,183914
1,CUTLASS,gemm,cutlass3x_sm90_tensorop_gemm_f16_f16_f32_f16_f16_128x16x64_1x2x1_0_ttn_align8_warpspecialized_pingpong_epi_tma,passed,success,universal,4096,5120,4096,f16:row,f16:row,f16:column,f16:column,1,0,serial,1,1,along_m,invalid,invalid,false,false,4,tensorop,f32,128,16,64,1,1,1,0,0,0,12,4,1,1,64,16,16,90,90,117440512,171840634880,1463,0.895993,122.071,191788
1,CUTLASS,gemm,cutlass3x_sm90_tensorop_gemm_f16_f16_f32_f16_f16_128x16x64_1x2x1_0_ttn_align8_warpspecialized_pingpong_epi_nosmem,passed,success,universal,4096,5120,4096,f16:row,f16:row,f16:column,f16:column,1,0,serial,1,1,along_m,invalid,invalid,false,false,4,tensorop,f32,128,16,64,1,1,1,0,0,0,12,4,1,1,64,16,16,90,90,117440512,171840634880,1463,0.896836,121.957,191608
1,CUTLASS,gemm,cutlass3x_sm90_tensorop_gemm_f16_f16_f32_f16_f16_128x16x64_1x2x1_0_ttn_align8_warpspecialized_cooperative_epi_nosmem,passed,success,universal,4096,5120,4096,f16:row,f16:row,f16:column,f16:column,1,0,serial,1,1,along_m,invalid,invalid,false,false,4,tensorop,f32,128,16,64,1,1,1,0,0,0,12,4,2,1,64,16,16,90,90,117440512,171840634880,1463,0.89931,121.621,191080
1,CUTLASS,gemm,cutlass3x_sm90_tensorop_gemm_f16_f16_f32_f16_f16_128x16x64_1x2x1_0_ttn_align8_warpspecialized_cooperative_epi_tma,passed,success,universal,4096,5120,4096,f16:row,f16:row,f16:column,f16:column,1,0,serial,1,1,along_m,invalid,invalid,false,false,8,tensorop,f32,128,16,64,1,1,1,0,0,0,12,4,2,1,64,16,16,90,90,117440512,171840634880,1463,0.899552,121.588,191029
1,CUTLASS,gemm,cutlass3x_sm90_tensorop_gemm_f16_f16_f32_f16_f16_128x16x64_1x2x1_0_ttn_align8_stream_k_warpspecialized_cooperative_epi_nosmem,passed,success,universal,4096,5120,4096,f16:row,f16:row,f16:column,f16:column,1,0,serial,1,1,along_m,invalid,invalid,false,false,8,tensorop,f32,128,16,64,1,1,1,0,0,0,12,4,2,1,64,16,16,90,90,117440512,171840634880,1463,0.901303,121.352,190658
1,CUTLASS,gemm,cutlass3x_sm90_tensorop_gemm_f16_f16_f32_f16_f16_128x16x64_1x2x1_0_ttn_align8_stream_k_warpspecialized_cooperative_epi_tma,passed,success,universal,4096,5120,4096,f16:row,f16:row,f16:column,f16:column,1,0,serial,1,1,along_m,invalid,invalid,false,false,1,tensorop,f32,128,16,64,1,1,1,0,0,0,12,4,2,1,64,16,16,90,90,117440512,171840634880,1463,0.903617,121.041,190170
1,CUTLASS,gemm,cutlass3x_sm90_tensorop_gemm_f16_f16_f32_f16_f16_64x64x128_8x1x1_0_ttn_align8,passed,success,universal,4096,5120,4096,f16:row,f16:row,f16:column,f16:column,1,0,serial,1,1,along_n,invalid,invalid,false,false,1,tensorop,f32,64,64,128,1,1,1,0,0,0,7,4,1,1,64,64,16,90,90,117440512,171840634880,1463,0.407072,268.687,422138
1,CUTLASS,gemm,cutlass3x_sm90_tensorop_gemm_f16_f16_f32_f16_f16_64x64x128_8x1x1_0_ttn_align8_warpspecialized_epi_nosmem,passed,success,universal,4096,5120,4096,f16:row,f16:row,f16:column,f16:column,1,0,serial,1,1,along_n,invalid,invalid,false,false,4,tensorop,f32,64,64,128,1,1,1,0,0,0,7,4,1,1,64,64,16,90,90,117440512,171840634880,1463,0.638728,171.239,269036
1,CUTLASS,gemm,cutlass3x_sm90_tensorop_gemm_f16_f16_f32_f16_f16_64x64x128_8x1x1_0_ttn_align8_warpspecialized_pingpong_epi_tma,passed,success,universal,4096,5120,4096,f16:row,f16:row,f16:column,f16:column,1,0,serial,1,1,along_n,invalid,invalid,false,false,1,tensorop,f32,64,64,128,1,1,1,0,0,0,6,4,1,1,64,64,16,90,90,117440512,171840634880,1463,0.436813,250.393,393396
1,CUTLASS,gemm,cutlass3x_sm90_tensorop_gemm_f16_f16_f32_f16_f16_64x64x128_8x1x1_0_ttn_align8_warpspecialized_pingpong_epi_nosmem,passed,success,universal,4096,5120,4096,f16:row,f16:row,f16:column,f16:column,1,0,serial,1,1,along_n,invalid,invalid,false,false,1,tensorop,f32,64,64,128,1,1,1,0,0,0,7,4,1,1,64,64,16,90,90,117440512,171840634880,1463,0.407612,268.331,421579
1,CUTLASS,gemm,cutlass3x_sm90_tensorop_gemm_f16_f16_f32_f16_f16_64x64x128_1x8x1_0_ttn_align8,passed,success,universal,4096,5120,4096,f16:row,f16:row,f16:column,f16:column,1,0,serial,1,1,along_m,invalid,invalid,false,false,1,tensorop,f32,64,64,128,1,1,1,0,0,0,7,4,1,1,64,64,16,90,90,117440512,171840634880,1463,0.404747,270.23,424563
1,CUTLASS,gemm,cutlass3x_sm90_tensorop_gemm_f16_f16_f32_f16_f16_64x64x128_1x8x1_0_ttn_align8_warpspecialized_epi_nosmem,passed,success,universal,4096,5120,4096,f16:row,f16:row,f16:column,f16:column,1,0,serial,1,1,along_m,invalid,invalid,false,false,2,tensorop,f32,64,64,128,1,1,1,0,0,0,7,4,1,1,64,64,16,90,90,117440512,171840634880,1463,0.462522,236.475,371529
1,CUTLASS,gemm,cutlass3x_sm90_tensorop_gemm_f16_f16_f32_f16_f16_64x64x128_1x8x1_0_ttn_align8_warpspecialized_pingpong_epi_tma,passed,success,universal,4096,5120,4096,f16:row,f16:row,f16:column,f16:column,1,0,serial,1,1,along_m,invalid,invalid,false,false,1,tensorop,f32,64,64,128,1,1,1,0,0,0,6,4,1,1,64,64,16,90,90,117440512,171840634880,1463,0.438346,249.518,392021
1,CUTLASS,gemm,cutlass3x_sm90_tensorop_gemm_f16_f16_f32_f16_f16_64x64x128_1x8x1_0_ttn_align8_warpspecialized_pingpong_epi_nosmem,passed,success,universal,4096,5120,4096,f16:row,f16:row,f16:column,f16:column,1,0,serial,1,1,along_m,invalid,invalid,false,false,1,tensorop,f32,64,64,128,1,1,1,0,0,0,7,4,1,1,64,64,16,90,90,117440512,171840634880,1463,0.403198,271.268,426194
1,CUTLASS,gemm,cutlass3x_sm90_tensorop_gemm_f16_f16_f32_f16_f16_64x64x128_4x2x1_0_ttn_align8,passed,success,universal,4096,5120,4096,f16:row,f16:row,f16:column,f16:column,1,0,serial,1,1,along_m,invalid,invalid,false,false,8,tensorop,f32,64,64,128,1,1,1,0,0,0,7,4,1,1,64,64,16,90,90,117440512,171840634880,1463,0.329058,332.389,522221
1,CUTLASS,gemm,cutlass3x_sm90_tensorop_gemm_f16_f16_f32_f16_f16_64x64x128_4x2x1_0_ttn_align8_warpspecialized_epi_nosmem,passed,success,universal,4096,5120,4096,f16:row,f16:row,f16:column,f16:column,1,0,serial,1,1,along_n,invalid,invalid,false,false,2,tensorop,f32,64,64,128,1,1,1,0,0,0,7,4,1,1,64,64,16,90,90,117440512,171840634880,1463,0.428591,255.196,400943
1,CUTLASS,gemm,cutlass3x_sm90_tensorop_gemm_f16_f16_f32_f16_f16_64x64x128_4x2x1_0_ttn_align8_warpspecialized_pingpong_epi_tma,passed,success,universal,4096,5120,4096,f16:row,f16:row,f16:column,f16:column,1,0,serial,1,1,along_m,invalid,invalid,false,false,8,tensorop,f32,64,64,128,1,1,1,0,0,0,6,4,1,1,64,64,16,90,90,117440512,171840634880,1463,0.347047,315.159,495151
1,CUTLASS,gemm,cutlass3x_sm90_tensorop_gemm_f16_f16_f32_f16_f16_64x64x128_4x2x1_0_ttn_align8_warpspecialized_pingpong_epi_nosmem,passed,success,universal,4096,5120,4096,f16:row,f16:row,f16:column,f16:column,1,0,serial,1,1,along_m,invalid,invalid,false,false,8,tensorop,f32,64,64,128,1,1,1,0,0,0,7,4,1,1,64,64,16,90,90,117440512,171840634880,1463,0.328991,332.456,522326
1,CUTLASS,gemm,cutlass3x_sm90_tensorop_gemm_f16_f16_f32_f16_f16_64x64x128_2x4x1_0_ttn_align8,passed,success,universal,4096,5120,4096,f16:row,f16:row,f16:column,f16:column,1,0,serial,1,1,along_m,invalid,invalid,false,false,4,tensorop,f32,64,64,128,1,1,1,0,0,0,7,4,1,1,64,64,16,90,90,117440512,171840634880,1463,0.326181,335.319,526825
1,CUTLASS,gemm,cutlass3x_sm90_tensorop_gemm_f16_f16_f32_f16_f16_64x64x128_2x4x1_0_ttn_align8_warpspecialized_epi_nosmem,passed,success,universal,4096,5120,4096,f16:row,f16:row,f16:column,f16:column,1,0,serial,1,1,along_n,invalid,invalid,false,false,8,tensorop,f32,64,64,128,1,1,1,0,0,0,7,4,1,1,64,64,16,90,90,117440512,171840634880,1463,0.420417,260.159,408739
1,CUTLASS,gemm,cutlass3x_sm90_tensorop_gemm_f16_f16_f32_f16_f16_64x64x128_2x4x1_0_ttn_align8_warpspecialized_pingpong_epi_tma,passed,success,universal,4096,5120,4096,f16:row,f16:row,f16:column,f16:column,1,0,serial,1,1,along_m,invalid,invalid,false,false,4,tensorop,f32,64,64,128,1,1,1,0,0,0,6,4,1,1,64,64,16,90,90,117440512,171840634880,1463,0.342051,319.762,502383
1,CUTLASS,gemm,cutlass3x_sm90_tensorop_gemm_f16_f16_f32_f16_f16_64x64x128_2x4x1_0_ttn_align8_warpspecialized_pingpong_epi_nosmem,passed,success,universal,4096,5120,4096,f16:row,f16:row,f16:column,f16:column,1,0,serial,1,1,along_m,invalid,invalid,false,false,4,tensorop,f32,64,64,128,1,1,1,0,0,0,7,4,1,1,64,64,16,90,90,117440512,171840634880,1463,0.325527,335.994,527884
1,CUTLASS,gemm,cutlass3x_sm90_tensorop_gemm_f16_f16_f32_f16_f16_128x16x64_8x1x1_0_ttn_align8,passed,success,universal,4096,5120,4096,f16:row,f16:row,f16:column,f16:column,1,0,serial,1,1,along_m,invalid,invalid,false,false,2,tensorop,f32,128,16,64,1,1,1,0,0,0,12,4,2,1,64,16,16,90,90,117440512,171840634880,1463,1.42007,77.0207,121008
1,CUTLASS,gemm,cutlass3x_sm90_tensorop_gemm_f16_f16_f32_f16_f16_128x16x64_8x1x1_0_ttn_align8_warpspecialized_epi_nosmem,passed,success,universal,4096,5120,4096,f16:row,f16:row,f16:column,f16:column,1,0,serial,1,1,along_m,invalid,invalid,false,false,2,tensorop,f32,128,16,64,1,1,1,0,0,0,12,4,1,1,64,16,16,90,90,117440512,171840634880,1463,1.59777,68.4546,107550
1,CUTLASS,gemm,cutlass3x_sm90_tensorop_gemm_f16_f16_f32_f16_f16_128x16x64_8x1x1_0_ttn_align8_warpspecialized_pingpong_epi_tma,passed,success,universal,4096,5120,4096,f16:row,f16:row,f16:column,f16:column,1,0,serial,1,1,along_n,invalid,invalid,false,false,1,tensorop,f32,128,16,64,1,1,1,0,0,0,12,4,1,1,64,16,16,90,90,117440512,171840634880,1463,1.41788,77.1397,121195
1,CUTLASS,gemm,cutlass3x_sm90_tensorop_gemm_f16_f16_f32_f16_f16_128x16x64_8x1x1_0_ttn_align8_warpspecialized_pingpong_epi_nosmem,passed,success,universal,4096,5120,4096,f16:row,f16:row,f16:column,f16:column,1,0,serial,1,1,along_m,invalid,invalid,false,false,2,tensorop,f32,128,16,64,1,1,1,0,0,0,12,4,1,1,64,16,16,90,90,117440512,171840634880,1463,1.4206,76.9919,120963
1,CUTLASS,gemm,cutlass3x_sm90_tensorop_gemm_f16_f16_f32_f16_f16_128x16x64_8x1x1_0_ttn_align8_warpspecialized_cooperative_epi_nosmem,passed,success,universal,4096,5120,4096,f16:row,f16:row,f16:column,f16:column,1,0,serial,1,1,along_m,invalid,invalid,false,false,2,tensorop,f32,128,16,64,1,1,1,0,0,0,12,4,2,1,64,16,16,90,90,117440512,171840634880,1463,1.41575,77.2557,121378
1,CUTLASS,gemm,cutlass3x_sm90_tensorop_gemm_f16_f16_f32_f16_f16_128x16x64_8x1x1_0_ttn_align8_warpspecialized_cooperative_epi_tma,passed,success,universal,4096,5120,4096,f16:row,f16:row,f16:column,f16:column,1,0,serial,1,1,along_n,invalid,invalid,false,false,1,tensorop,f32,128,16,64,1,1,1,0,0,0,12,4,2,1,64,16,16,90,90,117440512,171840634880,1463,1.41395,77.3544,121533
1,CUTLASS,gemm,cutlass3x_sm90_tensorop_gemm_f16_f16_f32_f16_f16_128x16x64_8x1x1_0_ttn_align8_stream_k_warpspecialized_cooperative_epi_nosmem,passed,success,universal,4096,5120,4096,f16:row,f16:row,f16:column,f16:column,1,0,serial,1,1,along_n,invalid,invalid,false,false,1,tensorop,f32,128,16,64,1,1,1,0,0,0,12,4,2,1,64,16,16,90,90,117440512,171840634880,1463,1.44861,75.5032,118624
1,CUTLASS,gemm,cutlass3x_sm90_tensorop_gemm_f16_f16_f32_f16_f16_128x16x64_8x1x1_0_ttn_align8_stream_k_warpspecialized_cooperative_epi_tma,passed,success,universal,4096,5120,4096,f16:row,f16:row,f16:column,f16:column,1,0,serial,1,1,along_n,invalid,invalid,false,false,1,tensorop,f32,128,16,64,1,1,1,0,0,0,12,4,2,1,64,16,16,90,90,117440512,171840634880,1463,1.42067,76.9882,120957
1,CUTLASS,gemm,cutlass3x_sm90_tensorop_gemm_f16_f16_f32_f16_f16_64x64x128_4x1x1_0_ttn_align8,passed,success,universal,4096,5120,4096,f16:row,f16:row,f16:column,f16:column,1,0,serial,1,1,along_n,invalid,invalid,false,false,1,tensorop,f32,64,64,128,1,1,1,0,0,0,7,4,1,1,64,64,16,90,90,117440512,171840634880,1463,0.430079,254.314,399556
1,CUTLASS,gemm,cutlass3x_sm90_tensorop_gemm_f16_f16_f32_f16_f16_64x64x128_4x1x1_0_ttn_align8_warpspecialized_epi_nosmem,passed,success,universal,4096,5120,4096,f16:row,f16:row,f16:column,f16:column,1,0,serial,1,1,along_n,invalid,invalid,false,false,1,tensorop,f32,64,64,128,1,1,1,0,0,0,7,4,1,1,64,64,16,90,90,117440512,171840634880,1463,0.559076,195.635,307365
1,CUTLASS,gemm,cutlass3x_sm90_tensorop_gemm_f16_f16_f32_f16_f16_64x64x128_4x1x1_0_ttn_align8_warpspecialized_pingpong_epi_tma,passed,success,universal,4096,5120,4096,f16:row,f16:row,f16:column,f16:column,1,0,serial,1,1,along_n,invalid,invalid,false,false,1,tensorop,f32,64,64,128,1,1,1,0,0,0,6,4,1,1,64,64,16,90,90,117440512,171840634880,1463,0.435622,251.078,394472
1,CUTLASS,gemm,cutlass3x_sm90_tensorop_gemm_f16_f16_f32_f16_f16_64x64x128_4x1x1_0_ttn_align8_warpspecialized_pingpong_epi_nosmem,passed,success,universal,4096,5120,4096,f16:row,f16:row,f16:column,f16:column,1,0,serial,1,1,along_n,invalid,invalid,false,false,1,tensorop,f32,64,64,128,1,1,1,0,0,0,7,4,1,1,64,64,16,90,90,117440512,171840634880,1463,0.430623,253.992,399051
1,CUTLASS,gemm,cutlass3x_sm90_tensorop_gemm_f16_f16_f32_f16_f16_64x64x128_1x4x1_0_ttn_align8,passed,success,universal,4096,5120,4096,f16:row,f16:row,f16:column,f16:column,1,0,serial,1,1,along_m,invalid,invalid,false,false,1,tensorop,f32,64,64,128,1,1,1,0,0,0,7,4,1,1,64,64,16,90,90,117440512,171840634880,1463,0.442852,246.979,388032
1,CUTLASS,gemm,cutlass3x_sm90_tensorop_gemm_f16_f16_f32_f16_f16_64x64x128_1x4x1_0_ttn_align8_warpspecialized_epi_nosmem,passed,success,universal,4096,5120,4096,f16:row,f16:row,f16:column,f16:column,1,0,serial,1,1,along_n,invalid,invalid,false,false,1,tensorop,f32,64,64,128,1,1,1,0,0,0,7,4,1,1,64,64,16,90,90,117440512,171840634880,1463,0.44864,243.793,383026
1,CUTLASS,gemm,cutlass3x_sm90_tensorop_gemm_f16_f16_f32_f16_f16_64x64x128_1x4x1_0_ttn_align8_warpspecialized_pingpong_epi_tma,passed,success,universal,4096,5120,4096,f16:row,f16:row,f16:column,f16:column,1,0,serial,1,1,along_m,invalid,invalid,false,false,4,tensorop,f32,64,64,128,1,1,1,0,0,0,6,4,1,1,64,64,16,90,90,117440512,171840634880,1463,0.426006,256.745,403376
1,CUTLASS,gemm,cutlass3x_sm90_tensorop_gemm_f16_f16_f32_f16_f16_64x64x128_1x4x1_0_ttn_align8_warpspecialized_pingpong_epi_nosmem,passed,success,universal,4096,5120,4096,f16:row,f16:row,f16:column,f16:column,1,0,serial,1,1,along_m,invalid,invalid,false,false,2,tensorop,f32,64,64,128,1,1,1,0,0,0,7,4,1,1,64,64,16,90,90,117440512,171840634880,1463,0.443518,246.608,387449
1,CUTLASS,gemm,cutlass3x_sm90_tensorop_gemm_f16_f16_f32_f16_f16_128x16x64_4x4x1_0_ttn_align8,passed,success,universal,4096,5120,4096,f16:row,f16:row,f16:column,f16:column,1,0,serial,1,1,along_m,invalid,invalid,false,false,4,tensorop,f32,128,16,64,1,1,1,0,0,0,12,4,2,1,64,16,16,90,90,117440512,171840634880,1463,0.879904,124.303,195295
1,CUTLASS,gemm,cutlass3x_sm90_tensorop_gemm_f16_f16_f32_f16_f16_128x16x64_4x4x1_0_ttn_align8_warpspecialized_epi_nosmem,passed,success,universal,4096,5120,4096,f16:row,f16:row,f16:column,f16:column,1,0,serial,1,1,along_n,invalid,invalid,false,false,2,tensorop,f32,128,16,64,1,1,1,0,0,0,12,4,1,1,64,16,16,90,90,117440512,171840634880,1463,0.912918,119.808,188232
1,CUTLASS,gemm,cutlass3x_sm90_tensorop_gemm_f16_f16_f32_f16_f16_128x16x64_4x4x1_0_ttn_align8_warpspecialized_pingpong_epi_tma,passed,success,universal,4096,5120,4096,f16:row,f16:row,f16:column,f16:column,1,0,serial,1,1,along_m,invalid,invalid,false,false,8,tensorop,f32,128,16,64,1,1,1,0,0,0,12,4,1,1,64,16,16,90,90,117440512,171840634880,1463,0.738721,148.06,232619
1,CUTLASS,gemm,cutlass3x_sm90_tensorop_gemm_f16_f16_f32_f16_f16_128x16x64_4x4x1_0_ttn_align8_warpspecialized_pingpong_epi_nosmem,passed,success,universal,4096,5120,4096,f16:row,f16:row,f16:column,f16:column,1,0,serial,1,1,along_m,invalid,invalid,false,false,8,tensorop,f32,128,16,64,1,1,1,0,0,0,12,4,1,1,64,16,16,90,90,117440512,171840634880,1463,0.742932,147.221,231301
1,CUTLASS,gemm,cutlass3x_sm90_tensorop_gemm_f16_f16_f32_f16_f16_128x16x64_4x4x1_0_ttn_align8_warpspecialized_cooperative_epi_nosmem,passed,success,universal,4096,5120,4096,f16:row,f16:row,f16:column,f16:column,1,0,serial,1,1,along_m,invalid,invalid,false,false,4,tensorop,f32,128,16,64,1,1,1,0,0,0,12,4,2,1,64,16,16,90,90,117440512,171840634880,1463,0.881254,124.113,194996
1,CUTLASS,gemm,cutlass3x_sm90_tensorop_gemm_f16_f16_f32_f16_f16_128x16x64_4x4x1_0_ttn_align8_warpspecialized_cooperative_epi_tma,passed,success,universal,4096,5120,4096,f16:row,f16:row,f16:column,f16:column,1,0,serial,1,1,along_m,invalid,invalid,false,false,1,tensorop,f32,128,16,64,1,1,1,0,0,0,12,4,2,1,64,16,16,90,90,117440512,171840634880,1463,0.90395,120.997,190100
1,CUTLASS,gemm,cutlass3x_sm90_tensorop_gemm_f16_f16_f32_f16_f16_128x16x64_4x4x1_0_ttn_align8_stream_k_warpspecialized_cooperative_epi_nosmem,passed,success,universal,4096,5120,4096,f16:row,f16:row,f16:column,f16:column,1,0,serial,1,1,along_m,invalid,invalid,false,false,8,tensorop,f32,128,16,64,1,1,1,0,0,0,12,4,2,1,64,16,16,90,90,117440512,171840634880,1463,0.890358,122.844,193002
1,CUTLASS,gemm,cutlass3x_sm90_tensorop_gemm_f16_f16_f32_f16_f16_128x16x64_4x4x1_0_ttn_align8_stream_k_warpspecialized_cooperative_epi_tma,passed,success,universal,4096,5120,4096,f16:row,f16:row,f16:column,f16:column,1,0,serial,1,1,along_m,invalid,invalid,false,false,4,tensorop,f32,128,16,64,1,1,1,0,0,0,12,4,2,1,64,16,16,90,90,117440512,171840634880,1463,0.915732,119.44,187654
1,CUTLASS,gemm,cutlass3x_sm90_tensorop_gemm_f16_f16_f32_f16_f16_64x64x128_2x2x1_0_ttn_align8,passed,success,universal,4096,5120,4096,f16:row,f16:row,f16:column,f16:column,1,0,serial,1,1,along_n,invalid,invalid,false,false,2,tensorop,f32,64,64,128,1,1,1,0,0,0,7,4,1,1,64,64,16,90,90,117440512,171840634880,1463,0.390257,280.264,440327
