profiler_out/4096x5120x4096.gemm.csv
Problem,Provider,OperationKind,Operation,Disposition,Status,gemm_kind,m,n,k,A,B,C,D,alpha,beta,split_k_mode,split_k_slices,batch_count,raster_order,runtime_input_datatype_a,runtime_input_datatype_b,use_pdl,enable_sm90_mixed_dtype_shuffle_test,swizzle_size,op_class,accum,cta_m,cta_n,cta_k,cluster_m,cluster_n,cluster_k,cluster_m_fallback,cluster_n_fallback,cluster_k_fallback,stages,warps_m,warps_n,warps_k,inst_m,inst_n,inst_k,min_cc,max_cc,Bytes,Flops,Flops/Byte,Runtime,GB/s,GFLOPs
1,CUTLASS,gemm,cutlass3x_sm90_tensorop_gemm_f16_f16_f32_f16_f16_64x16x128_1x4x1_0_tnn_align8,passed,success,universal,4096,5120,4096,f16:row,f16:column,f16:column,f16:column,1,0,serial,1,1,along_m,invalid,invalid,false,false,2,tensorop,f32,64,16,128,1,1,1,0,0,0,11,4,1,1,64,16,16,90,90,117440512,171840634880,1463,0.770533,141.947,223015
1,CUTLASS,gemm,cutlass3x_sm90_tensorop_gemm_f16_f16_f32_f16_f16_64x16x128_1x4x1_0_tnn_align8_warpspecialized_epi_nosmem,passed,success,universal,4096,5120,4096,f16:row,f16:column,f16:column,f16:column,1,0,serial,1,1,along_n,invalid,invalid,false,false,2,tensorop,f32,64,16,128,1,1,1,0,0,0,11,4,1,1,64,16,16,90,90,117440512,171840634880,1463,1.07621,101.63,159672
1,CUTLASS,gemm,cutlass3x_sm90_tensorop_gemm_f16_f16_f32_f16_f16_64x16x128_1x4x1_0_tnn_align8_warpspecialized_pingpong_epi_tma,passed,success,universal,4096,5120,4096,f16:row,f16:column,f16:column,f16:column,1,0,serial,1,1,along_m,invalid,invalid,false,false,2,tensorop,f32,64,16,128,1,1,1,0,0,0,11,4,1,1,64,16,16,90,90,117440512,171840634880,1463,0.772116,141.656,222558
1,CUTLASS,gemm,cutlass3x_sm90_tensorop_gemm_f16_f16_f32_f16_f16_64x16x128_1x4x1_0_tnn_align8_warpspecialized_pingpong_epi_nosmem,passed,success,universal,4096,5120,4096,f16:row,f16:column,f16:column,f16:column,1,0,serial,1,1,along_m,invalid,invalid,false,false,2,tensorop,f32,64,16,128,1,1,1,0,0,0,11,4,1,1,64,16,16,90,90,117440512,171840634880,1463,0.771724,141.728,222671
1,CUTLASS,gemm,cutlass3x_sm90_tensorop_gemm_f16_f16_f32_f16_f16_64x16x128_4x1x1_0_tnn_align8,passed,success,universal,4096,5120,4096,f16:row,f16:column,f16:column,f16:column,1,0,serial,1,1,along_n,invalid,invalid,false,false,1,tensorop,f32,64,16,128,1,1,1,0,0,0,11,4,1,1,64,16,16,90,90,117440512,171840634880,1463,1.41018,77.5608,121857
1,CUTLASS,gemm,cutlass3x_sm90_tensorop_gemm_f16_f16_f32_f16_f16_64x16x128_4x1x1_0_tnn_align8_warpspecialized_epi_nosmem,passed,success,universal,4096,5120,4096,f16:row,f16:column,f16:column,f16:column,1,0,serial,1,1,along_n,invalid,invalid,false,false,1,tensorop,f32,64,16,128,1,1,1,0,0,0,11,4,1,1,64,16,16,90,90,117440512,171840634880,1463,1.75139,62.4505,98116.9
1,CUTLASS,gemm,cutlass3x_sm90_tensorop_gemm_f16_f16_f32_f16_f16_64x16x128_4x1x1_0_tnn_align8_warpspecialized_pingpong_epi_tma,passed,success,universal,4096,5120,4096,f16:row,f16:column,f16:column,f16:column,1,0,serial,1,1,along_n,invalid,invalid,false,false,1,tensorop,f32,64,16,128,1,1,1,0,0,0,11,4,1,1,64,16,16,90,90,117440512,171840634880,1463,1.40281,77.9687,122498
1,CUTLASS,gemm,cutlass3x_sm90_tensorop_gemm_f16_f16_f32_f16_f16_64x16x128_4x1x1_0_tnn_align8_warpspecialized_pingpong_epi_nosmem,passed,success,universal,4096,5120,4096,f16:row,f16:column,f16:column,f16:column,1,0,serial,1,1,along_n,invalid,invalid,false,false,1,tensorop,f32,64,16,128,1,1,1,0,0,0,11,4,1,1,64,16,16,90,90,117440512,171840634880,1463,1.40842,77.6577,122009
1,CUTLASS,gemm,cutlass3x_sm90_tensorop_gemm_f16_f16_f32_f16_f16_64x16x128_2x4x1_0_tnn_align8,passed,success,universal,4096,5120,4096,f16:row,f16:column,f16:column,f16:column,1,0,serial,1,1,along_m,invalid,invalid,false,false,8,tensorop,f32,64,16,128,1,1,1,0,0,0,11,4,1,1,64,16,16,90,90,117440512,171840634880,1463,0.775996,140.948,221445
1,CUTLASS,gemm,cutlass3x_sm90_tensorop_gemm_f16_f16_f32_f16_f16_64x16x128_2x4x1_0_tnn_align8_warpspecialized_epi_nosmem,passed,success,universal,4096,5120,4096,f16:row,f16:column,f16:column,f16:column,1,0,serial,1,1,along_m,invalid,invalid,false,false,4,tensorop,f32,64,16,128,1,1,1,0,0,0,11,4,1,1,64,16,16,90,90,117440512,171840634880,1463,1.1021,99.2426,155921
1,CUTLASS,gemm,cutlass3x_sm90_tensorop_gemm_f16_f16_f32_f16_f16_64x16x128_2x4x1_0_tnn_align8_warpspecialized_pingpong_epi_tma,passed,success,universal,4096,5120,4096,f16:row,f16:column,f16:column,f16:column,1,0,serial,1,1,along_m,invalid,invalid,false,false,8,tensorop,f32,64,16,128,1,1,1,0,0,0,11,4,1,1,64,16,16,90,90,117440512,171840634880,1463,0.784775,139.371,218968
1,CUTLASS,gemm,cutlass3x_sm90_tensorop_gemm_f16_f16_f32_f16_f16_64x16x128_2x4x1_0_tnn_align8_warpspecialized_pingpong_epi_nosmem,passed,success,universal,4096,5120,4096,f16:row,f16:column,f16:column,f16:column,1,0,serial,1,1,along_m,invalid,invalid,false,false,8,tensorop,f32,64,16,128,1,1,1,0,0,0,11,4,1,1,64,16,16,90,90,117440512,171840634880,1463,0.775725,140.997,221523
1,CUTLASS,gemm,cutlass3x_sm90_tensorop_gemm_f16_f16_f32_f16_f16_64x16x128_4x2x1_0_tnn_align8,passed,success,universal,4096,5120,4096,f16:row,f16:column,f16:column,f16:column,1,0,serial,1,1,along_m,invalid,invalid,false,false,2,tensorop,f32,64,16,128,1,1,1,0,0,0,11,4,1,1,64,16,16,90,90,117440512,171840634880,1463,0.855734,127.814,200811
1,CUTLASS,gemm,cutlass3x_sm90_tensorop_gemm_f16_f16_f32_f16_f16_64x16x128_4x2x1_0_tnn_align8_warpspecialized_epi_nosmem,passed,success,universal,4096,5120,4096,f16:row,f16:column,f16:column,f16:column,1,0,serial,1,1,along_m,invalid,invalid,false,false,8,tensorop,f32,64,16,128,1,1,1,0,0,0,11,4,1,1,64,16,16,90,90,117440512,171840634880,1463,1.18013,92.6801,145611
1,CUTLASS,gemm,cutlass3x_sm90_tensorop_gemm_f16_f16_f32_f16_f16_64x16x128_4x2x1_0_tnn_align8_warpspecialized_pingpong_epi_tma,passed,success,universal,4096,5120,4096,f16:row,f16:column,f16:column,f16:column,1,0,serial,1,1,along_m,invalid,invalid,false,false,4,tensorop,f32,64,16,128,1,1,1,0,0,0,11,4,1,1,64,16,16,90,90,117440512,171840634880,1463,0.858089,127.464,200260
1,CUTLASS,gemm,cutlass3x_sm90_tensorop_gemm_f16_f16_f32_f16_f16_64x16x128_4x2x1_0_tnn_align8_warpspecialized_pingpong_epi_nosmem,passed,success,universal,4096,5120,4096,f16:row,f16:column,f16:column,f16:column,1,0,serial,1,1,along_m,invalid,invalid,false,false,2,tensorop,f32,64,16,128,1,1,1,0,0,0,11,4,1,1,64,16,16,90,90,117440512,171840634880,1463,0.856673,127.674,200591
1,CUTLASS,gemm,cutlass3x_sm90_tensorop_gemm_f16_f16_f32_f16_f16_64x16x128_1x8x1_0_tnn_align8,passed,success,universal,4096,5120,4096,f16:row,f16:column,f16:column,f16:column,1,0,serial,1,1,along_m,invalid,invalid,false,false,4,tensorop,f32,64,16,128,1,1,1,0,0,0,11,4,1,1,64,16,16,90,90,117440512,171840634880,1463,0.733444,149.125,234293
1,CUTLASS,gemm,cutlass3x_sm90_tensorop_gemm_f16_f16_f32_f16_f16_64x16x128_1x8x1_0_tnn_align8_warpspecialized_epi_nosmem,passed,success,universal,4096,5120,4096,f16:row,f16:column,f16:column,f16:column,1,0,serial,1,1,along_m,invalid,invalid,false,false,2,tensorop,f32,64,16,128,1,1,1,0,0,0,11,4,1,1,64,16,16,90,90,117440512,171840634880,1463,0.988096,110.693,173911
1,CUTLASS,gemm,cutlass3x_sm90_tensorop_gemm_f16_f16_f32_f16_f16_64x16x128_1x8x1_0_tnn_align8_warpspecialized_pingpong_epi_tma,passed,success,universal,4096,5120,4096,f16:row,f16:column,f16:column,f16:column,1,0,serial,1,1,along_m,invalid,invalid,false,false,8,tensorop,f32,64,16,128,1,1,1,0,0,0,11,4,1,1,64,16,16,90,90,117440512,171840634880,1463,0.732494,149.319,234597
1,CUTLASS,gemm,cutlass3x_sm90_tensorop_gemm_f16_f16_f32_f16_f16_64x16x128_1x8x1_0_tnn_align8_warpspecialized_pingpong_epi_nosmem,passed,success,universal,4096,5120,4096,f16:row,f16:column,f16:column,f16:column,1,0,serial,1,1,along_m,invalid,invalid,false,false,8,tensorop,f32,64,16,128,1,1,1,0,0,0,11,4,1,1,64,16,16,90,90,117440512,171840634880,1463,0.732405,149.337,234625
1,CUTLASS,gemm,cutlass3x_sm90_tensorop_gemm_f16_f16_f32_f16_f16_64x16x128_8x1x1_0_tnn_align8,passed,success,universal,4096,5120,4096,f16:row,f16:column,f16:column,f16:column,1,0,serial,1,1,along_n,invalid,invalid,false,false,1,tensorop,f32,64,16,128,1,1,1,0,0,0,11,4,1,1,64,16,16,90,90,117440512,171840634880,1463,1.41271,77.4219,121639
1,CUTLASS,gemm,cutlass3x_sm90_tensorop_gemm_f16_f16_f32_f16_f16_64x16x128_8x1x1_0_tnn_align8_warpspecialized_epi_nosmem,passed,success,universal,4096,5120,4096,f16:row,f16:column,f16:column,f16:column,1,0,serial,1,1,along_n,invalid,invalid,false,false,2,tensorop,f32,64,16,128,1,1,1,0,0,0,11,4,1,1,64,16,16,90,90,117440512,171840634880,1463,1.83323,59.6625,93736.6
1,CUTLASS,gemm,cutlass3x_sm90_tensorop_gemm_f16_f16_f32_f16_f16_64x16x128_8x1x1_0_tnn_align8_warpspecialized_pingpong_epi_tma,passed,success,universal,4096,5120,4096,f16:row,f16:column,f16:column,f16:column,1,0,serial,1,1,along_n,invalid,invalid,false,false,1,tensorop,f32,64,16,128,1,1,1,0,0,0,11,4,1,1,64,16,16,90,90,117440512,171840634880,1463,1.42063,76.9904,120961
1,CUTLASS,gemm,cutlass3x_sm90_tensorop_gemm_f16_f16_f32_f16_f16_64x16x128_8x1x1_0_tnn_align8_warpspecialized_pingpong_epi_nosmem,passed,success,universal,4096,5120,4096,f16:row,f16:column,f16:column,f16:column,1,0,serial,1,1,along_n,invalid,invalid,false,false,1,tensorop,f32,64,16,128,1,1,1,0,0,0,11,4,1,1,64,16,16,90,90,117440512,171840634880,1463,1.41294,77.4095,121619
1,CUTLASS,gemm,cutlass3x_sm90_tensorop_gemm_f16_f16_f32_f16_f16_64x16x128_4x4x1_0_tnn_align8,passed,success,universal,4096,5120,4096,f16:row,f16:column,f16:column,f16:column,1,0,serial,1,1,along_m,invalid,invalid,false,false,8,tensorop,f32,64,16,128,1,1,1,0,0,0,11,4,1,1,64,16,16,90,90,117440512,171840634880,1463,0.83461,131.049,205893
1,CUTLASS,gemm,cutlass3x_sm90_tensorop_gemm_f16_f16_f32_f16_f16_64x16x128_4x4x1_0_tnn_align8_warpspecialized_epi_nosmem,passed,success,universal,4096,5120,4096,f16:row,f16:column,f16:column,f16:column,1,0,serial,1,1,along_n,invalid,invalid,false,false,8,tensorop,f32,64,16,128,1,1,1,0,0,0,11,4,1,1,64,16,16,90,90,117440512,171840634880,1463,1.09178,100.18,157395
1,CUTLASS,gemm,cutlass3x_sm90_tensorop_gemm_f16_f16_f32_f16_f16_64x16x128_4x4x1_0_tnn_align8_warpspecialized_pingpong_epi_tma,passed,success,universal,4096,5120,4096,f16:row,f16:column,f16:column,f16:column,1,0,serial,1,1,along_m,invalid,invalid,false,false,8,tensorop,f32,64,16,128,1,1,1,0,0,0,11,4,1,1,64,16,16,90,90,117440512,171840634880,1463,0.837635,130.576,205150
1,CUTLASS,gemm,cutlass3x_sm90_tensorop_gemm_f16_f16_f32_f16_f16_64x16x128_4x4x1_0_tnn_align8_warpspecialized_pingpong_epi_nosmem,passed,success,universal,4096,5120,4096,f16:row,f16:column,f16:column,f16:column,1,0,serial,1,1,along_m,invalid,invalid,false,false,4,tensorop,f32,64,16,128,1,1,1,0,0,0,11,4,1,1,64,16,16,90,90,117440512,171840634880,1463,0.834778,131.023,205852
1,CUTLASS,gemm,cutlass3x_sm90_tensorop_gemm_f16_f16_f32_f16_f16_128x32x128_1x2x1_0_tnn_align8,passed,success,universal,4096,5120,4096,f16:row,f16:column,f16:column,f16:column,1,0,serial,1,1,along_m,invalid,invalid,false,false,2,tensorop,f32,128,32,128,1,1,1,0,0,0,5,4,2,1,64,32,16,90,90,117440512,171840634880,1463,0.522343,209.393,328980
1,CUTLASS,gemm,cutlass3x_sm90_tensorop_gemm_f16_f16_f32_f16_f16_128x32x128_1x2x1_0_tnn_align8_warpspecialized_epi_nosmem,passed,success,universal,4096,5120,4096,f16:row,f16:column,f16:column,f16:column,1,0,serial,1,1,along_n,invalid,invalid,false,false,1,tensorop,f32,128,32,128,1,1,1,0,0,0,5,4,1,1,64,32,16,90,90,117440512,171840634880,1463,0.558941,195.683,307440
1,CUTLASS,gemm,cutlass3x_sm90_tensorop_gemm_f16_f16_f32_f16_f16_128x32x128_1x2x1_0_tnn_align8_warpspecialized_pingpong_epi_tma,passed,success,universal,4096,5120,4096,f16:row,f16:column,f16:column,f16:column,1,0,serial,1,1,along_m,invalid,invalid,false,false,2,tensorop,f32,128,32,128,1,1,1,0,0,0,5,4,1,1,64,32,16,90,90,117440512,171840634880,1463,0.519118,210.694,331024
1,CUTLASS,gemm,cutlass3x_sm90_tensorop_gemm_f16_f16_f32_f16_f16_128x32x128_1x2x1_0_tnn_align8_warpspecialized_pingpong_epi_nosmem,passed,success,universal,4096,5120,4096,f16:row,f16:column,f16:column,f16:column,1,0,serial,1,1,along_m,invalid,invalid,false,false,2,tensorop,f32,128,32,128,1,1,1,0,0,0,5,4,1,1,64,32,16,90,90,117440512,171840634880,1463,0.521522,209.723,329498
1,CUTLASS,gemm,cutlass3x_sm90_tensorop_gemm_f16_f16_f32_f16_f16_128x32x128_1x2x1_0_tnn_align8_warpspecialized_cooperative_epi_nosmem,passed,success,universal,4096,5120,4096,f16:row,f16:column,f16:column,f16:column,1,0,serial,1,1,along_m,invalid,invalid,false,false,4,tensorop,f32,128,32,128,1,1,1,0,0,0,5,4,2,1,64,32,16,90,90,117440512,171840634880,1463,0.521381,209.779,329587
1,CUTLASS,gemm,cutlass3x_sm90_tensorop_gemm_f16_f16_f32_f16_f16_128x32x128_1x2x1_0_tnn_align8_warpspecialized_cooperative_epi_tma,passed,success,universal,4096,5120,4096,f16:row,f16:column,f16:column,f16:column,1,0,serial,1,1,along_m,invalid,invalid,false,false,2,tensorop,f32,128,32,128,1,1,1,0,0,0,5,4,2,1,64,32,16,90,90,117440512,171840634880,1463,0.523253,209.029,328408
1,CUTLASS,gemm,cutlass3x_sm90_tensorop_gemm_f16_f16_f32_f16_f16_128x32x128_1x2x1_0_tnn_align8_stream_k_warpspecialized_cooperative_epi_nosmem,passed,success,universal,4096,5120,4096,f16:row,f16:column,f16:column,f16:column,1,0,serial,1,1,along_m,invalid,invalid,false,false,4,tensorop,f32,128,32,128,1,1,1,0,0,0,5,4,2,1,64,32,16,90,90,117440512,171840634880,1463,0.525183,208.261,327202
1,CUTLASS,gemm,cutlass3x_sm90_tensorop_gemm_f16_f16_f32_f16_f16_128x32x128_1x2x1_0_tnn_align8_stream_k_warpspecialized_cooperative_epi_tma,passed,success,universal,4096,5120,4096,f16:row,f16:column,f16:column,f16:column,1,0,serial,1,1,along_m,invalid,invalid,false,false,2,tensorop,f32,128,32,128,1,1,1,0,0,0,5,4,2,1,64,32,16,90,90,117440512,171840634880,1463,0.527563,207.321,325725
1,CUTLASS,gemm,cutlass3x_sm90_tensorop_gemm_f16_f16_f32_f16_f16_128x32x128_2x1x1_0_tnn_align8,passed,success,universal,4096,5120,4096,f16:row,f16:column,f16:column,f16:column,1,0,serial,1,1,along_n,invalid,invalid,false,false,1,tensorop,f32,128,32,128,1,1,1,0,0,0,5,4,2,1,64,32,16,90,90,117440512,171840634880,1463,0.681187,160.565,252266
1,CUTLASS,gemm,cutlass3x_sm90_tensorop_gemm_f16_f16_f32_f16_f16_128x32x128_2x1x1_0_tnn_align8_warpspecialized_epi_nosmem,passed,success,universal,4096,5120,4096,f16:row,f16:column,f16:column,f16:column,1,0,serial,1,1,along_m,invalid,invalid,false,false,8,tensorop,f32,128,32,128,1,1,1,0,0,0,5,4,1,1,64,32,16,90,90,117440512,171840634880,1463,0.787505,138.888,218209
1,CUTLASS,gemm,cutlass3x_sm90_tensorop_gemm_f16_f16_f32_f16_f16_128x32x128_2x1x1_0_tnn_align8_warpspecialized_pingpong_epi_tma,passed,success,universal,4096,5120,4096,f16:row,f16:column,f16:column,f16:column,1,0,serial,1,1,along_n,invalid,invalid,false,false,1,tensorop,f32,128,32,128,1,1,1,0,0,0,5,4,1,1,64,32,16,90,90,117440512,171840634880,1463,0.659224,165.915,260671
1,CUTLASS,gemm,cutlass3x_sm90_tensorop_gemm_f16_f16_f32_f16_f16_128x32x128_2x1x1_0_tnn_align8_warpspecialized_pingpong_epi_nosmem,passed,success,universal,4096,5120,4096,f16:row,f16:column,f16:column,f16:column,1,0,serial,1,1,along_n,invalid,invalid,false,false,1,tensorop,f32,128,32,128,1,1,1,0,0,0,5,4,1,1,64,32,16,90,90,117440512,171840634880,1463,0.678152,161.284,253395
1,CUTLASS,gemm,cutlass3x_sm90_tensorop_gemm_f16_f16_f32_f16_f16_128x32x128_2x1x1_0_tnn_align8_warpspecialized_cooperative_epi_nosmem,passed,success,universal,4096,5120,4096,f16:row,f16:column,f16:column,f16:column,1,0,serial,1,1,along_n,invalid,invalid,false,false,1,tensorop,f32,128,32,128,1,1,1,0,0,0,5,4,2,1,64,32,16,90,90,117440512,171840634880,1463,0.679506,160.963,252891
1,CUTLASS,gemm,cutlass3x_sm90_tensorop_gemm_f16_f16_f32_f16_f16_128x32x128_2x1x1_0_tnn_align8_warpspecialized_cooperative_epi_tma,passed,success,universal,4096,5120,4096,f16:row,f16:column,f16:column,f16:column,1,0,serial,1,1,along_n,invalid,invalid,false,false,1,tensorop,f32,128,32,128,1,1,1,0,0,0,5,4,2,1,64,32,16,90,90,117440512,171840634880,1463,0.670029,163.239,256467
1,CUTLASS,gemm,cutlass3x_sm90_tensorop_gemm_f16_f16_f32_f16_f16_128x32x128_2x1x1_0_tnn_align8_stream_k_warpspecialized_cooperative_epi_nosmem,passed,success,universal,4096,5120,4096,f16:row,f16:column,f16:column,f16:column,1,0,serial,1,1,along_n,invalid,invalid,false,false,1,tensorop,f32,128,32,128,1,1,1,0,0,0,5,4,2,1,64,32,16,90,90,117440512,171840634880,1463,0.684615,159.761,251003
1,CUTLASS,gemm,cutlass3x_sm90_tensorop_gemm_f16_f16_f32_f16_f16_128x32x128_2x1x1_0_tnn_align8_stream_k_warpspecialized_cooperative_epi_tma,passed,success,universal,4096,5120,4096,f16:row,f16:column,f16:column,f16:column,1,0,serial,1,1,along_n,invalid,invalid,false,false,1,tensorop,f32,128,32,128,1,1,1,0,0,0,5,4,2,1,64,32,16,90,90,117440512,171840634880,1463,0.668542,163.602,257038
1,CUTLASS,gemm,cutlass3x_sm90_tensorop_gemm_f16_f16_f32_f16_f16_128x32x128_1x1x1_0_tnn_align8,passed,success,universal,4096,5120,4096,f16:row,f16:column,f16:column,f16:column,1,0,serial,1,1,along_n,invalid,invalid,false,false,1,tensorop,f32,128,32,128,1,1,1,0,0,0,5,4,2,1,64,32,16,90,90,117440512,171840634880,1463,0.677922,161.339,253481
1,CUTLASS,gemm,cutlass3x_sm90_tensorop_gemm_f16_f16_f32_f16_f16_128x32x128_1x1x1_0_tnn_align8_warpspecialized_epi_nosmem,passed,success,universal,4096,5120,4096,f16:row,f16:column,f16:column,f16:column,1,0,serial,1,1,along_n,invalid,invalid,false,false,8,tensorop,f32,128,32,128,1,1,1,0,0,0,5,4,1,1,64,32,16,90,90,117440512,171840634880,1463,0.80385,136.064,213772
1,CUTLASS,gemm,cutlass3x_sm90_tensorop_gemm_f16_f16_f32_f16_f16_128x32x128_1x1x1_0_tnn_align8_warpspecialized_pingpong_epi_tma,passed,success,universal,4096,5120,4096,f16:row,f16:column,f16:column,f16:column,1,0,serial,1,1,along_m,invalid,invalid,false,false,8,tensorop,f32,128,32,128,1,1,1,0,0,0,5,4,1,1,64,32,16,90,90,117440512,171840634880,1463,0.553592,197.573,310410
1,CUTLASS,gemm,cutlass3x_sm90_tensorop_gemm_f16_f16_f32_f16_f16_128x32x128_1x1x1_0_tnn_align8_warpspecialized_pingpong_epi_nosmem,passed,success,universal,4096,5120,4096,f16:row,f16:column,f16:column,f16:column,1,0,serial,1,1,along_m,invalid,invalid,false,false,8,tensorop,f32,128,32,128,1,1,1,0,0,0,5,4,1,1,64,32,16,90,90,117440512,171840634880,1463,0.62176,175.912,276378
1,CUTLASS,gemm,cutlass3x_sm90_tensorop_gemm_f16_f16_f32_f16_f16_128x32x128_1x1x1_0_tnn_align8_warpspecialized_cooperative_epi_nosmem,passed,success,universal,4096,5120,4096,f16:row,f16:column,f16:column,f16:column,1,0,serial,1,1,along_n,invalid,invalid,false,false,1,tensorop,f32,128,32,128,1,1,1,0,0,0,5,4,2,1,64,32,16,90,90,117440512,171840634880,1463,0.671416,162.902,255938
1,CUTLASS,gemm,cutlass3x_sm90_tensorop_gemm_f16_f16_f32_f16_f16_128x32x128_1x1x1_0_tnn_align8_warpspecialized_cooperative_epi_tma,passed,success,universal,4096,5120,4096,f16:row,f16:column,f16:column,f16:column,1,0,serial,1,1,along_m,invalid,invalid,false,false,2,tensorop,f32,128,32,128,1,1,1,0,0,0,5,4,2,1,64,32,16,90,90,117440512,171840634880,1463,0.625417,174.883,274762
1,CUTLASS,gemm,cutlass3x_sm90_tensorop_gemm_f16_f16_f32_f16_f16_128x32x128_1x1x1_0_tnn_align8_stream_k_warpspecialized_cooperative_epi_nosmem,passed,success,universal,4096,5120,4096,f16:row,f16:column,f16:column,f16:column,1,0,serial,1,1,along_m,invalid,invalid,false,false,8,tensorop,f32,128,32,128,1,1,1,0,0,0,5,4,2,1,64,32,16,90,90,117440512,171840634880,1463,0.670347,163.162,256346
1,CUTLASS,gemm,cutlass3x_sm90_tensorop_gemm_f16_f16_f32_f16_f16_128x32x128_1x1x1_0_tnn_align8_stream_k_warpspecialized_cooperative_epi_tma,passed,success,universal,4096,5120,4096,f16:row,f16:column,f16:column,f16:column,1,0,serial,1,1,along_m,invalid,invalid,false,false,8,tensorop,f32,128,32,128,1,1,1,0,0,0,5,4,2,1,64,32,16,90,90,117440512,171840634880,1463,0.546674,200.073,314338
1,CUTLASS,gemm,cutlass3x_sm90_tensorop_gemm_f16_f16_f32_f16_f16_128x32x128_2x2x1_0_tnn_align8,passed,success,universal,4096,5120,4096,f16:row,f16:column,f16:column,f16:column,1,0,serial,1,1,along_n,invalid,invalid,false,false,4,tensorop,f32,128,32,128,1,1,1,0,0,0,5,4,2,1,64,32,16,90,90,117440512,171840634880,1463,0.503184,217.366,341507
1,CUTLASS,gemm,cutlass3x_sm90_tensorop_gemm_f16_f16_f32_f16_f16_128x32x128_2x2x1_0_tnn_align8_warpspecialized_epi_nosmem,passed,success,universal,4096,5120,4096,f16:row,f16:column,f16:column,f16:column,1,0,serial,1,1,along_n,invalid,invalid,false,false,1,tensorop,f32,128,32,128,1,1,1,0,0,0,5,4,1,1,64,32,16,90,90,117440512,171840634880,1463,0.658251,166.16,261057
1,CUTLASS,gemm,cutlass3x_sm90_tensorop_gemm_f16_f16_f32_f16_f16_128x32x128_2x2x1_0_tnn_align8_warpspecialized_pingpong_epi_tma,passed,success,universal,4096,5120,4096,f16:row,f16:column,f16:column,f16:column,1,0,serial,1,1,along_m,invalid,invalid,false,false,2,tensorop,f32,128,32,128,1,1,1,0,0,0,5,4,1,1,64,32,16,90,90,117440512,171840634880,1463,0.505178,216.508,340158
1,CUTLASS,gemm,cutlass3x_sm90_tensorop_gemm_f16_f16_f32_f16_f16_128x32x128_2x2x1_0_tnn_align8_warpspecialized_pingpong_epi_nosmem,passed,success,universal,4096,5120,4096,f16:row,f16:column,f16:column,f16:column,1,0,serial,1,1,along_m,invalid,invalid,false,false,2,tensorop,f32,128,32,128,1,1,1,0,0,0,5,4,1,1,64,32,16,90,90,117440512,171840634880,1463,0.501177,218.236,342874
1,CUTLASS,gemm,cutlass3x_sm90_tensorop_gemm_f16_f16_f32_f16_f16_128x32x128_2x2x1_0_tnn_align8_warpspecialized_cooperative_epi_nosmem,passed,success,universal,4096,5120,4096,f16:row,f16:column,f16:column,f16:column,1,0,serial,1,1,along_n,invalid,invalid,false,false,4,tensorop,f32,128,32,128,1,1,1,0,0,0,5,4,2,1,64,32,16,90,90,117440512,171840634880,1463,0.502373,217.717,342058
1,CUTLASS,gemm,cutlass3x_sm90_tensorop_gemm_f16_f16_f32_f16_f16_128x32x128_2x2x1_0_tnn_align8_warpspecialized_cooperative_epi_tma,passed,success,universal,4096,5120,4096,f16:row,f16:column,f16:column,f16:column,1,0,serial,1,1,along_n,invalid,invalid,false,false,4,tensorop,f32,128,32,128,1,1,1,0,0,0,5,4,2,1,64,32,16,90,90,117440512,171840634880,1463,0.50231,217.744,342101
1,CUTLASS,gemm,cutlass3x_sm90_tensorop_gemm_f16_f16_f32_f16_f16_128x32x128_2x2x1_0_tnn_align8_stream_k_warpspecialized_cooperative_epi_nosmem,passed,success,universal,4096,5120,4096,f16:row,f16:column,f16:column,f16:column,1,0,serial,1,1,along_n,invalid,invalid,false,false,4,tensorop,f32,128,32,128,1,1,1,0,0,0,5,4,2,1,64,32,16,90,90,117440512,171840634880,1463,0.50438,216.85,340697
1,CUTLASS,gemm,cutlass3x_sm90_tensorop_gemm_f16_f16_f32_f16_f16_128x32x128_2x2x1_0_tnn_align8_stream_k_warpspecialized_cooperative_epi_tma,passed,success,universal,4096,5120,4096,f16:row,f16:column,f16:column,f16:column,1,0,serial,1,1,along_n,invalid,invalid,false,false,4,tensorop,f32,128,32,128,1,1,1,0,0,0,5,4,2,1,64,32,16,90,90,117440512,171840634880,1463,0.506752,215.835,339102
1,CUTLASS,gemm,cutlass3x_sm90_tensorop_gemm_f16_f16_f32_f16_f16_128x32x128_1x4x1_0_tnn_align8,passed,success,universal,4096,5120,4096,f16:row,f16:column,f16:column,f16:column,1,0,serial,1,1,along_m,invalid,invalid,false,false,8,tensorop,f32,128,32,128,1,1,1,0,0,0,5,4,2,1,64,32,16,90,90,117440512,171840634880,1463,0.401909,272.139,427561
1,CUTLASS,gemm,cutlass3x_sm90_tensorop_gemm_f16_f16_f32_f16_f16_128x32x128_1x4x1_0_tnn_align8_warpspecialized_epi_nosmem,passed,success,universal,4096,5120,4096,f16:row,f16:column,f16:column,f16:column,1,0,serial,1,1,along_n,invalid,invalid,false,false,4,tensorop,f32,128,32,128,1,1,1,0,0,0,5,4,1,1,64,32,16,90,90,117440512,171840634880,1463,0.500217,218.655,343532
1,CUTLASS,gemm,cutlass3x_sm90_tensorop_gemm_f16_f16_f32_f16_f16_128x32x128_1x4x1_0_tnn_align8_warpspecialized_pingpong_epi_tma,passed,success,universal,4096,5120,4096,f16:row,f16:column,f16:column,f16:column,1,0,serial,1,1,along_m,invalid,invalid,false,false,8,tensorop,f32,128,32,128,1,1,1,0,0,0,5,4,1,1,64,32,16,90,90,117440512,171840634880,1463,0.397073,275.453,432768
1,CUTLASS,gemm,cutlass3x_sm90_tensorop_gemm_f16_f16_f32_f16_f16_128x32x128_1x4x1_0_tnn_align8_warpspecialized_pingpong_epi_nosmem,passed,success,universal,4096,5120,4096,f16:row,f16:column,f16:column,f16:column,1,0,serial,1,1,along_m,invalid,invalid,false,false,8,tensorop,f32,128,32,128,1,1,1,0,0,0,5,4,1,1,64,32,16,90,90,117440512,171840634880,1463,0.399182,273.998,430482
1,CUTLASS,gemm,cutlass3x_sm90_tensorop_gemm_f16_f16_f32_f16_f16_128x32x128_1x4x1_0_tnn_align8_warpspecialized_cooperative_epi_nosmem,passed,success,universal,4096,5120,4096,f16:row,f16:column,f16:column,f16:column,1,0,serial,1,1,along_m,invalid,invalid,false,false,8,tensorop,f32,128,32,128,1,1,1,0,0,0,5,4,2,1,64,32,16,90,90,117440512,171840634880,1463,0.401763,272.238,427717
1,CUTLASS,gemm,cutlass3x_sm90_tensorop_gemm_f16_f16_f32_f16_f16_128x32x128_1x4x1_0_tnn_align8_warpspecialized_cooperative_epi_tma,passed,success,universal,4096,5120,4096,f16:row,f16:column,f16:column,f16:column,1,0,serial,1,1,along_m,invalid,invalid,false,false,8,tensorop,f32,128,32,128,1,1,1,0,0,0,5,4,2,1,64,32,16,90,90,117440512,171840634880,1463,0.41114,266.028,417961
1,CUTLASS,gemm,cutlass3x_sm90_tensorop_gemm_f16_f16_f32_f16_f16_128x32x128_1x4x1_0_tnn_align8_stream_k_warpspecialized_cooperative_epi_nosmem,passed,success,universal,4096,5120,4096,f16:row,f16:column,f16:column,f16:column,1,0,serial,1,1,along_m,invalid,invalid,false,false,8,tensorop,f32,128,32,128,1,1,1,0,0,0,5,4,2,1,64,32,16,90,90,117440512,171840634880,1463,0.422892,258.636,406347
1,CUTLASS,gemm,cutlass3x_sm90_tensorop_gemm_f16_f16_f32_f16_f16_128x32x128_1x4x1_0_tnn_align8_stream_k_warpspecialized_cooperative_epi_tma,passed,success,universal,4096,5120,4096,f16:row,f16:column,f16:column,f16:column,1,0,serial,1,1,along_m,invalid,invalid,false,false,8,tensorop,f32,128,32,128,1,1,1,0,0,0,5,4,2,1,64,32,16,90,90,117440512,171840634880,1463,0.429847,254.451,399771
1,CUTLASS,gemm,cutlass3x_sm90_tensorop_gemm_f16_f16_f32_f16_f16_128x32x128_4x1x1_0_tnn_align8,passed,success,universal,4096,5120,4096,f16:row,f16:column,f16:column,f16:column,1,0,serial,1,1,along_n,invalid,invalid,false,false,1,tensorop,f32,128,32,128,1,1,1,0,0,0,5,4,2,1,64,32,16,90,90,117440512,171840634880,1463,0.725284,150.803,236929
1,CUTLASS,gemm,cutlass3x_sm90_tensorop_gemm_f16_f16_f32_f16_f16_128x32x128_4x1x1_0_tnn_align8_warpspecialized_epi_nosmem,passed,success,universal,4096,5120,4096,f16:row,f16:column,f16:column,f16:column,1,0,serial,1,1,along_n,invalid,invalid,false,false,1,tensorop,f32,128,32,128,1,1,1,0,0,0,5,4,1,1,64,32,16,90,90,117440512,171840634880,1463,0.811211,134.829,211832
1,CUTLASS,gemm,cutlass3x_sm90_tensorop_gemm_f16_f16_f32_f16_f16_128x32x128_4x1x1_0_tnn_align8_warpspecialized_pingpong_epi_tma,passed,success,universal,4096,5120,4096,f16:row,f16:column,f16:column,f16:column,1,0,serial,1,1,along_n,invalid,invalid,false,false,1,tensorop,f32,128,32,128,1,1,1,0,0,0,5,4,1,1,64,32,16,90,90,117440512,171840634880,1463,0.707683,154.554,242821
1,CUTLASS,gemm,cutlass3x_sm90_tensorop_gemm_f16_f16_f32_f16_f16_128x32x128_4x1x1_0_tnn_align8_warpspecialized_pingpong_epi_nosmem,passed,success,universal,4096,5120,4096,f16:row,f16:column,f16:column,f16:column,1,0,serial,1,1,along_n,invalid,invalid,false,false,1,tensorop,f32,128,32,128,1,1,1,0,0,0,5,4,1,1,64,32,16,90,90,117440512,171840634880,1463,0.71995,151.92,238684
1,CUTLASS,gemm,cutlass3x_sm90_tensorop_gemm_f16_f16_f32_f16_f16_128x32x128_4x1x1_0_tnn_align8_warpspecialized_cooperative_epi_nosmem,passed,success,universal,4096,5120,4096,f16:row,f16:column,f16:column,f16:column,1,0,serial,1,1,along_n,invalid,invalid,false,false,1,tensorop,f32,128,32,128,1,1,1,0,0,0,5,4,2,1,64,32,16,90,90,117440512,171840634880,1463,0.723625,151.149,237472
1,CUTLASS,gemm,cutlass3x_sm90_tensorop_gemm_f16_f16_f32_f16_f16_128x32x128_4x1x1_0_tnn_align8_warpspecialized_cooperative_epi_tma,passed,success,universal,4096,5120,4096,f16:row,f16:column,f16:column,f16:column,1,0,serial,1,1,along_n,invalid,invalid,false,false,1,tensorop,f32,128,32,128,1,1,1,0,0,0,5,4,2,1,64,32,16,90,90,117440512,171840634880,1463,0.721375,151.62,238213
1,CUTLASS,gemm,cutlass3x_sm90_tensorop_gemm_f16_f16_f32_f16_f16_128x32x128_4x1x1_0_tnn_align8_stream_k_warpspecialized_cooperative_epi_nosmem,passed,success,universal,4096,5120,4096,f16:row,f16:column,f16:column,f16:column,1,0,serial,1,1,along_n,invalid,invalid,false,false,1,tensorop,f32,128,32,128,1,1,1,0,0,0,5,4,2,1,64,32,16,90,90,117440512,171840634880,1463,0.727279,150.389,236279
1,CUTLASS,gemm,cutlass3x_sm90_tensorop_gemm_f16_f16_f32_f16_f16_128x32x128_4x1x1_0_tnn_align8_stream_k_warpspecialized_cooperative_epi_tma,passed,success,universal,4096,5120,4096,f16:row,f16:column,f16:column,f16:column,1,0,serial,1,1,along_n,invalid,invalid,false,false,1,tensorop,f32,128,32,128,1,1,1,0,0,0,5,4,2,1,64,32,16,90,90,117440512,171840634880,1463,0.727168,150.412,236315
1,CUTLASS,gemm,cutlass3x_sm90_tensorop_gemm_f16_f16_f32_f16_f16_128x32x128_2x4x1_0_tnn_align8,passed,success,universal,4096,5120,4096,f16:row,f16:column,f16:column,f16:column,1,0,serial,1,1,along_n,invalid,invalid,false,false,8,tensorop,f32,128,32,128,1,1,1,0,0,0,5,4,2,1,64,32,16,90,90,117440512,171840634880,1463,0.406732,268.912,422491
1,CUTLASS,gemm,cutlass3x_sm90_tensorop_gemm_f16_f16_f32_f16_f16_128x32x128_2x4x1_0_tnn_align8_warpspecialized_epi_nosmem,passed,success,universal,4096,5120,4096,f16:row,f16:column,f16:column,f16:column,1,0,serial,1,1,along_n,invalid,invalid,false,false,8,tensorop,f32,128,32,128,1,1,1,0,0,0,5,4,1,1,64,32,16,90,90,117440512,171840634880,1463,0.491082,222.723,349923
1,CUTLASS,gemm,cutlass3x_sm90_tensorop_gemm_f16_f16_f32_f16_f16_128x32x128_2x4x1_0_tnn_align8_warpspecialized_pingpong_epi_tma,passed,success,universal,4096,5120,4096,f16:row,f16:column,f16:column,f16:column,1,0,serial,1,1,along_m,invalid,invalid,false,false,8,tensorop,f32,128,32,128,1,1,1,0,0,0,5,4,1,1,64,32,16,90,90,117440512,171840634880,1463,0.394781,277.052,435281
1,CUTLASS,gemm,cutlass3x_sm90_tensorop_gemm_f16_f16_f32_f16_f16_128x32x128_2x4x1_0_tnn_align8_warpspecialized_pingpong_epi_nosmem,passed,success,universal,4096,5120,4096,f16:row,f16:column,f16:column,f16:column,1,0,serial,1,1,along_n,invalid,invalid,false,false,8,tensorop,f32,128,32,128,1,1,1,0,0,0,5,4,1,1,64,32,16,90,90,117440512,171840634880,1463,0.398725,274.312,430975
1,CUTLASS,gemm,cutlass3x_sm90_tensorop_gemm_f16_f16_f32_f16_f16_128x32x128_2x4x1_0_tnn_align8_warpspecialized_cooperative_epi_nosmem,passed,success,universal,4096,5120,4096,f16:row,f16:column,f16:column,f16:column,1,0,serial,1,1,along_m,invalid,invalid,false,false,8,tensorop,f32,128,32,128,1,1,1,0,0,0,5,4,2,1,64,32,16,90,90,117440512,171840634880,1463,0.408532,267.727,420630
1,CUTLASS,gemm,cutlass3x_sm90_tensorop_gemm_f16_f16_f32_f16_f16_128x32x128_2x4x1_0_tnn_align8_warpspecialized_cooperative_epi_tma,passed,success,universal,4096,5120,4096,f16:row,f16:column,f16:column,f16:column,1,0,serial,1,1,along_m,invalid,invalid,false,false,8,tensorop,f32,128,32,128,1,1,1,0,0,0,5,4,2,1,64,32,16,90,90,117440512,171840634880,1463,0.407387,268.479,421812
1,CUTLASS,gemm,cutlass3x_sm90_tensorop_gemm_f16_f16_f32_f16_f16_128x32x128_2x4x1_0_tnn_align8_stream_k_warpspecialized_cooperative_epi_nosmem,passed,success,universal,4096,5120,4096,f16:row,f16:column,f16:column,f16:column,1,0,serial,1,1,along_m,invalid,invalid,false,false,8,tensorop,f32,128,32,128,1,1,1,0,0,0,5,4,2,1,64,32,16,90,90,117440512,171840634880,1463,0.421042,259.772,408132
1,CUTLASS,gemm,cutlass3x_sm90_tensorop_gemm_f16_f16_f32_f16_f16_128x32x128_2x4x1_0_tnn_align8_stream_k_warpspecialized_cooperative_epi_tma,passed,success,universal,4096,5120,4096,f16:row,f16:column,f16:column,f16:column,1,0,serial,1,1,along_m,invalid,invalid,false,false,8,tensorop,f32,128,32,128,1,1,1,0,0,0,5,4,2,1,64,32,16,90,90,117440512,171840634880,1463,0.423271,258.404,405983
1,CUTLASS,gemm,cutlass3x_sm90_tensorop_gemm_f16_f16_f32_f16_f16_128x32x128_4x2x1_0_tnn_align8,passed,success,universal,4096,5120,4096,f16:row,f16:column,f16:column,f16:column,1,0,serial,1,1,along_n,invalid,invalid,false,false,4,tensorop,f32,128,32,128,1,1,1,0,0,0,5,4,2,1,64,32,16,90,90,117440512,171840634880,1463,0.474359,230.574,362259
1,CUTLASS,gemm,cutlass3x_sm90_tensorop_gemm_f16_f16_f32_f16_f16_128x32x128_4x2x1_0_tnn_align8_warpspecialized_epi_nosmem,passed,success,universal,4096,5120,4096,f16:row,f16:column,f16:column,f16:column,1,0,serial,1,1,along_m,invalid,invalid,false,false,1,tensorop,f32,128,32,128,1,1,1,0,0,0,5,4,1,1,64,32,16,90,90,117440512,171840634880,1463,0.649472,168.406,264585
1,CUTLASS,gemm,cutlass3x_sm90_tensorop_gemm_f16_f16_f32_f16_f16_128x32x128_4x2x1_0_tnn_align8_warpspecialized_pingpong_epi_tma,passed,success,universal,4096,5120,4096,f16:row,f16:column,f16:column,f16:column,1,0,serial,1,1,along_m,invalid,invalid,false,false,4,tensorop,f32,128,32,128,1,1,1,0,0,0,5,4,1,1,64,32,16,90,90,117440512,171840634880,1463,0.475286,230.125,361552
1,CUTLASS,gemm,cutlass3x_sm90_tensorop_gemm_f16_f16_f32_f16_f16_128x32x128_4x2x1_0_tnn_align8_warpspecialized_pingpong_epi_nosmem,passed,success,universal,4096,5120,4096,f16:row,f16:column,f16:column,f16:column,1,0,serial,1,1,along_m,invalid,invalid,false,false,4,tensorop,f32,128,32,128,1,1,1,0,0,0,5,4,1,1,64,32,16,90,90,117440512,171840634880,1463,0.467204,234.106,367807
1,CUTLASS,gemm,cutlass3x_sm90_tensorop_gemm_f16_f16_f32_f16_f16_128x32x128_4x2x1_0_tnn_align8_warpspecialized_cooperative_epi_nosmem,passed,success,universal,4096,5120,4096,f16:row,f16:column,f16:column,f16:column,1,0,serial,1,1,along_n,invalid,invalid,false,false,4,tensorop,f32,128,32,128,1,1,1,0,0,0,5,4,2,1,64,32,16,90,90,117440512,171840634880,1463,0.472635,231.415,363580
1,CUTLASS,gemm,cutlass3x_sm90_tensorop_gemm_f16_f16_f32_f16_f16_128x32x128_4x2x1_0_tnn_align8_warpspecialized_cooperative_epi_tma,passed,success,universal,4096,5120,4096,f16:row,f16:column,f16:column,f16:column,1,0,serial,1,1,along_n,invalid,invalid,false,false,4,tensorop,f32,128,32,128,1,1,1,0,0,0,5,4,2,1,64,32,16,90,90,117440512,171840634880,1463,0.473485,231,362927
1,CUTLASS,gemm,cutlass3x_sm90_tensorop_gemm_f16_f16_f32_f16_f16_128x32x128_4x2x1_0_tnn_align8_stream_k_warpspecialized_cooperative_epi_nosmem,passed,success,universal,4096,5120,4096,f16:row,f16:column,f16:column,f16:column,1,0,serial,1,1,along_m,invalid,invalid,false,false,4,tensorop,f32,128,32,128,1,1,1,0,0,0,5,4,2,1,64,32,16,90,90,117440512,171840634880,1463,0.482671,226.604,356020
1,CUTLASS,gemm,cutlass3x_sm90_tensorop_gemm_f16_f16_f32_f16_f16_128x32x128_4x2x1_0_tnn_align8_stream_k_warpspecialized_cooperative_epi_tma,passed,success,universal,4096,5120,4096,f16:row,f16:column,f16:column,f16:column,1,0,serial,1,1,along_n,invalid,invalid,false,false,4,tensorop,f32,128,32,128,1,1,1,0,0,0,5,4,2,1,64,32,16,90,90,117440512,171840634880,1463,0.483487,226.221,355420
1,CUTLASS,gemm,cutlass3x_sm90_tensorop_gemm_f16_f16_f32_f16_f16_128x256x64_1x2x1_0_tnn_align8,passed,success,universal,4096,5120,4096,f16:row,f16:column,f16:column,f16:column,1,0,serial,1,1,along_m,invalid,invalid,false,false,2,tensorop,f32,128,256,64,1,1,1,0,0,0,4,4,2,1,64,256,16,90,90,117440512,171840634880,1463,0.216721,504.68,792911
1,CUTLASS,gemm,cutlass3x_sm90_tensorop_gemm_f16_f16_f32_f16_f16_128x256x64_1x2x1_0_tnn_align8_warpspecialized_epi_nosmem,passed,success,universal,4096,5120,4096,f16:row,f16:column,f16:column,f16:column,1,0,serial,1,1,along_n,invalid,invalid,false,false,8,tensorop,f32,128,256,64,1,1,1,0,0,0,4,4,1,1,64,256,16,90,90,117440512,171840634880,1463,3.80034,28.7803,45217.2
1,CUTLASS,gemm,cutlass3x_sm90_tensorop_gemm_f16_f16_f32_f16_f16_128x256x64_1x2x1_0_tnn_align8_warpspecialized_pingpong_epi_tma,passed,success,universal,4096,5120,4096,f16:row,f16:column,f16:column,f16:column,1,0,serial,1,1,along_m,invalid,invalid,false,false,2,tensorop,f32,128,256,64,1,1,1,0,0,0,4,4,1,1,64,256,16,90,90,117440512,171840634880,1463,4.38937,24.9182,39149.3
1,CUTLASS,gemm,cutlass3x_sm90_tensorop_gemm_f16_f16_f32_f16_f16_128x256x64_1x2x1_0_tnn_align8_warpspecialized_pingpong_epi_nosmem,passed,success,universal,4096,5120,4096,f16:row,f16:column,f16:column,f16:column,1,0,serial,1,1,along_m,invalid,invalid,false,false,2,tensorop,f32,128,256,64,1,1,1,0,0,0,4,4,1,1,64,256,16,90,90,117440512,171840634880,1463,4.24114,25.789,40517.5
1,CUTLASS,gemm,cutlass3x_sm90_tensorop_gemm_f16_f16_f32_f16_f16_128x256x64_1x2x1_0_tnn_align8_warpspecialized_cooperative_epi_nosmem,passed,success,universal,4096,5120,4096,f16:row,f16:column,f16:column,f16:column,1,0,serial,1,1,along_m,invalid,invalid,false,false,2,tensorop,f32,128,256,64,1,1,1,0,0,0,4,4,2,1,64,256,16,90,90,117440512,171840634880,1463,0.217709,502.391,789314
1,CUTLASS,gemm,cutlass3x_sm90_tensorop_gemm_f16_f16_f32_f16_f16_128x256x64_1x2x1_0_tnn_align8_warpspecialized_cooperative_epi_tma,passed,success,universal,4096,5120,4096,f16:row,f16:column,f16:column,f16:column,1,0,serial,1,1,along_m,invalid,invalid,false,false,1,tensorop,f32,128,256,64,1,1,1,0,0,0,4,4,2,1,64,256,16,90,90,117440512,171840634880,1463,0.201268,543.43,853791
1,CUTLASS,gemm,cutlass3x_sm90_tensorop_gemm_f16_f16_f32_f16_f16_128x256x64_1x2x1_0_tnn_align8_stream_k_warpspecialized_cooperative_epi_nosmem,passed,success,universal,4096,5120,4096,f16:row,f16:column,f16:column,f16:column,1,0,serial,1,1,along_m,invalid,invalid,false,false,2,tensorop,f32,128,256,64,1,1,1,0,0,0,4,4,2,1,64,256,16,90,90,117440512,171840634880,1463,0.226171,483.594,759781
1,CUTLASS,gemm,cutlass3x_sm90_tensorop_gemm_f16_f16_f32_f16_f16_128x256x64_1x2x1_0_tnn_align8_stream_k_warpspecialized_cooperative_epi_tma,passed,success,universal,4096,5120,4096,f16:row,f16:column,f16:column,f16:column,1,0,serial,1,1,along_m,invalid,invalid,false,false,1,tensorop,f32,128,256,64,1,1,1,0,0,0,4,4,2,1,64,256,16,90,90,117440512,171840634880,1463,0.2038,536.677,843181
1,CUTLASS,gemm,cutlass3x_sm90_tensorop_gemm_f16_f16_f32_f16_f16_128x32x128_1x8x1_0_tnn_align8,passed,success,universal,4096,5120,4096,f16:row,f16:column,f16:column,f16:column,1,0,serial,1,1,along_m,invalid,invalid,false,false,4,tensorop,f32,128,32,128,1,1,1,0,0,0,5,4,2,1,64,32,16,90,90,117440512,171840634880,1463,0.393593,277.889,436595
1,CUTLASS,gemm,cutlass3x_sm90_tensorop_gemm_f16_f16_f32_f16_f16_128x32x128_1x8x1_0_tnn_align8_warpspecialized_epi_nosmem,passed,success,universal,4096,5120,4096,f16:row,f16:column,f16:column,f16:column,1,0,serial,1,1,along_n,invalid,invalid,false,false,2,tensorop,f32,128,32,128,1,1,1,0,0,0,5,4,1,1,64,32,16,90,90,117440512,171840634880,1463,0.473726,230.882,362743
1,CUTLASS,gemm,cutlass3x_sm90_tensorop_gemm_f16_f16_f32_f16_f16_128x32x128_1x8x1_0_tnn_align8_warpspecialized_pingpong_epi_tma,passed,success,universal,4096,5120,4096,f16:row,f16:column,f16:column,f16:column,1,0,serial,1,1,along_m,invalid,invalid,false,false,4,tensorop,f32,128,32,128,1,1,1,0,0,0,5,4,1,1,64,32,16,90,90,117440512,171840634880,1463,0.381254,286.882,450725
1,CUTLASS,gemm,cutlass3x_sm90_tensorop_gemm_f16_f16_f32_f16_f16_128x32x128_1x8x1_0_tnn_align8_warpspecialized_pingpong_epi_nosmem,passed,success,universal,4096,5120,4096,f16:row,f16:column,f16:column,f16:column,1,0,serial,1,1,along_m,invalid,invalid,false,false,4,tensorop,f32,128,32,128,1,1,1,0,0,0,5,4,1,1,64,32,16,90,90,117440512,171840634880,1463,0.38498,284.106,446363
1,CUTLASS,gemm,cutlass3x_sm90_tensorop_gemm_f16_f16_f32_f16_f16_128x32x128_1x8x1_0_tnn_align8_warpspecialized_cooperative_epi_nosmem,passed,success,universal,4096,5120,4096,f16:row,f16:column,f16:column,f16:column,1,0,serial,1,1,along_m,invalid,invalid,false,false,4,tensorop,f32,128,32,128,1,1,1,0,0,0,5,4,2,1,64,32,16,90,90,117440512,171840634880,1463,0.392155,278.908,438196
1,CUTLASS,gemm,cutlass3x_sm90_tensorop_gemm_f16_f16_f32_f16_f16_128x32x128_1x8x1_0_tnn_align8_warpspecialized_cooperative_epi_tma,passed,success,universal,4096,5120,4096,f16:row,f16:column,f16:column,f16:column,1,0,serial,1,1,along_m,invalid,invalid,false,false,4,tensorop,f32,128,32,128,1,1,1,0,0,0,5,4,2,1,64,32,16,90,90,117440512,171840634880,1463,0.399571,273.731,430063
1,CUTLASS,gemm,cutlass3x_sm90_tensorop_gemm_f16_f16_f32_f16_f16_128x32x128_1x8x1_0_tnn_align8_stream_k_warpspecialized_cooperative_epi_nosmem,passed,success,universal,4096,5120,4096,f16:row,f16:column,f16:column,f16:column,1,0,serial,1,1,along_m,invalid,invalid,false,false,4,tensorop,f32,128,32,128,1,1,1,0,0,0,5,4,2,1,64,32,16,90,90,117440512,171840634880,1463,0.408797,267.553,420357
1,CUTLASS,gemm,cutlass3x_sm90_tensorop_gemm_f16_f16_f32_f16_f16_128x32x128_1x8x1_0_tnn_align8_stream_k_warpspecialized_cooperative_epi_tma,passed,success,universal,4096,5120,4096,f16:row,f16:column,f16:column,f16:column,1,0,serial,1,1,along_m,invalid,invalid,false,false,4,tensorop,f32,128,32,128,1,1,1,0,0,0,5,4,2,1,64,32,16,90,90,117440512,171840634880,1463,0.410958,266.146,418146
1,CUTLASS,gemm,cutlass3x_sm90_tensorop_gemm_f16_f16_f32_f16_f16_128x256x128_1x1x1_0_tnn_align8,passed,success,universal,4096,5120,4096,f16:row,f16:column,f16:column,f16:column,1,0,serial,1,1,along_n,invalid,invalid,false,false,4,tensorop,f32,128,256,128,1,1,1,0,0,0,2,4,2,1,64,256,16,90,90,117440512,171840634880,1463,0.335191,326.306,512665
1,CUTLASS,gemm,cutlass3x_sm90_tensorop_gemm_f16_f16_f32_f16_f16_128x256x128_1x1x1_0_tnn_align8_warpspecialized_epi_nosmem,passed,success,universal,4096,5120,4096,f16:row,f16:column,f16:column,f16:column,1,0,serial,1,1,along_n,invalid,invalid,false,false,1,tensorop,f32,128,256,128,1,1,1,0,0,0,2,4,1,1,64,256,16,90,90,117440512,171840634880,1463,3.85485,28.3733,44577.8
1,CUTLASS,gemm,cutlass3x_sm90_tensorop_gemm_f16_f16_f32_f16_f16_128x256x128_1x1x1_0_tnn_align8_warpspecialized_pingpong_epi_tma,passed,success,universal,4096,5120,4096,f16:row,f16:column,f16:column,f16:column,1,0,serial,1,1,along_m,invalid,invalid,false,false,4,tensorop,f32,128,256,128,1,1,1,0,0,0,2,4,1,1,64,256,16,90,90,117440512,171840634880,1463,4.41723,24.761,38902.3
1,CUTLASS,gemm,cutlass3x_sm90_tensorop_gemm_f16_f16_f32_f16_f16_128x256x128_1x1x1_0_tnn_align8_warpspecialized_pingpong_epi_nosmem,passed,success,universal,4096,5120,4096,f16:row,f16:column,f16:column,f16:column,1,0,serial,1,1,along_m,invalid,invalid,false,false,4,tensorop,f32,128,256,128,1,1,1,0,0,0,2,4,1,1,64,256,16,90,90,117440512,171840634880,1463,4.35341,25.124,39472.6
1,CUTLASS,gemm,cutlass3x_sm90_tensorop_gemm_f16_f16_f32_f16_f16_128x256x128_1x1x1_0_tnn_align8_warpspecialized_cooperative_epi_nosmem,passed,success,universal,4096,5120,4096,f16:row,f16:column,f16:column,f16:column,1,0,serial,1,1,along_n,invalid,invalid,false,false,4,tensorop,f32,128,256,128,1,1,1,0,0,0,2,4,2,1,64,256,16,90,90,117440512,171840634880,1463,0.335036,326.457,512902
1,CUTLASS,gemm,cutlass3x_sm90_tensorop_gemm_f16_f16_f32_f16_f16_128x256x128_1x1x1_0_tnn_align8_warpspecialized_cooperative_epi_tma,passed,success,universal,4096,5120,4096,f16:row,f16:column,f16:column,f16:column,1,0,serial,1,1,along_n,invalid,invalid,false,false,4,tensorop,f32,128,256,128,1,1,1,0,0,0,2,4,2,1,64,256,16,90,90,117440512,171840634880,1463,0.327755,333.71,524296
1,CUTLASS,gemm,cutlass3x_sm90_tensorop_gemm_f16_f16_f32_f16_f16_128x256x128_1x1x1_0_tnn_align8_stream_k_warpspecialized_cooperative_epi_nosmem,passed,success,universal,4096,5120,4096,f16:row,f16:column,f16:column,f16:column,1,0,serial,1,1,along_n,invalid,invalid,false,false,4,tensorop,f32,128,256,128,1,1,1,0,0,0,2,4,2,1,64,256,16,90,90,117440512,171840634880,1463,0.338895,322.74,507062
1,CUTLASS,gemm,cutlass3x_sm90_tensorop_gemm_f16_f16_f32_f16_f16_128x256x128_1x1x1_0_tnn_align8_stream_k_warpspecialized_cooperative_epi_tma,passed,success,universal,4096,5120,4096,f16:row,f16:column,f16:column,f16:column,1,0,serial,1,1,along_n,invalid,invalid,false,false,4,tensorop,f32,128,256,128,1,1,1,0,0,0,2,4,2,1,64,256,16,90,90,117440512,171840634880,1463,0.332608,328.841,516647
1,CUTLASS,gemm,cutlass3x_sm90_tensorop_gemm_f16_f16_f32_f16_f16_128x256x64_1x1x1_0_tnn_align8,passed,success,universal,4096,5120,4096,f16:row,f16:column,f16:column,f16:column,1,0,serial,1,1,along_m,invalid,invalid,false,false,1,tensorop,f32,128,256,64,1,1,1,0,0,0,4,4,2,1,64,256,16,90,90,117440512,171840634880,1463,0.214447,510.032,801318
1,CUTLASS,gemm,cutlass3x_sm90_tensorop_gemm_f16_f16_f32_f16_f16_128x256x64_1x1x1_0_tnn_align8_warpspecialized_epi_nosmem,passed,success,universal,4096,5120,4096,f16:row,f16:column,f16:column,f16:column,1,0,serial,1,1,along_n,invalid,invalid,false,false,4,tensorop,f32,128,256,64,1,1,1,0,0,0,4,4,1,1,64,256,16,90,90,117440512,171840634880,1463,3.82291,28.6104,44950.2
1,CUTLASS,gemm,cutlass3x_sm90_tensorop_gemm_f16_f16_f32_f16_f16_128x256x64_1x1x1_0_tnn_align8_warpspecialized_pingpong_epi_tma,passed,success,universal,4096,5120,4096,f16:row,f16:column,f16:column,f16:column,1,0,serial,1,1,along_m,invalid,invalid,false,false,2,tensorop,f32,128,256,64,1,1,1,0,0,0,4,4,1,1,64,256,16,90,90,117440512,171840634880,1463,4.38051,24.9685,39228.4
1,CUTLASS,gemm,cutlass3x_sm90_tensorop_gemm_f16_f16_f32_f16_f16_128x256x64_1x1x1_0_tnn_align8_warpspecialized_pingpong_epi_nosmem,passed,success,universal,4096,5120,4096,f16:row,f16:column,f16:column,f16:column,1,0,serial,1,1,along_m,invalid,invalid,false,false,2,tensorop,f32,128,256,64,1,1,1,0,0,0,4,4,1,1,64,256,16,90,90,117440512,171840634880,1463,4.26713,25.632,40270.8
1,CUTLASS,gemm,cutlass3x_sm90_tensorop_gemm_f16_f16_f32_f16_f16_128x256x64_1x1x1_0_tnn_align8_warpspecialized_cooperative_epi_nosmem,passed,success,universal,4096,5120,4096,f16:row,f16:column,f16:column,f16:column,1,0,serial,1,1,along_m,invalid,invalid,false,false,1,tensorop,f32,128,256,64,1,1,1,0,0,0,4,4,2,1,64,256,16,90,90,117440512,171840634880,1463,0.213897,511.345,803382
1,CUTLASS,gemm,cutlass3x_sm90_tensorop_gemm_f16_f16_f32_f16_f16_128x256x64_1x1x1_0_tnn_align8_warpspecialized_cooperative_epi_tma,passed,success,universal,4096,5120,4096,f16:row,f16:column,f16:column,f16:column,1,0,serial,1,1,along_m,invalid,invalid,false,false,2,tensorop,f32,128,256,64,1,1,1,0,0,0,4,4,2,1,64,256,16,90,90,117440512,171840634880,1463,0.201916,541.685,851049
1,CUTLASS,gemm,cutlass3x_sm90_tensorop_gemm_f16_f16_f32_f16_f16_128x256x64_1x1x1_0_tnn_align8_stream_k_warpspecialized_cooperative_epi_nosmem,passed,success,universal,4096,5120,4096,f16:row,f16:column,f16:column,f16:column,1,0,serial,1,1,along_m,invalid,invalid,false,false,1,tensorop,f32,128,256,64,1,1,1,0,0,0,4,4,2,1,64,256,16,90,90,117440512,171840634880,1463,0.228104,479.496,753343
1,CUTLASS,gemm,cutlass3x_sm90_tensorop_gemm_f16_f16_f32_f16_f16_128x256x64_1x1x1_0_tnn_align8_stream_k_warpspecialized_cooperative_epi_tma,passed,success,universal,4096,5120,4096,f16:row,f16:column,f16:column,f16:column,1,0,serial,1,1,along_m,invalid,invalid,false,false,1,tensorop,f32,128,256,64,1,1,1,0,0,0,4,4,2,1,64,256,16,90,90,117440512,171840634880,1463,0.203556,537.321,844193
1,CUTLASS,gemm,cutlass3x_sm90_tensorop_gemm_f16_f16_f32_f16_f16_128x32x128_8x1x1_0_tnn_align8,passed,success,universal,4096,5120,4096,f16:row,f16:column,f16:column,f16:column,1,0,serial,1,1,along_n,invalid,invalid,false,false,1,tensorop,f32,128,32,128,1,1,1,0,0,0,5,4,2,1,64,32,16,90,90,117440512,171840634880,1463,0.726692,150.511,236470
1,CUTLASS,gemm,cutlass3x_sm90_tensorop_gemm_f16_f16_f32_f16_f16_128x32x128_8x1x1_0_tnn_align8_warpspecialized_epi_nosmem,passed,success,universal,4096,5120,4096,f16:row,f16:column,f16:column,f16:column,1,0,serial,1,1,along_n,invalid,invalid,false,false,2,tensorop,f32,128,32,128,1,1,1,0,0,0,5,4,1,1,64,32,16,90,90,117440512,171840634880,1463,0.839128,130.344,204785
1,CUTLASS,gemm,cutlass3x_sm90_tensorop_gemm_f16_f16_f32_f16_f16_128x32x128_8x1x1_0_tnn_align8_warpspecialized_pingpong_epi_tma,passed,success,universal,4096,5120,4096,f16:row,f16:column,f16:column,f16:column,1,0,serial,1,1,along_n,invalid,invalid,false,false,1,tensorop,f32,128,32,128,1,1,1,0,0,0,5,4,1,1,64,32,16,90,90,117440512,171840634880,1463,0.728174,150.204,235988
1,CUTLASS,gemm,cutlass3x_sm90_tensorop_gemm_f16_f16_f32_f16_f16_128x32x128_8x1x1_0_tnn_align8_warpspecialized_pingpong_epi_nosmem,passed,success,universal,4096,5120,4096,f16:row,f16:column,f16:column,f16:column,1,0,serial,1,1,along_n,invalid,invalid,false,false,1,tensorop,f32,128,32,128,1,1,1,0,0,0,5,4,1,1,64,32,16,90,90,117440512,171840634880,1463,0.734125,148.987,234075
1,CUTLASS,gemm,cutlass3x_sm90_tensorop_gemm_f16_f16_f32_f16_f16_128x32x128_8x1x1_0_tnn_align8_warpspecialized_cooperative_epi_nosmem,passed,success,universal,4096,5120,4096,f16:row,f16:column,f16:column,f16:column,1,0,serial,1,1,along_n,invalid,invalid,false,false,1,tensorop,f32,128,32,128,1,1,1,0,0,0,5,4,2,1,64,32,16,90,90,117440512,171840634880,1463,0.73196,149.428,234768
1,CUTLASS,gemm,cutlass3x_sm90_tensorop_gemm_f16_f16_f32_f16_f16_128x32x128_8x1x1_0_tnn_align8_warpspecialized_cooperative_epi_tma,passed,success,universal,4096,5120,4096,f16:row,f16:column,f16:column,f16:column,1,0,serial,1,1,along_n,invalid,invalid,false,false,1,tensorop,f32,128,32,128,1,1,1,0,0,0,5,4,2,1,64,32,16,90,90,117440512,171840634880,1463,0.724617,150.942,237147
1,CUTLASS,gemm,cutlass3x_sm90_tensorop_gemm_f16_f16_f32_f16_f16_128x32x128_8x1x1_0_tnn_align8_stream_k_warpspecialized_cooperative_epi_nosmem,passed,success,universal,4096,5120,4096,f16:row,f16:column,f16:column,f16:column,1,0,serial,1,1,along_n,invalid,invalid,false,false,1,tensorop,f32,128,32,128,1,1,1,0,0,0,5,4,2,1,64,32,16,90,90,117440512,171840634880,1463,0.73523,148.763,233724
1,CUTLASS,gemm,cutlass3x_sm90_tensorop_gemm_f16_f16_f32_f16_f16_128x32x128_8x1x1_0_tnn_align8_stream_k_warpspecialized_cooperative_epi_tma,passed,success,universal,4096,5120,4096,f16:row,f16:column,f16:column,f16:column,1,0,serial,1,1,along_n,invalid,invalid,false,false,1,tensorop,f32,128,32,128,1,1,1,0,0,0,5,4,2,1,64,32,16,90,90,117440512,171840634880,1463,0.731473,149.527,234924
1,CUTLASS,gemm,cutlass3x_sm90_tensorop_gemm_f16_f16_f32_f16_f16_128x256x128_1x4x1_0_tnn_align8,passed,success,universal,4096,5120,4096,f16:row,f16:column,f16:column,f16:column,1,0,serial,1,1,along_m,invalid,invalid,false,false,1,tensorop,f32,128,256,128,1,1,1,0,0,0,2,4,2,1,64,256,16,90,90,117440512,171840634880,1463,0.356775,306.566,481650
1,CUTLASS,gemm,cutlass3x_sm90_tensorop_gemm_f16_f16_f32_f16_f16_128x256x128_1x4x1_0_tnn_align8_warpspecialized_epi_nosmem,passed,success,universal,4096,5120,4096,f16:row,f16:column,f16:column,f16:column,1,0,serial,1,1,along_m,invalid,invalid,false,false,2,tensorop,f32,128,256,128,1,1,1,0,0,0,2,4,1,1,64,256,16,90,90,117440512,171840634880,1463,4.35845,25.0949,39427
1,CUTLASS,gemm,cutlass3x_sm90_tensorop_gemm_f16_f16_f32_f16_f16_128x256x128_1x4x1_0_tnn_align8_warpspecialized_pingpong_epi_tma,passed,success,universal,4096,5120,4096,f16:row,f16:column,f16:column,f16:column,1,0,serial,1,1,along_n,invalid,invalid,false,false,1,tensorop,f32,128,256,128,1,1,1,0,0,0,2,4,1,1,64,256,16,90,90,117440512,171840634880,1463,5.27037,20.7528,32605.1
1,CUTLASS,gemm,cutlass3x_sm90_tensorop_gemm_f16_f16_f32_f16_f16_128x256x128_1x4x1_0_tnn_align8_warpspecialized_pingpong_epi_nosmem,passed,success,universal,4096,5120,4096,f16:row,f16:column,f16:column,f16:column,1,0,serial,1,1,along_n,invalid,invalid,false,false,1,tensorop,f32,128,256,128,1,1,1,0,0,0,2,4,1,1,64,256,16,90,90,117440512,171840634880,1463,4.99316,21.905,34415.2
1,CUTLASS,gemm,cutlass3x_sm90_tensorop_gemm_f16_f16_f32_f16_f16_128x256x128_1x4x1_0_tnn_align8_warpspecialized_cooperative_epi_nosmem,passed,success,universal,4096,5120,4096,f16:row,f16:column,f16:column,f16:column,1,0,serial,1,1,along_m,invalid,invalid,false,false,1,tensorop,f32,128,256,128,1,1,1,0,0,0,2,4,2,1,64,256,16,90,90,117440512,171840634880,1463,0.357006,306.367,481338
1,CUTLASS,gemm,cutlass3x_sm90_tensorop_gemm_f16_f16_f32_f16_f16_128x256x128_1x4x1_0_tnn_align8_warpspecialized_cooperative_epi_tma,passed,success,universal,4096,5120,4096,f16:row,f16:column,f16:column,f16:column,1,0,serial,1,1,along_m,invalid,invalid,false,false,1,tensorop,f32,128,256,128,1,1,1,0,0,0,2,4,2,1,64,256,16,90,90,117440512,171840634880,1463,0.349241,313.179,492040
1,CUTLASS,gemm,cutlass3x_sm90_tensorop_gemm_f16_f16_f32_f16_f16_128x256x128_1x4x1_0_tnn_align8_stream_k_warpspecialized_cooperative_epi_nosmem,passed,success,universal,4096,5120,4096,f16:row,f16:column,f16:column,f16:column,1,0,serial,1,1,along_m,invalid,invalid,false,false,1,tensorop,f32,128,256,128,1,1,1,0,0,0,2,4,2,1,64,256,16,90,90,117440512,171840634880,1463,0.336726,324.819,510328
1,CUTLASS,gemm,cutlass3x_sm90_tensorop_gemm_f16_f16_f32_f16_f16_128x256x128_1x4x1_0_tnn_align8_stream_k_warpspecialized_cooperative_epi_tma,passed,success,universal,4096,5120,4096,f16:row,f16:column,f16:column,f16:column,1,0,serial,1,1,along_m,invalid,invalid,false,false,1,tensorop,f32,128,256,128,1,1,1,0,0,0,2,4,2,1,64,256,16,90,90,117440512,171840634880,1463,0.318328,343.592,539823
1,CUTLASS,gemm,cutlass3x_sm90_tensorop_gemm_f16_f16_f32_f16_f16_128x32x128_4x4x1_0_tnn_align8,passed,success,universal,4096,5120,4096,f16:row,f16:column,f16:column,f16:column,1,0,serial,1,1,along_n,invalid,invalid,false,false,4,tensorop,f32,128,32,128,1,1,1,0,0,0,5,4,2,1,64,32,16,90,90,117440512,171840634880,1463,0.432962,252.621,396896
1,CUTLASS,gemm,cutlass3x_sm90_tensorop_gemm_f16_f16_f32_f16_f16_128x32x128_4x4x1_0_tnn_align8_warpspecialized_epi_nosmem,passed,success,universal,4096,5120,4096,f16:row,f16:column,f16:column,f16:column,1,0,serial,1,1,along_n,invalid,invalid,false,false,1,tensorop,f32,128,32,128,1,1,1,0,0,0,5,4,1,1,64,32,16,90,90,117440512,171840634880,1463,0.52082,210.005,329943
1,CUTLASS,gemm,cutlass3x_sm90_tensorop_gemm_f16_f16_f32_f16_f16_128x32x128_4x4x1_0_tnn_align8_warpspecialized_pingpong_epi_tma,passed,success,universal,4096,5120,4096,f16:row,f16:column,f16:column,f16:column,1,0,serial,1,1,along_n,invalid,invalid,false,false,4,tensorop,f32,128,32,128,1,1,1,0,0,0,5,4,1,1,64,32,16,90,90,117440512,171840634880,1463,0.417596,261.916,411500
1,CUTLASS,gemm,cutlass3x_sm90_tensorop_gemm_f16_f16_f32_f16_f16_128x32x128_4x4x1_0_tnn_align8_warpspecialized_pingpong_epi_nosmem,passed,success,universal,4096,5120,4096,f16:row,f16:column,f16:column,f16:column,1,0,serial,1,1,along_n,invalid,invalid,false,false,4,tensorop,f32,128,32,128,1,1,1,0,0,0,5,4,1,1,64,32,16,90,90,117440512,171840634880,1463,0.418368,261.433,410740
1,CUTLASS,gemm,cutlass3x_sm90_tensorop_gemm_f16_f16_f32_f16_f16_128x32x128_4x4x1_0_tnn_align8_warpspecialized_cooperative_epi_nosmem,passed,success,universal,4096,5120,4096,f16:row,f16:column,f16:column,f16:column,1,0,serial,1,1,along_n,invalid,invalid,false,false,4,tensorop,f32,128,32,128,1,1,1,0,0,0,5,4,2,1,64,32,16,90,90,117440512,171840634880,1463,0.433942,252.05,395999
1,CUTLASS,gemm,cutlass3x_sm90_tensorop_gemm_f16_f16_f32_f16_f16_128x32x128_4x4x1_0_tnn_align8_warpspecialized_cooperative_epi_tma,passed,success,universal,4096,5120,4096,f16:row,f16:column,f16:column,f16:column,1,0,serial,1,1,along_n,invalid,invalid,false,false,4,tensorop,f32,128,32,128,1,1,1,0,0,0,5,4,2,1,64,32,16,90,90,117440512,171840634880,1463,0.441973,247.47,388803
1,CUTLASS,gemm,cutlass3x_sm90_tensorop_gemm_f16_f16_f32_f16_f16_128x32x128_4x4x1_0_tnn_align8_stream_k_warpspecialized_cooperative_epi_nosmem,passed,success,universal,4096,5120,4096,f16:row,f16:column,f16:column,f16:column,1,0,serial,1,1,along_n,invalid,invalid,false,false,4,tensorop,f32,128,32,128,1,1,1,0,0,0,5,4,2,1,64,32,16,90,90,117440512,171840634880,1463,0.451289,242.361,380777
1,CUTLASS,gemm,cutlass3x_sm90_tensorop_gemm_f16_f16_f32_f16_f16_128x32x128_4x4x1_0_tnn_align8_stream_k_warpspecialized_cooperative_epi_tma,passed,success,universal,4096,5120,4096,f16:row,f16:column,f16:column,f16:column,1,0,serial,1,1,along_n,invalid,invalid,false,false,4,tensorop,f32,128,32,128,1,1,1,0,0,0,5,4,2,1,64,32,16,90,90,117440512,171840634880,1463,0.45351,241.174,378912
1,CUTLASS,gemm,cutlass3x_sm90_tensorop_gemm_f16_f16_f32_f16_f16_128x256x64_2x1x1_0_tnn_align8,passed,success,universal,4096,5120,4096,f16:row,f16:column,f16:column,f16:column,1,0,serial,1,1,along_n,invalid,invalid,false,false,1,tensorop,f32,128,256,64,1,1,1,0,0,0,4,4,2,1,64,256,16,90,90,117440512,171840634880,1463,0.21217,515.507,809920
1,CUTLASS,gemm,cutlass3x_sm90_tensorop_gemm_f16_f16_f32_f16_f16_128x256x64_2x1x1_0_tnn_align8_warpspecialized_epi_nosmem,passed,success,universal,4096,5120,4096,f16:row,f16:column,f16:column,f16:column,1,0,serial,1,1,along_n,invalid,invalid,false,false,8,tensorop,f32,128,256,64,1,1,1,0,0,0,4,4,1,1,64,256,16,90,90,117440512,171840634880,1463,3.8119,28.693,45080.1
1,CUTLASS,gemm,cutlass3x_sm90_tensorop_gemm_f16_f16_f32_f16_f16_128x256x64_2x1x1_0_tnn_align8_warpspecialized_pingpong_epi_tma,passed,success,universal,4096,5120,4096,f16:row,f16:column,f16:column,f16:column,1,0,serial,1,1,along_n,invalid,invalid,false,false,4,tensorop,f32,128,256,64,1,1,1,0,0,0,4,4,1,1,64,256,16,90,90,117440512,171840634880,1463,4.42907,24.6948,38798.4
1,CUTLASS,gemm,cutlass3x_sm90_tensorop_gemm_f16_f16_f32_f16_f16_128x256x64_2x1x1_0_tnn_align8_warpspecialized_pingpong_epi_nosmem,passed,success,universal,4096,5120,4096,f16:row,f16:column,f16:column,f16:column,1,0,serial,1,1,along_m,invalid,invalid,false,false,4,tensorop,f32,128,256,64,1,1,1,0,0,0,4,4,1,1,64,256,16,90,90,117440512,171840634880,1463,4.24748,25.7506,40457.1
1,CUTLASS,gemm,cutlass3x_sm90_tensorop_gemm_f16_f16_f32_f16_f16_128x256x64_2x1x1_0_tnn_align8_warpspecialized_cooperative_epi_nosmem,passed,success,universal,4096,5120,4096,f16:row,f16:column,f16:column,f16:column,1,0,serial,1,1,along_n,invalid,invalid,false,false,1,tensorop,f32,128,256,64,1,1,1,0,0,0,4,4,2,1,64,256,16,90,90,117440512,171840634880,1463,0.212564,514.552,808420
1,CUTLASS,gemm,cutlass3x_sm90_tensorop_gemm_f16_f16_f32_f16_f16_128x256x64_2x1x1_0_tnn_align8_warpspecialized_cooperative_epi_tma,passed,success,universal,4096,5120,4096,f16:row,f16:column,f16:column,f16:column,1,0,serial,1,1,along_n,invalid,invalid,false,false,4,tensorop,f32,128,256,64,1,1,1,0,0,0,4,4,2,1,64,256,16,90,90,117440512,171840634880,1463,0.202047,541.334,850498
1,CUTLASS,gemm,cutlass3x_sm90_tensorop_gemm_f16_f16_f32_f16_f16_128x256x64_2x1x1_0_tnn_align8_stream_k_warpspecialized_cooperative_epi_nosmem,passed,success,universal,4096,5120,4096,f16:row,f16:column,f16:column,f16:column,1,0,serial,1,1,along_m,invalid,invalid,false,false,1,tensorop,f32,128,256,64,1,1,1,0,0,0,4,4,2,1,64,256,16,90,90,117440512,171840634880,1463,0.215581,507.35,797105
1,CUTLASS,gemm,cutlass3x_sm90_tensorop_gemm_f16_f16_f32_f16_f16_128x256x64_2x1x1_0_tnn_align8_stream_k_warpspecialized_cooperative_epi_tma,passed,success,universal,4096,5120,4096,f16:row,f16:column,f16:column,f16:column,1,0,serial,1,1,along_n,invalid,invalid,false,false,1,tensorop,f32,128,256,64,1,1,1,0,0,0,4,4,2,1,64,256,16,90,90,117440512,171840634880,1463,0.204634,534.49,839745
1,CUTLASS,gemm,cutlass3x_sm90_tensorop_gemm_f16_f16_f32_f16_f16_128x256x64_2x2x1_0_tnn_align8,passed,success,universal,4096,5120,4096,f16:row,f16:column,f16:column,f16:column,1,0,serial,1,1,along_m,invalid,invalid,false,false,2,tensorop,f32,128,256,64,1,1,1,0,0,0,4,4,2,1,64,256,16,90,90,117440512,171840634880,1463,0.255394,428.259,672845
1,CUTLASS,gemm,cutlass3x_sm90_tensorop_gemm_f16_f16_f32_f16_f16_128x256x64_2x2x1_0_tnn_align8_warpspecialized_epi_nosmem,passed,success,universal,4096,5120,4096,f16:row,f16:column,f16:column,f16:column,1,0,serial,1,1,along_m,invalid,invalid,false,false,4,tensorop,f32,128,256,64,1,1,1,0,0,0,4,4,1,1,64,256,16,90,90,117440512,171840634880,1463,4.16022,26.2907,41305.7
1,CUTLASS,gemm,cutlass3x_sm90_tensorop_gemm_f16_f16_f32_f16_f16_128x256x64_2x2x1_0_tnn_align8_warpspecialized_pingpong_epi_tma,passed,success,universal,4096,5120,4096,f16:row,f16:column,f16:column,f16:column,1,0,serial,1,1,along_m,invalid,invalid,false,false,2,tensorop,f32,128,256,64,1,1,1,0,0,0,4,4,1,1,64,256,16,90,90,117440512,171840634880,1463,5.06239,21.6054,33944.6
1,CUTLASS,gemm,cutlass3x_sm90_tensorop_gemm_f16_f16_f32_f16_f16_128x256x64_2x2x1_0_tnn_align8_warpspecialized_pingpong_epi_nosmem,passed,success,universal,4096,5120,4096,f16:row,f16:column,f16:column,f16:column,1,0,serial,1,1,along_m,invalid,invalid,false,false,2,tensorop,f32,128,256,64,1,1,1,0,0,0,4,4,1,1,64,256,16,90,90,117440512,171840634880,1463,4.79585,22.8062,35831.1
1,CUTLASS,gemm,cutlass3x_sm90_tensorop_gemm_f16_f16_f32_f16_f16_128x256x64_2x2x1_0_tnn_align8_warpspecialized_cooperative_epi_nosmem,passed,success,universal,4096,5120,4096,f16:row,f16:column,f16:column,f16:column,1,0,serial,1,1,along_m,invalid,invalid,false,false,2,tensorop,f32,128,256,64,1,1,1,0,0,0,4,4,2,1,64,256,16,90,90,117440512,171840634880,1463,0.254123,430.403,676212
1,CUTLASS,gemm,cutlass3x_sm90_tensorop_gemm_f16_f16_f32_f16_f16_128x256x64_2x2x1_0_tnn_align8_warpspecialized_cooperative_epi_tma,passed,success,universal,4096,5120,4096,f16:row,f16:column,f16:column,f16:column,1,0,serial,1,1,along_n,invalid,invalid,false,false,2,tensorop,f32,128,256,64,1,1,1,0,0,0,4,4,2,1,64,256,16,90,90,117440512,171840634880,1463,0.240991,453.854,713057
1,CUTLASS,gemm,cutlass3x_sm90_tensorop_gemm_f16_f16_f32_f16_f16_128x256x64_2x2x1_0_tnn_align8_stream_k_warpspecialized_cooperative_epi_nosmem,passed,success,universal,4096,5120,4096,f16:row,f16:column,f16:column,f16:column,1,0,serial,1,1,along_n,invalid,invalid,false,false,1,tensorop,f32,128,256,64,1,1,1,0,0,0,4,4,2,1,64,256,16,90,90,117440512,171840634880,1463,0.23576,463.926,728881
1,CUTLASS,gemm,cutlass3x_sm90_tensorop_gemm_f16_f16_f32_f16_f16_128x256x64_2x2x1_0_tnn_align8_stream_k_warpspecialized_cooperative_epi_tma,passed,success,universal,4096,5120,4096,f16:row,f16:column,f16:column,f16:column,1,0,serial,1,1,along_n,invalid,invalid,false,false,1,tensorop,f32,128,256,64,1,1,1,0,0,0,4,4,2,1,64,256,16,90,90,117440512,171840634880,1463,0.227337,481.113,755884
1,CUTLASS,gemm,cutlass3x_sm90_tensorop_gemm_f16_f16_f32_f16_f16_128x256x64_1x4x1_0_tnn_align8,passed,success,universal,4096,5120,4096,f16:row,f16:column,f16:column,f16:column,1,0,serial,1,1,along_n,invalid,invalid,false,false,1,tensorop,f32,128,256,64,1,1,1,0,0,0,4,4,2,1,64,256,16,90,90,117440512,171840634880,1463,0.254414,429.909,675436
1,CUTLASS,gemm,cutlass3x_sm90_tensorop_gemm_f16_f16_f32_f16_f16_128x256x64_1x4x1_0_tnn_align8_warpspecialized_epi_nosmem,passed,success,universal,4096,5120,4096,f16:row,f16:column,f16:column,f16:column,1,0,serial,1,1,along_m,invalid,invalid,false,false,2,tensorop,f32,128,256,64,1,1,1,0,0,0,4,4,1,1,64,256,16,90,90,117440512,171840634880,1463,4.15801,26.3047,41327.7
1,CUTLASS,gemm,cutlass3x_sm90_tensorop_gemm_f16_f16_f32_f16_f16_128x256x64_1x4x1_0_tnn_align8_warpspecialized_pingpong_epi_tma,passed,success,universal,4096,5120,4096,f16:row,f16:column,f16:column,f16:column,1,0,serial,1,1,along_m,invalid,invalid,false,false,1,tensorop,f32,128,256,64,1,1,1,0,0,0,4,4,1,1,64,256,16,90,90,117440512,171840634880,1463,5.05815,21.6235,33973
1,CUTLASS,gemm,cutlass3x_sm90_tensorop_gemm_f16_f16_f32_f16_f16_128x256x64_1x4x1_0_tnn_align8_warpspecialized_pingpong_epi_nosmem,passed,success,universal,4096,5120,4096,f16:row,f16:column,f16:column,f16:column,1,0,serial,1,1,along_m,invalid,invalid,false,false,1,tensorop,f32,128,256,64,1,1,1,0,0,0,4,4,1,1,64,256,16,90,90,117440512,171840634880,1463,4.77604,22.9008,35979.7
1,CUTLASS,gemm,cutlass3x_sm90_tensorop_gemm_f16_f16_f32_f16_f16_128x256x64_1x4x1_0_tnn_align8_warpspecialized_cooperative_epi_nosmem,passed,success,universal,4096,5120,4096,f16:row,f16:column,f16:column,f16:column,1,0,serial,1,1,along_n,invalid,invalid,false,false,1,tensorop,f32,128,256,64,1,1,1,0,0,0,4,4,2,1,64,256,16,90,90,117440512,171840634880,1463,0.2542,430.271,676006
1,CUTLASS,gemm,cutlass3x_sm90_tensorop_gemm_f16_f16_f32_f16_f16_128x256x64_1x4x1_0_tnn_align8_warpspecialized_cooperative_epi_tma,passed,success,universal,4096,5120,4096,f16:row,f16:column,f16:column,f16:column,1,0,serial,1,1,along_m,invalid,invalid,false,false,1,tensorop,f32,128,256,64,1,1,1,0,0,0,4,4,2,1,64,256,16,90,90,117440512,171840634880,1463,0.24212,451.739,709733
1,CUTLASS,gemm,cutlass3x_sm90_tensorop_gemm_f16_f16_f32_f16_f16_128x256x64_1x4x1_0_tnn_align8_stream_k_warpspecialized_cooperative_epi_nosmem,passed,success,universal,4096,5120,4096,f16:row,f16:column,f16:column,f16:column,1,0,serial,1,1,along_m,invalid,invalid,false,false,1,tensorop,f32,128,256,64,1,1,1,0,0,0,4,4,2,1,64,256,16,90,90,117440512,171840634880,1463,0.238877,457.871,719368
