profiler_out/4096x5120x4096.log



=============================
  Problem ID: 1

        Provider: [1;37mCUTLASS[0m
   OperationKind: [1;37mgemm[0m
       Operation: cutlass3x_sm90_tensorop_gemm_f16_f16_f32_f16_f16_64x16x128_1x4x1_0_tnn_align8

          Status: [1;37mSuccess[0m
    Verification: [1;37mON[0m
     Disposition: [1;32mPassed[0m

reference_device: Passed
          cuBLAS: Not run
           cuDNN: Not run

       Arguments: --gemm_kind=universal --m=4096 --n=5120 --k=4096 --A=f16:row --B=f16:column --C=f16:column --D=f16:column  \
                  --alpha=1 --beta=0 --split_k_mode=serial --split_k_slices=1 --batch_count=1 --raster_order=along_m  \
                  --runtime_input_datatype_a=invalid --runtime_input_datatype_b=invalid --use_pdl=false --enable_sm90_mixed_dtype_shuffle_test=false  \
                  --swizzle_size=2 --op_class=tensorop --accum=f32 --cta_m=64 --cta_n=16 --cta_k=128 --cluster_m=1 --cluster_n=1  \
                  --cluster_k=1 --cluster_m_fallback=0 --cluster_n_fallback=0 --cluster_k_fallback=0 --stages=11 --warps_m=4  \
                  --warps_n=1 --warps_k=1 --inst_m=64 --inst_n=16 --inst_k=16 --min_cc=90 --max_cc=90

           Bytes: 117440512  bytes
           FLOPs: 171840634880  flops
           FLOPs/Byte: 1463

         Runtime: 0.770533  ms
          Memory: 141.947 GiB/s

            Math: 223015 GFLOP/s



=============================
  Problem ID: 1

        Provider: [1;37mCUTLASS[0m
   OperationKind: [1;37mgemm[0m
       Operation: cutlass3x_sm90_tensorop_gemm_f16_f16_f32_f16_f16_64x16x128_1x4x1_0_tnn_align8_warpspecialized_epi_nosmem

          Status: [1;37mSuccess[0m
    Verification: [1;37mON[0m
     Disposition: [1;32mPassed[0m

reference_device: Passed
          cuBLAS: Not run
           cuDNN: Not run

       Arguments: --gemm_kind=universal --m=4096 --n=5120 --k=4096 --A=f16:row --B=f16:column --C=f16:column --D=f16:column  \
                  --alpha=1 --beta=0 --split_k_mode=serial --split_k_slices=1 --batch_count=1 --raster_order=along_n  \
                  --runtime_input_datatype_a=invalid --runtime_input_datatype_b=invalid --use_pdl=false --enable_sm90_mixed_dtype_shuffle_test=false  \
                  --swizzle_size=2 --op_class=tensorop --accum=f32 --cta_m=64 --cta_n=16 --cta_k=128 --cluster_m=1 --cluster_n=1  \
                  --cluster_k=1 --cluster_m_fallback=0 --cluster_n_fallback=0 --cluster_k_fallback=0 --stages=11 --warps_m=4  \
                  --warps_n=1 --warps_k=1 --inst_m=64 --inst_n=16 --inst_k=16 --min_cc=90 --max_cc=90

           Bytes: 117440512  bytes
           FLOPs: 171840634880  flops
           FLOPs/Byte: 1463

         Runtime: 1.07621  ms
          Memory: 101.63 GiB/s

            Math: 159672 GFLOP/s



=============================
  Problem ID: 1

        Provider: [1;37mCUTLASS[0m
   OperationKind: [1;37mgemm[0m
       Operation: cutlass3x_sm90_tensorop_gemm_f16_f16_f32_f16_f16_64x16x128_1x4x1_0_tnn_align8_warpspecialized_pingpong_epi_tma

          Status: [1;37mSuccess[0m
    Verification: [1;37mON[0m
     Disposition: [1;32mPassed[0m

reference_device: Passed
          cuBLAS: Not run
           cuDNN: Not run

       Arguments: --gemm_kind=universal --m=4096 --n=5120 --k=4096 --A=f16:row --B=f16:column --C=f16:column --D=f16:column  \
                  --alpha=1 --beta=0 --split_k_mode=serial --split_k_slices=1 --batch_count=1 --raster_order=along_m  \
                  --runtime_input_datatype_a=invalid --runtime_input_datatype_b=invalid --use_pdl=false --enable_sm90_mixed_dtype_shuffle_test=false  \
                  --swizzle_size=2 --op_class=tensorop --accum=f32 --cta_m=64 --cta_n=16 --cta_k=128 --cluster_m=1 --cluster_n=1  \
                  --cluster_k=1 --cluster_m_fallback=0 --cluster_n_fallback=0 --cluster_k_fallback=0 --stages=11 --warps_m=4  \
                  --warps_n=1 --warps_k=1 --inst_m=64 --inst_n=16 --inst_k=16 --min_cc=90 --max_cc=90

           Bytes: 117440512  bytes
           FLOPs: 171840634880  flops
           FLOPs/Byte: 1463

         Runtime: 0.772116  ms
          Memory: 141.656 GiB/s

            Math: 222558 GFLOP/s



=============================
  Problem ID: 1

        Provider: [1;37mCUTLASS[0m
   OperationKind: [1;37mgemm[0m
       Operation: cutlass3x_sm90_tensorop_gemm_f16_f16_f32_f16_f16_64x16x128_1x4x1_0_tnn_align8_warpspecialized_pingpong_epi_nosmem

          Status: [1;37mSuccess[0m
    Verification: [1;37mON[0m
     Disposition: [1;32mPassed[0m

reference_device: Passed
          cuBLAS: Not run
           cuDNN: Not run

       Arguments: --gemm_kind=universal --m=4096 --n=5120 --k=4096 --A=f16:row --B=f16:column --C=f16:column --D=f16:column  \
                  --alpha=1 --beta=0 --split_k_mode=serial --split_k_slices=1 --batch_count=1 --raster_order=along_m  \
                  --runtime_input_datatype_a=invalid --runtime_input_datatype_b=invalid --use_pdl=false --enable_sm90_mixed_dtype_shuffle_test=false  \
                  --swizzle_size=2 --op_class=tensorop --accum=f32 --cta_m=64 --cta_n=16 --cta_k=128 --cluster_m=1 --cluster_n=1  \
                  --cluster_k=1 --cluster_m_fallback=0 --cluster_n_fallback=0 --cluster_k_fallback=0 --stages=11 --warps_m=4  \
                  --warps_n=1 --warps_k=1 --inst_m=64 --inst_n=16 --inst_k=16 --min_cc=90 --max_cc=90

           Bytes: 117440512  bytes
           FLOPs: 171840634880  flops
           FLOPs/Byte: 1463

         Runtime: 0.771724  ms
          Memory: 141.728 GiB/s

            Math: 222671 GFLOP/s



=============================
  Problem ID: 1

        Provider: [1;37mCUTLASS[0m
   OperationKind: [1;37mgemm[0m
       Operation: cutlass3x_sm90_tensorop_gemm_f16_f16_f32_f16_f16_64x16x128_4x1x1_0_tnn_align8

          Status: [1;37mSuccess[0m
    Verification: [1;37mON[0m
     Disposition: [1;32mPassed[0m

reference_device: Passed
          cuBLAS: Not run
           cuDNN: Not run

       Arguments: --gemm_kind=universal --m=4096 --n=5120 --k=4096 --A=f16:row --B=f16:column --C=f16:column --D=f16:column  \
                  --alpha=1 --beta=0 --split_k_mode=serial --split_k_slices=1 --batch_count=1 --raster_order=along_n  \
                  --runtime_input_datatype_a=invalid --runtime_input_datatype_b=invalid --use_pdl=false --enable_sm90_mixed_dtype_shuffle_test=false  \
                  --swizzle_size=1 --op_class=tensorop --accum=f32 --cta_m=64 --cta_n=16 --cta_k=128 --cluster_m=1 --cluster_n=1  \
                  --cluster_k=1 --cluster_m_fallback=0 --cluster_n_fallback=0 --cluster_k_fallback=0 --stages=11 --warps_m=4  \
                  --warps_n=1 --warps_k=1 --inst_m=64 --inst_n=16 --inst_k=16 --min_cc=90 --max_cc=90

           Bytes: 117440512  bytes
           FLOPs: 171840634880  flops
           FLOPs/Byte: 1463

         Runtime: 1.41018  ms
          Memory: 77.5608 GiB/s

            Math: 121857 GFLOP/s



=============================
  Problem ID: 1

        Provider: [1;37mCUTLASS[0m
   OperationKind: [1;37mgemm[0m
       Operation: cutlass3x_sm90_tensorop_gemm_f16_f16_f32_f16_f16_64x16x128_4x1x1_0_tnn_align8_warpspecialized_epi_nosmem

          Status: [1;37mSuccess[0m
    Verification: [1;37mON[0m
     Disposition: [1;32mPassed[0m

reference_device: Passed
          cuBLAS: Not run
           cuDNN: Not run

       Arguments: --gemm_kind=universal --m=4096 --n=5120 --k=4096 --A=f16:row --B=f16:column --C=f16:column --D=f16:column  \
                  --alpha=1 --beta=0 --split_k_mode=serial --split_k_slices=1 --batch_count=1 --raster_order=along_n  \
                  --runtime_input_datatype_a=invalid --runtime_input_datatype_b=invalid --use_pdl=false --enable_sm90_mixed_dtype_shuffle_test=false  \
                  --swizzle_size=1 --op_class=tensorop --accum=f32 --cta_m=64 --cta_n=16 --cta_k=128 --cluster_m=1 --cluster_n=1  \
                  --cluster_k=1 --cluster_m_fallback=0 --cluster_n_fallback=0 --cluster_k_fallback=0 --stages=11 --warps_m=4  \
                  --warps_n=1 --warps_k=1 --inst_m=64 --inst_n=16 --inst_k=16 --min_cc=90 --max_cc=90

           Bytes: 117440512  bytes
           FLOPs: 171840634880  flops
           FLOPs/Byte: 1463

         Runtime: 1.75139  ms
          Memory: 62.4505 GiB/s

            Math: 98116.9 GFLOP/s



=============================
  Problem ID: 1

        Provider: [1;37mCUTLASS[0m
   OperationKind: [1;37mgemm[0m
       Operation: cutlass3x_sm90_tensorop_gemm_f16_f16_f32_f16_f16_64x16x128_4x1x1_0_tnn_align8_warpspecialized_pingpong_epi_tma

          Status: [1;37mSuccess[0m
    Verification: [1;37mON[0m
     Disposition: [1;32mPassed[0m

reference_device: Passed
          cuBLAS: Not run
           cuDNN: Not run

       Arguments: --gemm_kind=universal --m=4096 --n=5120 --k=4096 --A=f16:row --B=f16:column --C=f16:column --D=f16:column  \
                  --alpha=1 --beta=0 --split_k_mode=serial --split_k_slices=1 --batch_count=1 --raster_order=along_n  \
                  --runtime_input_datatype_a=invalid --runtime_input_datatype_b=invalid --use_pdl=false --enable_sm90_mixed_dtype_shuffle_test=false  \
                  --swizzle_size=1 --op_class=tensorop --accum=f32 --cta_m=64 --cta_n=16 --cta_k=128 --cluster_m=1 --cluster_n=1  \
                  --cluster_k=1 --cluster_m_fallback=0 --cluster_n_fallback=0 --cluster_k_fallback=0 --stages=11 --warps_m=4  \
                  --warps_n=1 --warps_k=1 --inst_m=64 --inst_n=16 --inst_k=16 --min_cc=90 --max_cc=90

           Bytes: 117440512  bytes
           FLOPs: 171840634880  flops
           FLOPs/Byte: 1463

         Runtime: 1.40281  ms
          Memory: 77.9687 GiB/s

            Math: 122498 GFLOP/s



=============================
  Problem ID: 1

        Provider: [1;37mCUTLASS[0m
   OperationKind: [1;37mgemm[0m
       Operation: cutlass3x_sm90_tensorop_gemm_f16_f16_f32_f16_f16_64x16x128_4x1x1_0_tnn_align8_warpspecialized_pingpong_epi_nosmem

          Status: [1;37mSuccess[0m
    Verification: [1;37mON[0m
     Disposition: [1;32mPassed[0m

reference_device: Passed
          cuBLAS: Not run
           cuDNN: Not run

       Arguments: --gemm_kind=universal --m=4096 --n=5120 --k=4096 --A=f16:row --B=f16:column --C=f16:column --D=f16:column  \
                  --alpha=1 --beta=0 --split_k_mode=serial --split_k_slices=1 --batch_count=1 --raster_order=along_n  \
                  --runtime_input_datatype_a=invalid --runtime_input_datatype_b=invalid --use_pdl=false --enable_sm90_mixed_dtype_shuffle_test=false  \
                  --swizzle_size=1 --op_class=tensorop --accum=f32 --cta_m=64 --cta_n=16 --cta_k=128 --cluster_m=1 --cluster_n=1  \
                  --cluster_k=1 --cluster_m_fallback=0 --cluster_n_fallback=0 --cluster_k_fallback=0 --stages=11 --warps_m=4  \
                  --warps_n=1 --warps_k=1 --inst_m=64 --inst_n=16 --inst_k=16 --min_cc=90 --max_cc=90

           Bytes: 117440512  bytes
           FLOPs: 171840634880  flops
           FLOPs/Byte: 1463

         Runtime: 1.40842  ms
          Memory: 77.6577 GiB/s

            Math: 122009 GFLOP/s



=============================
  Problem ID: 1

        Provider: [1;37mCUTLASS[0m
   OperationKind: [1;37mgemm[0m
       Operation: cutlass3x_sm90_tensorop_gemm_f16_f16_f32_f16_f16_64x16x128_2x4x1_0_tnn_align8

          Status: [1;37mSuccess[0m
    Verification: [1;37mON[0m
     Disposition: [1;32mPassed[0m

reference_device: Passed
          cuBLAS: Not run
           cuDNN: Not run

       Arguments: --gemm_kind=universal --m=4096 --n=5120 --k=4096 --A=f16:row --B=f16:column --C=f16:column --D=f16:column  \
                  --alpha=1 --beta=0 --split_k_mode=serial --split_k_slices=1 --batch_count=1 --raster_order=along_m  \
                  --runtime_input_datatype_a=invalid --runtime_input_datatype_b=invalid --use_pdl=false --enable_sm90_mixed_dtype_shuffle_test=false  \
                  --swizzle_size=8 --op_class=tensorop --accum=f32 --cta_m=64 --cta_n=16 --cta_k=128 --cluster_m=1 --cluster_n=1  \
                  --cluster_k=1 --cluster_m_fallback=0 --cluster_n_fallback=0 --cluster_k_fallback=0 --stages=11 --warps_m=4  \
                  --warps_n=1 --warps_k=1 --inst_m=64 --inst_n=16 --inst_k=16 --min_cc=90 --max_cc=90

           Bytes: 117440512  bytes
           FLOPs: 171840634880  flops
           FLOPs/Byte: 1463

         Runtime: 0.775996  ms
          Memory: 140.948 GiB/s

            Math: 221445 GFLOP/s



=============================
  Problem ID: 1

        Provider: [1;37mCUTLASS[0m
   OperationKind: [1;37mgemm[0m
       Operation: cutlass3x_sm90_tensorop_gemm_f16_f16_f32_f16_f16_64x16x128_2x4x1_0_tnn_align8_warpspecialized_epi_nosmem

          Status: [1;37mSuccess[0m
    Verification: [1;37mON[0m
     Disposition: [1;32mPassed[0m

reference_device: Passed
          cuBLAS: Not run
           cuDNN: Not run

       Arguments: --gemm_kind=universal --m=4096 --n=5120 --k=4096 --A=f16:row --B=f16:column --C=f16:column --D=f16:column  \
                  --alpha=1 --beta=0 --split_k_mode=serial --split_k_slices=1 --batch_count=1 --raster_order=along_m  \
                  --runtime_input_datatype_a=invalid --runtime_input_datatype_b=invalid --use_pdl=false --enable_sm90_mixed_dtype_shuffle_test=false  \
                  --swizzle_size=4 --op_class=tensorop --accum=f32 --cta_m=64 --cta_n=16 --cta_k=128 --cluster_m=1 --cluster_n=1  \
                  --cluster_k=1 --cluster_m_fallback=0 --cluster_n_fallback=0 --cluster_k_fallback=0 --stages=11 --warps_m=4  \
                  --warps_n=1 --warps_k=1 --inst_m=64 --inst_n=16 --inst_k=16 --min_cc=90 --max_cc=90

           Bytes: 117440512  bytes
           FLOPs: 171840634880  flops
           FLOPs/Byte: 1463

         Runtime: 1.1021  ms
          Memory: 99.2426 GiB/s

            Math: 155921 GFLOP/s



=============================
  Problem ID: 1

        Provider: [1;37mCUTLASS[0m
   OperationKind: [1;37mgemm[0m
       Operation: cutlass3x_sm90_tensorop_gemm_f16_f16_f32_f16_f16_64x16x128_2x4x1_0_tnn_align8_warpspecialized_pingpong_epi_tma

          Status: [1;37mSuccess[0m
    Verification: [1;37mON[0m
     Disposition: [1;32mPassed[0m

reference_device: Passed
          cuBLAS: Not run
           cuDNN: Not run

       Arguments: --gemm_kind=universal --m=4096 --n=5120 --k=4096 --A=f16:row --B=f16:column --C=f16:column --D=f16:column  \
                  --alpha=1 --beta=0 --split_k_mode=serial --split_k_slices=1 --batch_count=1 --raster_order=along_m  \
                  --runtime_input_datatype_a=invalid --runtime_input_datatype_b=invalid --use_pdl=false --enable_sm90_mixed_dtype_shuffle_test=false  \
                  --swizzle_size=8 --op_class=tensorop --accum=f32 --cta_m=64 --cta_n=16 --cta_k=128 --cluster_m=1 --cluster_n=1  \
                  --cluster_k=1 --cluster_m_fallback=0 --cluster_n_fallback=0 --cluster_k_fallback=0 --stages=11 --warps_m=4  \
                  --warps_n=1 --warps_k=1 --inst_m=64 --inst_n=16 --inst_k=16 --min_cc=90 --max_cc=90

           Bytes: 117440512  bytes
           FLOPs: 171840634880  flops
           FLOPs/Byte: 1463

         Runtime: 0.784775  ms
          Memory: 139.371 GiB/s

            Math: 218968 GFLOP/s



=============================
  Problem ID: 1

        Provider: [1;37mCUTLASS[0m
   OperationKind: [1;37mgemm[0m
       Operation: cutlass3x_sm90_tensorop_gemm_f16_f16_f32_f16_f16_64x16x128_2x4x1_0_tnn_align8_warpspecialized_pingpong_epi_nosmem

          Status: [1;37mSuccess[0m
    Verification: [1;37mON[0m
     Disposition: [1;32mPassed[0m

reference_device: Passed
          cuBLAS: Not run
           cuDNN: Not run

       Arguments: --gemm_kind=universal --m=4096 --n=5120 --k=4096 --A=f16:row --B=f16:column --C=f16:column --D=f16:column  \
                  --alpha=1 --beta=0 --split_k_mode=serial --split_k_slices=1 --batch_count=1 --raster_order=along_m  \
                  --runtime_input_datatype_a=invalid --runtime_input_datatype_b=invalid --use_pdl=false --enable_sm90_mixed_dtype_shuffle_test=false  \
                  --swizzle_size=8 --op_class=tensorop --accum=f32 --cta_m=64 --cta_n=16 --cta_k=128 --cluster_m=1 --cluster_n=1  \
                  --cluster_k=1 --cluster_m_fallback=0 --cluster_n_fallback=0 --cluster_k_fallback=0 --stages=11 --warps_m=4  \
                  --warps_n=1 --warps_k=1 --inst_m=64 --inst_n=16 --inst_k=16 --min_cc=90 --max_cc=90

           Bytes: 117440512  bytes
           FLOPs: 171840634880  flops
           FLOPs/Byte: 1463

         Runtime: 0.775725  ms
          Memory: 140.997 GiB/s

            Math: 221523 GFLOP/s



=============================
  Problem ID: 1

        Provider: [1;37mCUTLASS[0m
   OperationKind: [1;37mgemm[0m
       Operation: cutlass3x_sm90_tensorop_gemm_f16_f16_f32_f16_f16_64x16x128_4x2x1_0_tnn_align8

          Status: [1;37mSuccess[0m
    Verification: [1;37mON[0m
     Disposition: [1;32mPassed[0m

reference_device: Passed
          cuBLAS: Not run
           cuDNN: Not run

       Arguments: --gemm_kind=universal --m=4096 --n=5120 --k=4096 --A=f16:row --B=f16:column --C=f16:column --D=f16:column  \
                  --alpha=1 --beta=0 --split_k_mode=serial --split_k_slices=1 --batch_count=1 --raster_order=along_m  \
                  --runtime_input_datatype_a=invalid --runtime_input_datatype_b=invalid --use_pdl=false --enable_sm90_mixed_dtype_shuffle_test=false  \
                  --swizzle_size=2 --op_class=tensorop --accum=f32 --cta_m=64 --cta_n=16 --cta_k=128 --cluster_m=1 --cluster_n=1  \
                  --cluster_k=1 --cluster_m_fallback=0 --cluster_n_fallback=0 --cluster_k_fallback=0 --stages=11 --warps_m=4  \
                  --warps_n=1 --warps_k=1 --inst_m=64 --inst_n=16 --inst_k=16 --min_cc=90 --max_cc=90

           Bytes: 117440512  bytes
           FLOPs: 171840634880  flops
           FLOPs/Byte: 1463

         Runtime: 0.855734  ms
          Memory: 127.814 GiB/s

            Math: 200811 GFLOP/s



=============================
  Problem ID: 1

        Provider: [1;37mCUTLASS[0m
   OperationKind: [1;37mgemm[0m
       Operation: cutlass3x_sm90_tensorop_gemm_f16_f16_f32_f16_f16_64x16x128_4x2x1_0_tnn_align8_warpspecialized_epi_nosmem

          Status: [1;37mSuccess[0m
    Verification: [1;37mON[0m
     Disposition: [1;32mPassed[0m

reference_device: Passed
          cuBLAS: Not run
           cuDNN: Not run

       Arguments: --gemm_kind=universal --m=4096 --n=5120 --k=4096 --A=f16:row --B=f16:column --C=f16:column --D=f16:column  \
                  --alpha=1 --beta=0 --split_k_mode=serial --split_k_slices=1 --batch_count=1 --raster_order=along_m  \
                  --runtime_input_datatype_a=invalid --runtime_input_datatype_b=invalid --use_pdl=false --enable_sm90_mixed_dtype_shuffle_test=false  \
                  --swizzle_size=8 --op_class=tensorop --accum=f32 --cta_m=64 --cta_n=16 --cta_k=128 --cluster_m=1 --cluster_n=1  \
                  --cluster_k=1 --cluster_m_fallback=0 --cluster_n_fallback=0 --cluster_k_fallback=0 --stages=11 --warps_m=4  \
                  --warps_n=1 --warps_k=1 --inst_m=64 --inst_n=16 --inst_k=16 --min_cc=90 --max_cc=90

           Bytes: 117440512  bytes
           FLOPs: 171840634880  flops
           FLOPs/Byte: 1463

         Runtime: 1.18013  ms
          Memory: 92.6801 GiB/s

            Math: 145611 GFLOP/s



=============================
  Problem ID: 1

        Provider: [1;37mCUTLASS[0m
   OperationKind: [1;37mgemm[0m
       Operation: cutlass3x_sm90_tensorop_gemm_f16_f16_f32_f16_f16_64x16x128_4x2x1_0_tnn_align8_warpspecialized_pingpong_epi_tma

          Status: [1;37mSuccess[0m
    Verification: [1;37mON[0m
     Disposition: [1;32mPassed[0m

reference_device: Passed
          cuBLAS: Not run
           cuDNN: Not run

       Arguments: --gemm_kind=universal --m=4096 --n=5120 --k=4096 --A=f16:row --B=f16:column --C=f16:column --D=f16:column  \
                  --alpha=1 --beta=0 --split_k_mode=serial --split_k_slices=1 --batch_count=1 --raster_order=along_m  \
                  --runtime_input_datatype_a=invalid --runtime_input_datatype_b=invalid --use_pdl=false --enable_sm90_mixed_dtype_shuffle_test=false  \
                  --swizzle_size=4 --op_class=tensorop --accum=f32 --cta_m=64 --cta_n=16 --cta_k=128 --cluster_m=1 --cluster_n=1  \
                  --cluster_k=1 --cluster_m_fallback=0 --cluster_n_fallback=0 --cluster_k_fallback=0 --stages=11 --warps_m=4  \
                  --warps_n=1 --warps_k=1 --inst_m=64 --inst_n=16 --inst_k=16 --min_cc=90 --max_cc=90

           Bytes: 117440512  bytes
           FLOPs: 171840634880  flops
           FLOPs/Byte: 1463

         Runtime: 0.858089  ms
          Memory: 127.464 GiB/s

            Math: 200260 GFLOP/s



=============================
  Problem ID: 1

        Provider: [1;37mCUTLASS[0m
   OperationKind: [1;37mgemm[0m
       Operation: cutlass3x_sm90_tensorop_gemm_f16_f16_f32_f16_f16_64x16x128_4x2x1_0_tnn_align8_warpspecialized_pingpong_epi_nosmem

          Status: [1;37mSuccess[0m
    Verification: [1;37mON[0m
     Disposition: [1;32mPassed[0m

reference_device: Passed
          cuBLAS: Not run
           cuDNN: Not run

       Arguments: --gemm_kind=universal --m=4096 --n=5120 --k=4096 --A=f16:row --B=f16:column --C=f16:column --D=f16:column  \
                  --alpha=1 --beta=0 --split_k_mode=serial --split_k_slices=1 --batch_count=1 --raster_order=along_m  \
                  --runtime_input_datatype_a=invalid --runtime_input_datatype_b=invalid --use_pdl=false --enable_sm90_mixed_dtype_shuffle_test=false  \
                  --swizzle_size=2 --op_class=tensorop --accum=f32 --cta_m=64 --cta_n=16 --cta_k=128 --cluster_m=1 --cluster_n=1  \
                  --cluster_k=1 --cluster_m_fallback=0 --cluster_n_fallback=0 --cluster_k_fallback=0 --stages=11 --warps_m=4  \
                  --warps_n=1 --warps_k=1 --inst_m=64 --inst_n=16 --inst_k=16 --min_cc=90 --max_cc=90

           Bytes: 117440512  bytes
           FLOPs: 171840634880  flops
           FLOPs/Byte: 1463

         Runtime: 0.856673  ms
          Memory: 127.674 GiB/s

            Math: 200591 GFLOP/s



=============================
  Problem ID: 1

        Provider: [1;37mCUTLASS[0m
   OperationKind: [1;37mgemm[0m
       Operation: cutlass3x_sm90_tensorop_gemm_f16_f16_f32_f16_f16_64x16x128_1x8x1_0_tnn_align8

          Status: [1;37mSuccess[0m
    Verification: [1;37mON[0m
     Disposition: [1;32mPassed[0m

reference_device: Passed
          cuBLAS: Not run
           cuDNN: Not run

       Arguments: --gemm_kind=universal --m=4096 --n=5120 --k=4096 --A=f16:row --B=f16:column --C=f16:column --D=f16:column  \
                  --alpha=1 --beta=0 --split_k_mode=serial --split_k_slices=1 --batch_count=1 --raster_order=along_m  \
                  --runtime_input_datatype_a=invalid --runtime_input_datatype_b=invalid --use_pdl=false --enable_sm90_mixed_dtype_shuffle_test=false  \
                  --swizzle_size=4 --op_class=tensorop --accum=f32 --cta_m=64 --cta_n=16 --cta_k=128 --cluster_m=1 --cluster_n=1  \
                  --cluster_k=1 --cluster_m_fallback=0 --cluster_n_fallback=0 --cluster_k_fallback=0 --stages=11 --warps_m=4  \
                  --warps_n=1 --warps_k=1 --inst_m=64 --inst_n=16 --inst_k=16 --min_cc=90 --max_cc=90

           Bytes: 117440512  bytes
           FLOPs: 171840634880  flops
           FLOPs/Byte: 1463

         Runtime: 0.733444  ms
          Memory: 149.125 GiB/s

            Math: 234293 GFLOP/s



=============================
  Problem ID: 1

        Provider: [1;37mCUTLASS[0m
   OperationKind: [1;37mgemm[0m
       Operation: cutlass3x_sm90_tensorop_gemm_f16_f16_f32_f16_f16_64x16x128_1x8x1_0_tnn_align8_warpspecialized_epi_nosmem

          Status: [1;37mSuccess[0m
    Verification: [1;37mON[0m
     Disposition: [1;32mPassed[0m

reference_device: Passed
          cuBLAS: Not run
           cuDNN: Not run

       Arguments: --gemm_kind=universal --m=4096 --n=5120 --k=4096 --A=f16:row --B=f16:column --C=f16:column --D=f16:column  \
                  --alpha=1 --beta=0 --split_k_mode=serial --split_k_slices=1 --batch_count=1 --raster_order=along_m  \
                  --runtime_input_datatype_a=invalid --runtime_input_datatype_b=invalid --use_pdl=false --enable_sm90_mixed_dtype_shuffle_test=false  \
                  --swizzle_size=2 --op_class=tensorop --accum=f32 --cta_m=64 --cta_n=16 --cta_k=128 --cluster_m=1 --cluster_n=1  \
                  --cluster_k=1 --cluster_m_fallback=0 --cluster_n_fallback=0 --cluster_k_fallback=0 --stages=11 --warps_m=4  \
                  --warps_n=1 --warps_k=1 --inst_m=64 --inst_n=16 --inst_k=16 --min_cc=90 --max_cc=90

           Bytes: 117440512  bytes
           FLOPs: 171840634880  flops
           FLOPs/Byte: 1463

         Runtime: 0.988096  ms
          Memory: 110.693 GiB/s

            Math: 173911 GFLOP/s



=============================
  Problem ID: 1

        Provider: [1;37mCUTLASS[0m
   OperationKind: [1;37mgemm[0m
       Operation: cutlass3x_sm90_tensorop_gemm_f16_f16_f32_f16_f16_64x16x128_1x8x1_0_tnn_align8_warpspecialized_pingpong_epi_tma

          Status: [1;37mSuccess[0m
    Verification: [1;37mON[0m
     Disposition: [1;32mPassed[0m

reference_device: Passed
          cuBLAS: Not run
           cuDNN: Not run

       Arguments: --gemm_kind=universal --m=4096 --n=5120 --k=4096 --A=f16:row --B=f16:column --C=f16:column --D=f16:column  \
                  --alpha=1 --beta=0 --split_k_mode=serial --split_k_slices=1 --batch_count=1 --raster_order=along_m  \
                  --runtime_input_datatype_a=invalid --runtime_input_datatype_b=invalid --use_pdl=false --enable_sm90_mixed_dtype_shuffle_test=false  \
                  --swizzle_size=8 --op_class=tensorop --accum=f32 --cta_m=64 --cta_n=16 --cta_k=128 --cluster_m=1 --cluster_n=1  \
                  --cluster_k=1 --cluster_m_fallback=0 --cluster_n_fallback=0 --cluster_k_fallback=0 --stages=11 --warps_m=4  \
                  --warps_n=1 --warps_k=1 --inst_m=64 --inst_n=16 --inst_k=16 --min_cc=90 --max_cc=90

           Bytes: 117440512  bytes
           FLOPs: 171840634880  flops
           FLOPs/Byte: 1463

         Runtime: 0.732494  ms
          Memory: 149.319 GiB/s

            Math: 234597 GFLOP/s



=============================
  Problem ID: 1

        Provider: [1;37mCUTLASS[0m
   OperationKind: [1;37mgemm[0m
       Operation: cutlass3x_sm90_tensorop_gemm_f16_f16_f32_f16_f16_64x16x128_1x8x1_0_tnn_align8_warpspecialized_pingpong_epi_nosmem

          Status: [1;37mSuccess[0m
    Verification: [1;37mON[0m
     Disposition: [1;32mPassed[0m

reference_device: Passed
          cuBLAS: Not run
           cuDNN: Not run

       Arguments: --gemm_kind=universal --m=4096 --n=5120 --k=4096 --A=f16:row --B=f16:column --C=f16:column --D=f16:column  \
                  --alpha=1 --beta=0 --split_k_mode=serial --split_k_slices=1 --batch_count=1 --raster_order=along_m  \
                  --runtime_input_datatype_a=invalid --runtime_input_datatype_b=invalid --use_pdl=false --enable_sm90_mixed_dtype_shuffle_test=false  \
                  --swizzle_size=8 --op_class=tensorop --accum=f32 --cta_m=64 --cta_n=16 --cta_k=128 --cluster_m=1 --cluster_n=1  \
                  --cluster_k=1 --cluster_m_fallback=0 --cluster_n_fallback=0 --cluster_k_fallback=0 --stages=11 --warps_m=4  \
                  --warps_n=1 --warps_k=1 --inst_m=64 --inst_n=16 --inst_k=16 --min_cc=90 --max_cc=90

           Bytes: 117440512  bytes
           FLOPs: 171840634880  flops
           FLOPs/Byte: 1463

         Runtime: 0.732405  ms
          Memory: 149.337 GiB/s

            Math: 234625 GFLOP/s



=============================
  Problem ID: 1

        Provider: [1;37mCUTLASS[0m
   OperationKind: [1;37mgemm[0m
       Operation: cutlass3x_sm90_tensorop_gemm_f16_f16_f32_f16_f16_64x16x128_8x1x1_0_tnn_align8

          Status: [1;37mSuccess[0m
    Verification: [1;37mON[0m
     Disposition: [1;32mPassed[0m

reference_device: Passed
          cuBLAS: Not run
           cuDNN: Not run

       Arguments: --gemm_kind=universal --m=4096 --n=5120 --k=4096 --A=f16:row --B=f16:column --C=f16:column --D=f16:column  \
                  --alpha=1 --beta=0 --split_k_mode=serial --split_k_slices=1 --batch_count=1 --raster_order=along_n  \
                  --runtime_input_datatype_a=invalid --runtime_input_datatype_b=invalid --use_pdl=false --enable_sm90_mixed_dtype_shuffle_test=false  \
                  --swizzle_size=1 --op_class=tensorop --accum=f32 --cta_m=64 --cta_n=16 --cta_k=128 --cluster_m=1 --cluster_n=1  \
                  --cluster_k=1 --cluster_m_fallback=0 --cluster_n_fallback=0 --cluster_k_fallback=0 --stages=11 --warps_m=4  \
                  --warps_n=1 --warps_k=1 --inst_m=64 --inst_n=16 --inst_k=16 --min_cc=90 --max_cc=90

           Bytes: 117440512  bytes
           FLOPs: 171840634880  flops
           FLOPs/Byte: 1463

         Runtime: 1.41271  ms
          Memory: 77.4219 GiB/s

            Math: 121639 GFLOP/s



=============================
  Problem ID: 1

        Provider: [1;37mCUTLASS[0m
   OperationKind: [1;37mgemm[0m
       Operation: cutlass3x_sm90_tensorop_gemm_f16_f16_f32_f16_f16_64x16x128_8x1x1_0_tnn_align8_warpspecialized_epi_nosmem

          Status: [1;37mSuccess[0m
    Verification: [1;37mON[0m
     Disposition: [1;32mPassed[0m

reference_device: Passed
          cuBLAS: Not run
           cuDNN: Not run

       Arguments: --gemm_kind=universal --m=4096 --n=5120 --k=4096 --A=f16:row --B=f16:column --C=f16:column --D=f16:column  \
                  --alpha=1 --beta=0 --split_k_mode=serial --split_k_slices=1 --batch_count=1 --raster_order=along_n  \
                  --runtime_input_datatype_a=invalid --runtime_input_datatype_b=invalid --use_pdl=false --enable_sm90_mixed_dtype_shuffle_test=false  \
                  --swizzle_size=2 --op_class=tensorop --accum=f32 --cta_m=64 --cta_n=16 --cta_k=128 --cluster_m=1 --cluster_n=1  \
                  --cluster_k=1 --cluster_m_fallback=0 --cluster_n_fallback=0 --cluster_k_fallback=0 --stages=11 --warps_m=4  \
                  --warps_n=1 --warps_k=1 --inst_m=64 --inst_n=16 --inst_k=16 --min_cc=90 --max_cc=90

           Bytes: 117440512  bytes
           FLOPs: 171840634880  flops
           FLOPs/Byte: 1463

         Runtime: 1.83323  ms
          Memory: 59.6625 GiB/s

            Math: 93736.6 GFLOP/s



=============================
  Problem ID: 1

        Provider: [1;37mCUTLASS[0m
   OperationKind: [1;37mgemm[0m
       Operation: cutlass3x_sm90_tensorop_gemm_f16_f16_f32_f16_f16_64x16x128_8x1x1_0_tnn_align8_warpspecialized_pingpong_epi_tma

          Status: [1;37mSuccess[0m
    Verification: [1;37mON[0m
     Disposition: [1;32mPassed[0m

reference_device: Passed
          cuBLAS: Not run
           cuDNN: Not run

       Arguments: --gemm_kind=universal --m=4096 --n=5120 --k=4096 --A=f16:row --B=f16:column --C=f16:column --D=f16:column  \
                  --alpha=1 --beta=0 --split_k_mode=serial --split_k_slices=1 --batch_count=1 --raster_order=along_n  \
                  --runtime_input_datatype_a=invalid --runtime_input_datatype_b=invalid --use_pdl=false --enable_sm90_mixed_dtype_shuffle_test=false  \
                  --swizzle_size=1 --op_class=tensorop --accum=f32 --cta_m=64 --cta_n=16 --cta_k=128 --cluster_m=1 --cluster_n=1  \
                  --cluster_k=1 --cluster_m_fallback=0 --cluster_n_fallback=0 --cluster_k_fallback=0 --stages=11 --warps_m=4  \
                  --warps_n=1 --warps_k=1 --inst_m=64 --inst_n=16 --inst_k=16 --min_cc=90 --max_cc=90

           Bytes: 117440512  bytes
           FLOPs: 171840634880  flops
           FLOPs/Byte: 1463

         Runtime: 1.42063  ms
          Memory: 76.9904 GiB/s

            Math: 120961 GFLOP/s



=============================
  Problem ID: 1

        Provider: [1;37mCUTLASS[0m
   OperationKind: [1;37mgemm[0m
       Operation: cutlass3x_sm90_tensorop_gemm_f16_f16_f32_f16_f16_64x16x128_8x1x1_0_tnn_align8_warpspecialized_pingpong_epi_nosmem

          Status: [1;37mSuccess[0m
    Verification: [1;37mON[0m
     Disposition: [1;32mPassed[0m

reference_device: Passed
          cuBLAS: Not run
           cuDNN: Not run

       Arguments: --gemm_kind=universal --m=4096 --n=5120 --k=4096 --A=f16:row --B=f16:column --C=f16:column --D=f16:column  \
                  --alpha=1 --beta=0 --split_k_mode=serial --split_k_slices=1 --batch_count=1 --raster_order=along_n  \
                  --runtime_input_datatype_a=invalid --runtime_input_datatype_b=invalid --use_pdl=false --enable_sm90_mixed_dtype_shuffle_test=false  \
                  --swizzle_size=1 --op_class=tensorop --accum=f32 --cta_m=64 --cta_n=16 --cta_k=128 --cluster_m=1 --cluster_n=1  \
                  --cluster_k=1 --cluster_m_fallback=0 --cluster_n_fallback=0 --cluster_k_fallback=0 --stages=11 --warps_m=4  \
                  --warps_n=1 --warps_k=1 --inst_m=64 --inst_n=16 --inst_k=16 --min_cc=90 --max_cc=90

           Bytes: 117440512  bytes
           FLOPs: 171840634880  flops
           FLOPs/Byte: 1463

         Runtime: 1.41294  ms
          Memory: 77.4095 GiB/s

            Math: 121619 GFLOP/s



=============================
  Problem ID: 1

        Provider: [1;37mCUTLASS[0m
   OperationKind: [1;37mgemm[0m
       Operation: cutlass3x_sm90_tensorop_gemm_f16_f16_f32_f16_f16_64x16x128_4x4x1_0_tnn_align8

          Status: [1;37mSuccess[0m
    Verification: [1;37mON[0m
     Disposition: [1;32mPassed[0m

reference_device: Passed
          cuBLAS: Not run
           cuDNN: Not run

       Arguments: --gemm_kind=universal --m=4096 --n=5120 --k=4096 --A=f16:row --B=f16:column --C=f16:column --D=f16:column  \
                  --alpha=1 --beta=0 --split_k_mode=serial --split_k_slices=1 --batch_count=1 --raster_order=along_m  \
                  --runtime_input_datatype_a=invalid --runtime_input_datatype_b=invalid --use_pdl=false --enable_sm90_mixed_dtype_shuffle_test=false  \
                  --swizzle_size=8 --op_class=tensorop --accum=f32 --cta_m=64 --cta_n=16 --cta_k=128 --cluster_m=1 --cluster_n=1  \
                  --cluster_k=1 --cluster_m_fallback=0 --cluster_n_fallback=0 --cluster_k_fallback=0 --stages=11 --warps_m=4  \
                  --warps_n=1 --warps_k=1 --inst_m=64 --inst_n=16 --inst_k=16 --min_cc=90 --max_cc=90

           Bytes: 117440512  bytes
           FLOPs: 171840634880  flops
           FLOPs/Byte: 1463

         Runtime: 0.83461  ms
          Memory: 131.049 GiB/s

            Math: 205893 GFLOP/s



=============================
  Problem ID: 1

        Provider: [1;37mCUTLASS[0m
   OperationKind: [1;37mgemm[0m
       Operation: cutlass3x_sm90_tensorop_gemm_f16_f16_f32_f16_f16_64x16x128_4x4x1_0_tnn_align8_warpspecialized_epi_nosmem

          Status: [1;37mSuccess[0m
    Verification: [1;37mON[0m
     Disposition: [1;32mPassed[0m

reference_device: Passed
          cuBLAS: Not run
           cuDNN: Not run

       Arguments: --gemm_kind=universal --m=4096 --n=5120 --k=4096 --A=f16:row --B=f16:column --C=f16:column --D=f16:column  \
                  --alpha=1 --beta=0 --split_k_mode=serial --split_k_slices=1 --batch_count=1 --raster_order=along_n  \
                  --runtime_input_datatype_a=invalid --runtime_input_datatype_b=invalid --use_pdl=false --enable_sm90_mixed_dtype_shuffle_test=false  \
                  --swizzle_size=8 --op_class=tensorop --accum=f32 --cta_m=64 --cta_n=16 --cta_k=128 --cluster_m=1 --cluster_n=1  \
                  --cluster_k=1 --cluster_m_fallback=0 --cluster_n_fallback=0 --cluster_k_fallback=0 --stages=11 --warps_m=4  \
                  --warps_n=1 --warps_k=1 --inst_m=64 --inst_n=16 --inst_k=16 --min_cc=90 --max_cc=90

           Bytes: 117440512  bytes
           FLOPs: 171840634880  flops
           FLOPs/Byte: 1463

         Runtime: 1.09178  ms
          Memory: 100.18 GiB/s

            Math: 157395 GFLOP/s



=============================
  Problem ID: 1

        Provider: [1;37mCUTLASS[0m
   OperationKind: [1;37mgemm[0m
       Operation: cutlass3x_sm90_tensorop_gemm_f16_f16_f32_f16_f16_64x16x128_4x4x1_0_tnn_align8_warpspecialized_pingpong_epi_tma

          Status: [1;37mSuccess[0m
    Verification: [1;37mON[0m
     Disposition: [1;32mPassed[0m

reference_device: Passed
          cuBLAS: Not run
           cuDNN: Not run

       Arguments: --gemm_kind=universal --m=4096 --n=5120 --k=4096 --A=f16:row --B=f16:column --C=f16:column --D=f16:column  \
                  --alpha=1 --beta=0 --split_k_mode=serial --split_k_slices=1 --batch_count=1 --raster_order=along_m  \
                  --runtime_input_datatype_a=invalid --runtime_input_datatype_b=invalid --use_pdl=false --enable_sm90_mixed_dtype_shuffle_test=false  \
                  --swizzle_size=8 --op_class=tensorop --accum=f32 --cta_m=64 --cta_n=16 --cta_k=128 --cluster_m=1 --cluster_n=1  \
                  --cluster_k=1 --cluster_m_fallback=0 --cluster_n_fallback=0 --cluster_k_fallback=0 --stages=11 --warps_m=4  \
                  --warps_n=1 --warps_k=1 --inst_m=64 --inst_n=16 --inst_k=16 --min_cc=90 --max_cc=90

           Bytes: 117440512  bytes
           FLOPs: 171840634880  flops
           FLOPs/Byte: 1463

         Runtime: 0.837635  ms
          Memory: 130.576 GiB/s

            Math: 205150 GFLOP/s



=============================
  Problem ID: 1

        Provider: [1;37mCUTLASS[0m
   OperationKind: [1;37mgemm[0m
       Operation: cutlass3x_sm90_tensorop_gemm_f16_f16_f32_f16_f16_64x16x128_4x4x1_0_tnn_align8_warpspecialized_pingpong_epi_nosmem

          Status: [1;37mSuccess[0m
    Verification: [1;37mON[0m
     Disposition: [1;32mPassed[0m

reference_device: Passed
          cuBLAS: Not run
           cuDNN: Not run

       Arguments: --gemm_kind=universal --m=4096 --n=5120 --k=4096 --A=f16:row --B=f16:column --C=f16:column --D=f16:column  \
                  --alpha=1 --beta=0 --split_k_mode=serial --split_k_slices=1 --batch_count=1 --raster_order=along_m  \
                  --runtime_input_datatype_a=invalid --runtime_input_datatype_b=invalid --use_pdl=false --enable_sm90_mixed_dtype_shuffle_test=false  \
                  --swizzle_size=4 --op_class=tensorop --accum=f32 --cta_m=64 --cta_n=16 --cta_k=128 --cluster_m=1 --cluster_n=1  \
                  --cluster_k=1 --cluster_m_fallback=0 --cluster_n_fallback=0 --cluster_k_fallback=0 --stages=11 --warps_m=4  \
                  --warps_n=1 --warps_k=1 --inst_m=64 --inst_n=16 --inst_k=16 --min_cc=90 --max_cc=90

           Bytes: 117440512  bytes
           FLOPs: 171840634880  flops
           FLOPs/Byte: 1463

         Runtime: 0.834778  ms
          Memory: 131.023 GiB/s

            Math: 205852 GFLOP/s



=============================
  Problem ID: 1

        Provider: [1;37mCUTLASS[0m
   OperationKind: [1;37mgemm[0m
       Operation: cutlass3x_sm90_tensorop_gemm_f16_f16_f32_f16_f16_128x32x128_1x2x1_0_tnn_align8

          Status: [1;37mSuccess[0m
    Verification: [1;37mON[0m
     Disposition: [1;32mPassed[0m

reference_device: Passed
          cuBLAS: Not run
           cuDNN: Not run

       Arguments: --gemm_kind=universal --m=4096 --n=5120 --k=4096 --A=f16:row --B=f16:column --C=f16:column --D=f16:column  \
                  --alpha=1 --beta=0 --split_k_mode=serial --split_k_slices=1 --batch_count=1 --raster_order=along_m  \
                  --runtime_input_datatype_a=invalid --runtime_input_datatype_b=invalid --use_pdl=false --enable_sm90_mixed_dtype_shuffle_test=false  \
                  --swizzle_size=2 --op_class=tensorop --accum=f32 --cta_m=128 --cta_n=32 --cta_k=128 --cluster_m=1 --cluster_n=1  \
                  --cluster_k=1 --cluster_m_fallback=0 --cluster_n_fallback=0 --cluster_k_fallback=0 --stages=5 --warps_m=4  \
                  --warps_n=2 --warps_k=1 --inst_m=64 --inst_n=32 --inst_k=16 --min_cc=90 --max_cc=90

           Bytes: 117440512  bytes
           FLOPs: 171840634880  flops
           FLOPs/Byte: 1463

         Runtime: 0.522343  ms
          Memory: 209.393 GiB/s

            Math: 328980 GFLOP/s



=============================
  Problem ID: 1

        Provider: [1;37mCUTLASS[0m
   OperationKind: [1;37mgemm[0m
       Operation: cutlass3x_sm90_tensorop_gemm_f16_f16_f32_f16_f16_128x32x128_1x2x1_0_tnn_align8_warpspecialized_epi_nosmem

          Status: [1;37mSuccess[0m
    Verification: [1;37mON[0m
     Disposition: [1;32mPassed[0m

reference_device: Passed
          cuBLAS: Not run
           cuDNN: Not run

       Arguments: --gemm_kind=universal --m=4096 --n=5120 --k=4096 --A=f16:row --B=f16:column --C=f16:column --D=f16:column  \
                  --alpha=1 --beta=0 --split_k_mode=serial --split_k_slices=1 --batch_count=1 --raster_order=along_n  \
                  --runtime_input_datatype_a=invalid --runtime_input_datatype_b=invalid --use_pdl=false --enable_sm90_mixed_dtype_shuffle_test=false  \
                  --swizzle_size=1 --op_class=tensorop --accum=f32 --cta_m=128 --cta_n=32 --cta_k=128 --cluster_m=1 --cluster_n=1  \
                  --cluster_k=1 --cluster_m_fallback=0 --cluster_n_fallback=0 --cluster_k_fallback=0 --stages=5 --warps_m=4  \
                  --warps_n=1 --warps_k=1 --inst_m=64 --inst_n=32 --inst_k=16 --min_cc=90 --max_cc=90

           Bytes: 117440512  bytes
           FLOPs: 171840634880  flops
           FLOPs/Byte: 1463

         Runtime: 0.558941  ms
          Memory: 195.683 GiB/s

            Math: 307440 GFLOP/s



=============================
  Problem ID: 1

        Provider: [1;37mCUTLASS[0m
   OperationKind: [1;37mgemm[0m
       Operation: cutlass3x_sm90_tensorop_gemm_f16_f16_f32_f16_f16_128x32x128_1x2x1_0_tnn_align8_warpspecialized_pingpong_epi_tma

          Status: [1;37mSuccess[0m
    Verification: [1;37mON[0m
     Disposition: [1;32mPassed[0m

reference_device: Passed
          cuBLAS: Not run
           cuDNN: Not run

       Arguments: --gemm_kind=universal --m=4096 --n=5120 --k=4096 --A=f16:row --B=f16:column --C=f16:column --D=f16:column  \
                  --alpha=1 --beta=0 --split_k_mode=serial --split_k_slices=1 --batch_count=1 --raster_order=along_m  \
                  --runtime_input_datatype_a=invalid --runtime_input_datatype_b=invalid --use_pdl=false --enable_sm90_mixed_dtype_shuffle_test=false  \
                  --swizzle_size=2 --op_class=tensorop --accum=f32 --cta_m=128 --cta_n=32 --cta_k=128 --cluster_m=1 --cluster_n=1  \
                  --cluster_k=1 --cluster_m_fallback=0 --cluster_n_fallback=0 --cluster_k_fallback=0 --stages=5 --warps_m=4  \
                  --warps_n=1 --warps_k=1 --inst_m=64 --inst_n=32 --inst_k=16 --min_cc=90 --max_cc=90

           Bytes: 117440512  bytes
           FLOPs: 171840634880  flops
           FLOPs/Byte: 1463

         Runtime: 0.519118  ms
          Memory: 210.694 GiB/s

            Math: 331024 GFLOP/s



=============================
  Problem ID: 1

        Provider: [1;37mCUTLASS[0m
   OperationKind: [1;37mgemm[0m
       Operation: cutlass3x_sm90_tensorop_gemm_f16_f16_f32_f16_f16_128x32x128_1x2x1_0_tnn_align8_warpspecialized_pingpong_epi_nosmem

          Status: [1;37mSuccess[0m
    Verification: [1;37mON[0m
     Disposition: [1;32mPassed[0m

reference_device: Passed
          cuBLAS: Not run
           cuDNN: Not run

       Arguments: --gemm_kind=universal --m=4096 --n=5120 --k=4096 --A=f16:row --B=f16:column --C=f16:column --D=f16:column  \
                  --alpha=1 --beta=0 --split_k_mode=serial --split_k_slices=1 --batch_count=1 --raster_order=along_m  \
                  --runtime_input_datatype_a=invalid --runtime_input_datatype_b=invalid --use_pdl=false --enable_sm90_mixed_dtype_shuffle_test=false  \
                  --swizzle_size=2 --op_class=tensorop --accum=f32 --cta_m=128 --cta_n=32 --cta_k=128 --cluster_m=1 --cluster_n=1  \
                  --cluster_k=1 --cluster_m_fallback=0 --cluster_n_fallback=0 --cluster_k_fallback=0 --stages=5 --warps_m=4  \
                  --warps_n=1 --warps_k=1 --inst_m=64 --inst_n=32 --inst_k=16 --min_cc=90 --max_cc=90

           Bytes: 117440512  bytes
           FLOPs: 171840634880  flops
           FLOPs/Byte: 1463

         Runtime: 0.521522  ms
          Memory: 209.723 GiB/s

            Math: 329498 GFLOP/s



=============================
  Problem ID: 1

        Provider: [1;37mCUTLASS[0m
   OperationKind: [1;37mgemm[0m
       Operation: cutlass3x_sm90_tensorop_gemm_f16_f16_f32_f16_f16_128x32x128_1x2x1_0_tnn_align8_warpspecialized_cooperative_epi_nosmem

          Status: [1;37mSuccess[0m
    Verification: [1;37mON[0m
     Disposition: [1;32mPassed[0m

reference_device: Passed
          cuBLAS: Not run
           cuDNN: Not run

       Arguments: --gemm_kind=universal --m=4096 --n=5120 --k=4096 --A=f16:row --B=f16:column --C=f16:column --D=f16:column  \
                  --alpha=1 --beta=0 --split_k_mode=serial --split_k_slices=1 --batch_count=1 --raster_order=along_m  \
                  --runtime_input_datatype_a=invalid --runtime_input_datatype_b=invalid --use_pdl=false --enable_sm90_mixed_dtype_shuffle_test=false  \
                  --swizzle_size=4 --op_class=tensorop --accum=f32 --cta_m=128 --cta_n=32 --cta_k=128 --cluster_m=1 --cluster_n=1  \
                  --cluster_k=1 --cluster_m_fallback=0 --cluster_n_fallback=0 --cluster_k_fallback=0 --stages=5 --warps_m=4  \
                  --warps_n=2 --warps_k=1 --inst_m=64 --inst_n=32 --inst_k=16 --min_cc=90 --max_cc=90

           Bytes: 117440512  bytes
           FLOPs: 171840634880  flops
           FLOPs/Byte: 1463

         Runtime: 0.521381  ms
          Memory: 209.779 GiB/s

            Math: 329587 GFLOP/s



=============================
  Problem ID: 1

        Provider: [1;37mCUTLASS[0m
   OperationKind: [1;37mgemm[0m
       Operation: cutlass3x_sm90_tensorop_gemm_f16_f16_f32_f16_f16_128x32x128_1x2x1_0_tnn_align8_warpspecialized_cooperative_epi_tma

          Status: [1;37mSuccess[0m
    Verification: [1;37mON[0m
     Disposition: [1;32mPassed[0m

reference_device: Passed
          cuBLAS: Not run
           cuDNN: Not run

       Arguments: --gemm_kind=universal --m=4096 --n=5120 --k=4096 --A=f16:row --B=f16:column --C=f16:column --D=f16:column  \
                  --alpha=1 --beta=0 --split_k_mode=serial --split_k_slices=1 --batch_count=1 --raster_order=along_m  \
                  --runtime_input_datatype_a=invalid --runtime_input_datatype_b=invalid --use_pdl=false --enable_sm90_mixed_dtype_shuffle_test=false  \
                  --swizzle_size=2 --op_class=tensorop --accum=f32 --cta_m=128 --cta_n=32 --cta_k=128 --cluster_m=1 --cluster_n=1  \
                  --cluster_k=1 --cluster_m_fallback=0 --cluster_n_fallback=0 --cluster_k_fallback=0 --stages=5 --warps_m=4  \
                  --warps_n=2 --warps_k=1 --inst_m=64 --inst_n=32 --inst_k=16 --min_cc=90 --max_cc=90

           Bytes: 117440512  bytes
           FLOPs: 171840634880  flops
           FLOPs/Byte: 1463

         Runtime: 0.523253  ms
          Memory: 209.029 GiB/s

            Math: 328408 GFLOP/s



=============================
  Problem ID: 1

        Provider: [1;37mCUTLASS[0m
   OperationKind: [1;37mgemm[0m
       Operation: cutlass3x_sm90_tensorop_gemm_f16_f16_f32_f16_f16_128x32x128_1x2x1_0_tnn_align8_stream_k_warpspecialized_cooperative_epi_nosmem

          Status: [1;37mSuccess[0m
    Verification: [1;37mON[0m
     Disposition: [1;32mPassed[0m

reference_device: Passed
          cuBLAS: Not run
           cuDNN: Not run

       Arguments: --gemm_kind=universal --m=4096 --n=5120 --k=4096 --A=f16:row --B=f16:column --C=f16:column --D=f16:column  \
                  --alpha=1 --beta=0 --split_k_mode=serial --split_k_slices=1 --batch_count=1 --raster_order=along_m  \
                  --runtime_input_datatype_a=invalid --runtime_input_datatype_b=invalid --use_pdl=false --enable_sm90_mixed_dtype_shuffle_test=false  \
                  --swizzle_size=4 --op_class=tensorop --accum=f32 --cta_m=128 --cta_n=32 --cta_k=128 --cluster_m=1 --cluster_n=1  \
                  --cluster_k=1 --cluster_m_fallback=0 --cluster_n_fallback=0 --cluster_k_fallback=0 --stages=5 --warps_m=4  \
                  --warps_n=2 --warps_k=1 --inst_m=64 --inst_n=32 --inst_k=16 --min_cc=90 --max_cc=90

           Bytes: 117440512  bytes
           FLOPs: 171840634880  flops
           FLOPs/Byte: 1463

         Runtime: 0.525183  ms
          Memory: 208.261 GiB/s

            Math: 327202 GFLOP/s



=============================
  Problem ID: 1

        Provider: [1;37mCUTLASS[0m
   OperationKind: [1;37mgemm[0m
       Operation: cutlass3x_sm90_tensorop_gemm_f16_f16_f32_f16_f16_128x32x128_1x2x1_0_tnn_align8_stream_k_warpspecialized_cooperative_epi_tma

          Status: [1;37mSuccess[0m
    Verification: [1;37mON[0m
     Disposition: [1;32mPassed[0m

reference_device: Passed
          cuBLAS: Not run
           cuDNN: Not run

       Arguments: --gemm_kind=universal --m=4096 --n=5120 --k=4096 --A=f16:row --B=f16:column --C=f16:column --D=f16:column  \
                  --alpha=1 --beta=0 --split_k_mode=serial --split_k_slices=1 --batch_count=1 --raster_order=along_m  \
                  --runtime_input_datatype_a=invalid --runtime_input_datatype_b=invalid --use_pdl=false --enable_sm90_mixed_dtype_shuffle_test=false  \
                  --swizzle_size=2 --op_class=tensorop --accum=f32 --cta_m=128 --cta_n=32 --cta_k=128 --cluster_m=1 --cluster_n=1  \
                  --cluster_k=1 --cluster_m_fallback=0 --cluster_n_fallback=0 --cluster_k_fallback=0 --stages=5 --warps_m=4  \
                  --warps_n=2 --warps_k=1 --inst_m=64 --inst_n=32 --inst_k=16 --min_cc=90 --max_cc=90

           Bytes: 117440512  bytes
           FLOPs: 171840634880  flops
           FLOPs/Byte: 1463

         Runtime: 0.527563  ms
          Memory: 207.321 GiB/s

            Math: 325725 GFLOP/s



=============================
  Problem ID: 1

        Provider: [1;37mCUTLASS[0m
   OperationKind: [1;37mgemm[0m
       Operation: cutlass3x_sm90_tensorop_gemm_f16_f16_f32_f16_f16_128x32x128_2x1x1_0_tnn_align8

          Status: [1;37mSuccess[0m
    Verification: [1;37mON[0m
     Disposition: [1;32mPassed[0m

reference_device: Passed
          cuBLAS: Not run
           cuDNN: Not run

       Arguments: --gemm_kind=universal --m=4096 --n=5120 --k=4096 --A=f16:row --B=f16:column --C=f16:column --D=f16:column  \
                  --alpha=1 --beta=0 --split_k_mode=serial --split_k_slices=1 --batch_count=1 --raster_order=along_n  \
                  --runtime_input_datatype_a=invalid --runtime_input_datatype_b=invalid --use_pdl=false --enable_sm90_mixed_dtype_shuffle_test=false  \
                  --swizzle_size=1 --op_class=tensorop --accum=f32 --cta_m=128 --cta_n=32 --cta_k=128 --cluster_m=1 --cluster_n=1  \
                  --cluster_k=1 --cluster_m_fallback=0 --cluster_n_fallback=0 --cluster_k_fallback=0 --stages=5 --warps_m=4  \
                  --warps_n=2 --warps_k=1 --inst_m=64 --inst_n=32 --inst_k=16 --min_cc=90 --max_cc=90

           Bytes: 117440512  bytes
           FLOPs: 171840634880  flops
           FLOPs/Byte: 1463

         Runtime: 0.681187  ms
          Memory: 160.565 GiB/s

            Math: 252266 GFLOP/s



=============================
  Problem ID: 1

        Provider: [1;37mCUTLASS[0m
   OperationKind: [1;37mgemm[0m
       Operation: cutlass3x_sm90_tensorop_gemm_f16_f16_f32_f16_f16_128x32x128_2x1x1_0_tnn_align8_warpspecialized_epi_nosmem

          Status: [1;37mSuccess[0m
    Verification: [1;37mON[0m
     Disposition: [1;32mPassed[0m

reference_device: Passed
          cuBLAS: Not run
           cuDNN: Not run

       Arguments: --gemm_kind=universal --m=4096 --n=5120 --k=4096 --A=f16:row --B=f16:column --C=f16:column --D=f16:column  \
                  --alpha=1 --beta=0 --split_k_mode=serial --split_k_slices=1 --batch_count=1 --raster_order=along_m  \
                  --runtime_input_datatype_a=invalid --runtime_input_datatype_b=invalid --use_pdl=false --enable_sm90_mixed_dtype_shuffle_test=false  \
                  --swizzle_size=8 --op_class=tensorop --accum=f32 --cta_m=128 --cta_n=32 --cta_k=128 --cluster_m=1 --cluster_n=1  \
                  --cluster_k=1 --cluster_m_fallback=0 --cluster_n_fallback=0 --cluster_k_fallback=0 --stages=5 --warps_m=4  \
                  --warps_n=1 --warps_k=1 --inst_m=64 --inst_n=32 --inst_k=16 --min_cc=90 --max_cc=90

           Bytes: 117440512  bytes
           FLOPs: 171840634880  flops
           FLOPs/Byte: 1463

         Runtime: 0.787505  ms
          Memory: 138.888 GiB/s

            Math: 218209 GFLOP/s



=============================
  Problem ID: 1

        Provider: [1;37mCUTLASS[0m
   OperationKind: [1;37mgemm[0m
       Operation: cutlass3x_sm90_tensorop_gemm_f16_f16_f32_f16_f16_128x32x128_2x1x1_0_tnn_align8_warpspecialized_pingpong_epi_tma

          Status: [1;37mSuccess[0m
    Verification: [1;37mON[0m
     Disposition: [1;32mPassed[0m

reference_device: Passed
          cuBLAS: Not run
           cuDNN: Not run

       Arguments: --gemm_kind=universal --m=4096 --n=5120 --k=4096 --A=f16:row --B=f16:column --C=f16:column --D=f16:column  \
                  --alpha=1 --beta=0 --split_k_mode=serial --split_k_slices=1 --batch_count=1 --raster_order=along_n  \
                  --runtime_input_datatype_a=invalid --runtime_input_datatype_b=invalid --use_pdl=false --enable_sm90_mixed_dtype_shuffle_test=false  \
                  --swizzle_size=1 --op_class=tensorop --accum=f32 --cta_m=128 --cta_n=32 --cta_k=128 --cluster_m=1 --cluster_n=1  \
                  --cluster_k=1 --cluster_m_fallback=0 --cluster_n_fallback=0 --cluster_k_fallback=0 --stages=5 --warps_m=4  \
                  --warps_n=1 --warps_k=1 --inst_m=64 --inst_n=32 --inst_k=16 --min_cc=90 --max_cc=90

           Bytes: 117440512  bytes
           FLOPs: 171840634880  flops
           FLOPs/Byte: 1463

         Runtime: 0.659224  ms
          Memory: 165.915 GiB/s

            Math: 260671 GFLOP/s



=============================
  Problem ID: 1

        Provider: [1;37mCUTLASS[0m
   OperationKind: [1;37mgemm[0m
       Operation: cutlass3x_sm90_tensorop_gemm_f16_f16_f32_f16_f16_128x32x128_2x1x1_0_tnn_align8_warpspecialized_pingpong_epi_nosmem

          Status: [1;37mSuccess[0m
    Verification: [1;37mON[0m
     Disposition: [1;32mPassed[0m

reference_device: Passed
          cuBLAS: Not run
           cuDNN: Not run

       Arguments: --gemm_kind=universal --m=4096 --n=5120 --k=4096 --A=f16:row --B=f16:column --C=f16:column --D=f16:column  \
                  --alpha=1 --beta=0 --split_k_mode=serial --split_k_slices=1 --batch_count=1 --raster_order=along_n  \
                  --runtime_input_datatype_a=invalid --runtime_input_datatype_b=invalid --use_pdl=false --enable_sm90_mixed_dtype_shuffle_test=false  \
                  --swizzle_size=1 --op_class=tensorop --accum=f32 --cta_m=128 --cta_n=32 --cta_k=128 --cluster_m=1 --cluster_n=1  \
                  --cluster_k=1 --cluster_m_fallback=0 --cluster_n_fallback=0 --cluster_k_fallback=0 --stages=5 --warps_m=4  \
                  --warps_n=1 --warps_k=1 --inst_m=64 --inst_n=32 --inst_k=16 --min_cc=90 --max_cc=90

           Bytes: 117440512  bytes
           FLOPs: 171840634880  flops
           FLOPs/Byte: 1463

         Runtime: 0.678152  ms
          Memory: 161.284 GiB/s

            Math: 253395 GFLOP/s



=============================
  Problem ID: 1

        Provider: [1;37mCUTLASS[0m
   OperationKind: [1;37mgemm[0m
       Operation: cutlass3x_sm90_tensorop_gemm_f16_f16_f32_f16_f16_128x32x128_2x1x1_0_tnn_align8_warpspecialized_cooperative_epi_nosmem

          Status: [1;37mSuccess[0m
    Verification: [1;37mON[0m
     Disposition: [1;32mPassed[0m

reference_device: Passed
          cuBLAS: Not run
           cuDNN: Not run

       Arguments: --gemm_kind=universal --m=4096 --n=5120 --k=4096 --A=f16:row --B=f16:column --C=f16:column --D=f16:column  \
                  --alpha=1 --beta=0 --split_k_mode=serial --split_k_slices=1 --batch_count=1 --raster_order=along_n  \
                  --runtime_input_datatype_a=invalid --runtime_input_datatype_b=invalid --use_pdl=false --enable_sm90_mixed_dtype_shuffle_test=false  \
                  --swizzle_size=1 --op_class=tensorop --accum=f32 --cta_m=128 --cta_n=32 --cta_k=128 --cluster_m=1 --cluster_n=1  \
                  --cluster_k=1 --cluster_m_fallback=0 --cluster_n_fallback=0 --cluster_k_fallback=0 --stages=5 --warps_m=4  \
                  --warps_n=2 --warps_k=1 --inst_m=64 --inst_n=32 --inst_k=16 --min_cc=90 --max_cc=90

           Bytes: 117440512  bytes
           FLOPs: 171840634880  flops
           FLOPs/Byte: 1463

         Runtime: 0.679506  ms
          Memory: 160.963 GiB/s

            Math: 252891 GFLOP/s



=============================
  Problem ID: 1

        Provider: [1;37mCUTLASS[0m
   OperationKind: [1;37mgemm[0m
       Operation: cutlass3x_sm90_tensorop_gemm_f16_f16_f32_f16_f16_128x32x128_2x1x1_0_tnn_align8_warpspecialized_cooperative_epi_tma

          Status: [1;37mSuccess[0m
    Verification: [1;37mON[0m
     Disposition: [1;32mPassed[0m

reference_device: Passed
          cuBLAS: Not run
           cuDNN: Not run

       Arguments: --gemm_kind=universal --m=4096 --n=5120 --k=4096 --A=f16:row --B=f16:column --C=f16:column --D=f16:column  \
                  --alpha=1 --beta=0 --split_k_mode=serial --split_k_slices=1 --batch_count=1 --raster_order=along_n  \
                  --runtime_input_datatype_a=invalid --runtime_input_datatype_b=invalid --use_pdl=false --enable_sm90_mixed_dtype_shuffle_test=false  \
                  --swizzle_size=1 --op_class=tensorop --accum=f32 --cta_m=128 --cta_n=32 --cta_k=128 --cluster_m=1 --cluster_n=1  \
                  --cluster_k=1 --cluster_m_fallback=0 --cluster_n_fallback=0 --cluster_k_fallback=0 --stages=5 --warps_m=4  \
                  --warps_n=2 --warps_k=1 --inst_m=64 --inst_n=32 --inst_k=16 --min_cc=90 --max_cc=90

           Bytes: 117440512  bytes
           FLOPs: 171840634880  flops
           FLOPs/Byte: 1463

         Runtime: 0.670029  ms
          Memory: 163.239 GiB/s

            Math: 256467 GFLOP/s



=============================
  Problem ID: 1

        Provider: [1;37mCUTLASS[0m
   OperationKind: [1;37mgemm[0m
       Operation: cutlass3x_sm90_tensorop_gemm_f16_f16_f32_f16_f16_128x32x128_2x1x1_0_tnn_align8_stream_k_warpspecialized_cooperative_epi_nosmem

          Status: [1;37mSuccess[0m
    Verification: [1;37mON[0m
     Disposition: [1;32mPassed[0m

reference_device: Passed
          cuBLAS: Not run
           cuDNN: Not run

       Arguments: --gemm_kind=universal --m=4096 --n=5120 --k=4096 --A=f16:row --B=f16:column --C=f16:column --D=f16:column  \
                  --alpha=1 --beta=0 --split_k_mode=serial --split_k_slices=1 --batch_count=1 --raster_order=along_n  \
                  --runtime_input_datatype_a=invalid --runtime_input_datatype_b=invalid --use_pdl=false --enable_sm90_mixed_dtype_shuffle_test=false  \
                  --swizzle_size=1 --op_class=tensorop --accum=f32 --cta_m=128 --cta_n=32 --cta_k=128 --cluster_m=1 --cluster_n=1  \
                  --cluster_k=1 --cluster_m_fallback=0 --cluster_n_fallback=0 --cluster_k_fallback=0 --stages=5 --warps_m=4  \
                  --warps_n=2 --warps_k=1 --inst_m=64 --inst_n=32 --inst_k=16 --min_cc=90 --max_cc=90

           Bytes: 117440512  bytes
           FLOPs: 171840634880  flops
           FLOPs/Byte: 1463

         Runtime: 0.684615  ms
          Memory: 159.761 GiB/s

            Math: 251003 GFLOP/s



=============================
  Problem ID: 1

        Provider: [1;37mCUTLASS[0m
   OperationKind: [1;37mgemm[0m
       Operation: cutlass3x_sm90_tensorop_gemm_f16_f16_f32_f16_f16_128x32x128_2x1x1_0_tnn_align8_stream_k_warpspecialized_cooperative_epi_tma

          Status: [1;37mSuccess[0m
    Verification: [1;37mON[0m
     Disposition: [1;32mPassed[0m

reference_device: Passed
          cuBLAS: Not run
           cuDNN: Not run

       Arguments: --gemm_kind=universal --m=4096 --n=5120 --k=4096 --A=f16:row --B=f16:column --C=f16:column --D=f16:column  \
                  --alpha=1 --beta=0 --split_k_mode=serial --split_k_slices=1 --batch_count=1 --raster_order=along_n  \
                  --runtime_input_datatype_a=invalid --runtime_input_datatype_b=invalid --use_pdl=false --enable_sm90_mixed_dtype_shuffle_test=false  \
                  --swizzle_size=1 --op_class=tensorop --accum=f32 --cta_m=128 --cta_n=32 --cta_k=128 --cluster_m=1 --cluster_n=1  \
                  --cluster_k=1 --cluster_m_fallback=0 --cluster_n_fallback=0 --cluster_k_fallback=0 --stages=5 --warps_m=4  \
                  --warps_n=2 --warps_k=1 --inst_m=64 --inst_n=32 --inst_k=16 --min_cc=90 --max_cc=90

           Bytes: 117440512  bytes
           FLOPs: 171840634880  flops
           FLOPs/Byte: 1463

         Runtime: 0.668542  ms
          Memory: 163.602 GiB/s

            Math: 257038 GFLOP/s



=============================
  Problem ID: 1

        Provider: [1;37mCUTLASS[0m
   OperationKind: [1;37mgemm[0m
       Operation: cutlass3x_sm90_tensorop_gemm_f16_f16_f32_f16_f16_128x32x128_1x1x1_0_tnn_align8

          Status: [1;37mSuccess[0m
    Verification: [1;37mON[0m
     Disposition: [1;32mPassed[0m

reference_device: Passed
          cuBLAS: Not run
           cuDNN: Not run

       Arguments: --gemm_kind=universal --m=4096 --n=5120 --k=4096 --A=f16:row --B=f16:column --C=f16:column --D=f16:column  \
                  --alpha=1 --beta=0 --split_k_mode=serial --split_k_slices=1 --batch_count=1 --raster_order=along_n  \
                  --runtime_input_datatype_a=invalid --runtime_input_datatype_b=invalid --use_pdl=false --enable_sm90_mixed_dtype_shuffle_test=false  \
                  --swizzle_size=1 --op_class=tensorop --accum=f32 --cta_m=128 --cta_n=32 --cta_k=128 --cluster_m=1 --cluster_n=1  \
                  --cluster_k=1 --cluster_m_fallback=0 --cluster_n_fallback=0 --cluster_k_fallback=0 --stages=5 --warps_m=4  \
                  --warps_n=2 --warps_k=1 --inst_m=64 --inst_n=32 --inst_k=16 --min_cc=90 --max_cc=90

           Bytes: 117440512  bytes
           FLOPs: 171840634880  flops
           FLOPs/Byte: 1463

         Runtime: 0.677922  ms
          Memory: 161.339 GiB/s

            Math: 253481 GFLOP/s



=============================
  Problem ID: 1

        Provider: [1;37mCUTLASS[0m
   OperationKind: [1;37mgemm[0m
       Operation: cutlass3x_sm90_tensorop_gemm_f16_f16_f32_f16_f16_128x32x128_1x1x1_0_tnn_align8_warpspecialized_epi_nosmem

          Status: [1;37mSuccess[0m
    Verification: [1;37mON[0m
     Disposition: [1;32mPassed[0m

reference_device: Passed
          cuBLAS: Not run
           cuDNN: Not run

       Arguments: --gemm_kind=universal --m=4096 --n=5120 --k=4096 --A=f16:row --B=f16:column --C=f16:column --D=f16:column  \
                  --alpha=1 --beta=0 --split_k_mode=serial --split_k_slices=1 --batch_count=1 --raster_order=along_n  \
                  --runtime_input_datatype_a=invalid --runtime_input_datatype_b=invalid --use_pdl=false --enable_sm90_mixed_dtype_shuffle_test=false  \
                  --swizzle_size=8 --op_class=tensorop --accum=f32 --cta_m=128 --cta_n=32 --cta_k=128 --cluster_m=1 --cluster_n=1  \
                  --cluster_k=1 --cluster_m_fallback=0 --cluster_n_fallback=0 --cluster_k_fallback=0 --stages=5 --warps_m=4  \
                  --warps_n=1 --warps_k=1 --inst_m=64 --inst_n=32 --inst_k=16 --min_cc=90 --max_cc=90

           Bytes: 117440512  bytes
           FLOPs: 171840634880  flops
           FLOPs/Byte: 1463

         Runtime: 0.80385  ms
          Memory: 136.064 GiB/s

            Math: 213772 GFLOP/s



=============================
  Problem ID: 1

