profiler_out/cutlass3x_sm90_tensorop_gemm_f16_f16_f32_f16_f16_tt/4096x5120x4096.gemm.csv
Problem,Provider,OperationKind,Operation,Disposition,Status,gemm_kind,m,n,k,A,B,C,D,alpha,beta,split_k_mode,split_k_slices,batch_count,raster_order,runtime_input_datatype_a,runtime_input_datatype_b,use_pdl,enable_sm90_mixed_dtype_shuffle_test,swizzle_size,op_class,accum,cta_m,cta_n,cta_k,cluster_m,cluster_n,cluster_k,cluster_m_fallback,cluster_n_fallback,cluster_k_fallback,stages,warps_m,warps_n,warps_k,inst_m,inst_n,inst_k,min_cc,max_cc,Bytes,Flops,Flops/Byte,Runtime,GB/s,GFLOPs
1,CUTLASS,gemm,cutlass3x_sm90_tensorop_gemm_f16_f16_f32_f16_f16_128x128x64_2x1x1_0_ttn_align8,passed,success,universal,4096,5120,4096,f16:row,f16:row,f16:column,f16:column,1,0,serial,1,1,heuristic,invalid,invalid,false,false,1,tensorop,f32,128,128,64,2,1,1,0,0,0,7,4,2,1,64,128,16,90,90,117440512,171840634880,1463,0.280444,390.006,612745
1,CUTLASS,gemm,cutlass3x_sm90_tensorop_gemm_f16_f16_f32_f16_f16_128x128x64_2x1x1_0_ttn_align8_warpspecialized_epi_nosmem,passed,success,universal,4096,5120,4096,f16:row,f16:row,f16:column,f16:column,1,0,serial,1,1,heuristic,invalid,invalid,false,false,1,tensorop,f32,128,128,64,2,1,1,0,0,0,7,4,1,1,64,128,16,90,90,117440512,171840634880,1463,0.286813,381.346,599138
1,CUTLASS,gemm,cutlass3x_sm90_tensorop_gemm_f16_f16_f32_f16_f16_128x128x64_2x1x1_0_ttn_align8_warpspecialized_pingpong_epi_tma,passed,success,universal,4096,5120,4096,f16:row,f16:row,f16:column,f16:column,1,0,serial,1,1,heuristic,invalid,invalid,false,false,1,tensorop,f32,128,128,64,2,1,1,0,0,0,6,4,1,1,64,128,16,90,90,117440512,171840634880,1463,0.264506,413.506,649666
1,CUTLASS,gemm,cutlass3x_sm90_tensorop_gemm_f16_f16_f32_f16_f16_128x128x64_2x1x1_0_ttn_align8_warpspecialized_pingpong_epi_nosmem,passed,success,universal,4096,5120,4096,f16:row,f16:row,f16:column,f16:column,1,0,serial,1,1,heuristic,invalid,invalid,false,false,1,tensorop,f32,128,128,64,2,1,1,0,0,0,7,4,1,1,64,128,16,90,90,117440512,171840634880,1463,0.26878,406.932,639336
1,CUTLASS,gemm,cutlass3x_sm90_tensorop_gemm_f16_f16_f32_f16_f16_128x128x64_2x1x1_0_ttn_align8_warpspecialized_cooperative_epi_nosmem,passed,success,universal,4096,5120,4096,f16:row,f16:row,f16:column,f16:column,1,0,serial,1,1,heuristic,invalid,invalid,false,false,1,tensorop,f32,128,128,64,2,1,1,0,0,0,7,4,2,1,64,128,16,90,90,117440512,171840634880,1463,0.280557,389.849,612497
1,CUTLASS,gemm,cutlass3x_sm90_tensorop_gemm_f16_f16_f32_f16_f16_128x128x64_2x1x1_0_ttn_align8_warpspecialized_cooperative_epi_tma,passed,success,universal,4096,5120,4096,f16:row,f16:row,f16:column,f16:column,1,0,serial,1,1,heuristic,invalid,invalid,false,false,1,tensorop,f32,128,128,64,2,1,1,0,0,0,6,4,2,1,64,128,16,90,90,117440512,171840634880,1463,0.269589,405.71,637418
1,CUTLASS,gemm,cutlass3x_sm90_tensorop_gemm_f16_f16_f32_f16_f16_128x128x64_2x1x1_0_ttn_align8_stream_k_warpspecialized_cooperative_epi_nosmem,passed,success,universal,4096,5120,4096,f16:row,f16:row,f16:column,f16:column,1,0,serial,1,1,heuristic,invalid,invalid,false,false,1,tensorop,f32,128,128,64,2,1,1,0,0,0,7,4,2,1,64,128,16,90,90,117440512,171840634880,1463,0.284505,384.44,603999
1,CUTLASS,gemm,cutlass3x_sm90_tensorop_gemm_f16_f16_f32_f16_f16_128x128x64_2x1x1_0_ttn_align8_stream_k_warpspecialized_cooperative_epi_tma,passed,success,universal,4096,5120,4096,f16:row,f16:row,f16:column,f16:column,1,0,serial,1,1,heuristic,invalid,invalid,false,false,1,tensorop,f32,128,128,64,2,1,1,0,0,0,6,4,2,1,64,128,16,90,90,117440512,171840634880,1463,0.275484,397.029,623778
1,CUTLASS,gemm,cutlass3x_sm90_tensorop_gemm_f16_f16_f32_f16_f16_128x16x64_1x8x1_0_ttn_align8,passed,success,universal,4096,5120,4096,f16:row,f16:row,f16:column,f16:column,1,0,serial,1,1,heuristic,invalid,invalid,false,false,1,tensorop,f32,128,16,64,1,8,1,0,0,0,12,4,2,1,64,16,16,90,90,117440512,171840634880,1463,0.822228,133.023,208994
1,CUTLASS,gemm,cutlass3x_sm90_tensorop_gemm_f16_f16_f32_f16_f16_128x16x64_1x8x1_0_ttn_align8_warpspecialized_epi_nosmem,passed,success,universal,4096,5120,4096,f16:row,f16:row,f16:column,f16:column,1,0,serial,1,1,heuristic,invalid,invalid,false,false,1,tensorop,f32,128,16,64,1,8,1,0,0,0,12,4,1,1,64,16,16,90,90,117440512,171840634880,1463,0.761906,143.554,225540
1,CUTLASS,gemm,cutlass3x_sm90_tensorop_gemm_f16_f16_f32_f16_f16_128x16x64_1x8x1_0_ttn_align8_warpspecialized_pingpong_epi_tma,passed,success,universal,4096,5120,4096,f16:row,f16:row,f16:column,f16:column,1,0,serial,1,1,heuristic,invalid,invalid,false,false,1,tensorop,f32,128,16,64,1,8,1,0,0,0,12,4,1,1,64,16,16,90,90,117440512,171840634880,1463,0.646053,169.297,265985
1,CUTLASS,gemm,cutlass3x_sm90_tensorop_gemm_f16_f16_f32_f16_f16_128x16x64_1x8x1_0_ttn_align8_warpspecialized_pingpong_epi_nosmem,passed,success,universal,4096,5120,4096,f16:row,f16:row,f16:column,f16:column,1,0,serial,1,1,heuristic,invalid,invalid,false,false,1,tensorop,f32,128,16,64,1,8,1,0,0,0,12,4,1,1,64,16,16,90,90,117440512,171840634880,1463,0.648429,168.677,265011
1,CUTLASS,gemm,cutlass3x_sm90_tensorop_gemm_f16_f16_f32_f16_f16_128x16x64_1x8x1_0_ttn_align8_warpspecialized_cooperative_epi_nosmem,passed,success,universal,4096,5120,4096,f16:row,f16:row,f16:column,f16:column,1,0,serial,1,1,heuristic,invalid,invalid,false,false,1,tensorop,f32,128,16,64,1,8,1,0,0,0,12,4,2,1,64,16,16,90,90,117440512,171840634880,1463,0.811612,134.763,211728
1,CUTLASS,gemm,cutlass3x_sm90_tensorop_gemm_f16_f16_f32_f16_f16_128x16x64_1x8x1_0_ttn_align8_warpspecialized_cooperative_epi_tma,passed,success,universal,4096,5120,4096,f16:row,f16:row,f16:column,f16:column,1,0,serial,1,1,heuristic,invalid,invalid,false,false,1,tensorop,f32,128,16,64,1,8,1,0,0,0,12,4,2,1,64,16,16,90,90,117440512,171840634880,1463,0.822916,132.911,208819
1,CUTLASS,gemm,cutlass3x_sm90_tensorop_gemm_f16_f16_f32_f16_f16_128x16x64_1x8x1_0_ttn_align8_stream_k_warpspecialized_cooperative_epi_nosmem,passed,success,universal,4096,5120,4096,f16:row,f16:row,f16:column,f16:column,1,0,serial,1,1,heuristic,invalid,invalid,false,false,1,tensorop,f32,128,16,64,1,8,1,0,0,0,12,4,2,1,64,16,16,90,90,117440512,171840634880,1463,0.800014,136.716,214797
1,CUTLASS,gemm,cutlass3x_sm90_tensorop_gemm_f16_f16_f32_f16_f16_128x16x64_1x8x1_0_ttn_align8_stream_k_warpspecialized_cooperative_epi_tma,passed,success,universal,4096,5120,4096,f16:row,f16:row,f16:column,f16:column,1,0,serial,1,1,heuristic,invalid,invalid,false,false,1,tensorop,f32,128,16,64,1,8,1,0,0,0,12,4,2,1,64,16,16,90,90,117440512,171840634880,1463,0.82057,133.292,209416
1,CUTLASS,gemm,cutlass3x_sm90_tensorop_gemm_f16_f16_f32_f16_f16_64x64x256_1x1x1_0_ttn_align8,passed,success,universal,4096,5120,4096,f16:row,f16:row,f16:column,f16:column,1,0,serial,1,1,heuristic,invalid,invalid,false,false,1,tensorop,f32,64,64,256,1,1,1,0,0,0,3,4,1,1,64,64,16,90,90,117440512,171840634880,1463,0.616301,177.47,278826
1,CUTLASS,gemm,cutlass3x_sm90_tensorop_gemm_f16_f16_f32_f16_f16_64x64x256_1x1x1_0_ttn_align8_warpspecialized_epi_nosmem,passed,success,universal,4096,5120,4096,f16:row,f16:row,f16:column,f16:column,1,0,serial,1,1,heuristic,invalid,invalid,false,false,1,tensorop,f32,64,64,256,1,1,1,0,0,0,3,4,1,1,64,64,16,90,90,117440512,171840634880,1463,0.61298,178.431,280336
1,CUTLASS,gemm,cutlass3x_sm90_tensorop_gemm_f16_f16_f32_f16_f16_64x64x256_1x1x1_0_ttn_align8_warpspecialized_pingpong_epi_tma,passed,success,universal,4096,5120,4096,f16:row,f16:row,f16:column,f16:column,1,0,serial,1,1,heuristic,invalid,invalid,false,false,1,tensorop,f32,64,64,256,1,1,1,0,0,0,3,4,1,1,64,64,16,90,90,117440512,171840634880,1463,0.622982,175.567,275836
1,CUTLASS,gemm,cutlass3x_sm90_tensorop_gemm_f16_f16_f32_f16_f16_64x64x256_1x1x1_0_ttn_align8_warpspecialized_pingpong_epi_nosmem,passed,success,universal,4096,5120,4096,f16:row,f16:row,f16:column,f16:column,1,0,serial,1,1,heuristic,invalid,invalid,false,false,1,tensorop,f32,64,64,256,1,1,1,0,0,0,3,4,1,1,64,64,16,90,90,117440512,171840634880,1463,0.614291,178.051,279738
1,CUTLASS,gemm,cutlass3x_sm90_tensorop_gemm_f16_f16_f32_f16_f16_128x16x64_4x2x1_0_ttn_align8,passed,success,universal,4096,5120,4096,f16:row,f16:row,f16:column,f16:column,1,0,serial,1,1,heuristic,invalid,invalid,false,false,1,tensorop,f32,128,16,64,4,2,1,0,0,0,12,4,2,1,64,16,16,90,90,117440512,171840634880,1463,0.855269,127.884,200920
1,CUTLASS,gemm,cutlass3x_sm90_tensorop_gemm_f16_f16_f32_f16_f16_128x16x64_4x2x1_0_ttn_align8_warpspecialized_epi_nosmem,passed,success,universal,4096,5120,4096,f16:row,f16:row,f16:column,f16:column,1,0,serial,1,1,heuristic,invalid,invalid,false,false,1,tensorop,f32,128,16,64,4,2,1,0,0,0,12,4,1,1,64,16,16,90,90,117440512,171840634880,1463,1.20511,90.7592,142593
1,CUTLASS,gemm,cutlass3x_sm90_tensorop_gemm_f16_f16_f32_f16_f16_128x16x64_4x2x1_0_ttn_align8_warpspecialized_pingpong_epi_tma,passed,success,universal,4096,5120,4096,f16:row,f16:row,f16:column,f16:column,1,0,serial,1,1,heuristic,invalid,invalid,false,false,1,tensorop,f32,128,16,64,4,2,1,0,0,0,12,4,1,1,64,16,16,90,90,117440512,171840634880,1463,0.846549,129.201,202989
1,CUTLASS,gemm,cutlass3x_sm90_tensorop_gemm_f16_f16_f32_f16_f16_128x16x64_4x2x1_0_ttn_align8_warpspecialized_pingpong_epi_nosmem,passed,success,universal,4096,5120,4096,f16:row,f16:row,f16:column,f16:column,1,0,serial,1,1,heuristic,invalid,invalid,false,false,1,tensorop,f32,128,16,64,4,2,1,0,0,0,12,4,1,1,64,16,16,90,90,117440512,171840634880,1463,0.851274,128.484,201863
1,CUTLASS,gemm,cutlass3x_sm90_tensorop_gemm_f16_f16_f32_f16_f16_128x16x64_4x2x1_0_ttn_align8_warpspecialized_cooperative_epi_nosmem,passed,success,universal,4096,5120,4096,f16:row,f16:row,f16:column,f16:column,1,0,serial,1,1,heuristic,invalid,invalid,false,false,1,tensorop,f32,128,16,64,4,2,1,0,0,0,12,4,2,1,64,16,16,90,90,117440512,171840634880,1463,0.857824,127.503,200322
1,CUTLASS,gemm,cutlass3x_sm90_tensorop_gemm_f16_f16_f32_f16_f16_128x16x64_4x2x1_0_ttn_align8_warpspecialized_cooperative_epi_tma,passed,success,universal,4096,5120,4096,f16:row,f16:row,f16:column,f16:column,1,0,serial,1,1,heuristic,invalid,invalid,false,false,1,tensorop,f32,128,16,64,4,2,1,0,0,0,12,4,2,1,64,16,16,90,90,117440512,171840634880,1463,0.874073,125.133,196598
1,CUTLASS,gemm,cutlass3x_sm90_tensorop_gemm_f16_f16_f32_f16_f16_128x16x64_4x2x1_0_ttn_align8_stream_k_warpspecialized_cooperative_epi_nosmem,passed,success,universal,4096,5120,4096,f16:row,f16:row,f16:column,f16:column,1,0,serial,1,1,heuristic,invalid,invalid,false,false,1,tensorop,f32,128,16,64,4,2,1,0,0,0,12,4,2,1,64,16,16,90,90,117440512,171840634880,1463,0.869546,125.784,197621
1,CUTLASS,gemm,cutlass3x_sm90_tensorop_gemm_f16_f16_f32_f16_f16_128x16x64_4x2x1_0_ttn_align8_stream_k_warpspecialized_cooperative_epi_tma,passed,success,universal,4096,5120,4096,f16:row,f16:row,f16:column,f16:column,1,0,serial,1,1,heuristic,invalid,invalid,false,false,1,tensorop,f32,128,16,64,4,2,1,0,0,0,12,4,2,1,64,16,16,90,90,117440512,171840634880,1463,0.892987,122.482,192434
1,CUTLASS,gemm,cutlass3x_sm90_tensorop_gemm_f16_f16_f32_f16_f16_128x128x128_1x8x1_0_ttn_align8,passed,success,universal,4096,5120,4096,f16:row,f16:row,f16:column,f16:column,1,0,serial,1,1,heuristic,invalid,invalid,false,false,1,tensorop,f32,128,128,128,1,8,1,0,0,0,3,4,2,1,64,128,16,90,90,117440512,171840634880,1463,0.277851,393.646,618463
1,CUTLASS,gemm,cutlass3x_sm90_tensorop_gemm_f16_f16_f32_f16_f16_128x128x128_1x8x1_0_ttn_align8_warpspecialized_epi_nosmem,passed,success,universal,4096,5120,4096,f16:row,f16:row,f16:column,f16:column,1,0,serial,1,1,heuristic,invalid,invalid,false,false,1,tensorop,f32,128,128,128,1,8,1,0,0,0,3,4,1,1,64,128,16,90,90,117440512,171840634880,1463,0.284435,384.534,604148
1,CUTLASS,gemm,cutlass3x_sm90_tensorop_gemm_f16_f16_f32_f16_f16_128x128x128_1x8x1_0_ttn_align8_warpspecialized_pingpong_epi_tma,passed,success,universal,4096,5120,4096,f16:row,f16:row,f16:column,f16:column,1,0,serial,1,1,heuristic,invalid,invalid,false,false,1,tensorop,f32,128,128,128,1,8,1,0,0,0,3,4,1,1,64,128,16,90,90,117440512,171840634880,1463,0.258762,422.685,664087
1,CUTLASS,gemm,cutlass3x_sm90_tensorop_gemm_f16_f16_f32_f16_f16_128x128x128_1x8x1_0_ttn_align8_warpspecialized_pingpong_epi_nosmem,passed,success,universal,4096,5120,4096,f16:row,f16:row,f16:column,f16:column,1,0,serial,1,1,heuristic,invalid,invalid,false,false,1,tensorop,f32,128,128,128,1,8,1,0,0,0,3,4,1,1,64,128,16,90,90,117440512,171840634880,1463,0.261631,418.051,656805
1,CUTLASS,gemm,cutlass3x_sm90_tensorop_gemm_f16_f16_f32_f16_f16_128x128x128_1x8x1_0_ttn_align8_warpspecialized_cooperative_epi_nosmem,passed,success,universal,4096,5120,4096,f16:row,f16:row,f16:column,f16:column,1,0,serial,1,1,heuristic,invalid,invalid,false,false,1,tensorop,f32,128,128,128,1,8,1,0,0,0,3,4,2,1,64,128,16,90,90,117440512,171840634880,1463,0.278367,392.916,617317
1,CUTLASS,gemm,cutlass3x_sm90_tensorop_gemm_f16_f16_f32_f16_f16_128x128x128_1x8x1_0_ttn_align8_warpspecialized_cooperative_epi_tma,passed,success,universal,4096,5120,4096,f16:row,f16:row,f16:column,f16:column,1,0,serial,1,1,heuristic,invalid,invalid,false,false,1,tensorop,f32,128,128,128,1,8,1,0,0,0,3,4,2,1,64,128,16,90,90,117440512,171840634880,1463,0.269245,406.228,638230
1,CUTLASS,gemm,cutlass3x_sm90_tensorop_gemm_f16_f16_f32_f16_f16_128x128x128_1x8x1_0_ttn_align8_stream_k_warpspecialized_cooperative_epi_nosmem,passed,success,universal,4096,5120,4096,f16:row,f16:row,f16:column,f16:column,1,0,serial,1,1,heuristic,invalid,invalid,false,false,1,tensorop,f32,128,128,128,1,8,1,0,0,0,3,4,2,1,64,128,16,90,90,117440512,171840634880,1463,0.287626,380.268,597444
1,CUTLASS,gemm,cutlass3x_sm90_tensorop_gemm_f16_f16_f32_f16_f16_128x128x128_1x8x1_0_ttn_align8_stream_k_warpspecialized_cooperative_epi_tma,passed,success,universal,4096,5120,4096,f16:row,f16:row,f16:column,f16:column,1,0,serial,1,1,heuristic,invalid,invalid,false,false,1,tensorop,f32,128,128,128,1,8,1,0,0,0,3,4,2,1,64,128,16,90,90,117440512,171840634880,1463,0.274081,399.061,626970
1,CUTLASS,gemm,cutlass3x_sm90_tensorop_gemm_f16_f16_f32_f16_f16_128x128x128_8x1x1_0_ttn_align8,passed,success,universal,4096,5120,4096,f16:row,f16:row,f16:column,f16:column,1,0,serial,1,1,heuristic,invalid,invalid,false,false,1,tensorop,f32,128,128,128,8,1,1,0,0,0,3,4,2,1,64,128,16,90,90,117440512,171840634880,1463,0.304932,358.686,563537
1,CUTLASS,gemm,cutlass3x_sm90_tensorop_gemm_f16_f16_f32_f16_f16_128x128x128_8x1x1_0_ttn_align8_warpspecialized_epi_nosmem,passed,success,universal,4096,5120,4096,f16:row,f16:row,f16:column,f16:column,1,0,serial,1,1,heuristic,invalid,invalid,false,false,1,tensorop,f32,128,128,128,8,1,1,0,0,0,3,4,1,1,64,128,16,90,90,117440512,171840634880,1463,0.308056,355.049,557822
1,CUTLASS,gemm,cutlass3x_sm90_tensorop_gemm_f16_f16_f32_f16_f16_128x128x128_8x1x1_0_ttn_align8_warpspecialized_pingpong_epi_tma,passed,success,universal,4096,5120,4096,f16:row,f16:row,f16:column,f16:column,1,0,serial,1,1,heuristic,invalid,invalid,false,false,1,tensorop,f32,128,128,128,8,1,1,0,0,0,3,4,1,1,64,128,16,90,90,117440512,171840634880,1463,0.283219,386.185,606741
1,CUTLASS,gemm,cutlass3x_sm90_tensorop_gemm_f16_f16_f32_f16_f16_128x128x128_8x1x1_0_ttn_align8_warpspecialized_pingpong_epi_nosmem,passed,success,universal,4096,5120,4096,f16:row,f16:row,f16:column,f16:column,1,0,serial,1,1,heuristic,invalid,invalid,false,false,1,tensorop,f32,128,128,128,8,1,1,0,0,0,3,4,1,1,64,128,16,90,90,117440512,171840634880,1463,0.285924,382.531,601001
1,CUTLASS,gemm,cutlass3x_sm90_tensorop_gemm_f16_f16_f32_f16_f16_128x128x128_8x1x1_0_ttn_align8_warpspecialized_cooperative_epi_nosmem,passed,success,universal,4096,5120,4096,f16:row,f16:row,f16:column,f16:column,1,0,serial,1,1,heuristic,invalid,invalid,false,false,1,tensorop,f32,128,128,128,8,1,1,0,0,0,3,4,2,1,64,128,16,90,90,117440512,171840634880,1463,0.301108,363.241,570693
1,CUTLASS,gemm,cutlass3x_sm90_tensorop_gemm_f16_f16_f32_f16_f16_128x128x128_8x1x1_0_ttn_align8_warpspecialized_cooperative_epi_tma,passed,success,universal,4096,5120,4096,f16:row,f16:row,f16:column,f16:column,1,0,serial,1,1,heuristic,invalid,invalid,false,false,1,tensorop,f32,128,128,128,8,1,1,0,0,0,3,4,2,1,64,128,16,90,90,117440512,171840634880,1463,0.2913,375.472,589909
1,CUTLASS,gemm,cutlass3x_sm90_tensorop_gemm_f16_f16_f32_f16_f16_128x128x128_8x1x1_0_ttn_align8_stream_k_warpspecialized_cooperative_epi_nosmem,passed,success,universal,4096,5120,4096,f16:row,f16:row,f16:column,f16:column,1,0,serial,1,1,heuristic,invalid,invalid,false,false,1,tensorop,f32,128,128,128,8,1,1,0,0,0,3,4,2,1,64,128,16,90,90,117440512,171840634880,1463,0.305085,358.507,563255
1,CUTLASS,gemm,cutlass3x_sm90_tensorop_gemm_f16_f16_f32_f16_f16_128x128x128_8x1x1_0_ttn_align8_stream_k_warpspecialized_cooperative_epi_tma,passed,success,universal,4096,5120,4096,f16:row,f16:row,f16:column,f16:column,1,0,serial,1,1,heuristic,invalid,invalid,false,false,1,tensorop,f32,128,128,128,8,1,1,0,0,0,3,4,2,1,64,128,16,90,90,117440512,171840634880,1463,0.296744,368.583,579087
1,CUTLASS,gemm,cutlass3x_sm90_tensorop_gemm_f16_f16_f32_f16_f16_128x128x128_4x1x1_0_ttn_align8,passed,success,universal,4096,5120,4096,f16:row,f16:row,f16:column,f16:column,1,0,serial,1,1,heuristic,invalid,invalid,false,false,1,tensorop,f32,128,128,128,4,1,1,0,0,0,3,4,2,1,64,128,16,90,90,117440512,171840634880,1463,0.287088,380.981,598565
1,CUTLASS,gemm,cutlass3x_sm90_tensorop_gemm_f16_f16_f32_f16_f16_128x128x128_4x1x1_0_ttn_align8_warpspecialized_epi_nosmem,passed,success,universal,4096,5120,4096,f16:row,f16:row,f16:column,f16:column,1,0,serial,1,1,heuristic,invalid,invalid,false,false,1,tensorop,f32,128,128,128,4,1,1,0,0,0,3,4,1,1,64,128,16,90,90,117440512,171840634880,1463,0.299892,364.714,573008
1,CUTLASS,gemm,cutlass3x_sm90_tensorop_gemm_f16_f16_f32_f16_f16_128x128x128_4x1x1_0_ttn_align8_warpspecialized_pingpong_epi_tma,passed,success,universal,4096,5120,4096,f16:row,f16:row,f16:column,f16:column,1,0,serial,1,1,heuristic,invalid,invalid,false,false,1,tensorop,f32,128,128,128,4,1,1,0,0,0,3,4,1,1,64,128,16,90,90,117440512,171840634880,1463,0.270344,404.577,635636
1,CUTLASS,gemm,cutlass3x_sm90_tensorop_gemm_f16_f16_f32_f16_f16_128x128x128_4x1x1_0_ttn_align8_warpspecialized_pingpong_epi_nosmem,passed,success,universal,4096,5120,4096,f16:row,f16:row,f16:column,f16:column,1,0,serial,1,1,heuristic,invalid,invalid,false,false,1,tensorop,f32,128,128,128,4,1,1,0,0,0,3,4,1,1,64,128,16,90,90,117440512,171840634880,1463,0.275907,396.42,622822
1,CUTLASS,gemm,cutlass3x_sm90_tensorop_gemm_f16_f16_f32_f16_f16_128x128x128_4x1x1_0_ttn_align8_warpspecialized_cooperative_epi_nosmem,passed,success,universal,4096,5120,4096,f16:row,f16:row,f16:column,f16:column,1,0,serial,1,1,heuristic,invalid,invalid,false,false,1,tensorop,f32,128,128,128,4,1,1,0,0,0,3,4,2,1,64,128,16,90,90,117440512,171840634880,1463,0.290283,376.788,591976
1,CUTLASS,gemm,cutlass3x_sm90_tensorop_gemm_f16_f16_f32_f16_f16_128x128x128_4x1x1_0_ttn_align8_warpspecialized_cooperative_epi_tma,passed,success,universal,4096,5120,4096,f16:row,f16:row,f16:column,f16:column,1,0,serial,1,1,heuristic,invalid,invalid,false,false,1,tensorop,f32,128,128,128,4,1,1,0,0,0,3,4,2,1,64,128,16,90,90,117440512,171840634880,1463,0.278099,393.295,617912
1,CUTLASS,gemm,cutlass3x_sm90_tensorop_gemm_f16_f16_f32_f16_f16_128x128x128_4x1x1_0_ttn_align8_stream_k_warpspecialized_cooperative_epi_nosmem,passed,success,universal,4096,5120,4096,f16:row,f16:row,f16:column,f16:column,1,0,serial,1,1,heuristic,invalid,invalid,false,false,1,tensorop,f32,128,128,128,4,1,1,0,0,0,3,4,2,1,64,128,16,90,90,117440512,171840634880,1463,0.29593,369.598,580680
1,CUTLASS,gemm,cutlass3x_sm90_tensorop_gemm_f16_f16_f32_f16_f16_128x128x128_4x1x1_0_ttn_align8_stream_k_warpspecialized_cooperative_epi_tma,passed,success,universal,4096,5120,4096,f16:row,f16:row,f16:column,f16:column,1,0,serial,1,1,heuristic,invalid,invalid,false,false,1,tensorop,f32,128,128,128,4,1,1,0,0,0,3,4,2,1,64,128,16,90,90,117440512,171840634880,1463,0.286001,382.429,600839
1,CUTLASS,gemm,cutlass3x_sm90_tensorop_gemm_f16_f16_f32_f16_f16_128x128x128_1x4x1_0_ttn_align8,passed,success,universal,4096,5120,4096,f16:row,f16:row,f16:column,f16:column,1,0,serial,1,1,heuristic,invalid,invalid,false,false,1,tensorop,f32,128,128,128,1,4,1,0,0,0,3,4,2,1,64,128,16,90,90,117440512,171840634880,1463,0.282005,387.848,609353
1,CUTLASS,gemm,cutlass3x_sm90_tensorop_gemm_f16_f16_f32_f16_f16_128x128x128_1x4x1_0_ttn_align8_warpspecialized_epi_nosmem,passed,success,universal,4096,5120,4096,f16:row,f16:row,f16:column,f16:column,1,0,serial,1,1,heuristic,invalid,invalid,false,false,1,tensorop,f32,128,128,128,1,4,1,0,0,0,3,4,1,1,64,128,16,90,90,117440512,171840634880,1463,0.290288,376.781,591966
1,CUTLASS,gemm,cutlass3x_sm90_tensorop_gemm_f16_f16_f32_f16_f16_128x128x128_1x4x1_0_ttn_align8_warpspecialized_pingpong_epi_tma,passed,success,universal,4096,5120,4096,f16:row,f16:row,f16:column,f16:column,1,0,serial,1,1,heuristic,invalid,invalid,false,false,1,tensorop,f32,128,128,128,1,4,1,0,0,0,3,4,1,1,64,128,16,90,90,117440512,171840634880,1463,0.269716,405.519,637117
1,CUTLASS,gemm,cutlass3x_sm90_tensorop_gemm_f16_f16_f32_f16_f16_128x128x128_1x4x1_0_ttn_align8_warpspecialized_pingpong_epi_nosmem,passed,success,universal,4096,5120,4096,f16:row,f16:row,f16:column,f16:column,1,0,serial,1,1,heuristic,invalid,invalid,false,false,1,tensorop,f32,128,128,128,1,4,1,0,0,0,3,4,1,1,64,128,16,90,90,117440512,171840634880,1463,0.272184,401.842,631339
1,CUTLASS,gemm,cutlass3x_sm90_tensorop_gemm_f16_f16_f32_f16_f16_128x128x128_1x4x1_0_ttn_align8_warpspecialized_cooperative_epi_nosmem,passed,success,universal,4096,5120,4096,f16:row,f16:row,f16:column,f16:column,1,0,serial,1,1,heuristic,invalid,invalid,false,false,1,tensorop,f32,128,128,128,1,4,1,0,0,0,3,4,2,1,64,128,16,90,90,117440512,171840634880,1463,0.283403,385.935,606348
1,CUTLASS,gemm,cutlass3x_sm90_tensorop_gemm_f16_f16_f32_f16_f16_128x128x128_1x4x1_0_ttn_align8_warpspecialized_cooperative_epi_tma,passed,success,universal,4096,5120,4096,f16:row,f16:row,f16:column,f16:column,1,0,serial,1,1,heuristic,invalid,invalid,false,false,1,tensorop,f32,128,128,128,1,4,1,0,0,0,3,4,2,1,64,128,16,90,90,117440512,171840634880,1463,0.275763,396.627,623146
1,CUTLASS,gemm,cutlass3x_sm90_tensorop_gemm_f16_f16_f32_f16_f16_128x128x128_1x4x1_0_ttn_align8_stream_k_warpspecialized_cooperative_epi_nosmem,passed,success,universal,4096,5120,4096,f16:row,f16:row,f16:column,f16:column,1,0,serial,1,1,heuristic,invalid,invalid,false,false,1,tensorop,f32,128,128,128,1,4,1,0,0,0,3,4,2,1,64,128,16,90,90,117440512,171840634880,1463,0.290089,377.039,592372
1,CUTLASS,gemm,cutlass3x_sm90_tensorop_gemm_f16_f16_f32_f16_f16_128x128x128_1x4x1_0_ttn_align8_stream_k_warpspecialized_cooperative_epi_tma,passed,success,universal,4096,5120,4096,f16:row,f16:row,f16:column,f16:column,1,0,serial,1,1,heuristic,invalid,invalid,false,false,1,tensorop,f32,128,128,128,1,4,1,0,0,0,3,4,2,1,64,128,16,90,90,117440512,171840634880,1463,0.280596,389.796,612414
1,CUTLASS,gemm,cutlass3x_sm90_tensorop_gemm_f16_f16_f32_f16_f16_128x128x128_2x1x1_0_ttn_align8,passed,success,universal,4096,5120,4096,f16:row,f16:row,f16:column,f16:column,1,0,serial,1,1,heuristic,invalid,invalid,false,false,1,tensorop,f32,128,128,128,2,1,1,0,0,0,3,4,2,1,64,128,16,90,90,117440512,171840634880,1463,0.303842,359.973,565559
1,CUTLASS,gemm,cutlass3x_sm90_tensorop_gemm_f16_f16_f32_f16_f16_128x128x128_2x1x1_0_ttn_align8_warpspecialized_epi_nosmem,passed,success,universal,4096,5120,4096,f16:row,f16:row,f16:column,f16:column,1,0,serial,1,1,heuristic,invalid,invalid,false,false,1,tensorop,f32,128,128,128,2,1,1,0,0,0,3,4,1,1,64,128,16,90,90,117440512,171840634880,1463,0.322908,338.719,532166
1,CUTLASS,gemm,cutlass3x_sm90_tensorop_gemm_f16_f16_f32_f16_f16_128x128x128_2x1x1_0_ttn_align8_warpspecialized_pingpong_epi_tma,passed,success,universal,4096,5120,4096,f16:row,f16:row,f16:column,f16:column,1,0,serial,1,1,heuristic,invalid,invalid,false,false,1,tensorop,f32,128,128,128,2,1,1,0,0,0,3,4,1,1,64,128,16,90,90,117440512,171840634880,1463,0.305322,358.229,562818
1,CUTLASS,gemm,cutlass3x_sm90_tensorop_gemm_f16_f16_f32_f16_f16_128x128x128_2x1x1_0_ttn_align8_warpspecialized_pingpong_epi_nosmem,passed,success,universal,4096,5120,4096,f16:row,f16:row,f16:column,f16:column,1,0,serial,1,1,heuristic,invalid,invalid,false,false,1,tensorop,f32,128,128,128,2,1,1,0,0,0,3,4,1,1,64,128,16,90,90,117440512,171840634880,1463,0.30177,362.445,569443
1,CUTLASS,gemm,cutlass3x_sm90_tensorop_gemm_f16_f16_f32_f16_f16_128x128x128_2x1x1_0_ttn_align8_warpspecialized_cooperative_epi_nosmem,passed,success,universal,4096,5120,4096,f16:row,f16:row,f16:column,f16:column,1,0,serial,1,1,heuristic,invalid,invalid,false,false,1,tensorop,f32,128,128,128,2,1,1,0,0,0,3,4,2,1,64,128,16,90,90,117440512,171840634880,1463,0.304529,359.161,564283
1,CUTLASS,gemm,cutlass3x_sm90_tensorop_gemm_f16_f16_f32_f16_f16_128x128x128_2x1x1_0_ttn_align8_warpspecialized_cooperative_epi_tma,passed,success,universal,4096,5120,4096,f16:row,f16:row,f16:column,f16:column,1,0,serial,1,1,heuristic,invalid,invalid,false,false,1,tensorop,f32,128,128,128,2,1,1,0,0,0,3,4,2,1,64,128,16,90,90,117440512,171840634880,1463,0.300048,364.525,572710
1,CUTLASS,gemm,cutlass3x_sm90_tensorop_gemm_f16_f16_f32_f16_f16_128x128x128_2x1x1_0_ttn_align8_stream_k_warpspecialized_cooperative_epi_nosmem,passed,success,universal,4096,5120,4096,f16:row,f16:row,f16:column,f16:column,1,0,serial,1,1,heuristic,invalid,invalid,false,false,1,tensorop,f32,128,128,128,2,1,1,0,0,0,3,4,2,1,64,128,16,90,90,117440512,171840634880,1463,0.309982,352.843,554357
1,CUTLASS,gemm,cutlass3x_sm90_tensorop_gemm_f16_f16_f32_f16_f16_128x128x128_2x1x1_0_ttn_align8_stream_k_warpspecialized_cooperative_epi_tma,passed,success,universal,4096,5120,4096,f16:row,f16:row,f16:column,f16:column,1,0,serial,1,1,heuristic,invalid,invalid,false,false,1,tensorop,f32,128,128,128,2,1,1,0,0,0,3,4,2,1,64,128,16,90,90,117440512,171840634880,1463,0.304382,359.335,564556
1,CUTLASS,gemm,cutlass3x_sm90_tensorop_gemm_f16_f16_f32_f16_f16_128x128x128_1x2x1_0_ttn_align8,passed,success,universal,4096,5120,4096,f16:row,f16:row,f16:column,f16:column,1,0,serial,1,1,heuristic,invalid,invalid,false,false,1,tensorop,f32,128,128,128,1,2,1,0,0,0,3,4,2,1,64,128,16,90,90,117440512,171840634880,1463,0.273604,399.757,628064
1,CUTLASS,gemm,cutlass3x_sm90_tensorop_gemm_f16_f16_f32_f16_f16_128x128x128_1x2x1_0_ttn_align8_warpspecialized_epi_nosmem,passed,success,universal,4096,5120,4096,f16:row,f16:row,f16:column,f16:column,1,0,serial,1,1,heuristic,invalid,invalid,false,false,1,tensorop,f32,128,128,128,1,2,1,0,0,0,3,4,1,1,64,128,16,90,90,117440512,171840634880,1463,0.276917,394.973,620548
1,CUTLASS,gemm,cutlass3x_sm90_tensorop_gemm_f16_f16_f32_f16_f16_128x128x128_1x2x1_0_ttn_align8_warpspecialized_pingpong_epi_tma,passed,success,universal,4096,5120,4096,f16:row,f16:row,f16:column,f16:column,1,0,serial,1,1,heuristic,invalid,invalid,false,false,1,tensorop,f32,128,128,128,1,2,1,0,0,0,3,4,1,1,64,128,16,90,90,117440512,171840634880,1463,0.253113,432.119,678908
1,CUTLASS,gemm,cutlass3x_sm90_tensorop_gemm_f16_f16_f32_f16_f16_128x128x128_1x2x1_0_ttn_align8_warpspecialized_pingpong_epi_nosmem,passed,success,universal,4096,5120,4096,f16:row,f16:row,f16:column,f16:column,1,0,serial,1,1,heuristic,invalid,invalid,false,false,1,tensorop,f32,128,128,128,1,2,1,0,0,0,3,4,1,1,64,128,16,90,90,117440512,171840634880,1463,0.25751,424.741,667317
1,CUTLASS,gemm,cutlass3x_sm90_tensorop_gemm_f16_f16_f32_f16_f16_128x128x128_1x2x1_0_ttn_align8_warpspecialized_cooperative_epi_nosmem,passed,success,universal,4096,5120,4096,f16:row,f16:row,f16:column,f16:column,1,0,serial,1,1,heuristic,invalid,invalid,false,false,1,tensorop,f32,128,128,128,1,2,1,0,0,0,3,4,2,1,64,128,16,90,90,117440512,171840634880,1463,0.272591,401.242,630397
1,CUTLASS,gemm,cutlass3x_sm90_tensorop_gemm_f16_f16_f32_f16_f16_128x128x128_1x2x1_0_ttn_align8_warpspecialized_cooperative_epi_tma,passed,success,universal,4096,5120,4096,f16:row,f16:row,f16:column,f16:column,1,0,serial,1,1,heuristic,invalid,invalid,false,false,1,tensorop,f32,128,128,128,1,2,1,0,0,0,3,4,2,1,64,128,16,90,90,117440512,171840634880,1463,0.259282,421.839,662757
1,CUTLASS,gemm,cutlass3x_sm90_tensorop_gemm_f16_f16_f32_f16_f16_128x128x128_1x2x1_0_ttn_align8_stream_k_warpspecialized_cooperative_epi_nosmem,passed,success,universal,4096,5120,4096,f16:row,f16:row,f16:column,f16:column,1,0,serial,1,1,heuristic,invalid,invalid,false,false,1,tensorop,f32,128,128,128,1,2,1,0,0,0,3,4,2,1,64,128,16,90,90,117440512,171840634880,1463,0.287228,380.795,598272
1,CUTLASS,gemm,cutlass3x_sm90_tensorop_gemm_f16_f16_f32_f16_f16_128x128x128_1x2x1_0_ttn_align8_stream_k_warpspecialized_cooperative_epi_tma,passed,success,universal,4096,5120,4096,f16:row,f16:row,f16:column,f16:column,1,0,serial,1,1,heuristic,invalid,invalid,false,false,1,tensorop,f32,128,128,128,1,2,1,0,0,0,3,4,2,1,64,128,16,90,90,117440512,171840634880,1463,0.26405,414.22,650788
1,CUTLASS,gemm,cutlass3x_sm90_tensorop_gemm_f16_f16_f32_f16_f16_128x16x64_2x4x1_0_ttn_align8,passed,success,universal,4096,5120,4096,f16:row,f16:row,f16:column,f16:column,1,0,serial,1,1,heuristic,invalid,invalid,false,false,1,tensorop,f32,128,16,64,2,4,1,0,0,0,12,4,2,1,64,16,16,90,90,117440512,171840634880,1463,0.818761,133.586,209879
1,CUTLASS,gemm,cutlass3x_sm90_tensorop_gemm_f16_f16_f32_f16_f16_128x16x64_2x4x1_0_ttn_align8_warpspecialized_epi_nosmem,passed,success,universal,4096,5120,4096,f16:row,f16:row,f16:column,f16:column,1,0,serial,1,1,heuristic,invalid,invalid,false,false,1,tensorop,f32,128,16,64,2,4,1,0,0,0,12,4,1,1,64,16,16,90,90,117440512,171840634880,1463,0.997341,109.667,172299
1,CUTLASS,gemm,cutlass3x_sm90_tensorop_gemm_f16_f16_f32_f16_f16_128x16x64_2x4x1_0_ttn_align8_warpspecialized_pingpong_epi_tma,passed,success,universal,4096,5120,4096,f16:row,f16:row,f16:column,f16:column,1,0,serial,1,1,heuristic,invalid,invalid,false,false,1,tensorop,f32,128,16,64,2,4,1,0,0,0,12,4,1,1,64,16,16,90,90,117440512,171840634880,1463,0.752052,145.435,228496
1,CUTLASS,gemm,cutlass3x_sm90_tensorop_gemm_f16_f16_f32_f16_f16_128x16x64_2x4x1_0_ttn_align8_warpspecialized_pingpong_epi_nosmem,passed,success,universal,4096,5120,4096,f16:row,f16:row,f16:column,f16:column,1,0,serial,1,1,heuristic,invalid,invalid,false,false,1,tensorop,f32,128,16,64,2,4,1,0,0,0,12,4,1,1,64,16,16,90,90,117440512,171840634880,1463,0.769882,142.067,223204
1,CUTLASS,gemm,cutlass3x_sm90_tensorop_gemm_f16_f16_f32_f16_f16_128x16x64_2x4x1_0_ttn_align8_warpspecialized_cooperative_epi_nosmem,passed,success,universal,4096,5120,4096,f16:row,f16:row,f16:column,f16:column,1,0,serial,1,1,heuristic,invalid,invalid,false,false,1,tensorop,f32,128,16,64,2,4,1,0,0,0,12,4,2,1,64,16,16,90,90,117440512,171840634880,1463,0.819353,133.489,209727
1,CUTLASS,gemm,cutlass3x_sm90_tensorop_gemm_f16_f16_f32_f16_f16_128x16x64_2x4x1_0_ttn_align8_warpspecialized_cooperative_epi_tma,passed,success,universal,4096,5120,4096,f16:row,f16:row,f16:column,f16:column,1,0,serial,1,1,heuristic,invalid,invalid,false,false,1,tensorop,f32,128,16,64,2,4,1,0,0,0,12,4,2,1,64,16,16,90,90,117440512,171840634880,1463,0.845268,129.397,203297
1,CUTLASS,gemm,cutlass3x_sm90_tensorop_gemm_f16_f16_f32_f16_f16_128x16x64_2x4x1_0_ttn_align8_stream_k_warpspecialized_cooperative_epi_nosmem,passed,success,universal,4096,5120,4096,f16:row,f16:row,f16:column,f16:column,1,0,serial,1,1,heuristic,invalid,invalid,false,false,1,tensorop,f32,128,16,64,2,4,1,0,0,0,12,4,2,1,64,16,16,90,90,117440512,171840634880,1463,0.820146,133.36,209524
1,CUTLASS,gemm,cutlass3x_sm90_tensorop_gemm_f16_f16_f32_f16_f16_128x16x64_2x4x1_0_ttn_align8_stream_k_warpspecialized_cooperative_epi_tma,passed,success,universal,4096,5120,4096,f16:row,f16:row,f16:column,f16:column,1,0,serial,1,1,heuristic,invalid,invalid,false,false,1,tensorop,f32,128,16,64,2,4,1,0,0,0,12,4,2,1,64,16,16,90,90,117440512,171840634880,1463,0.857278,127.584,200449
1,CUTLASS,gemm,cutlass3x_sm90_tensorop_gemm_f16_f16_f32_f16_f16_128x16x64_4x1x1_0_ttn_align8,passed,success,universal,4096,5120,4096,f16:row,f16:row,f16:column,f16:column,1,0,serial,1,1,heuristic,invalid,invalid,false,false,1,tensorop,f32,128,16,64,4,1,1,0,0,0,12,4,2,1,64,16,16,90,90,117440512,171840634880,1463,1.49142,73.3363,115220
1,CUTLASS,gemm,cutlass3x_sm90_tensorop_gemm_f16_f16_f32_f16_f16_128x16x64_4x1x1_0_ttn_align8_warpspecialized_epi_nosmem,passed,success,universal,4096,5120,4096,f16:row,f16:row,f16:column,f16:column,1,0,serial,1,1,heuristic,invalid,invalid,false,false,1,tensorop,f32,128,16,64,4,1,1,0,0,0,12,4,1,1,64,16,16,90,90,117440512,171840634880,1463,1.55387,70.3886,110589
1,CUTLASS,gemm,cutlass3x_sm90_tensorop_gemm_f16_f16_f32_f16_f16_128x16x64_4x1x1_0_ttn_align8_warpspecialized_pingpong_epi_tma,passed,success,universal,4096,5120,4096,f16:row,f16:row,f16:column,f16:column,1,0,serial,1,1,heuristic,invalid,invalid,false,false,1,tensorop,f32,128,16,64,4,1,1,0,0,0,12,4,1,1,64,16,16,90,90,117440512,171840634880,1463,1.47883,73.9604,116200
1,CUTLASS,gemm,cutlass3x_sm90_tensorop_gemm_f16_f16_f32_f16_f16_128x16x64_4x1x1_0_ttn_align8_warpspecialized_pingpong_epi_nosmem,passed,success,universal,4096,5120,4096,f16:row,f16:row,f16:column,f16:column,1,0,serial,1,1,heuristic,invalid,invalid,false,false,1,tensorop,f32,128,16,64,4,1,1,0,0,0,12,4,1,1,64,16,16,90,90,117440512,171840634880,1463,1.48696,73.556,115565
1,CUTLASS,gemm,cutlass3x_sm90_tensorop_gemm_f16_f16_f32_f16_f16_128x16x64_4x1x1_0_ttn_align8_warpspecialized_cooperative_epi_nosmem,passed,success,universal,4096,5120,4096,f16:row,f16:row,f16:column,f16:column,1,0,serial,1,1,heuristic,invalid,invalid,false,false,1,tensorop,f32,128,16,64,4,1,1,0,0,0,12,4,2,1,64,16,16,90,90,117440512,171840634880,1463,1.49007,73.4024,115324
1,CUTLASS,gemm,cutlass3x_sm90_tensorop_gemm_f16_f16_f32_f16_f16_128x16x64_4x1x1_0_ttn_align8_warpspecialized_cooperative_epi_tma,passed,success,universal,4096,5120,4096,f16:row,f16:row,f16:column,f16:column,1,0,serial,1,1,heuristic,invalid,invalid,false,false,1,tensorop,f32,128,16,64,4,1,1,0,0,0,12,4,2,1,64,16,16,90,90,117440512,171840634880,1463,1.48714,73.5471,115551
1,CUTLASS,gemm,cutlass3x_sm90_tensorop_gemm_f16_f16_f32_f16_f16_128x16x64_4x1x1_0_ttn_align8_stream_k_warpspecialized_cooperative_epi_nosmem,passed,success,universal,4096,5120,4096,f16:row,f16:row,f16:column,f16:column,1,0,serial,1,1,heuristic,invalid,invalid,false,false,1,tensorop,f32,128,16,64,4,1,1,0,0,0,12,4,2,1,64,16,16,90,90,117440512,171840634880,1463,1.51451,72.2182,113463
1,CUTLASS,gemm,cutlass3x_sm90_tensorop_gemm_f16_f16_f32_f16_f16_128x16x64_4x1x1_0_ttn_align8_stream_k_warpspecialized_cooperative_epi_tma,passed,success,universal,4096,5120,4096,f16:row,f16:row,f16:column,f16:column,1,0,serial,1,1,heuristic,invalid,invalid,false,false,1,tensorop,f32,128,16,64,4,1,1,0,0,0,12,4,2,1,64,16,16,90,90,117440512,171840634880,1463,1.51248,72.3152,113616
1,CUTLASS,gemm,cutlass3x_sm90_tensorop_gemm_f16_f16_f32_f16_f16_128x16x64_1x4x1_0_ttn_align8,passed,success,universal,4096,5120,4096,f16:row,f16:row,f16:column,f16:column,1,0,serial,1,1,heuristic,invalid,invalid,false,false,1,tensorop,f32,128,16,64,1,4,1,0,0,0,12,4,2,1,64,16,16,90,90,117440512,171840634880,1463,0.795202,137.544,216097
1,CUTLASS,gemm,cutlass3x_sm90_tensorop_gemm_f16_f16_f32_f16_f16_128x16x64_1x4x1_0_ttn_align8_warpspecialized_epi_nosmem,passed,success,universal,4096,5120,4096,f16:row,f16:row,f16:column,f16:column,1,0,serial,1,1,heuristic,invalid,invalid,false,false,1,tensorop,f32,128,16,64,1,4,1,0,0,0,12,4,1,1,64,16,16,90,90,117440512,171840634880,1463,0.815724,134.083,210660
1,CUTLASS,gemm,cutlass3x_sm90_tensorop_gemm_f16_f16_f32_f16_f16_128x16x64_1x4x1_0_ttn_align8_warpspecialized_pingpong_epi_tma,passed,success,universal,4096,5120,4096,f16:row,f16:row,f16:column,f16:column,1,0,serial,1,1,heuristic,invalid,invalid,false,false,1,tensorop,f32,128,16,64,1,4,1,0,0,0,12,4,1,1,64,16,16,90,90,117440512,171840634880,1463,0.671492,162.884,255909
1,CUTLASS,gemm,cutlass3x_sm90_tensorop_gemm_f16_f16_f32_f16_f16_128x16x64_1x4x1_0_ttn_align8_warpspecialized_pingpong_epi_nosmem,passed,success,universal,4096,5120,4096,f16:row,f16:row,f16:column,f16:column,1,0,serial,1,1,heuristic,invalid,invalid,false,false,1,tensorop,f32,128,16,64,1,4,1,0,0,0,12,4,1,1,64,16,16,90,90,117440512,171840634880,1463,0.678455,161.212,253282
1,CUTLASS,gemm,cutlass3x_sm90_tensorop_gemm_f16_f16_f32_f16_f16_128x16x64_1x4x1_0_ttn_align8_warpspecialized_cooperative_epi_nosmem,passed,success,universal,4096,5120,4096,f16:row,f16:row,f16:column,f16:column,1,0,serial,1,1,heuristic,invalid,invalid,false,false,1,tensorop,f32,128,16,64,1,4,1,0,0,0,12,4,2,1,64,16,16,90,90,117440512,171840634880,1463,0.794987,137.581,216155
1,CUTLASS,gemm,cutlass3x_sm90_tensorop_gemm_f16_f16_f32_f16_f16_128x16x64_1x4x1_0_ttn_align8_warpspecialized_cooperative_epi_tma,passed,success,universal,4096,5120,4096,f16:row,f16:row,f16:column,f16:column,1,0,serial,1,1,heuristic,invalid,invalid,false,false,1,tensorop,f32,128,16,64,1,4,1,0,0,0,12,4,2,1,64,16,16,90,90,117440512,171840634880,1463,0.795598,137.475,215989
1,CUTLASS,gemm,cutlass3x_sm90_tensorop_gemm_f16_f16_f32_f16_f16_128x16x64_1x4x1_0_ttn_align8_stream_k_warpspecialized_cooperative_epi_nosmem,passed,success,universal,4096,5120,4096,f16:row,f16:row,f16:column,f16:column,1,0,serial,1,1,heuristic,invalid,invalid,false,false,1,tensorop,f32,128,16,64,1,4,1,0,0,0,12,4,2,1,64,16,16,90,90,117440512,171840634880,1463,0.794552,137.656,216274
1,CUTLASS,gemm,cutlass3x_sm90_tensorop_gemm_f16_f16_f32_f16_f16_128x16x64_1x4x1_0_ttn_align8_stream_k_warpspecialized_cooperative_epi_tma,passed,success,universal,4096,5120,4096,f16:row,f16:row,f16:column,f16:column,1,0,serial,1,1,heuristic,invalid,invalid,false,false,1,tensorop,f32,128,16,64,1,4,1,0,0,0,12,4,2,1,64,16,16,90,90,117440512,171840634880,1463,0.805176,135.84,213420
1,CUTLASS,gemm,cutlass3x_sm90_tensorop_gemm_f16_f16_f32_f16_f16_128x16x64_2x2x1_0_ttn_align8,passed,success,universal,4096,5120,4096,f16:row,f16:row,f16:column,f16:column,1,0,serial,1,1,heuristic,invalid,invalid,false,false,1,tensorop,f32,128,16,64,2,2,1,0,0,0,12,4,2,1,64,16,16,90,90,117440512,171840634880,1463,0.941034,116.229,182608
1,CUTLASS,gemm,cutlass3x_sm90_tensorop_gemm_f16_f16_f32_f16_f16_128x16x64_2x2x1_0_ttn_align8_warpspecialized_epi_nosmem,passed,success,universal,4096,5120,4096,f16:row,f16:row,f16:column,f16:column,1,0,serial,1,1,heuristic,invalid,invalid,false,false,1,tensorop,f32,128,16,64,2,2,1,0,0,0,12,4,1,1,64,16,16,90,90,117440512,171840634880,1463,1.13811,96.1019,150987
1,CUTLASS,gemm,cutlass3x_sm90_tensorop_gemm_f16_f16_f32_f16_f16_128x16x64_2x2x1_0_ttn_align8_warpspecialized_pingpong_epi_tma,passed,success,universal,4096,5120,4096,f16:row,f16:row,f16:column,f16:column,1,0,serial,1,1,heuristic,invalid,invalid,false,false,1,tensorop,f32,128,16,64,2,2,1,0,0,0,12,4,1,1,64,16,16,90,90,117440512,171840634880,1463,0.93597,116.857,183596
1,CUTLASS,gemm,cutlass3x_sm90_tensorop_gemm_f16_f16_f32_f16_f16_128x16x64_2x2x1_0_ttn_align8_warpspecialized_pingpong_epi_nosmem,passed,success,universal,4096,5120,4096,f16:row,f16:row,f16:column,f16:column,1,0,serial,1,1,heuristic,invalid,invalid,false,false,1,tensorop,f32,128,16,64,2,2,1,0,0,0,12,4,1,1,64,16,16,90,90,117440512,171840634880,1463,0.936999,116.729,183395
1,CUTLASS,gemm,cutlass3x_sm90_tensorop_gemm_f16_f16_f32_f16_f16_128x16x64_2x2x1_0_ttn_align8_warpspecialized_cooperative_epi_nosmem,passed,success,universal,4096,5120,4096,f16:row,f16:row,f16:column,f16:column,1,0,serial,1,1,heuristic,invalid,invalid,false,false,1,tensorop,f32,128,16,64,2,2,1,0,0,0,12,4,2,1,64,16,16,90,90,117440512,171840634880,1463,0.940171,116.335,182776
1,CUTLASS,gemm,cutlass3x_sm90_tensorop_gemm_f16_f16_f32_f16_f16_128x16x64_2x2x1_0_ttn_align8_warpspecialized_cooperative_epi_tma,passed,success,universal,4096,5120,4096,f16:row,f16:row,f16:column,f16:column,1,0,serial,1,1,heuristic,invalid,invalid,false,false,1,tensorop,f32,128,16,64,2,2,1,0,0,0,12,4,2,1,64,16,16,90,90,117440512,171840634880,1463,0.946912,115.507,181475
1,CUTLASS,gemm,cutlass3x_sm90_tensorop_gemm_f16_f16_f32_f16_f16_128x16x64_2x2x1_0_ttn_align8_stream_k_warpspecialized_cooperative_epi_nosmem,passed,success,universal,4096,5120,4096,f16:row,f16:row,f16:column,f16:column,1,0,serial,1,1,heuristic,invalid,invalid,false,false,1,tensorop,f32,128,16,64,2,2,1,0,0,0,12,4,2,1,64,16,16,90,90,117440512,171840634880,1463,0.942345,116.067,182354
1,CUTLASS,gemm,cutlass3x_sm90_tensorop_gemm_f16_f16_f32_f16_f16_128x16x64_2x2x1_0_ttn_align8_stream_k_warpspecialized_cooperative_epi_tma,passed,success,universal,4096,5120,4096,f16:row,f16:row,f16:column,f16:column,1,0,serial,1,1,heuristic,invalid,invalid,false,false,1,tensorop,f32,128,16,64,2,2,1,0,0,0,12,4,2,1,64,16,16,90,90,117440512,171840634880,1463,0.951984,114.892,180508
1,CUTLASS,gemm,cutlass3x_sm90_tensorop_gemm_f16_f16_f32_f16_f16_128x16x64_1x1x1_0_ttn_align8,passed,success,universal,4096,5120,4096,f16:row,f16:row,f16:column,f16:column,1,0,serial,1,1,heuristic,invalid,invalid,false,false,1,tensorop,f32,128,16,64,1,1,1,0,0,0,12,4,2,1,64,16,16,90,90,117440512,171840634880,1463,1.57913,69.2626,108819
1,CUTLASS,gemm,cutlass3x_sm90_tensorop_gemm_f16_f16_f32_f16_f16_128x16x64_1x1x1_0_ttn_align8_warpspecialized_epi_nosmem,passed,success,universal,4096,5120,4096,f16:row,f16:row,f16:column,f16:column,1,0,serial,1,1,heuristic,invalid,invalid,false,false,1,tensorop,f32,128,16,64,1,1,1,0,0,0,12,4,1,1,64,16,16,90,90,117440512,171840634880,1463,1.47346,74.2299,116624
1,CUTLASS,gemm,cutlass3x_sm90_tensorop_gemm_f16_f16_f32_f16_f16_128x16x64_1x1x1_0_ttn_align8_warpspecialized_pingpong_epi_tma,passed,success,universal,4096,5120,4096,f16:row,f16:row,f16:column,f16:column,1,0,serial,1,1,heuristic,invalid,invalid,false,false,1,tensorop,f32,128,16,64,1,1,1,0,0,0,12,4,1,1,64,16,16,90,90,117440512,171840634880,1463,1.5733,69.5196,109223
1,CUTLASS,gemm,cutlass3x_sm90_tensorop_gemm_f16_f16_f32_f16_f16_128x16x64_1x1x1_0_ttn_align8_warpspecialized_pingpong_epi_nosmem,passed,success,universal,4096,5120,4096,f16:row,f16:row,f16:column,f16:column,1,0,serial,1,1,heuristic,invalid,invalid,false,false,1,tensorop,f32,128,16,64,1,1,1,0,0,0,12,4,1,1,64,16,16,90,90,117440512,171840634880,1463,1.57271,69.5453,109264
1,CUTLASS,gemm,cutlass3x_sm90_tensorop_gemm_f16_f16_f32_f16_f16_128x16x64_1x1x1_0_ttn_align8_warpspecialized_cooperative_epi_nosmem,passed,success,universal,4096,5120,4096,f16:row,f16:row,f16:column,f16:column,1,0,serial,1,1,heuristic,invalid,invalid,false,false,1,tensorop,f32,128,16,64,1,1,1,0,0,0,12,4,2,1,64,16,16,90,90,117440512,171840634880,1463,1.57388,69.494,109183
1,CUTLASS,gemm,cutlass3x_sm90_tensorop_gemm_f16_f16_f32_f16_f16_128x16x64_1x1x1_0_ttn_align8_warpspecialized_cooperative_epi_tma,passed,success,universal,4096,5120,4096,f16:row,f16:row,f16:column,f16:column,1,0,serial,1,1,heuristic,invalid,invalid,false,false,1,tensorop,f32,128,16,64,1,1,1,0,0,0,12,4,2,1,64,16,16,90,90,117440512,171840634880,1463,1.57708,69.353,108961
1,CUTLASS,gemm,cutlass3x_sm90_tensorop_gemm_f16_f16_f32_f16_f16_128x16x64_1x1x1_0_ttn_align8_stream_k_warpspecialized_cooperative_epi_nosmem,passed,success,universal,4096,5120,4096,f16:row,f16:row,f16:column,f16:column,1,0,serial,1,1,heuristic,invalid,invalid,false,false,1,tensorop,f32,128,16,64,1,1,1,0,0,0,12,4,2,1,64,16,16,90,90,117440512,171840634880,1463,1.579,69.2683,108828
1,CUTLASS,gemm,cutlass3x_sm90_tensorop_gemm_f16_f16_f32_f16_f16_128x16x64_1x1x1_0_ttn_align8_stream_k_warpspecialized_cooperative_epi_tma,passed,success,universal,4096,5120,4096,f16:row,f16:row,f16:column,f16:column,1,0,serial,1,1,heuristic,invalid,invalid,false,false,1,tensorop,f32,128,16,64,1,1,1,0,0,0,12,4,2,1,64,16,16,90,90,117440512,171840634880,1463,1.57263,69.5492,109270
1,CUTLASS,gemm,cutlass3x_sm90_tensorop_gemm_f16_f16_f32_f16_f16_128x16x64_2x1x1_0_ttn_align8,passed,success,universal,4096,5120,4096,f16:row,f16:row,f16:column,f16:column,1,0,serial,1,1,heuristic,invalid,invalid,false,false,1,tensorop,f32,128,16,64,2,1,1,0,0,0,12,4,2,1,64,16,16,90,90,117440512,171840634880,1463,1.5598,70.121,110168
1,CUTLASS,gemm,cutlass3x_sm90_tensorop_gemm_f16_f16_f32_f16_f16_128x16x64_2x1x1_0_ttn_align8_warpspecialized_epi_nosmem,passed,success,universal,4096,5120,4096,f16:row,f16:row,f16:column,f16:column,1,0,serial,1,1,heuristic,invalid,invalid,false,false,1,tensorop,f32,128,16,64,2,1,1,0,0,0,12,4,1,1,64,16,16,90,90,117440512,171840634880,1463,1.51104,72.384,113724
1,CUTLASS,gemm,cutlass3x_sm90_tensorop_gemm_f16_f16_f32_f16_f16_128x16x64_2x1x1_0_ttn_align8_warpspecialized_pingpong_epi_tma,passed,success,universal,4096,5120,4096,f16:row,f16:row,f16:column,f16:column,1,0,serial,1,1,heuristic,invalid,invalid,false,false,1,tensorop,f32,128,16,64,2,1,1,0,0,0,12,4,1,1,64,16,16,90,90,117440512,171840634880,1463,1.55594,70.2951,110442
1,CUTLASS,gemm,cutlass3x_sm90_tensorop_gemm_f16_f16_f32_f16_f16_128x16x64_2x1x1_0_ttn_align8_warpspecialized_pingpong_epi_nosmem,passed,success,universal,4096,5120,4096,f16:row,f16:row,f16:column,f16:column,1,0,serial,1,1,heuristic,invalid,invalid,false,false,1,tensorop,f32,128,16,64,2,1,1,0,0,0,12,4,1,1,64,16,16,90,90,117440512,171840634880,1463,1.55854,70.1779,110258
1,CUTLASS,gemm,cutlass3x_sm90_tensorop_gemm_f16_f16_f32_f16_f16_128x16x64_2x1x1_0_ttn_align8_warpspecialized_cooperative_epi_nosmem,passed,success,universal,4096,5120,4096,f16:row,f16:row,f16:column,f16:column,1,0,serial,1,1,heuristic,invalid,invalid,false,false,1,tensorop,f32,128,16,64,2,1,1,0,0,0,12,4,2,1,64,16,16,90,90,117440512,171840634880,1463,1.56124,70.0563,110067
1,CUTLASS,gemm,cutlass3x_sm90_tensorop_gemm_f16_f16_f32_f16_f16_128x16x64_2x1x1_0_ttn_align8_warpspecialized_cooperative_epi_tma,passed,success,universal,4096,5120,4096,f16:row,f16:row,f16:column,f16:column,1,0,serial,1,1,heuristic,invalid,invalid,false,false,1,tensorop,f32,128,16,64,2,1,1,0,0,0,12,4,2,1,64,16,16,90,90,117440512,171840634880,1463,1.55683,70.2549,110378
1,CUTLASS,gemm,cutlass3x_sm90_tensorop_gemm_f16_f16_f32_f16_f16_128x16x64_2x1x1_0_ttn_align8_stream_k_warpspecialized_cooperative_epi_nosmem,passed,success,universal,4096,5120,4096,f16:row,f16:row,f16:column,f16:column,1,0,serial,1,1,heuristic,invalid,invalid,false,false,1,tensorop,f32,128,16,64,2,1,1,0,0,0,12,4,2,1,64,16,16,90,90,117440512,171840634880,1463,1.56296,69.9795,109946
1,CUTLASS,gemm,cutlass3x_sm90_tensorop_gemm_f16_f16_f32_f16_f16_128x16x64_2x1x1_0_ttn_align8_stream_k_warpspecialized_cooperative_epi_tma,passed,success,universal,4096,5120,4096,f16:row,f16:row,f16:column,f16:column,1,0,serial,1,1,heuristic,invalid,invalid,false,false,1,tensorop,f32,128,16,64,2,1,1,0,0,0,12,4,2,1,64,16,16,90,90,117440512,171840634880,1463,1.55766,70.2173,110319
1,CUTLASS,gemm,cutlass3x_sm90_tensorop_gemm_f16_f16_f32_f16_f16_128x16x64_1x2x1_0_ttn_align8,passed,success,universal,4096,5120,4096,f16:row,f16:row,f16:column,f16:column,1,0,serial,1,1,heuristic,invalid,invalid,false,false,1,tensorop,f32,128,16,64,1,2,1,0,0,0,12,4,2,1,64,16,16,90,90,117440512,171840634880,1463,0.900942,121.401,190734
1,CUTLASS,gemm,cutlass3x_sm90_tensorop_gemm_f16_f16_f32_f16_f16_128x16x64_1x2x1_0_ttn_align8_warpspecialized_epi_nosmem,passed,success,universal,4096,5120,4096,f16:row,f16:row,f16:column,f16:column,1,0,serial,1,1,heuristic,invalid,invalid,false,false,1,tensorop,f32,128,16,64,1,2,1,0,0,0,12,4,1,1,64,16,16,90,90,117440512,171840634880,1463,0.934322,117.064,183920
1,CUTLASS,gemm,cutlass3x_sm90_tensorop_gemm_f16_f16_f32_f16_f16_128x16x64_1x2x1_0_ttn_align8_warpspecialized_pingpong_epi_tma,passed,success,universal,4096,5120,4096,f16:row,f16:row,f16:column,f16:column,1,0,serial,1,1,heuristic,invalid,invalid,false,false,1,tensorop,f32,128,16,64,1,2,1,0,0,0,12,4,1,1,64,16,16,90,90,117440512,171840634880,1463,0.898978,121.666,191151
1,CUTLASS,gemm,cutlass3x_sm90_tensorop_gemm_f16_f16_f32_f16_f16_128x16x64_1x2x1_0_ttn_align8_warpspecialized_pingpong_epi_nosmem,passed,success,universal,4096,5120,4096,f16:row,f16:row,f16:column,f16:column,1,0,serial,1,1,heuristic,invalid,invalid,false,false,1,tensorop,f32,128,16,64,1,2,1,0,0,0,12,4,1,1,64,16,16,90,90,117440512,171840634880,1463,0.899218,121.633,191100
1,CUTLASS,gemm,cutlass3x_sm90_tensorop_gemm_f16_f16_f32_f16_f16_128x16x64_1x2x1_0_ttn_align8_warpspecialized_cooperative_epi_nosmem,passed,success,universal,4096,5120,4096,f16:row,f16:row,f16:column,f16:column,1,0,serial,1,1,heuristic,invalid,invalid,false,false,1,tensorop,f32,128,16,64,1,2,1,0,0,0,12,4,2,1,64,16,16,90,90,117440512,171840634880,1463,0.901351,121.346,190648
1,CUTLASS,gemm,cutlass3x_sm90_tensorop_gemm_f16_f16_f32_f16_f16_128x16x64_1x2x1_0_ttn_align8_warpspecialized_cooperative_epi_tma,passed,success,universal,4096,5120,4096,f16:row,f16:row,f16:column,f16:column,1,0,serial,1,1,heuristic,invalid,invalid,false,false,1,tensorop,f32,128,16,64,1,2,1,0,0,0,12,4,2,1,64,16,16,90,90,117440512,171840634880,1463,0.900961,121.398,190730
1,CUTLASS,gemm,cutlass3x_sm90_tensorop_gemm_f16_f16_f32_f16_f16_128x16x64_1x2x1_0_ttn_align8_stream_k_warpspecialized_cooperative_epi_nosmem,passed,success,universal,4096,5120,4096,f16:row,f16:row,f16:column,f16:column,1,0,serial,1,1,heuristic,invalid,invalid,false,false,1,tensorop,f32,128,16,64,1,2,1,0,0,0,12,4,2,1,64,16,16,90,90,117440512,171840634880,1463,0.902189,121.233,190471
1,CUTLASS,gemm,cutlass3x_sm90_tensorop_gemm_f16_f16_f32_f16_f16_128x16x64_1x2x1_0_ttn_align8_stream_k_warpspecialized_cooperative_epi_tma,passed,success,universal,4096,5120,4096,f16:row,f16:row,f16:column,f16:column,1,0,serial,1,1,heuristic,invalid,invalid,false,false,1,tensorop,f32,128,16,64,1,2,1,0,0,0,12,4,2,1,64,16,16,90,90,117440512,171840634880,1463,0.903324,121.081,190232
1,CUTLASS,gemm,cutlass3x_sm90_tensorop_gemm_f16_f16_f32_f16_f16_64x64x128_8x1x1_0_ttn_align8,passed,success,universal,4096,5120,4096,f16:row,f16:row,f16:column,f16:column,1,0,serial,1,1,heuristic,invalid,invalid,false,false,1,tensorop,f32,64,64,128,8,1,1,0,0,0,7,4,1,1,64,64,16,90,90,117440512,171840634880,1463,0.433848,252.104,396085
1,CUTLASS,gemm,cutlass3x_sm90_tensorop_gemm_f16_f16_f32_f16_f16_64x64x128_8x1x1_0_ttn_align8_warpspecialized_epi_nosmem,passed,success,universal,4096,5120,4096,f16:row,f16:row,f16:column,f16:column,1,0,serial,1,1,heuristic,invalid,invalid,false,false,1,tensorop,f32,64,64,128,8,1,1,0,0,0,7,4,1,1,64,64,16,90,90,117440512,171840634880,1463,0.637572,171.549,269524
1,CUTLASS,gemm,cutlass3x_sm90_tensorop_gemm_f16_f16_f32_f16_f16_64x64x128_8x1x1_0_ttn_align8_warpspecialized_pingpong_epi_tma,passed,success,universal,4096,5120,4096,f16:row,f16:row,f16:column,f16:column,1,0,serial,1,1,heuristic,invalid,invalid,false,false,1,tensorop,f32,64,64,128,8,1,1,0,0,0,6,4,1,1,64,64,16,90,90,117440512,171840634880,1463,0.460079,237.731,373502
1,CUTLASS,gemm,cutlass3x_sm90_tensorop_gemm_f16_f16_f32_f16_f16_64x64x128_8x1x1_0_ttn_align8_warpspecialized_pingpong_epi_nosmem,passed,success,universal,4096,5120,4096,f16:row,f16:row,f16:column,f16:column,1,0,serial,1,1,heuristic,invalid,invalid,false,false,1,tensorop,f32,64,64,128,8,1,1,0,0,0,7,4,1,1,64,64,16,90,90,117440512,171840634880,1463,0.401979,272.092,427487
1,CUTLASS,gemm,cutlass3x_sm90_tensorop_gemm_f16_f16_f32_f16_f16_64x64x128_1x8x1_0_ttn_align8,passed,success,universal,4096,5120,4096,f16:row,f16:row,f16:column,f16:column,1,0,serial,1,1,heuristic,invalid,invalid,false,false,1,tensorop,f32,64,64,128,1,8,1,0,0,0,7,4,1,1,64,64,16,90,90,117440512,171840634880,1463,0.406446,269.101,422789
1,CUTLASS,gemm,cutlass3x_sm90_tensorop_gemm_f16_f16_f32_f16_f16_64x64x128_1x8x1_0_ttn_align8_warpspecialized_epi_nosmem,passed,success,universal,4096,5120,4096,f16:row,f16:row,f16:column,f16:column,1,0,serial,1,1,heuristic,invalid,invalid,false,false,1,tensorop,f32,64,64,128,1,8,1,0,0,0,7,4,1,1,64,64,16,90,90,117440512,171840634880,1463,0.463951,235.747,370385
1,CUTLASS,gemm,cutlass3x_sm90_tensorop_gemm_f16_f16_f32_f16_f16_64x64x128_1x8x1_0_ttn_align8_warpspecialized_pingpong_epi_tma,passed,success,universal,4096,5120,4096,f16:row,f16:row,f16:column,f16:column,1,0,serial,1,1,heuristic,invalid,invalid,false,false,1,tensorop,f32,64,64,128,1,8,1,0,0,0,6,4,1,1,64,64,16,90,90,117440512,171840634880,1463,0.439709,248.744,390806
1,CUTLASS,gemm,cutlass3x_sm90_tensorop_gemm_f16_f16_f32_f16_f16_64x64x128_1x8x1_0_ttn_align8_warpspecialized_pingpong_epi_nosmem,passed,success,universal,4096,5120,4096,f16:row,f16:row,f16:column,f16:column,1,0,serial,1,1,heuristic,invalid,invalid,false,false,1,tensorop,f32,64,64,128,1,8,1,0,0,0,7,4,1,1,64,64,16,90,90,117440512,171840634880,1463,0.404376,270.479,424953
1,CUTLASS,gemm,cutlass3x_sm90_tensorop_gemm_f16_f16_f32_f16_f16_64x64x128_4x2x1_0_ttn_align8,passed,success,universal,4096,5120,4096,f16:row,f16:row,f16:column,f16:column,1,0,serial,1,1,heuristic,invalid,invalid,false,false,1,tensorop,f32,64,64,128,4,2,1,0,0,0,7,4,1,1,64,64,16,90,90,117440512,171840634880,1463,0.341161,320.597,503694
1,CUTLASS,gemm,cutlass3x_sm90_tensorop_gemm_f16_f16_f32_f16_f16_64x64x128_4x2x1_0_ttn_align8_warpspecialized_epi_nosmem,passed,success,universal,4096,5120,4096,f16:row,f16:row,f16:column,f16:column,1,0,serial,1,1,heuristic,invalid,invalid,false,false,1,tensorop,f32,64,64,128,4,2,1,0,0,0,7,4,1,1,64,64,16,90,90,117440512,171840634880,1463,0.429588,254.605,400013
1,CUTLASS,gemm,cutlass3x_sm90_tensorop_gemm_f16_f16_f32_f16_f16_64x64x128_4x2x1_0_ttn_align8_warpspecialized_pingpong_epi_tma,passed,success,universal,4096,5120,4096,f16:row,f16:row,f16:column,f16:column,1,0,serial,1,1,heuristic,invalid,invalid,false,false,1,tensorop,f32,64,64,128,4,2,1,0,0,0,6,4,1,1,64,64,16,90,90,117440512,171840634880,1463,0.369453,296.046,465122
1,CUTLASS,gemm,cutlass3x_sm90_tensorop_gemm_f16_f16_f32_f16_f16_64x64x128_4x2x1_0_ttn_align8_warpspecialized_pingpong_epi_nosmem,passed,success,universal,4096,5120,4096,f16:row,f16:row,f16:column,f16:column,1,0,serial,1,1,heuristic,invalid,invalid,false,false,1,tensorop,f32,64,64,128,4,2,1,0,0,0,7,4,1,1,64,64,16,90,90,117440512,171840634880,1463,0.34305,318.831,500921
1,CUTLASS,gemm,cutlass3x_sm90_tensorop_gemm_f16_f16_f32_f16_f16_64x64x128_2x4x1_0_ttn_align8,passed,success,universal,4096,5120,4096,f16:row,f16:row,f16:column,f16:column,1,0,serial,1,1,heuristic,invalid,invalid,false,false,1,tensorop,f32,64,64,128,2,4,1,0,0,0,7,4,1,1,64,64,16,90,90,117440512,171840634880,1463,0.334127,327.346,514297
1,CUTLASS,gemm,cutlass3x_sm90_tensorop_gemm_f16_f16_f32_f16_f16_64x64x128_2x4x1_0_ttn_align8_warpspecialized_epi_nosmem,passed,success,universal,4096,5120,4096,f16:row,f16:row,f16:column,f16:column,1,0,serial,1,1,heuristic,invalid,invalid,false,false,1,tensorop,f32,64,64,128,2,4,1,0,0,0,7,4,1,1,64,64,16,90,90,117440512,171840634880,1463,0.420969,259.817,408203
1,CUTLASS,gemm,cutlass3x_sm90_tensorop_gemm_f16_f16_f32_f16_f16_64x64x128_2x4x1_0_ttn_align8_warpspecialized_pingpong_epi_tma,passed,success,universal,4096,5120,4096,f16:row,f16:row,f16:column,f16:column,1,0,serial,1,1,heuristic,invalid,invalid,false,false,1,tensorop,f32,64,64,128,2,4,1,0,0,0,6,4,1,1,64,64,16,90,90,117440512,171840634880,1463,0.363803,300.643,472345
1,CUTLASS,gemm,cutlass3x_sm90_tensorop_gemm_f16_f16_f32_f16_f16_64x64x128_2x4x1_0_ttn_align8_warpspecialized_pingpong_epi_nosmem,passed,success,universal,4096,5120,4096,f16:row,f16:row,f16:column,f16:column,1,0,serial,1,1,heuristic,invalid,invalid,false,false,1,tensorop,f32,64,64,128,2,4,1,0,0,0,7,4,1,1,64,64,16,90,90,117440512,171840634880,1463,0.336032,325.49,511381
1,CUTLASS,gemm,cutlass3x_sm90_tensorop_gemm_f16_f16_f32_f16_f16_128x16x64_8x1x1_0_ttn_align8,passed,success,universal,4096,5120,4096,f16:row,f16:row,f16:column,f16:column,1,0,serial,1,1,heuristic,invalid,invalid,false,false,1,tensorop,f32,128,16,64,8,1,1,0,0,0,12,4,2,1,64,16,16,90,90,117440512,171840634880,1463,1.44347,75.7725,119047
1,CUTLASS,gemm,cutlass3x_sm90_tensorop_gemm_f16_f16_f32_f16_f16_128x16x64_8x1x1_0_ttn_align8_warpspecialized_epi_nosmem,passed,success,universal,4096,5120,4096,f16:row,f16:row,f16:column,f16:column,1,0,serial,1,1,heuristic,invalid,invalid,false,false,1,tensorop,f32,128,16,64,8,1,1,0,0,0,12,4,1,1,64,16,16,90,90,117440512,171840634880,1463,1.5997,68.3722,107420
1,CUTLASS,gemm,cutlass3x_sm90_tensorop_gemm_f16_f16_f32_f16_f16_128x16x64_8x1x1_0_ttn_align8_warpspecialized_pingpong_epi_tma,passed,success,universal,4096,5120,4096,f16:row,f16:row,f16:column,f16:column,1,0,serial,1,1,heuristic,invalid,invalid,false,false,1,tensorop,f32,128,16,64,8,1,1,0,0,0,12,4,1,1,64,16,16,90,90,117440512,171840634880,1463,1.42247,76.8912,120805
1,CUTLASS,gemm,cutlass3x_sm90_tensorop_gemm_f16_f16_f32_f16_f16_128x16x64_8x1x1_0_ttn_align8_warpspecialized_pingpong_epi_nosmem,passed,success,universal,4096,5120,4096,f16:row,f16:row,f16:column,f16:column,1,0,serial,1,1,heuristic,invalid,invalid,false,false,1,tensorop,f32,128,16,64,8,1,1,0,0,0,12,4,1,1,64,16,16,90,90,117440512,171840634880,1463,1.44537,75.6727,118891
1,CUTLASS,gemm,cutlass3x_sm90_tensorop_gemm_f16_f16_f32_f16_f16_128x16x64_8x1x1_0_ttn_align8_warpspecialized_cooperative_epi_nosmem,passed,success,universal,4096,5120,4096,f16:row,f16:row,f16:column,f16:column,1,0,serial,1,1,heuristic,invalid,invalid,false,false,1,tensorop,f32,128,16,64,8,1,1,0,0,0,12,4,2,1,64,16,16,90,90,117440512,171840634880,1463,1.41697,77.1895,121274
1,CUTLASS,gemm,cutlass3x_sm90_tensorop_gemm_f16_f16_f32_f16_f16_128x16x64_8x1x1_0_ttn_align8_warpspecialized_cooperative_epi_tma,passed,success,universal,4096,5120,4096,f16:row,f16:row,f16:column,f16:column,1,0,serial,1,1,heuristic,invalid,invalid,false,false,1,tensorop,f32,128,16,64,8,1,1,0,0,0,12,4,2,1,64,16,16,90,90,117440512,171840634880,1463,1.45074,75.3923,118450
1,CUTLASS,gemm,cutlass3x_sm90_tensorop_gemm_f16_f16_f32_f16_f16_128x16x64_8x1x1_0_ttn_align8_stream_k_warpspecialized_cooperative_epi_nosmem,passed,success,universal,4096,5120,4096,f16:row,f16:row,f16:column,f16:column,1,0,serial,1,1,heuristic,invalid,invalid,false,false,1,tensorop,f32,128,16,64,8,1,1,0,0,0,12,4,2,1,64,16,16,90,90,117440512,171840634880,1463,1.46325,74.7482,117438
1,CUTLASS,gemm,cutlass3x_sm90_tensorop_gemm_f16_f16_f32_f16_f16_128x16x64_8x1x1_0_ttn_align8_stream_k_warpspecialized_cooperative_epi_tma,passed,success,universal,4096,5120,4096,f16:row,f16:row,f16:column,f16:column,1,0,serial,1,1,heuristic,invalid,invalid,false,false,1,tensorop,f32,128,16,64,8,1,1,0,0,0,12,4,2,1,64,16,16,90,90,117440512,171840634880,1463,1.43815,76.0528,119488
1,CUTLASS,gemm,cutlass3x_sm90_tensorop_gemm_f16_f16_f32_f16_f16_64x64x128_4x1x1_0_ttn_align8,passed,success,universal,4096,5120,4096,f16:row,f16:row,f16:column,f16:column,1,0,serial,1,1,heuristic,invalid,invalid,false,false,1,tensorop,f32,64,64,128,4,1,1,0,0,0,7,4,1,1,64,64,16,90,90,117440512,171840634880,1463,0.461892,236.798,372037
1,CUTLASS,gemm,cutlass3x_sm90_tensorop_gemm_f16_f16_f32_f16_f16_64x64x128_4x1x1_0_ttn_align8_warpspecialized_epi_nosmem,passed,success,universal,4096,5120,4096,f16:row,f16:row,f16:column,f16:column,1,0,serial,1,1,heuristic,invalid,invalid,false,false,1,tensorop,f32,64,64,128,4,1,1,0,0,0,7,4,1,1,64,64,16,90,90,117440512,171840634880,1463,0.560806,195.032,306417
1,CUTLASS,gemm,cutlass3x_sm90_tensorop_gemm_f16_f16_f32_f16_f16_64x64x128_4x1x1_0_ttn_align8_warpspecialized_pingpong_epi_tma,passed,success,universal,4096,5120,4096,f16:row,f16:row,f16:column,f16:column,1,0,serial,1,1,heuristic,invalid,invalid,false,false,1,tensorop,f32,64,64,128,4,1,1,0,0,0,6,4,1,1,64,64,16,90,90,117440512,171840634880,1463,0.463762,235.843,370537
1,CUTLASS,gemm,cutlass3x_sm90_tensorop_gemm_f16_f16_f32_f16_f16_64x64x128_4x1x1_0_ttn_align8_warpspecialized_pingpong_epi_nosmem,passed,success,universal,4096,5120,4096,f16:row,f16:row,f16:column,f16:column,1,0,serial,1,1,heuristic,invalid,invalid,false,false,1,tensorop,f32,64,64,128,4,1,1,0,0,0,7,4,1,1,64,64,16,90,90,117440512,171840634880,1463,0.460032,237.755,373540
1,CUTLASS,gemm,cutlass3x_sm90_tensorop_gemm_f16_f16_f32_f16_f16_64x64x128_1x4x1_0_ttn_align8,passed,success,universal,4096,5120,4096,f16:row,f16:row,f16:column,f16:column,1,0,serial,1,1,heuristic,invalid,invalid,false,false,1,tensorop,f32,64,64,128,1,4,1,0,0,0,7,4,1,1,64,64,16,90,90,117440512,171840634880,1463,0.445414,245.558,385800
1,CUTLASS,gemm,cutlass3x_sm90_tensorop_gemm_f16_f16_f32_f16_f16_64x64x128_1x4x1_0_ttn_align8_warpspecialized_epi_nosmem,passed,success,universal,4096,5120,4096,f16:row,f16:row,f16:column,f16:column,1,0,serial,1,1,heuristic,invalid,invalid,false,false,1,tensorop,f32,64,64,128,1,4,1,0,0,0,7,4,1,1,64,64,16,90,90,117440512,171840634880,1463,0.448801,243.705,382888
1,CUTLASS,gemm,cutlass3x_sm90_tensorop_gemm_f16_f16_f32_f16_f16_64x64x128_1x4x1_0_ttn_align8_warpspecialized_pingpong_epi_tma,passed,success,universal,4096,5120,4096,f16:row,f16:row,f16:column,f16:column,1,0,serial,1,1,heuristic,invalid,invalid,false,false,1,tensorop,f32,64,64,128,1,4,1,0,0,0,6,4,1,1,64,64,16,90,90,117440512,171840634880,1463,0.429734,254.518,399877
1,CUTLASS,gemm,cutlass3x_sm90_tensorop_gemm_f16_f16_f32_f16_f16_64x64x128_1x4x1_0_ttn_align8_warpspecialized_pingpong_epi_nosmem,passed,success,universal,4096,5120,4096,f16:row,f16:row,f16:column,f16:column,1,0,serial,1,1,heuristic,invalid,invalid,false,false,1,tensorop,f32,64,64,128,1,4,1,0,0,0,7,4,1,1,64,64,16,90,90,117440512,171840634880,1463,0.445148,245.705,386030
1,CUTLASS,gemm,cutlass3x_sm90_tensorop_gemm_f16_f16_f32_f16_f16_128x16x64_4x4x1_0_ttn_align8,passed,success,universal,4096,5120,4096,f16:row,f16:row,f16:column,f16:column,1,0,serial,1,1,heuristic,invalid,invalid,false,false,1,tensorop,f32,128,16,64,4,4,1,0,0,0,12,4,2,1,64,16,16,90,90,117440512,171840634880,1463,0.883493,123.798,194501
1,CUTLASS,gemm,cutlass3x_sm90_tensorop_gemm_f16_f16_f32_f16_f16_128x16x64_4x4x1_0_ttn_align8_warpspecialized_epi_nosmem,passed,success,universal,4096,5120,4096,f16:row,f16:row,f16:column,f16:column,1,0,serial,1,1,heuristic,invalid,invalid,false,false,1,tensorop,f32,128,16,64,4,4,1,0,0,0,12,4,1,1,64,16,16,90,90,117440512,171840634880,1463,0.914828,119.558,187839
1,CUTLASS,gemm,cutlass3x_sm90_tensorop_gemm_f16_f16_f32_f16_f16_128x16x64_4x4x1_0_ttn_align8_warpspecialized_pingpong_epi_tma,passed,success,universal,4096,5120,4096,f16:row,f16:row,f16:column,f16:column,1,0,serial,1,1,heuristic,invalid,invalid,false,false,1,tensorop,f32,128,16,64,4,4,1,0,0,0,12,4,1,1,64,16,16,90,90,117440512,171840634880,1463,0.753464,145.163,228067
1,CUTLASS,gemm,cutlass3x_sm90_tensorop_gemm_f16_f16_f32_f16_f16_128x16x64_4x4x1_0_ttn_align8_warpspecialized_pingpong_epi_nosmem,passed,success,universal,4096,5120,4096,f16:row,f16:row,f16:column,f16:column,1,0,serial,1,1,heuristic,invalid,invalid,false,false,1,tensorop,f32,128,16,64,4,4,1,0,0,0,12,4,1,1,64,16,16,90,90,117440512,171840634880,1463,0.763718,143.214,225005
1,CUTLASS,gemm,cutlass3x_sm90_tensorop_gemm_f16_f16_f32_f16_f16_128x16x64_4x4x1_0_ttn_align8_warpspecialized_cooperative_epi_nosmem,passed,success,universal,4096,5120,4096,f16:row,f16:row,f16:column,f16:column,1,0,serial,1,1,heuristic,invalid,invalid,false,false,1,tensorop,f32,128,16,64,4,4,1,0,0,0,12,4,2,1,64,16,16,90,90,117440512,171840634880,1463,0.883482,123.8,194504
1,CUTLASS,gemm,cutlass3x_sm90_tensorop_gemm_f16_f16_f32_f16_f16_128x16x64_4x4x1_0_ttn_align8_warpspecialized_cooperative_epi_tma,passed,success,universal,4096,5120,4096,f16:row,f16:row,f16:column,f16:column,1,0,serial,1,1,heuristic,invalid,invalid,false,false,1,tensorop,f32,128,16,64,4,4,1,0,0,0,12,4,2,1,64,16,16,90,90,117440512,171840634880,1463,0.904267,120.954,190033
1,CUTLASS,gemm,cutlass3x_sm90_tensorop_gemm_f16_f16_f32_f16_f16_128x16x64_4x4x1_0_ttn_align8_stream_k_warpspecialized_cooperative_epi_nosmem,passed,success,universal,4096,5120,4096,f16:row,f16:row,f16:column,f16:column,1,0,serial,1,1,heuristic,invalid,invalid,false,false,1,tensorop,f32,128,16,64,4,4,1,0,0,0,12,4,2,1,64,16,16,90,90,117440512,171840634880,1463,0.892541,122.543,192530
1,CUTLASS,gemm,cutlass3x_sm90_tensorop_gemm_f16_f16_f32_f16_f16_128x16x64_4x4x1_0_ttn_align8_stream_k_warpspecialized_cooperative_epi_tma,passed,success,universal,4096,5120,4096,f16:row,f16:row,f16:column,f16:column,1,0,serial,1,1,heuristic,invalid,invalid,false,false,1,tensorop,f32,128,16,64,4,4,1,0,0,0,12,4,2,1,64,16,16,90,90,117440512,171840634880,1463,0.92226,118.595,186326
