profiler_out/cutlass3x_sm90_tensorop_gemm_f16_f16_f32_f16_f16_tt/4096x5120x4096.log



=============================
  Problem ID: 1

        Provider: [1;37mCUTLASS[0m
   OperationKind: [1;37mgemm[0m
       Operation: cutlass3x_sm90_tensorop_gemm_f16_f16_f32_f16_f16_128x128x64_2x1x1_0_ttn_align8

          Status: [1;37mSuccess[0m
    Verification: [1;37mON[0m
     Disposition: [1;32mPassed[0m

reference_device: Passed
          cuBLAS: Not run
           cuDNN: Not run

       Arguments: --gemm_kind=universal --m=4096 --n=5120 --k=4096 --A=f16:row --B=f16:row --C=f16:column --D=f16:column  \
                  --alpha=1 --beta=0 --split_k_mode=serial --split_k_slices=1 --batch_count=1 --raster_order=heuristic  \
                  --runtime_input_datatype_a=invalid --runtime_input_datatype_b=invalid --use_pdl=false --enable_sm90_mixed_dtype_shuffle_test=false  \
                  --swizzle_size=1 --op_class=tensorop --accum=f32 --cta_m=128 --cta_n=128 --cta_k=64 --cluster_m=2 --cluster_n=1  \
                  --cluster_k=1 --cluster_m_fallback=0 --cluster_n_fallback=0 --cluster_k_fallback=0 --stages=7 --warps_m=4  \
                  --warps_n=2 --warps_k=1 --inst_m=64 --inst_n=128 --inst_k=16 --min_cc=90 --max_cc=90

           Bytes: 117440512  bytes
           FLOPs: 171840634880  flops
           FLOPs/Byte: 1463

         Runtime: 0.280444  ms
          Memory: 390.006 GiB/s

            Math: 612745 GFLOP/s



=============================
  Problem ID: 1

        Provider: [1;37mCUTLASS[0m
   OperationKind: [1;37mgemm[0m
       Operation: cutlass3x_sm90_tensorop_gemm_f16_f16_f32_f16_f16_128x128x64_2x1x1_0_ttn_align8_warpspecialized_epi_nosmem

          Status: [1;37mSuccess[0m
    Verification: [1;37mON[0m
     Disposition: [1;32mPassed[0m

reference_device: Passed
          cuBLAS: Not run
           cuDNN: Not run

       Arguments: --gemm_kind=universal --m=4096 --n=5120 --k=4096 --A=f16:row --B=f16:row --C=f16:column --D=f16:column  \
                  --alpha=1 --beta=0 --split_k_mode=serial --split_k_slices=1 --batch_count=1 --raster_order=heuristic  \
                  --runtime_input_datatype_a=invalid --runtime_input_datatype_b=invalid --use_pdl=false --enable_sm90_mixed_dtype_shuffle_test=false  \
                  --swizzle_size=1 --op_class=tensorop --accum=f32 --cta_m=128 --cta_n=128 --cta_k=64 --cluster_m=2 --cluster_n=1  \
                  --cluster_k=1 --cluster_m_fallback=0 --cluster_n_fallback=0 --cluster_k_fallback=0 --stages=7 --warps_m=4  \
                  --warps_n=1 --warps_k=1 --inst_m=64 --inst_n=128 --inst_k=16 --min_cc=90 --max_cc=90

           Bytes: 117440512  bytes
           FLOPs: 171840634880  flops
           FLOPs/Byte: 1463

         Runtime: 0.286813  ms
          Memory: 381.346 GiB/s

            Math: 599138 GFLOP/s



=============================
  Problem ID: 1

        Provider: [1;37mCUTLASS[0m
   OperationKind: [1;37mgemm[0m
       Operation: cutlass3x_sm90_tensorop_gemm_f16_f16_f32_f16_f16_128x128x64_2x1x1_0_ttn_align8_warpspecialized_pingpong_epi_tma

          Status: [1;37mSuccess[0m
    Verification: [1;37mON[0m
     Disposition: [1;32mPassed[0m

reference_device: Passed
          cuBLAS: Not run
           cuDNN: Not run

       Arguments: --gemm_kind=universal --m=4096 --n=5120 --k=4096 --A=f16:row --B=f16:row --C=f16:column --D=f16:column  \
                  --alpha=1 --beta=0 --split_k_mode=serial --split_k_slices=1 --batch_count=1 --raster_order=heuristic  \
                  --runtime_input_datatype_a=invalid --runtime_input_datatype_b=invalid --use_pdl=false --enable_sm90_mixed_dtype_shuffle_test=false  \
                  --swizzle_size=1 --op_class=tensorop --accum=f32 --cta_m=128 --cta_n=128 --cta_k=64 --cluster_m=2 --cluster_n=1  \
                  --cluster_k=1 --cluster_m_fallback=0 --cluster_n_fallback=0 --cluster_k_fallback=0 --stages=6 --warps_m=4  \
                  --warps_n=1 --warps_k=1 --inst_m=64 --inst_n=128 --inst_k=16 --min_cc=90 --max_cc=90

           Bytes: 117440512  bytes
           FLOPs: 171840634880  flops
           FLOPs/Byte: 1463

         Runtime: 0.264506  ms
          Memory: 413.506 GiB/s

            Math: 649666 GFLOP/s



=============================
  Problem ID: 1

        Provider: [1;37mCUTLASS[0m
   OperationKind: [1;37mgemm[0m
       Operation: cutlass3x_sm90_tensorop_gemm_f16_f16_f32_f16_f16_128x128x64_2x1x1_0_ttn_align8_warpspecialized_pingpong_epi_nosmem

          Status: [1;37mSuccess[0m
    Verification: [1;37mON[0m
     Disposition: [1;32mPassed[0m

reference_device: Passed
          cuBLAS: Not run
           cuDNN: Not run

       Arguments: --gemm_kind=universal --m=4096 --n=5120 --k=4096 --A=f16:row --B=f16:row --C=f16:column --D=f16:column  \
                  --alpha=1 --beta=0 --split_k_mode=serial --split_k_slices=1 --batch_count=1 --raster_order=heuristic  \
                  --runtime_input_datatype_a=invalid --runtime_input_datatype_b=invalid --use_pdl=false --enable_sm90_mixed_dtype_shuffle_test=false  \
                  --swizzle_size=1 --op_class=tensorop --accum=f32 --cta_m=128 --cta_n=128 --cta_k=64 --cluster_m=2 --cluster_n=1  \
                  --cluster_k=1 --cluster_m_fallback=0 --cluster_n_fallback=0 --cluster_k_fallback=0 --stages=7 --warps_m=4  \
                  --warps_n=1 --warps_k=1 --inst_m=64 --inst_n=128 --inst_k=16 --min_cc=90 --max_cc=90

           Bytes: 117440512  bytes
           FLOPs: 171840634880  flops
           FLOPs/Byte: 1463

         Runtime: 0.26878  ms
          Memory: 406.932 GiB/s

            Math: 639336 GFLOP/s



=============================
  Problem ID: 1

        Provider: [1;37mCUTLASS[0m
   OperationKind: [1;37mgemm[0m
       Operation: cutlass3x_sm90_tensorop_gemm_f16_f16_f32_f16_f16_128x128x64_2x1x1_0_ttn_align8_warpspecialized_cooperative_epi_nosmem

          Status: [1;37mSuccess[0m
    Verification: [1;37mON[0m
     Disposition: [1;32mPassed[0m

reference_device: Passed
          cuBLAS: Not run
           cuDNN: Not run

       Arguments: --gemm_kind=universal --m=4096 --n=5120 --k=4096 --A=f16:row --B=f16:row --C=f16:column --D=f16:column  \
                  --alpha=1 --beta=0 --split_k_mode=serial --split_k_slices=1 --batch_count=1 --raster_order=heuristic  \
                  --runtime_input_datatype_a=invalid --runtime_input_datatype_b=invalid --use_pdl=false --enable_sm90_mixed_dtype_shuffle_test=false  \
                  --swizzle_size=1 --op_class=tensorop --accum=f32 --cta_m=128 --cta_n=128 --cta_k=64 --cluster_m=2 --cluster_n=1  \
                  --cluster_k=1 --cluster_m_fallback=0 --cluster_n_fallback=0 --cluster_k_fallback=0 --stages=7 --warps_m=4  \
                  --warps_n=2 --warps_k=1 --inst_m=64 --inst_n=128 --inst_k=16 --min_cc=90 --max_cc=90

           Bytes: 117440512  bytes
           FLOPs: 171840634880  flops
           FLOPs/Byte: 1463

         Runtime: 0.280557  ms
          Memory: 389.849 GiB/s

            Math: 612497 GFLOP/s



=============================
  Problem ID: 1

        Provider: [1;37mCUTLASS[0m
   OperationKind: [1;37mgemm[0m
       Operation: cutlass3x_sm90_tensorop_gemm_f16_f16_f32_f16_f16_128x128x64_2x1x1_0_ttn_align8_warpspecialized_cooperative_epi_tma

          Status: [1;37mSuccess[0m
    Verification: [1;37mON[0m
     Disposition: [1;32mPassed[0m

reference_device: Passed
          cuBLAS: Not run
           cuDNN: Not run

       Arguments: --gemm_kind=universal --m=4096 --n=5120 --k=4096 --A=f16:row --B=f16:row --C=f16:column --D=f16:column  \
                  --alpha=1 --beta=0 --split_k_mode=serial --split_k_slices=1 --batch_count=1 --raster_order=heuristic  \
                  --runtime_input_datatype_a=invalid --runtime_input_datatype_b=invalid --use_pdl=false --enable_sm90_mixed_dtype_shuffle_test=false  \
                  --swizzle_size=1 --op_class=tensorop --accum=f32 --cta_m=128 --cta_n=128 --cta_k=64 --cluster_m=2 --cluster_n=1  \
                  --cluster_k=1 --cluster_m_fallback=0 --cluster_n_fallback=0 --cluster_k_fallback=0 --stages=6 --warps_m=4  \
                  --warps_n=2 --warps_k=1 --inst_m=64 --inst_n=128 --inst_k=16 --min_cc=90 --max_cc=90

           Bytes: 117440512  bytes
           FLOPs: 171840634880  flops
           FLOPs/Byte: 1463

         Runtime: 0.269589  ms
          Memory: 405.71 GiB/s

            Math: 637418 GFLOP/s



=============================
  Problem ID: 1

        Provider: [1;37mCUTLASS[0m
   OperationKind: [1;37mgemm[0m
       Operation: cutlass3x_sm90_tensorop_gemm_f16_f16_f32_f16_f16_128x128x64_2x1x1_0_ttn_align8_stream_k_warpspecialized_cooperative_epi_nosmem

          Status: [1;37mSuccess[0m
    Verification: [1;37mON[0m
     Disposition: [1;32mPassed[0m

reference_device: Passed
          cuBLAS: Not run
           cuDNN: Not run

       Arguments: --gemm_kind=universal --m=4096 --n=5120 --k=4096 --A=f16:row --B=f16:row --C=f16:column --D=f16:column  \
                  --alpha=1 --beta=0 --split_k_mode=serial --split_k_slices=1 --batch_count=1 --raster_order=heuristic  \
                  --runtime_input_datatype_a=invalid --runtime_input_datatype_b=invalid --use_pdl=false --enable_sm90_mixed_dtype_shuffle_test=false  \
                  --swizzle_size=1 --op_class=tensorop --accum=f32 --cta_m=128 --cta_n=128 --cta_k=64 --cluster_m=2 --cluster_n=1  \
                  --cluster_k=1 --cluster_m_fallback=0 --cluster_n_fallback=0 --cluster_k_fallback=0 --stages=7 --warps_m=4  \
                  --warps_n=2 --warps_k=1 --inst_m=64 --inst_n=128 --inst_k=16 --min_cc=90 --max_cc=90

           Bytes: 117440512  bytes
           FLOPs: 171840634880  flops
           FLOPs/Byte: 1463

         Runtime: 0.284505  ms
          Memory: 384.44 GiB/s

            Math: 603999 GFLOP/s



=============================
  Problem ID: 1

        Provider: [1;37mCUTLASS[0m
   OperationKind: [1;37mgemm[0m
       Operation: cutlass3x_sm90_tensorop_gemm_f16_f16_f32_f16_f16_128x128x64_2x1x1_0_ttn_align8_stream_k_warpspecialized_cooperative_epi_tma

          Status: [1;37mSuccess[0m
    Verification: [1;37mON[0m
     Disposition: [1;32mPassed[0m

reference_device: Passed
          cuBLAS: Not run
           cuDNN: Not run

       Arguments: --gemm_kind=universal --m=4096 --n=5120 --k=4096 --A=f16:row --B=f16:row --C=f16:column --D=f16:column  \
                  --alpha=1 --beta=0 --split_k_mode=serial --split_k_slices=1 --batch_count=1 --raster_order=heuristic  \
                  --runtime_input_datatype_a=invalid --runtime_input_datatype_b=invalid --use_pdl=false --enable_sm90_mixed_dtype_shuffle_test=false  \
                  --swizzle_size=1 --op_class=tensorop --accum=f32 --cta_m=128 --cta_n=128 --cta_k=64 --cluster_m=2 --cluster_n=1  \
                  --cluster_k=1 --cluster_m_fallback=0 --cluster_n_fallback=0 --cluster_k_fallback=0 --stages=6 --warps_m=4  \
                  --warps_n=2 --warps_k=1 --inst_m=64 --inst_n=128 --inst_k=16 --min_cc=90 --max_cc=90

           Bytes: 117440512  bytes
           FLOPs: 171840634880  flops
           FLOPs/Byte: 1463

         Runtime: 0.275484  ms
          Memory: 397.029 GiB/s

            Math: 623778 GFLOP/s



=============================
  Problem ID: 1

        Provider: [1;37mCUTLASS[0m
   OperationKind: [1;37mgemm[0m
       Operation: cutlass3x_sm90_tensorop_gemm_f16_f16_f32_f16_f16_128x16x64_1x8x1_0_ttn_align8

          Status: [1;37mSuccess[0m
    Verification: [1;37mON[0m
     Disposition: [1;32mPassed[0m

reference_device: Passed
          cuBLAS: Not run
           cuDNN: Not run

       Arguments: --gemm_kind=universal --m=4096 --n=5120 --k=4096 --A=f16:row --B=f16:row --C=f16:column --D=f16:column  \
                  --alpha=1 --beta=0 --split_k_mode=serial --split_k_slices=1 --batch_count=1 --raster_order=heuristic  \
                  --runtime_input_datatype_a=invalid --runtime_input_datatype_b=invalid --use_pdl=false --enable_sm90_mixed_dtype_shuffle_test=false  \
                  --swizzle_size=1 --op_class=tensorop --accum=f32 --cta_m=128 --cta_n=16 --cta_k=64 --cluster_m=1 --cluster_n=8  \
                  --cluster_k=1 --cluster_m_fallback=0 --cluster_n_fallback=0 --cluster_k_fallback=0 --stages=12 --warps_m=4  \
                  --warps_n=2 --warps_k=1 --inst_m=64 --inst_n=16 --inst_k=16 --min_cc=90 --max_cc=90

           Bytes: 117440512  bytes
           FLOPs: 171840634880  flops
           FLOPs/Byte: 1463

         Runtime: 0.822228  ms
          Memory: 133.023 GiB/s

            Math: 208994 GFLOP/s



=============================
  Problem ID: 1

        Provider: [1;37mCUTLASS[0m
   OperationKind: [1;37mgemm[0m
       Operation: cutlass3x_sm90_tensorop_gemm_f16_f16_f32_f16_f16_128x16x64_1x8x1_0_ttn_align8_warpspecialized_epi_nosmem

          Status: [1;37mSuccess[0m
    Verification: [1;37mON[0m
     Disposition: [1;32mPassed[0m

reference_device: Passed
          cuBLAS: Not run
           cuDNN: Not run

       Arguments: --gemm_kind=universal --m=4096 --n=5120 --k=4096 --A=f16:row --B=f16:row --C=f16:column --D=f16:column  \
                  --alpha=1 --beta=0 --split_k_mode=serial --split_k_slices=1 --batch_count=1 --raster_order=heuristic  \
                  --runtime_input_datatype_a=invalid --runtime_input_datatype_b=invalid --use_pdl=false --enable_sm90_mixed_dtype_shuffle_test=false  \
                  --swizzle_size=1 --op_class=tensorop --accum=f32 --cta_m=128 --cta_n=16 --cta_k=64 --cluster_m=1 --cluster_n=8  \
                  --cluster_k=1 --cluster_m_fallback=0 --cluster_n_fallback=0 --cluster_k_fallback=0 --stages=12 --warps_m=4  \
                  --warps_n=1 --warps_k=1 --inst_m=64 --inst_n=16 --inst_k=16 --min_cc=90 --max_cc=90

           Bytes: 117440512  bytes
           FLOPs: 171840634880  flops
           FLOPs/Byte: 1463

         Runtime: 0.761906  ms
          Memory: 143.554 GiB/s

            Math: 225540 GFLOP/s



=============================
  Problem ID: 1

        Provider: [1;37mCUTLASS[0m
   OperationKind: [1;37mgemm[0m
       Operation: cutlass3x_sm90_tensorop_gemm_f16_f16_f32_f16_f16_128x16x64_1x8x1_0_ttn_align8_warpspecialized_pingpong_epi_tma

          Status: [1;37mSuccess[0m
    Verification: [1;37mON[0m
     Disposition: [1;32mPassed[0m

reference_device: Passed
          cuBLAS: Not run
           cuDNN: Not run

       Arguments: --gemm_kind=universal --m=4096 --n=5120 --k=4096 --A=f16:row --B=f16:row --C=f16:column --D=f16:column  \
                  --alpha=1 --beta=0 --split_k_mode=serial --split_k_slices=1 --batch_count=1 --raster_order=heuristic  \
                  --runtime_input_datatype_a=invalid --runtime_input_datatype_b=invalid --use_pdl=false --enable_sm90_mixed_dtype_shuffle_test=false  \
                  --swizzle_size=1 --op_class=tensorop --accum=f32 --cta_m=128 --cta_n=16 --cta_k=64 --cluster_m=1 --cluster_n=8  \
                  --cluster_k=1 --cluster_m_fallback=0 --cluster_n_fallback=0 --cluster_k_fallback=0 --stages=12 --warps_m=4  \
                  --warps_n=1 --warps_k=1 --inst_m=64 --inst_n=16 --inst_k=16 --min_cc=90 --max_cc=90

           Bytes: 117440512  bytes
           FLOPs: 171840634880  flops
           FLOPs/Byte: 1463

         Runtime: 0.646053  ms
          Memory: 169.297 GiB/s

            Math: 265985 GFLOP/s



=============================
  Problem ID: 1

        Provider: [1;37mCUTLASS[0m
   OperationKind: [1;37mgemm[0m
       Operation: cutlass3x_sm90_tensorop_gemm_f16_f16_f32_f16_f16_128x16x64_1x8x1_0_ttn_align8_warpspecialized_pingpong_epi_nosmem

          Status: [1;37mSuccess[0m
    Verification: [1;37mON[0m
     Disposition: [1;32mPassed[0m

reference_device: Passed
          cuBLAS: Not run
           cuDNN: Not run

       Arguments: --gemm_kind=universal --m=4096 --n=5120 --k=4096 --A=f16:row --B=f16:row --C=f16:column --D=f16:column  \
                  --alpha=1 --beta=0 --split_k_mode=serial --split_k_slices=1 --batch_count=1 --raster_order=heuristic  \
                  --runtime_input_datatype_a=invalid --runtime_input_datatype_b=invalid --use_pdl=false --enable_sm90_mixed_dtype_shuffle_test=false  \
                  --swizzle_size=1 --op_class=tensorop --accum=f32 --cta_m=128 --cta_n=16 --cta_k=64 --cluster_m=1 --cluster_n=8  \
                  --cluster_k=1 --cluster_m_fallback=0 --cluster_n_fallback=0 --cluster_k_fallback=0 --stages=12 --warps_m=4  \
                  --warps_n=1 --warps_k=1 --inst_m=64 --inst_n=16 --inst_k=16 --min_cc=90 --max_cc=90

           Bytes: 117440512  bytes
           FLOPs: 171840634880  flops
           FLOPs/Byte: 1463

         Runtime: 0.648429  ms
          Memory: 168.677 GiB/s

            Math: 265011 GFLOP/s



=============================
  Problem ID: 1

        Provider: [1;37mCUTLASS[0m
   OperationKind: [1;37mgemm[0m
       Operation: cutlass3x_sm90_tensorop_gemm_f16_f16_f32_f16_f16_128x16x64_1x8x1_0_ttn_align8_warpspecialized_cooperative_epi_nosmem

          Status: [1;37mSuccess[0m
    Verification: [1;37mON[0m
     Disposition: [1;32mPassed[0m

reference_device: Passed
          cuBLAS: Not run
           cuDNN: Not run

       Arguments: --gemm_kind=universal --m=4096 --n=5120 --k=4096 --A=f16:row --B=f16:row --C=f16:column --D=f16:column  \
                  --alpha=1 --beta=0 --split_k_mode=serial --split_k_slices=1 --batch_count=1 --raster_order=heuristic  \
                  --runtime_input_datatype_a=invalid --runtime_input_datatype_b=invalid --use_pdl=false --enable_sm90_mixed_dtype_shuffle_test=false  \
                  --swizzle_size=1 --op_class=tensorop --accum=f32 --cta_m=128 --cta_n=16 --cta_k=64 --cluster_m=1 --cluster_n=8  \
                  --cluster_k=1 --cluster_m_fallback=0 --cluster_n_fallback=0 --cluster_k_fallback=0 --stages=12 --warps_m=4  \
                  --warps_n=2 --warps_k=1 --inst_m=64 --inst_n=16 --inst_k=16 --min_cc=90 --max_cc=90

           Bytes: 117440512  bytes
           FLOPs: 171840634880  flops
           FLOPs/Byte: 1463

         Runtime: 0.811612  ms
          Memory: 134.763 GiB/s

            Math: 211728 GFLOP/s



=============================
  Problem ID: 1

        Provider: [1;37mCUTLASS[0m
   OperationKind: [1;37mgemm[0m
       Operation: cutlass3x_sm90_tensorop_gemm_f16_f16_f32_f16_f16_128x16x64_1x8x1_0_ttn_align8_warpspecialized_cooperative_epi_tma

          Status: [1;37mSuccess[0m
    Verification: [1;37mON[0m
     Disposition: [1;32mPassed[0m

reference_device: Passed
          cuBLAS: Not run
           cuDNN: Not run

       Arguments: --gemm_kind=universal --m=4096 --n=5120 --k=4096 --A=f16:row --B=f16:row --C=f16:column --D=f16:column  \
                  --alpha=1 --beta=0 --split_k_mode=serial --split_k_slices=1 --batch_count=1 --raster_order=heuristic  \
                  --runtime_input_datatype_a=invalid --runtime_input_datatype_b=invalid --use_pdl=false --enable_sm90_mixed_dtype_shuffle_test=false  \
                  --swizzle_size=1 --op_class=tensorop --accum=f32 --cta_m=128 --cta_n=16 --cta_k=64 --cluster_m=1 --cluster_n=8  \
                  --cluster_k=1 --cluster_m_fallback=0 --cluster_n_fallback=0 --cluster_k_fallback=0 --stages=12 --warps_m=4  \
                  --warps_n=2 --warps_k=1 --inst_m=64 --inst_n=16 --inst_k=16 --min_cc=90 --max_cc=90

           Bytes: 117440512  bytes
           FLOPs: 171840634880  flops
           FLOPs/Byte: 1463

         Runtime: 0.822916  ms
          Memory: 132.911 GiB/s

            Math: 208819 GFLOP/s



=============================
  Problem ID: 1

        Provider: [1;37mCUTLASS[0m
   OperationKind: [1;37mgemm[0m
       Operation: cutlass3x_sm90_tensorop_gemm_f16_f16_f32_f16_f16_128x16x64_1x8x1_0_ttn_align8_stream_k_warpspecialized_cooperative_epi_nosmem

          Status: [1;37mSuccess[0m
    Verification: [1;37mON[0m
     Disposition: [1;32mPassed[0m

reference_device: Passed
          cuBLAS: Not run
           cuDNN: Not run

       Arguments: --gemm_kind=universal --m=4096 --n=5120 --k=4096 --A=f16:row --B=f16:row --C=f16:column --D=f16:column  \
                  --alpha=1 --beta=0 --split_k_mode=serial --split_k_slices=1 --batch_count=1 --raster_order=heuristic  \
                  --runtime_input_datatype_a=invalid --runtime_input_datatype_b=invalid --use_pdl=false --enable_sm90_mixed_dtype_shuffle_test=false  \
                  --swizzle_size=1 --op_class=tensorop --accum=f32 --cta_m=128 --cta_n=16 --cta_k=64 --cluster_m=1 --cluster_n=8  \
                  --cluster_k=1 --cluster_m_fallback=0 --cluster_n_fallback=0 --cluster_k_fallback=0 --stages=12 --warps_m=4  \
                  --warps_n=2 --warps_k=1 --inst_m=64 --inst_n=16 --inst_k=16 --min_cc=90 --max_cc=90

           Bytes: 117440512  bytes
           FLOPs: 171840634880  flops
           FLOPs/Byte: 1463

         Runtime: 0.800014  ms
          Memory: 136.716 GiB/s

            Math: 214797 GFLOP/s



=============================
  Problem ID: 1

        Provider: [1;37mCUTLASS[0m
   OperationKind: [1;37mgemm[0m
       Operation: cutlass3x_sm90_tensorop_gemm_f16_f16_f32_f16_f16_128x16x64_1x8x1_0_ttn_align8_stream_k_warpspecialized_cooperative_epi_tma

          Status: [1;37mSuccess[0m
    Verification: [1;37mON[0m
     Disposition: [1;32mPassed[0m

reference_device: Passed
          cuBLAS: Not run
           cuDNN: Not run

       Arguments: --gemm_kind=universal --m=4096 --n=5120 --k=4096 --A=f16:row --B=f16:row --C=f16:column --D=f16:column  \
                  --alpha=1 --beta=0 --split_k_mode=serial --split_k_slices=1 --batch_count=1 --raster_order=heuristic  \
                  --runtime_input_datatype_a=invalid --runtime_input_datatype_b=invalid --use_pdl=false --enable_sm90_mixed_dtype_shuffle_test=false  \
                  --swizzle_size=1 --op_class=tensorop --accum=f32 --cta_m=128 --cta_n=16 --cta_k=64 --cluster_m=1 --cluster_n=8  \
                  --cluster_k=1 --cluster_m_fallback=0 --cluster_n_fallback=0 --cluster_k_fallback=0 --stages=12 --warps_m=4  \
                  --warps_n=2 --warps_k=1 --inst_m=64 --inst_n=16 --inst_k=16 --min_cc=90 --max_cc=90

           Bytes: 117440512  bytes
           FLOPs: 171840634880  flops
           FLOPs/Byte: 1463

         Runtime: 0.82057  ms
          Memory: 133.292 GiB/s

            Math: 209416 GFLOP/s



=============================
  Problem ID: 1

        Provider: [1;37mCUTLASS[0m
   OperationKind: [1;37mgemm[0m
       Operation: cutlass3x_sm90_tensorop_gemm_f16_f16_f32_f16_f16_64x64x256_1x1x1_0_ttn_align8

          Status: [1;37mSuccess[0m
    Verification: [1;37mON[0m
     Disposition: [1;32mPassed[0m

reference_device: Passed
          cuBLAS: Not run
           cuDNN: Not run

       Arguments: --gemm_kind=universal --m=4096 --n=5120 --k=4096 --A=f16:row --B=f16:row --C=f16:column --D=f16:column  \
                  --alpha=1 --beta=0 --split_k_mode=serial --split_k_slices=1 --batch_count=1 --raster_order=heuristic  \
                  --runtime_input_datatype_a=invalid --runtime_input_datatype_b=invalid --use_pdl=false --enable_sm90_mixed_dtype_shuffle_test=false  \
                  --swizzle_size=1 --op_class=tensorop --accum=f32 --cta_m=64 --cta_n=64 --cta_k=256 --cluster_m=1 --cluster_n=1  \
                  --cluster_k=1 --cluster_m_fallback=0 --cluster_n_fallback=0 --cluster_k_fallback=0 --stages=3 --warps_m=4  \
                  --warps_n=1 --warps_k=1 --inst_m=64 --inst_n=64 --inst_k=16 --min_cc=90 --max_cc=90

           Bytes: 117440512  bytes
           FLOPs: 171840634880  flops
           FLOPs/Byte: 1463

         Runtime: 0.616301  ms
          Memory: 177.47 GiB/s

            Math: 278826 GFLOP/s



=============================
  Problem ID: 1

        Provider: [1;37mCUTLASS[0m
   OperationKind: [1;37mgemm[0m
       Operation: cutlass3x_sm90_tensorop_gemm_f16_f16_f32_f16_f16_64x64x256_1x1x1_0_ttn_align8_warpspecialized_epi_nosmem

          Status: [1;37mSuccess[0m
    Verification: [1;37mON[0m
     Disposition: [1;32mPassed[0m

reference_device: Passed
          cuBLAS: Not run
           cuDNN: Not run

       Arguments: --gemm_kind=universal --m=4096 --n=5120 --k=4096 --A=f16:row --B=f16:row --C=f16:column --D=f16:column  \
                  --alpha=1 --beta=0 --split_k_mode=serial --split_k_slices=1 --batch_count=1 --raster_order=heuristic  \
                  --runtime_input_datatype_a=invalid --runtime_input_datatype_b=invalid --use_pdl=false --enable_sm90_mixed_dtype_shuffle_test=false  \
                  --swizzle_size=1 --op_class=tensorop --accum=f32 --cta_m=64 --cta_n=64 --cta_k=256 --cluster_m=1 --cluster_n=1  \
                  --cluster_k=1 --cluster_m_fallback=0 --cluster_n_fallback=0 --cluster_k_fallback=0 --stages=3 --warps_m=4  \
                  --warps_n=1 --warps_k=1 --inst_m=64 --inst_n=64 --inst_k=16 --min_cc=90 --max_cc=90

           Bytes: 117440512  bytes
           FLOPs: 171840634880  flops
           FLOPs/Byte: 1463

         Runtime: 0.61298  ms
          Memory: 178.431 GiB/s

            Math: 280336 GFLOP/s



=============================
  Problem ID: 1

        Provider: [1;37mCUTLASS[0m
   OperationKind: [1;37mgemm[0m
       Operation: cutlass3x_sm90_tensorop_gemm_f16_f16_f32_f16_f16_64x64x256_1x1x1_0_ttn_align8_warpspecialized_pingpong_epi_tma

          Status: [1;37mSuccess[0m
    Verification: [1;37mON[0m
     Disposition: [1;32mPassed[0m

reference_device: Passed
          cuBLAS: Not run
           cuDNN: Not run

       Arguments: --gemm_kind=universal --m=4096 --n=5120 --k=4096 --A=f16:row --B=f16:row --C=f16:column --D=f16:column  \
                  --alpha=1 --beta=0 --split_k_mode=serial --split_k_slices=1 --batch_count=1 --raster_order=heuristic  \
                  --runtime_input_datatype_a=invalid --runtime_input_datatype_b=invalid --use_pdl=false --enable_sm90_mixed_dtype_shuffle_test=false  \
                  --swizzle_size=1 --op_class=tensorop --accum=f32 --cta_m=64 --cta_n=64 --cta_k=256 --cluster_m=1 --cluster_n=1  \
                  --cluster_k=1 --cluster_m_fallback=0 --cluster_n_fallback=0 --cluster_k_fallback=0 --stages=3 --warps_m=4  \
                  --warps_n=1 --warps_k=1 --inst_m=64 --inst_n=64 --inst_k=16 --min_cc=90 --max_cc=90

           Bytes: 117440512  bytes
           FLOPs: 171840634880  flops
           FLOPs/Byte: 1463

         Runtime: 0.622982  ms
          Memory: 175.567 GiB/s

            Math: 275836 GFLOP/s



=============================
  Problem ID: 1

        Provider: [1;37mCUTLASS[0m
   OperationKind: [1;37mgemm[0m
       Operation: cutlass3x_sm90_tensorop_gemm_f16_f16_f32_f16_f16_64x64x256_1x1x1_0_ttn_align8_warpspecialized_pingpong_epi_nosmem

          Status: [1;37mSuccess[0m
    Verification: [1;37mON[0m
     Disposition: [1;32mPassed[0m

reference_device: Passed
          cuBLAS: Not run
           cuDNN: Not run

       Arguments: --gemm_kind=universal --m=4096 --n=5120 --k=4096 --A=f16:row --B=f16:row --C=f16:column --D=f16:column  \
                  --alpha=1 --beta=0 --split_k_mode=serial --split_k_slices=1 --batch_count=1 --raster_order=heuristic  \
                  --runtime_input_datatype_a=invalid --runtime_input_datatype_b=invalid --use_pdl=false --enable_sm90_mixed_dtype_shuffle_test=false  \
                  --swizzle_size=1 --op_class=tensorop --accum=f32 --cta_m=64 --cta_n=64 --cta_k=256 --cluster_m=1 --cluster_n=1  \
                  --cluster_k=1 --cluster_m_fallback=0 --cluster_n_fallback=0 --cluster_k_fallback=0 --stages=3 --warps_m=4  \
                  --warps_n=1 --warps_k=1 --inst_m=64 --inst_n=64 --inst_k=16 --min_cc=90 --max_cc=90

           Bytes: 117440512  bytes
           FLOPs: 171840634880  flops
           FLOPs/Byte: 1463

         Runtime: 0.614291  ms
          Memory: 178.051 GiB/s

            Math: 279738 GFLOP/s



=============================
  Problem ID: 1

        Provider: [1;37mCUTLASS[0m
   OperationKind: [1;37mgemm[0m
       Operation: cutlass3x_sm90_tensorop_gemm_f16_f16_f32_f16_f16_128x16x64_4x2x1_0_ttn_align8

          Status: [1;37mSuccess[0m
    Verification: [1;37mON[0m
     Disposition: [1;32mPassed[0m

reference_device: Passed
          cuBLAS: Not run
           cuDNN: Not run

       Arguments: --gemm_kind=universal --m=4096 --n=5120 --k=4096 --A=f16:row --B=f16:row --C=f16:column --D=f16:column  \
                  --alpha=1 --beta=0 --split_k_mode=serial --split_k_slices=1 --batch_count=1 --raster_order=heuristic  \
                  --runtime_input_datatype_a=invalid --runtime_input_datatype_b=invalid --use_pdl=false --enable_sm90_mixed_dtype_shuffle_test=false  \
                  --swizzle_size=1 --op_class=tensorop --accum=f32 --cta_m=128 --cta_n=16 --cta_k=64 --cluster_m=4 --cluster_n=2  \
                  --cluster_k=1 --cluster_m_fallback=0 --cluster_n_fallback=0 --cluster_k_fallback=0 --stages=12 --warps_m=4  \
                  --warps_n=2 --warps_k=1 --inst_m=64 --inst_n=16 --inst_k=16 --min_cc=90 --max_cc=90

           Bytes: 117440512  bytes
           FLOPs: 171840634880  flops
           FLOPs/Byte: 1463

         Runtime: 0.855269  ms
          Memory: 127.884 GiB/s

            Math: 200920 GFLOP/s



=============================
  Problem ID: 1

        Provider: [1;37mCUTLASS[0m
   OperationKind: [1;37mgemm[0m
       Operation: cutlass3x_sm90_tensorop_gemm_f16_f16_f32_f16_f16_128x16x64_4x2x1_0_ttn_align8_warpspecialized_epi_nosmem

          Status: [1;37mSuccess[0m
    Verification: [1;37mON[0m
     Disposition: [1;32mPassed[0m

reference_device: Passed
          cuBLAS: Not run
           cuDNN: Not run

       Arguments: --gemm_kind=universal --m=4096 --n=5120 --k=4096 --A=f16:row --B=f16:row --C=f16:column --D=f16:column  \
                  --alpha=1 --beta=0 --split_k_mode=serial --split_k_slices=1 --batch_count=1 --raster_order=heuristic  \
                  --runtime_input_datatype_a=invalid --runtime_input_datatype_b=invalid --use_pdl=false --enable_sm90_mixed_dtype_shuffle_test=false  \
                  --swizzle_size=1 --op_class=tensorop --accum=f32 --cta_m=128 --cta_n=16 --cta_k=64 --cluster_m=4 --cluster_n=2  \
                  --cluster_k=1 --cluster_m_fallback=0 --cluster_n_fallback=0 --cluster_k_fallback=0 --stages=12 --warps_m=4  \
                  --warps_n=1 --warps_k=1 --inst_m=64 --inst_n=16 --inst_k=16 --min_cc=90 --max_cc=90

           Bytes: 117440512  bytes
           FLOPs: 171840634880  flops
           FLOPs/Byte: 1463

         Runtime: 1.20511  ms
          Memory: 90.7592 GiB/s

            Math: 142593 GFLOP/s



=============================
  Problem ID: 1

        Provider: [1;37mCUTLASS[0m
   OperationKind: [1;37mgemm[0m
       Operation: cutlass3x_sm90_tensorop_gemm_f16_f16_f32_f16_f16_128x16x64_4x2x1_0_ttn_align8_warpspecialized_pingpong_epi_tma

          Status: [1;37mSuccess[0m
    Verification: [1;37mON[0m
     Disposition: [1;32mPassed[0m

reference_device: Passed
          cuBLAS: Not run
           cuDNN: Not run

       Arguments: --gemm_kind=universal --m=4096 --n=5120 --k=4096 --A=f16:row --B=f16:row --C=f16:column --D=f16:column  \
                  --alpha=1 --beta=0 --split_k_mode=serial --split_k_slices=1 --batch_count=1 --raster_order=heuristic  \
                  --runtime_input_datatype_a=invalid --runtime_input_datatype_b=invalid --use_pdl=false --enable_sm90_mixed_dtype_shuffle_test=false  \
                  --swizzle_size=1 --op_class=tensorop --accum=f32 --cta_m=128 --cta_n=16 --cta_k=64 --cluster_m=4 --cluster_n=2  \
                  --cluster_k=1 --cluster_m_fallback=0 --cluster_n_fallback=0 --cluster_k_fallback=0 --stages=12 --warps_m=4  \
                  --warps_n=1 --warps_k=1 --inst_m=64 --inst_n=16 --inst_k=16 --min_cc=90 --max_cc=90

           Bytes: 117440512  bytes
           FLOPs: 171840634880  flops
           FLOPs/Byte: 1463

         Runtime: 0.846549  ms
          Memory: 129.201 GiB/s

            Math: 202989 GFLOP/s



=============================
  Problem ID: 1

        Provider: [1;37mCUTLASS[0m
   OperationKind: [1;37mgemm[0m
       Operation: cutlass3x_sm90_tensorop_gemm_f16_f16_f32_f16_f16_128x16x64_4x2x1_0_ttn_align8_warpspecialized_pingpong_epi_nosmem

          Status: [1;37mSuccess[0m
    Verification: [1;37mON[0m
     Disposition: [1;32mPassed[0m

reference_device: Passed
          cuBLAS: Not run
           cuDNN: Not run

       Arguments: --gemm_kind=universal --m=4096 --n=5120 --k=4096 --A=f16:row --B=f16:row --C=f16:column --D=f16:column  \
                  --alpha=1 --beta=0 --split_k_mode=serial --split_k_slices=1 --batch_count=1 --raster_order=heuristic  \
                  --runtime_input_datatype_a=invalid --runtime_input_datatype_b=invalid --use_pdl=false --enable_sm90_mixed_dtype_shuffle_test=false  \
                  --swizzle_size=1 --op_class=tensorop --accum=f32 --cta_m=128 --cta_n=16 --cta_k=64 --cluster_m=4 --cluster_n=2  \
                  --cluster_k=1 --cluster_m_fallback=0 --cluster_n_fallback=0 --cluster_k_fallback=0 --stages=12 --warps_m=4  \
                  --warps_n=1 --warps_k=1 --inst_m=64 --inst_n=16 --inst_k=16 --min_cc=90 --max_cc=90

           Bytes: 117440512  bytes
           FLOPs: 171840634880  flops
           FLOPs/Byte: 1463

         Runtime: 0.851274  ms
          Memory: 128.484 GiB/s

            Math: 201863 GFLOP/s



=============================
  Problem ID: 1

        Provider: [1;37mCUTLASS[0m
   OperationKind: [1;37mgemm[0m
       Operation: cutlass3x_sm90_tensorop_gemm_f16_f16_f32_f16_f16_128x16x64_4x2x1_0_ttn_align8_warpspecialized_cooperative_epi_nosmem

          Status: [1;37mSuccess[0m
    Verification: [1;37mON[0m
     Disposition: [1;32mPassed[0m

reference_device: Passed
          cuBLAS: Not run
           cuDNN: Not run

       Arguments: --gemm_kind=universal --m=4096 --n=5120 --k=4096 --A=f16:row --B=f16:row --C=f16:column --D=f16:column  \
                  --alpha=1 --beta=0 --split_k_mode=serial --split_k_slices=1 --batch_count=1 --raster_order=heuristic  \
                  --runtime_input_datatype_a=invalid --runtime_input_datatype_b=invalid --use_pdl=false --enable_sm90_mixed_dtype_shuffle_test=false  \
                  --swizzle_size=1 --op_class=tensorop --accum=f32 --cta_m=128 --cta_n=16 --cta_k=64 --cluster_m=4 --cluster_n=2  \
                  --cluster_k=1 --cluster_m_fallback=0 --cluster_n_fallback=0 --cluster_k_fallback=0 --stages=12 --warps_m=4  \
                  --warps_n=2 --warps_k=1 --inst_m=64 --inst_n=16 --inst_k=16 --min_cc=90 --max_cc=90

           Bytes: 117440512  bytes
           FLOPs: 171840634880  flops
           FLOPs/Byte: 1463

         Runtime: 0.857824  ms
          Memory: 127.503 GiB/s

            Math: 200322 GFLOP/s



=============================
  Problem ID: 1

        Provider: [1;37mCUTLASS[0m
   OperationKind: [1;37mgemm[0m
       Operation: cutlass3x_sm90_tensorop_gemm_f16_f16_f32_f16_f16_128x16x64_4x2x1_0_ttn_align8_warpspecialized_cooperative_epi_tma

          Status: [1;37mSuccess[0m
    Verification: [1;37mON[0m
     Disposition: [1;32mPassed[0m

reference_device: Passed
          cuBLAS: Not run
           cuDNN: Not run

       Arguments: --gemm_kind=universal --m=4096 --n=5120 --k=4096 --A=f16:row --B=f16:row --C=f16:column --D=f16:column  \
                  --alpha=1 --beta=0 --split_k_mode=serial --split_k_slices=1 --batch_count=1 --raster_order=heuristic  \
                  --runtime_input_datatype_a=invalid --runtime_input_datatype_b=invalid --use_pdl=false --enable_sm90_mixed_dtype_shuffle_test=false  \
                  --swizzle_size=1 --op_class=tensorop --accum=f32 --cta_m=128 --cta_n=16 --cta_k=64 --cluster_m=4 --cluster_n=2  \
                  --cluster_k=1 --cluster_m_fallback=0 --cluster_n_fallback=0 --cluster_k_fallback=0 --stages=12 --warps_m=4  \
                  --warps_n=2 --warps_k=1 --inst_m=64 --inst_n=16 --inst_k=16 --min_cc=90 --max_cc=90

           Bytes: 117440512  bytes
           FLOPs: 171840634880  flops
           FLOPs/Byte: 1463

         Runtime: 0.874073  ms
          Memory: 125.133 GiB/s

            Math: 196598 GFLOP/s



=============================
  Problem ID: 1

        Provider: [1;37mCUTLASS[0m
   OperationKind: [1;37mgemm[0m
       Operation: cutlass3x_sm90_tensorop_gemm_f16_f16_f32_f16_f16_128x16x64_4x2x1_0_ttn_align8_stream_k_warpspecialized_cooperative_epi_nosmem

          Status: [1;37mSuccess[0m
    Verification: [1;37mON[0m
     Disposition: [1;32mPassed[0m

reference_device: Passed
          cuBLAS: Not run
           cuDNN: Not run

       Arguments: --gemm_kind=universal --m=4096 --n=5120 --k=4096 --A=f16:row --B=f16:row --C=f16:column --D=f16:column  \
                  --alpha=1 --beta=0 --split_k_mode=serial --split_k_slices=1 --batch_count=1 --raster_order=heuristic  \
                  --runtime_input_datatype_a=invalid --runtime_input_datatype_b=invalid --use_pdl=false --enable_sm90_mixed_dtype_shuffle_test=false  \
                  --swizzle_size=1 --op_class=tensorop --accum=f32 --cta_m=128 --cta_n=16 --cta_k=64 --cluster_m=4 --cluster_n=2  \
                  --cluster_k=1 --cluster_m_fallback=0 --cluster_n_fallback=0 --cluster_k_fallback=0 --stages=12 --warps_m=4  \
                  --warps_n=2 --warps_k=1 --inst_m=64 --inst_n=16 --inst_k=16 --min_cc=90 --max_cc=90

           Bytes: 117440512  bytes
           FLOPs: 171840634880  flops
           FLOPs/Byte: 1463

         Runtime: 0.869546  ms
          Memory: 125.784 GiB/s

            Math: 197621 GFLOP/s



=============================
  Problem ID: 1

        Provider: [1;37mCUTLASS[0m
   OperationKind: [1;37mgemm[0m
       Operation: cutlass3x_sm90_tensorop_gemm_f16_f16_f32_f16_f16_128x16x64_4x2x1_0_ttn_align8_stream_k_warpspecialized_cooperative_epi_tma

          Status: [1;37mSuccess[0m
    Verification: [1;37mON[0m
     Disposition: [1;32mPassed[0m

reference_device: Passed
          cuBLAS: Not run
           cuDNN: Not run

       Arguments: --gemm_kind=universal --m=4096 --n=5120 --k=4096 --A=f16:row --B=f16:row --C=f16:column --D=f16:column  \
                  --alpha=1 --beta=0 --split_k_mode=serial --split_k_slices=1 --batch_count=1 --raster_order=heuristic  \
                  --runtime_input_datatype_a=invalid --runtime_input_datatype_b=invalid --use_pdl=false --enable_sm90_mixed_dtype_shuffle_test=false  \
                  --swizzle_size=1 --op_class=tensorop --accum=f32 --cta_m=128 --cta_n=16 --cta_k=64 --cluster_m=4 --cluster_n=2  \
                  --cluster_k=1 --cluster_m_fallback=0 --cluster_n_fallback=0 --cluster_k_fallback=0 --stages=12 --warps_m=4  \
                  --warps_n=2 --warps_k=1 --inst_m=64 --inst_n=16 --inst_k=16 --min_cc=90 --max_cc=90

           Bytes: 117440512  bytes
           FLOPs: 171840634880  flops
           FLOPs/Byte: 1463

         Runtime: 0.892987  ms
          Memory: 122.482 GiB/s

            Math: 192434 GFLOP/s



=============================
  Problem ID: 1

        Provider: [1;37mCUTLASS[0m
   OperationKind: [1;37mgemm[0m
       Operation: cutlass3x_sm90_tensorop_gemm_f16_f16_f32_f16_f16_128x128x128_1x8x1_0_ttn_align8

          Status: [1;37mSuccess[0m
    Verification: [1;37mON[0m
     Disposition: [1;32mPassed[0m

reference_device: Passed
          cuBLAS: Not run
           cuDNN: Not run

       Arguments: --gemm_kind=universal --m=4096 --n=5120 --k=4096 --A=f16:row --B=f16:row --C=f16:column --D=f16:column  \
                  --alpha=1 --beta=0 --split_k_mode=serial --split_k_slices=1 --batch_count=1 --raster_order=heuristic  \
                  --runtime_input_datatype_a=invalid --runtime_input_datatype_b=invalid --use_pdl=false --enable_sm90_mixed_dtype_shuffle_test=false  \
                  --swizzle_size=1 --op_class=tensorop --accum=f32 --cta_m=128 --cta_n=128 --cta_k=128 --cluster_m=1  \
                  --cluster_n=8 --cluster_k=1 --cluster_m_fallback=0 --cluster_n_fallback=0 --cluster_k_fallback=0 --stages=3  \
                  --warps_m=4 --warps_n=2 --warps_k=1 --inst_m=64 --inst_n=128 --inst_k=16 --min_cc=90 --max_cc=90

           Bytes: 117440512  bytes
           FLOPs: 171840634880  flops
           FLOPs/Byte: 1463

         Runtime: 0.277851  ms
          Memory: 393.646 GiB/s

            Math: 618463 GFLOP/s



=============================
  Problem ID: 1

        Provider: [1;37mCUTLASS[0m
   OperationKind: [1;37mgemm[0m
       Operation: cutlass3x_sm90_tensorop_gemm_f16_f16_f32_f16_f16_128x128x128_1x8x1_0_ttn_align8_warpspecialized_epi_nosmem

          Status: [1;37mSuccess[0m
    Verification: [1;37mON[0m
     Disposition: [1;32mPassed[0m

reference_device: Passed
          cuBLAS: Not run
           cuDNN: Not run

       Arguments: --gemm_kind=universal --m=4096 --n=5120 --k=4096 --A=f16:row --B=f16:row --C=f16:column --D=f16:column  \
                  --alpha=1 --beta=0 --split_k_mode=serial --split_k_slices=1 --batch_count=1 --raster_order=heuristic  \
                  --runtime_input_datatype_a=invalid --runtime_input_datatype_b=invalid --use_pdl=false --enable_sm90_mixed_dtype_shuffle_test=false  \
                  --swizzle_size=1 --op_class=tensorop --accum=f32 --cta_m=128 --cta_n=128 --cta_k=128 --cluster_m=1  \
                  --cluster_n=8 --cluster_k=1 --cluster_m_fallback=0 --cluster_n_fallback=0 --cluster_k_fallback=0 --stages=3  \
                  --warps_m=4 --warps_n=1 --warps_k=1 --inst_m=64 --inst_n=128 --inst_k=16 --min_cc=90 --max_cc=90

           Bytes: 117440512  bytes
           FLOPs: 171840634880  flops
           FLOPs/Byte: 1463

         Runtime: 0.284435  ms
          Memory: 384.534 GiB/s

            Math: 604148 GFLOP/s



=============================
  Problem ID: 1

        Provider: [1;37mCUTLASS[0m
   OperationKind: [1;37mgemm[0m
       Operation: cutlass3x_sm90_tensorop_gemm_f16_f16_f32_f16_f16_128x128x128_1x8x1_0_ttn_align8_warpspecialized_pingpong_epi_tma

          Status: [1;37mSuccess[0m
    Verification: [1;37mON[0m
     Disposition: [1;32mPassed[0m

reference_device: Passed
          cuBLAS: Not run
           cuDNN: Not run

       Arguments: --gemm_kind=universal --m=4096 --n=5120 --k=4096 --A=f16:row --B=f16:row --C=f16:column --D=f16:column  \
                  --alpha=1 --beta=0 --split_k_mode=serial --split_k_slices=1 --batch_count=1 --raster_order=heuristic  \
                  --runtime_input_datatype_a=invalid --runtime_input_datatype_b=invalid --use_pdl=false --enable_sm90_mixed_dtype_shuffle_test=false  \
                  --swizzle_size=1 --op_class=tensorop --accum=f32 --cta_m=128 --cta_n=128 --cta_k=128 --cluster_m=1  \
                  --cluster_n=8 --cluster_k=1 --cluster_m_fallback=0 --cluster_n_fallback=0 --cluster_k_fallback=0 --stages=3  \
                  --warps_m=4 --warps_n=1 --warps_k=1 --inst_m=64 --inst_n=128 --inst_k=16 --min_cc=90 --max_cc=90

           Bytes: 117440512  bytes
           FLOPs: 171840634880  flops
           FLOPs/Byte: 1463

         Runtime: 0.258762  ms
          Memory: 422.685 GiB/s

            Math: 664087 GFLOP/s



=============================
  Problem ID: 1

        Provider: [1;37mCUTLASS[0m
   OperationKind: [1;37mgemm[0m
       Operation: cutlass3x_sm90_tensorop_gemm_f16_f16_f32_f16_f16_128x128x128_1x8x1_0_ttn_align8_warpspecialized_pingpong_epi_nosmem

          Status: [1;37mSuccess[0m
    Verification: [1;37mON[0m
     Disposition: [1;32mPassed[0m

reference_device: Passed
          cuBLAS: Not run
           cuDNN: Not run

       Arguments: --gemm_kind=universal --m=4096 --n=5120 --k=4096 --A=f16:row --B=f16:row --C=f16:column --D=f16:column  \
                  --alpha=1 --beta=0 --split_k_mode=serial --split_k_slices=1 --batch_count=1 --raster_order=heuristic  \
                  --runtime_input_datatype_a=invalid --runtime_input_datatype_b=invalid --use_pdl=false --enable_sm90_mixed_dtype_shuffle_test=false  \
                  --swizzle_size=1 --op_class=tensorop --accum=f32 --cta_m=128 --cta_n=128 --cta_k=128 --cluster_m=1  \
                  --cluster_n=8 --cluster_k=1 --cluster_m_fallback=0 --cluster_n_fallback=0 --cluster_k_fallback=0 --stages=3  \
                  --warps_m=4 --warps_n=1 --warps_k=1 --inst_m=64 --inst_n=128 --inst_k=16 --min_cc=90 --max_cc=90

           Bytes: 117440512  bytes
           FLOPs: 171840634880  flops
           FLOPs/Byte: 1463

         Runtime: 0.261631  ms
          Memory: 418.051 GiB/s

            Math: 656805 GFLOP/s



=============================
  Problem ID: 1

        Provider: [1;37mCUTLASS[0m
   OperationKind: [1;37mgemm[0m
       Operation: cutlass3x_sm90_tensorop_gemm_f16_f16_f32_f16_f16_128x128x128_1x8x1_0_ttn_align8_warpspecialized_cooperative_epi_nosmem

          Status: [1;37mSuccess[0m
    Verification: [1;37mON[0m
     Disposition: [1;32mPassed[0m

reference_device: Passed
          cuBLAS: Not run
           cuDNN: Not run

       Arguments: --gemm_kind=universal --m=4096 --n=5120 --k=4096 --A=f16:row --B=f16:row --C=f16:column --D=f16:column  \
                  --alpha=1 --beta=0 --split_k_mode=serial --split_k_slices=1 --batch_count=1 --raster_order=heuristic  \
                  --runtime_input_datatype_a=invalid --runtime_input_datatype_b=invalid --use_pdl=false --enable_sm90_mixed_dtype_shuffle_test=false  \
                  --swizzle_size=1 --op_class=tensorop --accum=f32 --cta_m=128 --cta_n=128 --cta_k=128 --cluster_m=1  \
                  --cluster_n=8 --cluster_k=1 --cluster_m_fallback=0 --cluster_n_fallback=0 --cluster_k_fallback=0 --stages=3  \
                  --warps_m=4 --warps_n=2 --warps_k=1 --inst_m=64 --inst_n=128 --inst_k=16 --min_cc=90 --max_cc=90

           Bytes: 117440512  bytes
           FLOPs: 171840634880  flops
           FLOPs/Byte: 1463

         Runtime: 0.278367  ms
          Memory: 392.916 GiB/s

            Math: 617317 GFLOP/s



=============================
  Problem ID: 1

        Provider: [1;37mCUTLASS[0m
   OperationKind: [1;37mgemm[0m
       Operation: cutlass3x_sm90_tensorop_gemm_f16_f16_f32_f16_f16_128x128x128_1x8x1_0_ttn_align8_warpspecialized_cooperative_epi_tma

          Status: [1;37mSuccess[0m
    Verification: [1;37mON[0m
     Disposition: [1;32mPassed[0m

reference_device: Passed
          cuBLAS: Not run
           cuDNN: Not run

       Arguments: --gemm_kind=universal --m=4096 --n=5120 --k=4096 --A=f16:row --B=f16:row --C=f16:column --D=f16:column  \
                  --alpha=1 --beta=0 --split_k_mode=serial --split_k_slices=1 --batch_count=1 --raster_order=heuristic  \
                  --runtime_input_datatype_a=invalid --runtime_input_datatype_b=invalid --use_pdl=false --enable_sm90_mixed_dtype_shuffle_test=false  \
                  --swizzle_size=1 --op_class=tensorop --accum=f32 --cta_m=128 --cta_n=128 --cta_k=128 --cluster_m=1  \
                  --cluster_n=8 --cluster_k=1 --cluster_m_fallback=0 --cluster_n_fallback=0 --cluster_k_fallback=0 --stages=3  \
                  --warps_m=4 --warps_n=2 --warps_k=1 --inst_m=64 --inst_n=128 --inst_k=16 --min_cc=90 --max_cc=90

           Bytes: 117440512  bytes
           FLOPs: 171840634880  flops
           FLOPs/Byte: 1463

         Runtime: 0.269245  ms
          Memory: 406.228 GiB/s

            Math: 638230 GFLOP/s



=============================
  Problem ID: 1

        Provider: [1;37mCUTLASS[0m
   OperationKind: [1;37mgemm[0m
       Operation: cutlass3x_sm90_tensorop_gemm_f16_f16_f32_f16_f16_128x128x128_1x8x1_0_ttn_align8_stream_k_warpspecialized_cooperative_epi_nosmem

          Status: [1;37mSuccess[0m
    Verification: [1;37mON[0m
     Disposition: [1;32mPassed[0m

reference_device: Passed
          cuBLAS: Not run
           cuDNN: Not run

       Arguments: --gemm_kind=universal --m=4096 --n=5120 --k=4096 --A=f16:row --B=f16:row --C=f16:column --D=f16:column  \
                  --alpha=1 --beta=0 --split_k_mode=serial --split_k_slices=1 --batch_count=1 --raster_order=heuristic  \
                  --runtime_input_datatype_a=invalid --runtime_input_datatype_b=invalid --use_pdl=false --enable_sm90_mixed_dtype_shuffle_test=false  \
                  --swizzle_size=1 --op_class=tensorop --accum=f32 --cta_m=128 --cta_n=128 --cta_k=128 --cluster_m=1  \
                  --cluster_n=8 --cluster_k=1 --cluster_m_fallback=0 --cluster_n_fallback=0 --cluster_k_fallback=0 --stages=3  \
                  --warps_m=4 --warps_n=2 --warps_k=1 --inst_m=64 --inst_n=128 --inst_k=16 --min_cc=90 --max_cc=90

           Bytes: 117440512  bytes
           FLOPs: 171840634880  flops
           FLOPs/Byte: 1463

         Runtime: 0.287626  ms
          Memory: 380.268 GiB/s

            Math: 597444 GFLOP/s



=============================
  Problem ID: 1

        Provider: [1;37mCUTLASS[0m
   OperationKind: [1;37mgemm[0m
       Operation: cutlass3x_sm90_tensorop_gemm_f16_f16_f32_f16_f16_128x128x128_1x8x1_0_ttn_align8_stream_k_warpspecialized_cooperative_epi_tma

          Status: [1;37mSuccess[0m
    Verification: [1;37mON[0m
     Disposition: [1;32mPassed[0m

reference_device: Passed
          cuBLAS: Not run
           cuDNN: Not run

       Arguments: --gemm_kind=universal --m=4096 --n=5120 --k=4096 --A=f16:row --B=f16:row --C=f16:column --D=f16:column  \
                  --alpha=1 --beta=0 --split_k_mode=serial --split_k_slices=1 --batch_count=1 --raster_order=heuristic  \
                  --runtime_input_datatype_a=invalid --runtime_input_datatype_b=invalid --use_pdl=false --enable_sm90_mixed_dtype_shuffle_test=false  \
                  --swizzle_size=1 --op_class=tensorop --accum=f32 --cta_m=128 --cta_n=128 --cta_k=128 --cluster_m=1  \
                  --cluster_n=8 --cluster_k=1 --cluster_m_fallback=0 --cluster_n_fallback=0 --cluster_k_fallback=0 --stages=3  \
                  --warps_m=4 --warps_n=2 --warps_k=1 --inst_m=64 --inst_n=128 --inst_k=16 --min_cc=90 --max_cc=90

           Bytes: 117440512  bytes
           FLOPs: 171840634880  flops
           FLOPs/Byte: 1463

         Runtime: 0.274081  ms
          Memory: 399.061 GiB/s

            Math: 626970 GFLOP/s



=============================
  Problem ID: 1

        Provider: [1;37mCUTLASS[0m
   OperationKind: [1;37mgemm[0m
       Operation: cutlass3x_sm90_tensorop_gemm_f16_f16_f32_f16_f16_128x128x128_8x1x1_0_ttn_align8

          Status: [1;37mSuccess[0m
    Verification: [1;37mON[0m
     Disposition: [1;32mPassed[0m

reference_device: Passed
          cuBLAS: Not run
           cuDNN: Not run

       Arguments: --gemm_kind=universal --m=4096 --n=5120 --k=4096 --A=f16:row --B=f16:row --C=f16:column --D=f16:column  \
                  --alpha=1 --beta=0 --split_k_mode=serial --split_k_slices=1 --batch_count=1 --raster_order=heuristic  \
                  --runtime_input_datatype_a=invalid --runtime_input_datatype_b=invalid --use_pdl=false --enable_sm90_mixed_dtype_shuffle_test=false  \
                  --swizzle_size=1 --op_class=tensorop --accum=f32 --cta_m=128 --cta_n=128 --cta_k=128 --cluster_m=8  \
                  --cluster_n=1 --cluster_k=1 --cluster_m_fallback=0 --cluster_n_fallback=0 --cluster_k_fallback=0 --stages=3  \
                  --warps_m=4 --warps_n=2 --warps_k=1 --inst_m=64 --inst_n=128 --inst_k=16 --min_cc=90 --max_cc=90

           Bytes: 117440512  bytes
           FLOPs: 171840634880  flops
           FLOPs/Byte: 1463

         Runtime: 0.304932  ms
          Memory: 358.686 GiB/s

            Math: 563537 GFLOP/s



=============================
  Problem ID: 1

        Provider: [1;37mCUTLASS[0m
   OperationKind: [1;37mgemm[0m
       Operation: cutlass3x_sm90_tensorop_gemm_f16_f16_f32_f16_f16_128x128x128_8x1x1_0_ttn_align8_warpspecialized_epi_nosmem

          Status: [1;37mSuccess[0m
    Verification: [1;37mON[0m
     Disposition: [1;32mPassed[0m

reference_device: Passed
          cuBLAS: Not run
           cuDNN: Not run

       Arguments: --gemm_kind=universal --m=4096 --n=5120 --k=4096 --A=f16:row --B=f16:row --C=f16:column --D=f16:column  \
                  --alpha=1 --beta=0 --split_k_mode=serial --split_k_slices=1 --batch_count=1 --raster_order=heuristic  \
                  --runtime_input_datatype_a=invalid --runtime_input_datatype_b=invalid --use_pdl=false --enable_sm90_mixed_dtype_shuffle_test=false  \
                  --swizzle_size=1 --op_class=tensorop --accum=f32 --cta_m=128 --cta_n=128 --cta_k=128 --cluster_m=8  \
                  --cluster_n=1 --cluster_k=1 --cluster_m_fallback=0 --cluster_n_fallback=0 --cluster_k_fallback=0 --stages=3  \
                  --warps_m=4 --warps_n=1 --warps_k=1 --inst_m=64 --inst_n=128 --inst_k=16 --min_cc=90 --max_cc=90

           Bytes: 117440512  bytes
           FLOPs: 171840634880  flops
           FLOPs/Byte: 1463

         Runtime: 0.308056  ms
          Memory: 355.049 GiB/s

            Math: 557822 GFLOP/s



=============================
  Problem ID: 1

        Provider: [1;37mCUTLASS[0m
   OperationKind: [1;37mgemm[0m
       Operation: cutlass3x_sm90_tensorop_gemm_f16_f16_f32_f16_f16_128x128x128_8x1x1_0_ttn_align8_warpspecialized_pingpong_epi_tma

          Status: [1;37mSuccess[0m
    Verification: [1;37mON[0m
     Disposition: [1;32mPassed[0m

reference_device: Passed
          cuBLAS: Not run
           cuDNN: Not run

       Arguments: --gemm_kind=universal --m=4096 --n=5120 --k=4096 --A=f16:row --B=f16:row --C=f16:column --D=f16:column  \
                  --alpha=1 --beta=0 --split_k_mode=serial --split_k_slices=1 --batch_count=1 --raster_order=heuristic  \
                  --runtime_input_datatype_a=invalid --runtime_input_datatype_b=invalid --use_pdl=false --enable_sm90_mixed_dtype_shuffle_test=false  \
                  --swizzle_size=1 --op_class=tensorop --accum=f32 --cta_m=128 --cta_n=128 --cta_k=128 --cluster_m=8  \
                  --cluster_n=1 --cluster_k=1 --cluster_m_fallback=0 --cluster_n_fallback=0 --cluster_k_fallback=0 --stages=3  \
                  --warps_m=4 --warps_n=1 --warps_k=1 --inst_m=64 --inst_n=128 --inst_k=16 --min_cc=90 --max_cc=90

           Bytes: 117440512  bytes
           FLOPs: 171840634880  flops
           FLOPs/Byte: 1463

         Runtime: 0.283219  ms
          Memory: 386.185 GiB/s

            Math: 606741 GFLOP/s



=============================
  Problem ID: 1

        Provider: [1;37mCUTLASS[0m
   OperationKind: [1;37mgemm[0m
       Operation: cutlass3x_sm90_tensorop_gemm_f16_f16_f32_f16_f16_128x128x128_8x1x1_0_ttn_align8_warpspecialized_pingpong_epi_nosmem

          Status: [1;37mSuccess[0m
    Verification: [1;37mON[0m
     Disposition: [1;32mPassed[0m

reference_device: Passed
          cuBLAS: Not run
           cuDNN: Not run

       Arguments: --gemm_kind=universal --m=4096 --n=5120 --k=4096 --A=f16:row --B=f16:row --C=f16:column --D=f16:column  \
                  --alpha=1 --beta=0 --split_k_mode=serial --split_k_slices=1 --batch_count=1 --raster_order=heuristic  \
                  --runtime_input_datatype_a=invalid --runtime_input_datatype_b=invalid --use_pdl=false --enable_sm90_mixed_dtype_shuffle_test=false  \
                  --swizzle_size=1 --op_class=tensorop --accum=f32 --cta_m=128 --cta_n=128 --cta_k=128 --cluster_m=8  \
                  --cluster_n=1 --cluster_k=1 --cluster_m_fallback=0 --cluster_n_fallback=0 --cluster_k_fallback=0 --stages=3  \
                  --warps_m=4 --warps_n=1 --warps_k=1 --inst_m=64 --inst_n=128 --inst_k=16 --min_cc=90 --max_cc=90

           Bytes: 117440512  bytes
           FLOPs: 171840634880  flops
           FLOPs/Byte: 1463

         Runtime: 0.285924  ms
          Memory: 382.531 GiB/s

            Math: 601001 GFLOP/s



=============================
  Problem ID: 1

        Provider: [1;37mCUTLASS[0m
   OperationKind: [1;37mgemm[0m
       Operation: cutlass3x_sm90_tensorop_gemm_f16_f16_f32_f16_f16_128x128x128_8x1x1_0_ttn_align8_warpspecialized_cooperative_epi_nosmem

          Status: [1;37mSuccess[0m
    Verification: [1;37mON[0m
     Disposition: [1;32mPassed[0m

reference_device: Passed
          cuBLAS: Not run
           cuDNN: Not run

       Arguments: --gemm_kind=universal --m=4096 --n=5120 --k=4096 --A=f16:row --B=f16:row --C=f16:column --D=f16:column  \
                  --alpha=1 --beta=0 --split_k_mode=serial --split_k_slices=1 --batch_count=1 --raster_order=heuristic  \
                  --runtime_input_datatype_a=invalid --runtime_input_datatype_b=invalid --use_pdl=false --enable_sm90_mixed_dtype_shuffle_test=false  \
                  --swizzle_size=1 --op_class=tensorop --accum=f32 --cta_m=128 --cta_n=128 --cta_k=128 --cluster_m=8  \
                  --cluster_n=1 --cluster_k=1 --cluster_m_fallback=0 --cluster_n_fallback=0 --cluster_k_fallback=0 --stages=3  \
                  --warps_m=4 --warps_n=2 --warps_k=1 --inst_m=64 --inst_n=128 --inst_k=16 --min_cc=90 --max_cc=90

           Bytes: 117440512  bytes
           FLOPs: 171840634880  flops
           FLOPs/Byte: 1463

         Runtime: 0.301108  ms
          Memory: 363.241 GiB/s

            Math: 570693 GFLOP/s



=============================
  Problem ID: 1

        Provider: [1;37mCUTLASS[0m
   OperationKind: [1;37mgemm[0m
       Operation: cutlass3x_sm90_tensorop_gemm_f16_f16_f32_f16_f16_128x128x128_8x1x1_0_ttn_align8_warpspecialized_cooperative_epi_tma

          Status: [1;37mSuccess[0m
    Verification: [1;37mON[0m
     Disposition: [1;32mPassed[0m

reference_device: Passed
          cuBLAS: Not run
           cuDNN: Not run

       Arguments: --gemm_kind=universal --m=4096 --n=5120 --k=4096 --A=f16:row --B=f16:row --C=f16:column --D=f16:column  \
                  --alpha=1 --beta=0 --split_k_mode=serial --split_k_slices=1 --batch_count=1 --raster_order=heuristic  \
                  --runtime_input_datatype_a=invalid --runtime_input_datatype_b=invalid --use_pdl=false --enable_sm90_mixed_dtype_shuffle_test=false  \
                  --swizzle_size=1 --op_class=tensorop --accum=f32 --cta_m=128 --cta_n=128 --cta_k=128 --cluster_m=8  \
                  --cluster_n=1 --cluster_k=1 --cluster_m_fallback=0 --cluster_n_fallback=0 --cluster_k_fallback=0 --stages=3  \
                  --warps_m=4 --warps_n=2 --warps_k=1 --inst_m=64 --inst_n=128 --inst_k=16 --min_cc=90 --max_cc=90

           Bytes: 117440512  bytes
           FLOPs: 171840634880  flops
           FLOPs/Byte: 1463

         Runtime: 0.2913  ms
          Memory: 375.472 GiB/s

            Math: 589909 GFLOP/s



=============================
  Problem ID: 1

        Provider: [1;37mCUTLASS[0m
   OperationKind: [1;37mgemm[0m
       Operation: cutlass3x_sm90_tensorop_gemm_f16_f16_f32_f16_f16_128x128x128_8x1x1_0_ttn_align8_stream_k_warpspecialized_cooperative_epi_nosmem

          Status: [1;37mSuccess[0m
    Verification: [1;37mON[0m
     Disposition: [1;32mPassed[0m

reference_device: Passed
          cuBLAS: Not run
           cuDNN: Not run

       Arguments: --gemm_kind=universal --m=4096 --n=5120 --k=4096 --A=f16:row --B=f16:row --C=f16:column --D=f16:column  \
                  --alpha=1 --beta=0 --split_k_mode=serial --split_k_slices=1 --batch_count=1 --raster_order=heuristic  \
                  --runtime_input_datatype_a=invalid --runtime_input_datatype_b=invalid --use_pdl=false --enable_sm90_mixed_dtype_shuffle_test=false  \
                  --swizzle_size=1 --op_class=tensorop --accum=f32 --cta_m=128 --cta_n=128 --cta_k=128 --cluster_m=8  \
                  --cluster_n=1 --cluster_k=1 --cluster_m_fallback=0 --cluster_n_fallback=0 --cluster_k_fallback=0 --stages=3  \
                  --warps_m=4 --warps_n=2 --warps_k=1 --inst_m=64 --inst_n=128 --inst_k=16 --min_cc=90 --max_cc=90

           Bytes: 117440512  bytes
           FLOPs: 171840634880  flops
           FLOPs/Byte: 1463

         Runtime: 0.305085  ms
          Memory: 358.507 GiB/s

            Math: 563255 GFLOP/s



=============================
  Problem ID: 1

        Provider: [1;37mCUTLASS[0m
   OperationKind: [1;37mgemm[0m
       Operation: cutlass3x_sm90_tensorop_gemm_f16_f16_f32_f16_f16_128x128x128_8x1x1_0_ttn_align8_stream_k_warpspecialized_cooperative_epi_tma

          Status: [1;37mSuccess[0m
    Verification: [1;37mON[0m
     Disposition: [1;32mPassed[0m

reference_device: Passed
          cuBLAS: Not run
           cuDNN: Not run

       Arguments: --gemm_kind=universal --m=4096 --n=5120 --k=4096 --A=f16:row --B=f16:row --C=f16:column --D=f16:column  \
                  --alpha=1 --beta=0 --split_k_mode=serial --split_k_slices=1 --batch_count=1 --raster_order=heuristic  \
                  --runtime_input_datatype_a=invalid --runtime_input_datatype_b=invalid --use_pdl=false --enable_sm90_mixed_dtype_shuffle_test=false  \
                  --swizzle_size=1 --op_class=tensorop --accum=f32 --cta_m=128 --cta_n=128 --cta_k=128 --cluster_m=8  \
                  --cluster_n=1 --cluster_k=1 --cluster_m_fallback=0 --cluster_n_fallback=0 --cluster_k_fallback=0 --stages=3  \
                  --warps_m=4 --warps_n=2 --warps_k=1 --inst_m=64 --inst_n=128 --inst_k=16 --min_cc=90 --max_cc=90

           Bytes: 117440512  bytes
           FLOPs: 171840634880  flops
           FLOPs/Byte: 1463

         Runtime: 0.296744  ms
          Memory: 368.583 GiB/s

            Math: 579087 GFLOP/s



=============================
  Problem ID: 1

        Provider: [1;37mCUTLASS[0m
   OperationKind: [1;37mgemm[0m
       Operation: cutlass3x_sm90_tensorop_gemm_f16_f16_f32_f16_f16_128x128x128_4x1x1_0_ttn_align8

          Status: [1;37mSuccess[0m
    Verification: [1;37mON[0m
     Disposition: [1;32mPassed[0m

reference_device: Passed
          cuBLAS: Not run
           cuDNN: Not run

       Arguments: --gemm_kind=universal --m=4096 --n=5120 --k=4096 --A=f16:row --B=f16:row --C=f16:column --D=f16:column  \
                  --alpha=1 --beta=0 --split_k_mode=serial --split_k_slices=1 --batch_count=1 --raster_order=heuristic  \
                  --runtime_input_datatype_a=invalid --runtime_input_datatype_b=invalid --use_pdl=false --enable_sm90_mixed_dtype_shuffle_test=false  \
                  --swizzle_size=1 --op_class=tensorop --accum=f32 --cta_m=128 --cta_n=128 --cta_k=128 --cluster_m=4  \
                  --cluster_n=1 --cluster_k=1 --cluster_m_fallback=0 --cluster_n_fallback=0 --cluster_k_fallback=0 --stages=3  \
                  --warps_m=4 --warps_n=2 --warps_k=1 --inst_m=64 --inst_n=128 --inst_k=16 --min_cc=90 --max_cc=90

           Bytes: 117440512  bytes
           FLOPs: 171840634880  flops
           FLOPs/Byte: 1463

         Runtime: 0.287088  ms
          Memory: 380.981 GiB/s

            Math: 598565 GFLOP/s



=============================
  Problem ID: 1

        Provider: [1;37mCUTLASS[0m
   OperationKind: [1;37mgemm[0m
       Operation: cutlass3x_sm90_tensorop_gemm_f16_f16_f32_f16_f16_128x128x128_4x1x1_0_ttn_align8_warpspecialized_epi_nosmem

          Status: [1;37mSuccess[0m
    Verification: [1;37mON[0m
     Disposition: [1;32mPassed[0m

reference_device: Passed
          cuBLAS: Not run
           cuDNN: Not run

       Arguments: --gemm_kind=universal --m=4096 --n=5120 --k=4096 --A=f16:row --B=f16:row --C=f16:column --D=f16:column  \
                  --alpha=1 --beta=0 --split_k_mode=serial --split_k_slices=1 --batch_count=1 --raster_order=heuristic  \
                  --runtime_input_datatype_a=invalid --runtime_input_datatype_b=invalid --use_pdl=false --enable_sm90_mixed_dtype_shuffle_test=false  \
                  --swizzle_size=1 --op_class=tensorop --accum=f32 --cta_m=128 --cta_n=128 --cta_k=128 --cluster_m=4  \
                  --cluster_n=1 --cluster_k=1 --cluster_m_fallback=0 --cluster_n_fallback=0 --cluster_k_fallback=0 --stages=3  \
                  --warps_m=4 --warps_n=1 --warps_k=1 --inst_m=64 --inst_n=128 --inst_k=16 --min_cc=90 --max_cc=90

