perf_test/basic.gemm.csv
Problem,Provider,OperationKind,Operation,Disposition,Status,gemm_kind,m,n,k,A,B,C,D,alpha,beta,split_k_mode,split_k_slices,batch_count,raster_order,runtime_input_datatype_a,runtime_input_datatype_b,use_pdl,enable_sm90_mixed_dtype_shuffle_test,swizzle_size,op_class,accum,cta_m,cta_n,cta_k,cluster_m,cluster_n,cluster_k,cluster_m_fallback,cluster_n_fallback,cluster_k_fallback,stages,warps_m,warps_n,warps_k,inst_m,inst_n,inst_k,min_cc,max_cc,Bytes,Flops,Flops/Byte,Runtime,GB/s,GFLOPs
1,CUTLASS,gemm,cutlass3x_sm90_tensorop_gemm_f16_f16_f32_f16_f16_128x256x64_2x1x1_0_tnn_align8,passed,success,universal,512,512,512,f16:row,f16:column,f16:column,f16:column,1,0,serial,1,1,heuristic,invalid,invalid,false,false,1,tensorop,f32,128,256,64,2,1,1,0,0,0,4,4,2,1,64,256,16,90,90,1572864,268959744,171,0.0130797,111.994,20563.2
1,CUTLASS,gemm,cutlass3x_sm90_tensorop_gemm_f16_f16_f32_f16_f16_128x256x64_2x1x1_0_tnn_align8_warpspecialized_epi_nosmem,passed,success,universal,512,512,512,f16:row,f16:column,f16:column,f16:column,1,0,serial,1,1,heuristic,invalid,invalid,false,false,1,tensorop,f32,128,256,64,2,1,1,0,0,0,4,4,1,1,64,256,16,90,90,1572864,268959744,171,0.080352,18.2303,3347.27
1,CUTLASS,gemm,cutlass3x_sm90_tensorop_gemm_f16_f16_f32_f16_f16_128x256x64_2x1x1_0_tnn_align8_warpspecialized_pingpong_epi_tma,passed,success,universal,512,512,512,f16:row,f16:column,f16:column,f16:column,1,0,serial,1,1,heuristic,invalid,invalid,false,false,1,tensorop,f32,128,256,64,2,1,1,0,0,0,4,4,1,1,64,256,16,90,90,1572864,268959744,171,0.0916928,15.9756,2933.27
1,CUTLASS,gemm,cutlass3x_sm90_tensorop_gemm_f16_f16_f32_f16_f16_128x256x64_2x1x1_0_tnn_align8_warpspecialized_pingpong_epi_nosmem,passed,success,universal,512,512,512,f16:row,f16:column,f16:column,f16:column,1,0,serial,1,1,heuristic,invalid,invalid,false,false,1,tensorop,f32,128,256,64,2,1,1,0,0,0,4,4,1,1,64,256,16,90,90,1572864,268959744,171,0.0881056,16.626,3052.7
1,CUTLASS,gemm,cutlass3x_sm90_tensorop_gemm_f16_f16_f32_f16_f16_128x256x64_2x1x1_0_tnn_align8_warpspecialized_cooperative_epi_nosmem,passed,success,universal,512,512,512,f16:row,f16:column,f16:column,f16:column,1,0,serial,1,1,heuristic,invalid,invalid,false,false,1,tensorop,f32,128,256,64,2,1,1,0,0,0,4,4,2,1,64,256,16,90,90,1572864,268959744,171,0.0131312,111.554,20482.5
1,CUTLASS,gemm,cutlass3x_sm90_tensorop_gemm_f16_f16_f32_f16_f16_128x256x64_2x1x1_0_tnn_align8_warpspecialized_cooperative_epi_tma,passed,success,universal,512,512,512,f16:row,f16:column,f16:column,f16:column,1,0,serial,1,1,heuristic,invalid,invalid,false,false,1,tensorop,f32,128,256,64,2,1,1,0,0,0,4,4,2,1,64,256,16,90,90,1572864,268959744,171,0.0116093,126.179,23167.7
1,CUTLASS,gemm,cutlass3x_sm90_tensorop_gemm_f16_f16_f32_f16_f16_128x256x64_2x1x1_0_tnn_align8_stream_k_warpspecialized_cooperative_epi_nosmem,passed,success,universal,512,512,512,f16:row,f16:column,f16:column,f16:column,1,0,serial,1,1,heuristic,invalid,invalid,false,false,1,tensorop,f32,128,256,64,2,1,1,0,0,0,4,4,2,1,64,256,16,90,90,1572864,268959744,171,0.0138534,105.739,19414.7
1,CUTLASS,gemm,cutlass3x_sm90_tensorop_gemm_f16_f16_f32_f16_f16_128x256x64_2x1x1_0_tnn_align8_stream_k_warpspecialized_cooperative_epi_tma,passed,success,universal,512,512,512,f16:row,f16:column,f16:column,f16:column,1,0,serial,1,1,heuristic,invalid,invalid,false,false,1,tensorop,f32,128,256,64,2,1,1,0,0,0,4,4,2,1,64,256,16,90,90,1572864,268959744,171,0.0123894,118.233,21708.8
1,CUTLASS,gemm,cutlass3x_sm90_tensorop_gemm_f16_f16_f32_f16_f16_128x256x64_1x2x1_0_tnn_align8,passed,success,universal,512,512,512,f16:row,f16:column,f16:column,f16:column,1,0,serial,1,1,heuristic,invalid,invalid,false,false,1,tensorop,f32,128,256,64,1,2,1,0,0,0,4,4,2,1,64,256,16,90,90,1572864,268959744,171,0.013072,112.06,20575.3
1,CUTLASS,gemm,cutlass3x_sm90_tensorop_gemm_f16_f16_f32_f16_f16_128x256x64_1x2x1_0_tnn_align8_warpspecialized_epi_nosmem,passed,success,universal,512,512,512,f16:row,f16:column,f16:column,f16:column,1,0,serial,1,1,heuristic,invalid,invalid,false,false,1,tensorop,f32,128,256,64,1,2,1,0,0,0,4,4,1,1,64,256,16,90,90,1572864,268959744,171,0.0796355,18.3944,3377.38
1,CUTLASS,gemm,cutlass3x_sm90_tensorop_gemm_f16_f16_f32_f16_f16_128x256x64_1x2x1_0_tnn_align8_warpspecialized_pingpong_epi_tma,passed,success,universal,512,512,512,f16:row,f16:column,f16:column,f16:column,1,0,serial,1,1,heuristic,invalid,invalid,false,false,1,tensorop,f32,128,256,64,1,2,1,0,0,0,4,4,1,1,64,256,16,90,90,1572864,268959744,171,0.0911798,16.0654,2949.77
1,CUTLASS,gemm,cutlass3x_sm90_tensorop_gemm_f16_f16_f32_f16_f16_128x256x64_1x2x1_0_tnn_align8_warpspecialized_pingpong_epi_nosmem,passed,success,universal,512,512,512,f16:row,f16:column,f16:column,f16:column,1,0,serial,1,1,heuristic,invalid,invalid,false,false,1,tensorop,f32,128,256,64,1,2,1,0,0,0,4,4,1,1,64,256,16,90,90,1572864,268959744,171,0.0881389,16.6197,3051.54
1,CUTLASS,gemm,cutlass3x_sm90_tensorop_gemm_f16_f16_f32_f16_f16_128x256x64_1x2x1_0_tnn_align8_warpspecialized_cooperative_epi_nosmem,passed,success,universal,512,512,512,f16:row,f16:column,f16:column,f16:column,1,0,serial,1,1,heuristic,invalid,invalid,false,false,1,tensorop,f32,128,256,64,1,2,1,0,0,0,4,4,2,1,64,256,16,90,90,1572864,268959744,171,0.0129296,113.294,20801.9
1,CUTLASS,gemm,cutlass3x_sm90_tensorop_gemm_f16_f16_f32_f16_f16_128x256x64_1x2x1_0_tnn_align8_warpspecialized_cooperative_epi_tma,passed,success,universal,512,512,512,f16:row,f16:column,f16:column,f16:column,1,0,serial,1,1,heuristic,invalid,invalid,false,false,1,tensorop,f32,128,256,64,1,2,1,0,0,0,4,4,2,1,64,256,16,90,90,1572864,268959744,171,0.0113891,128.618,23615.5
1,CUTLASS,gemm,cutlass3x_sm90_tensorop_gemm_f16_f16_f32_f16_f16_128x256x64_1x2x1_0_tnn_align8_stream_k_warpspecialized_cooperative_epi_nosmem,passed,success,universal,512,512,512,f16:row,f16:column,f16:column,f16:column,1,0,serial,1,1,heuristic,invalid,invalid,false,false,1,tensorop,f32,128,256,64,1,2,1,0,0,0,4,4,2,1,64,256,16,90,90,1572864,268959744,171,0.013689,107.009,19647.9
1,CUTLASS,gemm,cutlass3x_sm90_tensorop_gemm_f16_f16_f32_f16_f16_128x256x64_1x2x1_0_tnn_align8_stream_k_warpspecialized_cooperative_epi_tma,passed,success,universal,512,512,512,f16:row,f16:column,f16:column,f16:column,1,0,serial,1,1,heuristic,invalid,invalid,false,false,1,tensorop,f32,128,256,64,1,2,1,0,0,0,4,4,2,1,64,256,16,90,90,1572864,268959744,171,0.0124691,117.478,21570.1
1,CUTLASS,gemm,cutlass3x_sm90_tensorop_gemm_f16_f16_f32_f16_f16_64x256x64_1x2x1_0_tnn_align8,passed,success,universal,512,512,512,f16:row,f16:column,f16:column,f16:column,1,0,serial,1,1,heuristic,invalid,invalid,false,false,1,tensorop,f32,64,256,64,1,2,1,0,0,0,5,4,1,1,64,256,16,90,90,1572864,268959744,171,0.00907328,161.446,29643.1
1,CUTLASS,gemm,cutlass3x_sm90_tensorop_gemm_f16_f16_f32_f16_f16_64x256x64_1x2x1_0_tnn_align8_warpspecialized_epi_nosmem,passed,success,universal,512,512,512,f16:row,f16:column,f16:column,f16:column,1,0,serial,1,1,heuristic,invalid,invalid,false,false,1,tensorop,f32,64,256,64,1,2,1,0,0,0,5,4,1,1,64,256,16,90,90,1572864,268959744,171,0.00845664,173.218,31804.6
1,CUTLASS,gemm,cutlass3x_sm90_tensorop_gemm_f16_f16_f32_f16_f16_64x256x64_1x2x1_0_tnn_align8_warpspecialized_pingpong_epi_tma,passed,success,universal,512,512,512,f16:row,f16:column,f16:column,f16:column,1,0,serial,1,1,heuristic,invalid,invalid,false,false,1,tensorop,f32,64,256,64,1,2,1,0,0,0,5,4,1,1,64,256,16,90,90,1572864,268959744,171,0.00932,157.172,28858.3
1,CUTLASS,gemm,cutlass3x_sm90_tensorop_gemm_f16_f16_f32_f16_f16_64x256x64_1x2x1_0_tnn_align8_warpspecialized_pingpong_epi_nosmem,passed,success,universal,512,512,512,f16:row,f16:column,f16:column,f16:column,1,0,serial,1,1,heuristic,invalid,invalid,false,false,1,tensorop,f32,64,256,64,1,2,1,0,0,0,5,4,1,1,64,256,16,90,90,1572864,268959744,171,0.00908896,161.167,29591.9
1,CUTLASS,gemm,cutlass3x_sm90_tensorop_gemm_f16_f16_f32_f16_f16_256x128x64_1x2x1_0_tnn_align8,passed,success,universal,512,512,512,f16:row,f16:column,f16:column,f16:column,1,0,serial,1,1,heuristic,invalid,invalid,false,false,1,tensorop,f32,256,128,64,1,2,1,0,0,0,4,4,2,1,64,128,16,90,90,1572864,268959744,171,0.0133562,109.676,20137.5
1,CUTLASS,gemm,cutlass3x_sm90_tensorop_gemm_f16_f16_f32_f16_f16_256x128x64_1x2x1_0_tnn_align8_warpspecialized_epi_nosmem,passed,success,universal,512,512,512,f16:row,f16:column,f16:column,f16:column,1,0,serial,1,1,heuristic,invalid,invalid,false,false,1,tensorop,f32,256,128,64,1,2,1,0,0,0,4,4,1,1,64,128,16,90,90,1572864,268959744,171,0.0500429,29.2718,5374.59
1,CUTLASS,gemm,cutlass3x_sm90_tensorop_gemm_f16_f16_f32_f16_f16_256x128x64_1x2x1_0_tnn_align8_warpspecialized_pingpong_epi_tma,passed,success,universal,512,512,512,f16:row,f16:column,f16:column,f16:column,1,0,serial,1,1,heuristic,invalid,invalid,false,false,1,tensorop,f32,256,128,64,1,2,1,0,0,0,4,4,1,1,64,128,16,90,90,1572864,268959744,171,0.0623744,23.4847,4312.02
1,CUTLASS,gemm,cutlass3x_sm90_tensorop_gemm_f16_f16_f32_f16_f16_256x128x64_1x2x1_0_tnn_align8_warpspecialized_pingpong_epi_nosmem,passed,success,universal,512,512,512,f16:row,f16:column,f16:column,f16:column,1,0,serial,1,1,heuristic,invalid,invalid,false,false,1,tensorop,f32,256,128,64,1,2,1,0,0,0,4,4,1,1,64,128,16,90,90,1572864,268959744,171,0.0584611,25.0567,4600.66
1,CUTLASS,gemm,cutlass3x_sm90_tensorop_gemm_f16_f16_f32_f16_f16_256x128x64_1x2x1_0_tnn_align8_warpspecialized_cooperative_epi_nosmem,passed,success,universal,512,512,512,f16:row,f16:column,f16:column,f16:column,1,0,serial,1,1,heuristic,invalid,invalid,false,false,1,tensorop,f32,256,128,64,1,2,1,0,0,0,4,4,2,1,64,128,16,90,90,1572864,268959744,171,0.0134317,109.059,20024.3
1,CUTLASS,gemm,cutlass3x_sm90_tensorop_gemm_f16_f16_f32_f16_f16_256x128x64_1x2x1_0_tnn_align8_warpspecialized_cooperative_epi_tma,passed,success,universal,512,512,512,f16:row,f16:column,f16:column,f16:column,1,0,serial,1,1,heuristic,invalid,invalid,false,false,1,tensorop,f32,256,128,64,1,2,1,0,0,0,4,4,2,1,64,128,16,90,90,1572864,268959744,171,0.0116768,125.449,23033.7
1,CUTLASS,gemm,cutlass3x_sm90_tensorop_gemm_f16_f16_f32_f16_f16_256x128x64_1x2x1_0_tnn_align8_stream_k_warpspecialized_cooperative_epi_nosmem,passed,success,universal,512,512,512,f16:row,f16:column,f16:column,f16:column,1,0,serial,1,1,heuristic,invalid,invalid,false,false,1,tensorop,f32,256,128,64,1,2,1,0,0,0,4,4,2,1,64,128,16,90,90,1572864,268959744,171,0.0137814,106.291,19516.1
1,CUTLASS,gemm,cutlass3x_sm90_tensorop_gemm_f16_f16_f32_f16_f16_256x128x64_1x2x1_0_tnn_align8_stream_k_warpspecialized_cooperative_epi_tma,passed,success,universal,512,512,512,f16:row,f16:column,f16:column,f16:column,1,0,serial,1,1,heuristic,invalid,invalid,false,false,1,tensorop,f32,256,128,64,1,2,1,0,0,0,4,4,2,1,64,128,16,90,90,1572864,268959744,171,0.01256,116.628,21414
1,CUTLASS,gemm,cutlass3x_sm90_tensorop_gemm_f16_f16_f32_f16_f16_64x256x64_2x1x1_0_tnn_align8,passed,success,universal,512,512,512,f16:row,f16:column,f16:column,f16:column,1,0,serial,1,1,heuristic,invalid,invalid,false,false,1,tensorop,f32,64,256,64,2,1,1,0,0,0,5,4,1,1,64,256,16,90,90,1572864,268959744,171,0.00929824,157.54,28925.9
1,CUTLASS,gemm,cutlass3x_sm90_tensorop_gemm_f16_f16_f32_f16_f16_64x256x64_2x1x1_0_tnn_align8_warpspecialized_epi_nosmem,passed,success,universal,512,512,512,f16:row,f16:column,f16:column,f16:column,1,0,serial,1,1,heuristic,invalid,invalid,false,false,1,tensorop,f32,64,256,64,2,1,1,0,0,0,5,4,1,1,64,256,16,90,90,1572864,268959744,171,0.00865792,169.191,31065.2
1,CUTLASS,gemm,cutlass3x_sm90_tensorop_gemm_f16_f16_f32_f16_f16_64x256x64_2x1x1_0_tnn_align8_warpspecialized_pingpong_epi_tma,passed,success,universal,512,512,512,f16:row,f16:column,f16:column,f16:column,1,0,serial,1,1,heuristic,invalid,invalid,false,false,1,tensorop,f32,64,256,64,2,1,1,0,0,0,5,4,1,1,64,256,16,90,90,1572864,268959744,171,0.00941408,155.601,28569.9
1,CUTLASS,gemm,cutlass3x_sm90_tensorop_gemm_f16_f16_f32_f16_f16_64x256x64_2x1x1_0_tnn_align8_warpspecialized_pingpong_epi_nosmem,passed,success,universal,512,512,512,f16:row,f16:column,f16:column,f16:column,1,0,serial,1,1,heuristic,invalid,invalid,false,false,1,tensorop,f32,64,256,64,2,1,1,0,0,0,5,4,1,1,64,256,16,90,90,1572864,268959744,171,0.00931424,157.269,28876.2
1,CUTLASS,gemm,cutlass3x_sm90_tensorop_gemm_f16_f16_f32_f16_f16_256x256x64_1x2x1_0_tnn_align8,passed,success,universal,512,512,512,f16:row,f16:column,f16:column,f16:column,1,0,serial,1,1,heuristic,invalid,invalid,false,false,1,tensorop,f32,256,256,64,1,2,1,0,0,0,3,4,2,1,64,256,16,90,90,1572864,268959744,171,0.144293,10.1518,1863.98
1,CUTLASS,gemm,cutlass3x_sm90_tensorop_gemm_f16_f16_f32_f16_f16_256x256x64_1x2x1_0_tnn_align8_warpspecialized_epi_nosmem,passed,success,universal,512,512,512,f16:row,f16:column,f16:column,f16:column,1,0,serial,1,1,heuristic,invalid,invalid,false,false,1,tensorop,f32,256,256,64,1,2,1,0,0,0,3,4,1,1,64,256,16,90,90,1572864,268959744,171,0.343735,4.26155,782.463
1,CUTLASS,gemm,cutlass3x_sm90_tensorop_gemm_f16_f16_f32_f16_f16_256x256x64_1x2x1_0_tnn_align8_warpspecialized_pingpong_epi_nosmem,passed,success,universal,512,512,512,f16:row,f16:column,f16:column,f16:column,1,0,serial,1,1,heuristic,invalid,invalid,false,false,1,tensorop,f32,256,256,64,1,2,1,0,0,0,3,4,1,1,64,256,16,90,90,1572864,268959744,171,0.362984,4.03556,740.969
1,CUTLASS,gemm,cutlass3x_sm90_tensorop_gemm_f16_f16_f32_f16_f16_256x256x64_1x2x1_0_tnn_align8_warpspecialized_cooperative_epi_nosmem,passed,success,universal,512,512,512,f16:row,f16:column,f16:column,f16:column,1,0,serial,1,1,heuristic,invalid,invalid,false,false,1,tensorop,f32,256,256,64,1,2,1,0,0,0,3,4,2,1,64,256,16,90,90,1572864,268959744,171,0.144696,10.1236,1858.8
1,CUTLASS,gemm,cutlass3x_sm90_tensorop_gemm_f16_f16_f32_f16_f16_256x256x64_1x2x1_0_tnn_align8_stream_k_warpspecialized_cooperative_epi_nosmem,passed,success,universal,512,512,512,f16:row,f16:column,f16:column,f16:column,1,0,serial,1,1,heuristic,invalid,invalid,false,false,1,tensorop,f32,256,256,64,1,2,1,0,0,0,3,4,2,1,64,256,16,90,90,1572864,268959744,171,0.148138,9.88838,1815.6
1,CUTLASS,gemm,cutlass3x_sm90_tensorop_gemm_f16_f16_f32_f16_f16_256x256x64_2x1x1_0_tnn_align8,passed,success,universal,512,512,512,f16:row,f16:column,f16:column,f16:column,1,0,serial,1,1,heuristic,invalid,invalid,false,false,1,tensorop,f32,256,256,64,2,1,1,0,0,0,3,4,2,1,64,256,16,90,90,1572864,268959744,171,0.143854,10.1829,1869.67
1,CUTLASS,gemm,cutlass3x_sm90_tensorop_gemm_f16_f16_f32_f16_f16_256x256x64_2x1x1_0_tnn_align8_warpspecialized_epi_nosmem,passed,success,universal,512,512,512,f16:row,f16:column,f16:column,f16:column,1,0,serial,1,1,heuristic,invalid,invalid,false,false,1,tensorop,f32,256,256,64,2,1,1,0,0,0,3,4,1,1,64,256,16,90,90,1572864,268959744,171,0.343434,4.26529,783.148
1,CUTLASS,gemm,cutlass3x_sm90_tensorop_gemm_f16_f16_f32_f16_f16_256x256x64_2x1x1_0_tnn_align8_warpspecialized_pingpong_epi_nosmem,passed,success,universal,512,512,512,f16:row,f16:column,f16:column,f16:column,1,0,serial,1,1,heuristic,invalid,invalid,false,false,1,tensorop,f32,256,256,64,2,1,1,0,0,0,3,4,1,1,64,256,16,90,90,1572864,268959744,171,0.353303,4.14614,761.271
1,CUTLASS,gemm,cutlass3x_sm90_tensorop_gemm_f16_f16_f32_f16_f16_256x256x64_2x1x1_0_tnn_align8_warpspecialized_cooperative_epi_nosmem,passed,success,universal,512,512,512,f16:row,f16:column,f16:column,f16:column,1,0,serial,1,1,heuristic,invalid,invalid,false,false,1,tensorop,f32,256,256,64,2,1,1,0,0,0,3,4,2,1,64,256,16,90,90,1572864,268959744,171,0.144409,10.1437,1862.48
1,CUTLASS,gemm,cutlass3x_sm90_tensorop_gemm_f16_f16_f32_f16_f16_256x256x64_2x1x1_0_tnn_align8_stream_k_warpspecialized_cooperative_epi_nosmem,passed,success,universal,512,512,512,f16:row,f16:column,f16:column,f16:column,1,0,serial,1,1,heuristic,invalid,invalid,false,false,1,tensorop,f32,256,256,64,2,1,1,0,0,0,3,4,2,1,64,256,16,90,90,1572864,268959744,171,0.147934,9.902,1818.11
1,CUTLASS,gemm,cutlass3x_sm90_tensorop_gemm_f16_f16_f32_f16_f16_128x128x64_2x1x1_0_tnn_align8,passed,success,universal,512,512,512,f16:row,f16:column,f16:column,f16:column,1,0,serial,1,1,heuristic,invalid,invalid,false,false,1,tensorop,f32,128,128,64,2,1,1,0,0,0,7,4,2,1,64,128,16,90,90,1572864,268959744,171,0.00914208,160.231,29420
1,CUTLASS,gemm,cutlass3x_sm90_tensorop_gemm_f16_f16_f32_f16_f16_128x128x64_2x1x1_0_tnn_align8_warpspecialized_epi_nosmem,passed,success,universal,512,512,512,f16:row,f16:column,f16:column,f16:column,1,0,serial,1,1,heuristic,invalid,invalid,false,false,1,tensorop,f32,128,128,64,2,1,1,0,0,0,7,4,1,1,64,128,16,90,90,1572864,268959744,171,0.00895008,163.668,30051.1
1,CUTLASS,gemm,cutlass3x_sm90_tensorop_gemm_f16_f16_f32_f16_f16_128x128x64_2x1x1_0_tnn_align8_warpspecialized_pingpong_epi_tma,passed,success,universal,512,512,512,f16:row,f16:column,f16:column,f16:column,1,0,serial,1,1,heuristic,invalid,invalid,false,false,1,tensorop,f32,128,128,64,2,1,1,0,0,0,6,4,1,1,64,128,16,90,90,1572864,268959744,171,0.00913792,160.304,29433.4
1,CUTLASS,gemm,cutlass3x_sm90_tensorop_gemm_f16_f16_f32_f16_f16_128x128x64_2x1x1_0_tnn_align8_warpspecialized_pingpong_epi_nosmem,passed,success,universal,512,512,512,f16:row,f16:column,f16:column,f16:column,1,0,serial,1,1,heuristic,invalid,invalid,false,false,1,tensorop,f32,128,128,64,2,1,1,0,0,0,7,4,1,1,64,128,16,90,90,1572864,268959744,171,0.00925504,158.275,29060.9
1,CUTLASS,gemm,cutlass3x_sm90_tensorop_gemm_f16_f16_f32_f16_f16_128x128x64_2x1x1_0_tnn_align8_warpspecialized_cooperative_epi_nosmem,passed,success,universal,512,512,512,f16:row,f16:column,f16:column,f16:column,1,0,serial,1,1,heuristic,invalid,invalid,false,false,1,tensorop,f32,128,128,64,2,1,1,0,0,0,7,4,2,1,64,128,16,90,90,1572864,268959744,171,0.00924928,158.374,29079
1,CUTLASS,gemm,cutlass3x_sm90_tensorop_gemm_f16_f16_f32_f16_f16_128x128x64_2x1x1_0_tnn_align8_warpspecialized_cooperative_epi_tma,passed,success,universal,512,512,512,f16:row,f16:column,f16:column,f16:column,1,0,serial,1,1,heuristic,invalid,invalid,false,false,1,tensorop,f32,128,128,64,2,1,1,0,0,0,6,4,2,1,64,128,16,90,90,1572864,268959744,171,0.00855584,171.21,31435.8
1,CUTLASS,gemm,cutlass3x_sm90_tensorop_gemm_f16_f16_f32_f16_f16_128x128x64_2x1x1_0_tnn_align8_stream_k_warpspecialized_cooperative_epi_nosmem,passed,success,universal,512,512,512,f16:row,f16:column,f16:column,f16:column,1,0,serial,1,1,heuristic,invalid,invalid,false,false,1,tensorop,f32,128,128,64,2,1,1,0,0,0,7,4,2,1,64,128,16,90,90,1572864,268959744,171,0.00956992,153.068,28104.7
1,CUTLASS,gemm,cutlass3x_sm90_tensorop_gemm_f16_f16_f32_f16_f16_128x128x64_2x1x1_0_tnn_align8_stream_k_warpspecialized_cooperative_epi_tma,passed,success,universal,512,512,512,f16:row,f16:column,f16:column,f16:column,1,0,serial,1,1,heuristic,invalid,invalid,false,false,1,tensorop,f32,128,128,64,2,1,1,0,0,0,6,4,2,1,64,128,16,90,90,1572864,268959744,171,0.00924,158.533,29108.2
1,CUTLASS,gemm,cutlass3x_sm90_tensorop_gemm_f16_f16_f32_f16_f16_128x128x64_1x2x1_0_tnn_align8,passed,success,universal,512,512,512,f16:row,f16:column,f16:column,f16:column,1,0,serial,1,1,heuristic,invalid,invalid,false,false,1,tensorop,f32,128,128,64,1,2,1,0,0,0,7,4,2,1,64,128,16,90,90,1572864,268959744,171,0.00937248,156.292,28696.8
1,CUTLASS,gemm,cutlass3x_sm90_tensorop_gemm_f16_f16_f32_f16_f16_128x128x64_1x2x1_0_tnn_align8_warpspecialized_epi_nosmem,passed,success,universal,512,512,512,f16:row,f16:column,f16:column,f16:column,1,0,serial,1,1,heuristic,invalid,invalid,false,false,1,tensorop,f32,128,128,64,1,2,1,0,0,0,7,4,1,1,64,128,16,90,90,1572864,268959744,171,0.00869536,168.463,30931.4
1,CUTLASS,gemm,cutlass3x_sm90_tensorop_gemm_f16_f16_f32_f16_f16_128x128x64_1x2x1_0_tnn_align8_warpspecialized_pingpong_epi_tma,passed,success,universal,512,512,512,f16:row,f16:column,f16:column,f16:column,1,0,serial,1,1,heuristic,invalid,invalid,false,false,1,tensorop,f32,128,128,64,1,2,1,0,0,0,6,4,1,1,64,128,16,90,90,1572864,268959744,171,0.009176,159.639,29311.2
1,CUTLASS,gemm,cutlass3x_sm90_tensorop_gemm_f16_f16_f32_f16_f16_128x128x64_1x2x1_0_tnn_align8_warpspecialized_pingpong_epi_nosmem,passed,success,universal,512,512,512,f16:row,f16:column,f16:column,f16:column,1,0,serial,1,1,heuristic,invalid,invalid,false,false,1,tensorop,f32,128,128,64,1,2,1,0,0,0,7,4,1,1,64,128,16,90,90,1572864,268959744,171,0.00906464,161.6,29671.3
1,CUTLASS,gemm,cutlass3x_sm90_tensorop_gemm_f16_f16_f32_f16_f16_128x128x64_1x2x1_0_tnn_align8_warpspecialized_cooperative_epi_nosmem,passed,success,universal,512,512,512,f16:row,f16:column,f16:column,f16:column,1,0,serial,1,1,heuristic,invalid,invalid,false,false,1,tensorop,f32,128,128,64,1,2,1,0,0,0,7,4,2,1,64,128,16,90,90,1572864,268959744,171,0.00937888,156.185,28677.2
1,CUTLASS,gemm,cutlass3x_sm90_tensorop_gemm_f16_f16_f32_f16_f16_128x128x64_1x2x1_0_tnn_align8_warpspecialized_cooperative_epi_tma,passed,success,universal,512,512,512,f16:row,f16:column,f16:column,f16:column,1,0,serial,1,1,heuristic,invalid,invalid,false,false,1,tensorop,f32,128,128,64,1,2,1,0,0,0,6,4,2,1,64,128,16,90,90,1572864,268959744,171,0.00869376,168.494,30937.1
1,CUTLASS,gemm,cutlass3x_sm90_tensorop_gemm_f16_f16_f32_f16_f16_128x128x64_1x2x1_0_tnn_align8_stream_k_warpspecialized_cooperative_epi_nosmem,passed,success,universal,512,512,512,f16:row,f16:column,f16:column,f16:column,1,0,serial,1,1,heuristic,invalid,invalid,false,false,1,tensorop,f32,128,128,64,1,2,1,0,0,0,7,4,2,1,64,128,16,90,90,1572864,268959744,171,0.00978144,149.757,27496.9
1,CUTLASS,gemm,cutlass3x_sm90_tensorop_gemm_f16_f16_f32_f16_f16_128x128x64_1x2x1_0_tnn_align8_stream_k_warpspecialized_cooperative_epi_tma,passed,success,universal,512,512,512,f16:row,f16:column,f16:column,f16:column,1,0,serial,1,1,heuristic,invalid,invalid,false,false,1,tensorop,f32,128,128,64,1,2,1,0,0,0,6,4,2,1,64,128,16,90,90,1572864,268959744,171,0.00944992,155.011,28461.6
1,CUTLASS,gemm,cutlass3x_sm90_tensorop_gemm_f16_f16_f32_f16_f16_256x128x64_2x1x1_0_tnn_align8,passed,success,universal,512,512,512,f16:row,f16:column,f16:column,f16:column,1,0,serial,1,1,heuristic,invalid,invalid,false,false,1,tensorop,f32,256,128,64,2,1,1,0,0,0,4,4,2,1,64,128,16,90,90,1572864,268959744,171,0.0129443,113.165,20778.2
1,CUTLASS,gemm,cutlass3x_sm90_tensorop_gemm_f16_f16_f32_f16_f16_256x128x64_2x1x1_0_tnn_align8_warpspecialized_epi_nosmem,passed,success,universal,512,512,512,f16:row,f16:column,f16:column,f16:column,1,0,serial,1,1,heuristic,invalid,invalid,false,false,1,tensorop,f32,256,128,64,2,1,1,0,0,0,4,4,1,1,64,128,16,90,90,1572864,268959744,171,0.0506058,28.9462,5314.8
1,CUTLASS,gemm,cutlass3x_sm90_tensorop_gemm_f16_f16_f32_f16_f16_256x128x64_2x1x1_0_tnn_align8_warpspecialized_pingpong_epi_tma,passed,success,universal,512,512,512,f16:row,f16:column,f16:column,f16:column,1,0,serial,1,1,heuristic,invalid,invalid,false,false,1,tensorop,f32,256,128,64,2,1,1,0,0,0,4,4,1,1,64,128,16,90,90,1572864,268959744,171,0.0629014,23.2879,4275.89
1,CUTLASS,gemm,cutlass3x_sm90_tensorop_gemm_f16_f16_f32_f16_f16_256x128x64_2x1x1_0_tnn_align8_warpspecialized_pingpong_epi_nosmem,passed,success,universal,512,512,512,f16:row,f16:column,f16:column,f16:column,1,0,serial,1,1,heuristic,invalid,invalid,false,false,1,tensorop,f32,256,128,64,2,1,1,0,0,0,4,4,1,1,64,128,16,90,90,1572864,268959744,171,0.0593869,24.6661,4528.94
1,CUTLASS,gemm,cutlass3x_sm90_tensorop_gemm_f16_f16_f32_f16_f16_256x128x64_2x1x1_0_tnn_align8_warpspecialized_cooperative_epi_nosmem,passed,success,universal,512,512,512,f16:row,f16:column,f16:column,f16:column,1,0,serial,1,1,heuristic,invalid,invalid,false,false,1,tensorop,f32,256,128,64,2,1,1,0,0,0,4,4,2,1,64,128,16,90,90,1572864,268959744,171,0.0129872,112.791,20709.6
1,CUTLASS,gemm,cutlass3x_sm90_tensorop_gemm_f16_f16_f32_f16_f16_256x128x64_2x1x1_0_tnn_align8_warpspecialized_cooperative_epi_tma,passed,success,universal,512,512,512,f16:row,f16:column,f16:column,f16:column,1,0,serial,1,1,heuristic,invalid,invalid,false,false,1,tensorop,f32,256,128,64,2,1,1,0,0,0,4,4,2,1,64,128,16,90,90,1572864,268959744,171,0.0116154,126.113,23155.5
1,CUTLASS,gemm,cutlass3x_sm90_tensorop_gemm_f16_f16_f32_f16_f16_256x128x64_2x1x1_0_tnn_align8_stream_k_warpspecialized_cooperative_epi_nosmem,passed,success,universal,512,512,512,f16:row,f16:column,f16:column,f16:column,1,0,serial,1,1,heuristic,invalid,invalid,false,false,1,tensorop,f32,256,128,64,2,1,1,0,0,0,4,4,2,1,64,128,16,90,90,1572864,268959744,171,0.01388,105.536,19377.5
1,CUTLASS,gemm,cutlass3x_sm90_tensorop_gemm_f16_f16_f32_f16_f16_256x128x64_2x1x1_0_tnn_align8_stream_k_warpspecialized_cooperative_epi_tma,passed,success,universal,512,512,512,f16:row,f16:column,f16:column,f16:column,1,0,serial,1,1,heuristic,invalid,invalid,false,false,1,tensorop,f32,256,128,64,2,1,1,0,0,0,4,4,2,1,64,128,16,90,90,1572864,268959744,171,0.0124787,117.387,21553.5
1,CUTLASS,gemm,cutlass3x_sm90_tensorop_gemm_f16_f16_f32_f16_f16_128x256x64_1x1x1_0_tnn_align4_cpasync_warpspecialized_epi_nosmem,passed,success,universal,512,512,512,f16:row,f16:column,f16:column,f16:column,1,0,serial,1,1,heuristic,invalid,invalid,false,false,1,tensorop,f32,128,256,64,1,1,1,0,0,0,4,4,1,1,64,256,16,90,90,1572864,268959744,171,0.121495,12.0569,2213.76
1,CUTLASS,gemm,cutlass3x_sm90_tensorop_gemm_f16_f16_f32_f16_f16_128x256x64_1x1x1_0_tnn_align4_cpasync_warpspecialized_cooperative_epi_nosmem,passed,success,universal,512,512,512,f16:row,f16:column,f16:column,f16:column,1,0,serial,1,1,heuristic,invalid,invalid,false,false,1,tensorop,f32,128,256,64,1,1,1,0,0,0,4,4,2,1,64,256,16,90,90,1572864,268959744,171,0.0155213,94.3765,17328.5
1,CUTLASS,gemm,cutlass3x_sm90_tensorop_gemm_f16_f16_f32_f16_f16_128x256x64_1x1x1_0_tnn_align4_stream_k_cpasync_warpspecialized_cooperative_epi_nosmem,passed,success,universal,512,512,512,f16:row,f16:column,f16:column,f16:column,1,0,serial,1,1,heuristic,invalid,invalid,false,false,1,tensorop,f32,128,256,64,1,1,1,0,0,0,4,4,2,1,64,256,16,90,90,1572864,268959744,171,0.0160688,91.1607,16738
1,CUTLASS,gemm,cutlass3x_sm90_tensorop_gemm_f16_f16_f32_f16_f16_128x256x64_1x1x1_0_tnn_align2_cpasync_warpspecialized_epi_nosmem,passed,success,universal,512,512,512,f16:row,f16:column,f16:column,f16:column,1,0,serial,1,1,heuristic,invalid,invalid,false,false,1,tensorop,f32,128,256,64,1,1,1,0,0,0,4,4,1,1,64,256,16,90,90,1572864,268959744,171,0.121976,12.0093,2205.03
1,CUTLASS,gemm,cutlass3x_sm90_tensorop_gemm_f16_f16_f32_f16_f16_128x256x64_1x1x1_0_tnn_align2_cpasync_warpspecialized_cooperative_epi_nosmem,passed,success,universal,512,512,512,f16:row,f16:column,f16:column,f16:column,1,0,serial,1,1,heuristic,invalid,invalid,false,false,1,tensorop,f32,128,256,64,1,1,1,0,0,0,4,4,2,1,64,256,16,90,90,1572864,268959744,171,0.0202531,72.3268,13279.9
1,CUTLASS,gemm,cutlass3x_sm90_tensorop_gemm_f16_f16_f32_f16_f16_128x256x64_1x1x1_0_tnn_align2_stream_k_cpasync_warpspecialized_cooperative_epi_nosmem,passed,success,universal,512,512,512,f16:row,f16:column,f16:column,f16:column,1,0,serial,1,1,heuristic,invalid,invalid,false,false,1,tensorop,f32,128,256,64,1,1,1,0,0,0,4,4,2,1,64,256,16,90,90,1572864,268959744,171,0.0245101,59.7649,10973.4
1,CUTLASS,gemm,cutlass3x_sm90_tensorop_gemm_f16_f16_f32_f16_f16_128x128x64_1x1x1_0_tnn_align4_cpasync_warpspecialized_epi_nosmem,passed,success,universal,512,512,512,f16:row,f16:column,f16:column,f16:column,1,0,serial,1,1,heuristic,invalid,invalid,false,false,1,tensorop,f32,128,128,64,1,1,1,0,0,0,7,4,1,1,64,128,16,90,90,1572864,268959744,171,0.010415,140.647,25824.2
1,CUTLASS,gemm,cutlass3x_sm90_tensorop_gemm_f16_f16_f32_f16_f16_128x128x64_1x1x1_0_tnn_align4_cpasync_warpspecialized_cooperative_epi_nosmem,passed,success,universal,512,512,512,f16:row,f16:column,f16:column,f16:column,1,0,serial,1,1,heuristic,invalid,invalid,false,false,1,tensorop,f32,128,128,64,1,1,1,0,0,0,7,4,2,1,64,128,16,90,90,1572864,268959744,171,0.0125488,116.732,21433.1
1,CUTLASS,gemm,cutlass3x_sm90_tensorop_gemm_f16_f16_f32_f16_f16_128x128x64_1x1x1_0_tnn_align4_stream_k_cpasync_warpspecialized_cooperative_epi_nosmem,passed,success,universal,512,512,512,f16:row,f16:column,f16:column,f16:column,1,0,serial,1,1,heuristic,invalid,invalid,false,false,1,tensorop,f32,128,128,64,1,1,1,0,0,0,7,4,2,1,64,128,16,90,90,1572864,268959744,171,0.0130074,112.617,20677.5
1,CUTLASS,gemm,cutlass3x_sm90_tensorop_gemm_f16_f16_f32_f16_f16_128x128x64_1x1x1_0_tnn_align2_cpasync_warpspecialized_epi_nosmem,passed,success,universal,512,512,512,f16:row,f16:column,f16:column,f16:column,1,0,serial,1,1,heuristic,invalid,invalid,false,false,1,tensorop,f32,128,128,64,1,1,1,0,0,0,7,4,1,1,64,128,16,90,90,1572864,268959744,171,0.0119603,122.475,22487.7
1,CUTLASS,gemm,cutlass3x_sm90_tensorop_gemm_f16_f16_f32_f16_f16_128x128x64_1x1x1_0_tnn_align2_cpasync_warpspecialized_cooperative_epi_nosmem,passed,success,universal,512,512,512,f16:row,f16:column,f16:column,f16:column,1,0,serial,1,1,heuristic,invalid,invalid,false,false,1,tensorop,f32,128,128,64,1,1,1,0,0,0,7,4,2,1,64,128,16,90,90,1572864,268959744,171,0.0148339,98.7496,18131.4
1,CUTLASS,gemm,cutlass3x_sm90_tensorop_gemm_f16_f16_f32_f16_f16_128x128x64_1x1x1_0_tnn_align2_stream_k_cpasync_warpspecialized_cooperative_epi_nosmem,passed,success,universal,512,512,512,f16:row,f16:column,f16:column,f16:column,1,0,serial,1,1,heuristic,invalid,invalid,false,false,1,tensorop,f32,128,128,64,1,1,1,0,0,0,7,4,2,1,64,128,16,90,90,1572864,268959744,171,0.0154851,94.5969,17368.9
