profiler_out/no_search/4096x5120x4096.log



=============================
  Problem ID: 1

        Provider: [1;37mCUTLASS[0m
   OperationKind: [1;37mgemm[0m
       Operation: cutlass3x_sm90_tensorop_gemm_f16_f16_f32_f16_f16_64x16x128_1x4x1_0_tnn_align8

          Status: [1;37mSuccess[0m
    Verification: [1;37mON[0m
     Disposition: [1;32mPassed[0m

reference_device: Passed
          cuBLAS: Not run
           cuDNN: Not run

       Arguments: --gemm_kind=universal --m=4096 --n=5120 --k=4096 --A=f16:row --B=f16:column --C=f16:column --D=f16:column  \
                  --alpha=1 --beta=0 --split_k_mode=serial --split_k_slices=1 --batch_count=1 --raster_order=heuristic  \
                  --runtime_input_datatype_a=invalid --runtime_input_datatype_b=invalid --use_pdl=false --enable_sm90_mixed_dtype_shuffle_test=false  \
                  --swizzle_size=1 --op_class=tensorop --accum=f32 --cta_m=64 --cta_n=16 --cta_k=128 --cluster_m=1 --cluster_n=4  \
                  --cluster_k=1 --cluster_m_fallback=0 --cluster_n_fallback=0 --cluster_k_fallback=0 --stages=11 --warps_m=4  \
                  --warps_n=1 --warps_k=1 --inst_m=64 --inst_n=16 --inst_k=16 --min_cc=90 --max_cc=90

           Bytes: 117440512  bytes
           FLOPs: 171840634880  flops
           FLOPs/Byte: 1463

         Runtime: 0.78049  ms
          Memory: 140.136 GiB/s

            Math: 220170 GFLOP/s



=============================
  Problem ID: 1

        Provider: [1;37mCUTLASS[0m
   OperationKind: [1;37mgemm[0m
       Operation: cutlass3x_sm90_tensorop_gemm_f16_f16_f32_f16_f16_64x16x128_1x4x1_0_tnn_align8_warpspecialized_epi_nosmem

          Status: [1;37mSuccess[0m
    Verification: [1;37mON[0m
     Disposition: [1;32mPassed[0m

reference_device: Passed
          cuBLAS: Not run
           cuDNN: Not run

       Arguments: --gemm_kind=universal --m=4096 --n=5120 --k=4096 --A=f16:row --B=f16:column --C=f16:column --D=f16:column  \
                  --alpha=1 --beta=0 --split_k_mode=serial --split_k_slices=1 --batch_count=1 --raster_order=heuristic  \
                  --runtime_input_datatype_a=invalid --runtime_input_datatype_b=invalid --use_pdl=false --enable_sm90_mixed_dtype_shuffle_test=false  \
                  --swizzle_size=1 --op_class=tensorop --accum=f32 --cta_m=64 --cta_n=16 --cta_k=128 --cluster_m=1 --cluster_n=4  \
                  --cluster_k=1 --cluster_m_fallback=0 --cluster_n_fallback=0 --cluster_k_fallback=0 --stages=11 --warps_m=4  \
                  --warps_n=1 --warps_k=1 --inst_m=64 --inst_n=16 --inst_k=16 --min_cc=90 --max_cc=90

           Bytes: 117440512  bytes
           FLOPs: 171840634880  flops
           FLOPs/Byte: 1463

         Runtime: 1.07739  ms
          Memory: 101.518 GiB/s

            Math: 159496 GFLOP/s



=============================
  Problem ID: 1

        Provider: [1;37mCUTLASS[0m
   OperationKind: [1;37mgemm[0m
       Operation: cutlass3x_sm90_tensorop_gemm_f16_f16_f32_f16_f16_64x16x128_1x4x1_0_tnn_align8_warpspecialized_pingpong_epi_tma

          Status: [1;37mSuccess[0m
    Verification: [1;37mON[0m
     Disposition: [1;32mPassed[0m

reference_device: Passed
          cuBLAS: Not run
           cuDNN: Not run

       Arguments: --gemm_kind=universal --m=4096 --n=5120 --k=4096 --A=f16:row --B=f16:column --C=f16:column --D=f16:column  \
                  --alpha=1 --beta=0 --split_k_mode=serial --split_k_slices=1 --batch_count=1 --raster_order=heuristic  \
                  --runtime_input_datatype_a=invalid --runtime_input_datatype_b=invalid --use_pdl=false --enable_sm90_mixed_dtype_shuffle_test=false  \
                  --swizzle_size=1 --op_class=tensorop --accum=f32 --cta_m=64 --cta_n=16 --cta_k=128 --cluster_m=1 --cluster_n=4  \
                  --cluster_k=1 --cluster_m_fallback=0 --cluster_n_fallback=0 --cluster_k_fallback=0 --stages=11 --warps_m=4  \
                  --warps_n=1 --warps_k=1 --inst_m=64 --inst_n=16 --inst_k=16 --min_cc=90 --max_cc=90

           Bytes: 117440512  bytes
           FLOPs: 171840634880  flops
           FLOPs/Byte: 1463

         Runtime: 0.777025  ms
          Memory: 140.761 GiB/s

            Math: 221152 GFLOP/s



=============================
  Problem ID: 1

        Provider: [1;37mCUTLASS[0m
   OperationKind: [1;37mgemm[0m
       Operation: cutlass3x_sm90_tensorop_gemm_f16_f16_f32_f16_f16_64x16x128_1x4x1_0_tnn_align8_warpspecialized_pingpong_epi_nosmem

          Status: [1;37mSuccess[0m
    Verification: [1;37mON[0m
     Disposition: [1;32mPassed[0m

reference_device: Passed
          cuBLAS: Not run
           cuDNN: Not run

       Arguments: --gemm_kind=universal --m=4096 --n=5120 --k=4096 --A=f16:row --B=f16:column --C=f16:column --D=f16:column  \
                  --alpha=1 --beta=0 --split_k_mode=serial --split_k_slices=1 --batch_count=1 --raster_order=heuristic  \
                  --runtime_input_datatype_a=invalid --runtime_input_datatype_b=invalid --use_pdl=false --enable_sm90_mixed_dtype_shuffle_test=false  \
                  --swizzle_size=1 --op_class=tensorop --accum=f32 --cta_m=64 --cta_n=16 --cta_k=128 --cluster_m=1 --cluster_n=4  \
                  --cluster_k=1 --cluster_m_fallback=0 --cluster_n_fallback=0 --cluster_k_fallback=0 --stages=11 --warps_m=4  \
                  --warps_n=1 --warps_k=1 --inst_m=64 --inst_n=16 --inst_k=16 --min_cc=90 --max_cc=90

           Bytes: 117440512  bytes
           FLOPs: 171840634880  flops
           FLOPs/Byte: 1463

         Runtime: 0.776396  ms
          Memory: 140.875 GiB/s

            Math: 221331 GFLOP/s



=============================
  Problem ID: 1

        Provider: [1;37mCUTLASS[0m
   OperationKind: [1;37mgemm[0m
       Operation: cutlass3x_sm90_tensorop_gemm_f16_f16_f32_f16_f16_64x16x128_4x1x1_0_tnn_align8

          Status: [1;37mSuccess[0m
    Verification: [1;37mON[0m
     Disposition: [1;32mPassed[0m

reference_device: Passed
          cuBLAS: Not run
           cuDNN: Not run

       Arguments: --gemm_kind=universal --m=4096 --n=5120 --k=4096 --A=f16:row --B=f16:column --C=f16:column --D=f16:column  \
                  --alpha=1 --beta=0 --split_k_mode=serial --split_k_slices=1 --batch_count=1 --raster_order=heuristic  \
                  --runtime_input_datatype_a=invalid --runtime_input_datatype_b=invalid --use_pdl=false --enable_sm90_mixed_dtype_shuffle_test=false  \
                  --swizzle_size=1 --op_class=tensorop --accum=f32 --cta_m=64 --cta_n=16 --cta_k=128 --cluster_m=4 --cluster_n=1  \
                  --cluster_k=1 --cluster_m_fallback=0 --cluster_n_fallback=0 --cluster_k_fallback=0 --stages=11 --warps_m=4  \
                  --warps_n=1 --warps_k=1 --inst_m=64 --inst_n=16 --inst_k=16 --min_cc=90 --max_cc=90

           Bytes: 117440512  bytes
           FLOPs: 171840634880  flops
           FLOPs/Byte: 1463

         Runtime: 1.4932  ms
          Memory: 73.249 GiB/s

            Math: 115082 GFLOP/s



=============================
  Problem ID: 1

        Provider: [1;37mCUTLASS[0m
   OperationKind: [1;37mgemm[0m
       Operation: cutlass3x_sm90_tensorop_gemm_f16_f16_f32_f16_f16_64x16x128_4x1x1_0_tnn_align8_warpspecialized_epi_nosmem

          Status: [1;37mSuccess[0m
    Verification: [1;37mON[0m
     Disposition: [1;32mPassed[0m

reference_device: Passed
          cuBLAS: Not run
           cuDNN: Not run

       Arguments: --gemm_kind=universal --m=4096 --n=5120 --k=4096 --A=f16:row --B=f16:column --C=f16:column --D=f16:column  \
                  --alpha=1 --beta=0 --split_k_mode=serial --split_k_slices=1 --batch_count=1 --raster_order=heuristic  \
                  --runtime_input_datatype_a=invalid --runtime_input_datatype_b=invalid --use_pdl=false --enable_sm90_mixed_dtype_shuffle_test=false  \
                  --swizzle_size=1 --op_class=tensorop --accum=f32 --cta_m=64 --cta_n=16 --cta_k=128 --cluster_m=4 --cluster_n=1  \
                  --cluster_k=1 --cluster_m_fallback=0 --cluster_n_fallback=0 --cluster_k_fallback=0 --stages=11 --warps_m=4  \
                  --warps_n=1 --warps_k=1 --inst_m=64 --inst_n=16 --inst_k=16 --min_cc=90 --max_cc=90

           Bytes: 117440512  bytes
           FLOPs: 171840634880  flops
           FLOPs/Byte: 1463

         Runtime: 1.75178  ms
          Memory: 62.4366 GiB/s

            Math: 98095 GFLOP/s



=============================
  Problem ID: 1

        Provider: [1;37mCUTLASS[0m
   OperationKind: [1;37mgemm[0m
       Operation: cutlass3x_sm90_tensorop_gemm_f16_f16_f32_f16_f16_64x16x128_4x1x1_0_tnn_align8_warpspecialized_pingpong_epi_tma

          Status: [1;37mSuccess[0m
    Verification: [1;37mON[0m
     Disposition: [1;32mPassed[0m

reference_device: Passed
          cuBLAS: Not run
           cuDNN: Not run

       Arguments: --gemm_kind=universal --m=4096 --n=5120 --k=4096 --A=f16:row --B=f16:column --C=f16:column --D=f16:column  \
                  --alpha=1 --beta=0 --split_k_mode=serial --split_k_slices=1 --batch_count=1 --raster_order=heuristic  \
                  --runtime_input_datatype_a=invalid --runtime_input_datatype_b=invalid --use_pdl=false --enable_sm90_mixed_dtype_shuffle_test=false  \
                  --swizzle_size=1 --op_class=tensorop --accum=f32 --cta_m=64 --cta_n=16 --cta_k=128 --cluster_m=4 --cluster_n=1  \
                  --cluster_k=1 --cluster_m_fallback=0 --cluster_n_fallback=0 --cluster_k_fallback=0 --stages=11 --warps_m=4  \
                  --warps_n=1 --warps_k=1 --inst_m=64 --inst_n=16 --inst_k=16 --min_cc=90 --max_cc=90

           Bytes: 117440512  bytes
           FLOPs: 171840634880  flops
           FLOPs/Byte: 1463

         Runtime: 1.49595  ms
          Memory: 73.114 GiB/s

            Math: 114870 GFLOP/s



=============================
  Problem ID: 1

        Provider: [1;37mCUTLASS[0m
   OperationKind: [1;37mgemm[0m
       Operation: cutlass3x_sm90_tensorop_gemm_f16_f16_f32_f16_f16_64x16x128_4x1x1_0_tnn_align8_warpspecialized_pingpong_epi_nosmem

          Status: [1;37mSuccess[0m
    Verification: [1;37mON[0m
     Disposition: [1;32mPassed[0m

reference_device: Passed
          cuBLAS: Not run
           cuDNN: Not run

       Arguments: --gemm_kind=universal --m=4096 --n=5120 --k=4096 --A=f16:row --B=f16:column --C=f16:column --D=f16:column  \
                  --alpha=1 --beta=0 --split_k_mode=serial --split_k_slices=1 --batch_count=1 --raster_order=heuristic  \
                  --runtime_input_datatype_a=invalid --runtime_input_datatype_b=invalid --use_pdl=false --enable_sm90_mixed_dtype_shuffle_test=false  \
                  --swizzle_size=1 --op_class=tensorop --accum=f32 --cta_m=64 --cta_n=16 --cta_k=128 --cluster_m=4 --cluster_n=1  \
                  --cluster_k=1 --cluster_m_fallback=0 --cluster_n_fallback=0 --cluster_k_fallback=0 --stages=11 --warps_m=4  \
                  --warps_n=1 --warps_k=1 --inst_m=64 --inst_n=16 --inst_k=16 --min_cc=90 --max_cc=90

           Bytes: 117440512  bytes
           FLOPs: 171840634880  flops
           FLOPs/Byte: 1463

         Runtime: 1.49787  ms
          Memory: 73.0202 GiB/s

            Math: 114723 GFLOP/s



=============================
  Problem ID: 1

        Provider: [1;37mCUTLASS[0m
   OperationKind: [1;37mgemm[0m
       Operation: cutlass3x_sm90_tensorop_gemm_f16_f16_f32_f16_f16_64x16x128_2x4x1_0_tnn_align8

          Status: [1;37mSuccess[0m
    Verification: [1;37mON[0m
     Disposition: [1;32mPassed[0m

reference_device: Passed
          cuBLAS: Not run
           cuDNN: Not run

       Arguments: --gemm_kind=universal --m=4096 --n=5120 --k=4096 --A=f16:row --B=f16:column --C=f16:column --D=f16:column  \
                  --alpha=1 --beta=0 --split_k_mode=serial --split_k_slices=1 --batch_count=1 --raster_order=heuristic  \
                  --runtime_input_datatype_a=invalid --runtime_input_datatype_b=invalid --use_pdl=false --enable_sm90_mixed_dtype_shuffle_test=false  \
                  --swizzle_size=1 --op_class=tensorop --accum=f32 --cta_m=64 --cta_n=16 --cta_k=128 --cluster_m=2 --cluster_n=4  \
                  --cluster_k=1 --cluster_m_fallback=0 --cluster_n_fallback=0 --cluster_k_fallback=0 --stages=11 --warps_m=4  \
                  --warps_n=1 --warps_k=1 --inst_m=64 --inst_n=16 --inst_k=16 --min_cc=90 --max_cc=90

           Bytes: 117440512  bytes
           FLOPs: 171840634880  flops
           FLOPs/Byte: 1463

         Runtime: 0.78335  ms
          Memory: 139.625 GiB/s

            Math: 219366 GFLOP/s



=============================
  Problem ID: 1

        Provider: [1;37mCUTLASS[0m
   OperationKind: [1;37mgemm[0m
       Operation: cutlass3x_sm90_tensorop_gemm_f16_f16_f32_f16_f16_64x16x128_2x4x1_0_tnn_align8_warpspecialized_epi_nosmem

          Status: [1;37mSuccess[0m
    Verification: [1;37mON[0m
     Disposition: [1;32mPassed[0m

reference_device: Passed
          cuBLAS: Not run
           cuDNN: Not run

       Arguments: --gemm_kind=universal --m=4096 --n=5120 --k=4096 --A=f16:row --B=f16:column --C=f16:column --D=f16:column  \
                  --alpha=1 --beta=0 --split_k_mode=serial --split_k_slices=1 --batch_count=1 --raster_order=heuristic  \
                  --runtime_input_datatype_a=invalid --runtime_input_datatype_b=invalid --use_pdl=false --enable_sm90_mixed_dtype_shuffle_test=false  \
                  --swizzle_size=1 --op_class=tensorop --accum=f32 --cta_m=64 --cta_n=16 --cta_k=128 --cluster_m=2 --cluster_n=4  \
                  --cluster_k=1 --cluster_m_fallback=0 --cluster_n_fallback=0 --cluster_k_fallback=0 --stages=11 --warps_m=4  \
                  --warps_n=1 --warps_k=1 --inst_m=64 --inst_n=16 --inst_k=16 --min_cc=90 --max_cc=90

           Bytes: 117440512  bytes
           FLOPs: 171840634880  flops
           FLOPs/Byte: 1463

         Runtime: 1.10503  ms
          Memory: 98.9795 GiB/s

            Math: 155508 GFLOP/s



=============================
  Problem ID: 1

        Provider: [1;37mCUTLASS[0m
   OperationKind: [1;37mgemm[0m
       Operation: cutlass3x_sm90_tensorop_gemm_f16_f16_f32_f16_f16_64x16x128_2x4x1_0_tnn_align8_warpspecialized_pingpong_epi_tma

          Status: [1;37mSuccess[0m
    Verification: [1;37mON[0m
     Disposition: [1;32mPassed[0m

reference_device: Passed
          cuBLAS: Not run
           cuDNN: Not run

       Arguments: --gemm_kind=universal --m=4096 --n=5120 --k=4096 --A=f16:row --B=f16:column --C=f16:column --D=f16:column  \
                  --alpha=1 --beta=0 --split_k_mode=serial --split_k_slices=1 --batch_count=1 --raster_order=heuristic  \
                  --runtime_input_datatype_a=invalid --runtime_input_datatype_b=invalid --use_pdl=false --enable_sm90_mixed_dtype_shuffle_test=false  \
                  --swizzle_size=1 --op_class=tensorop --accum=f32 --cta_m=64 --cta_n=16 --cta_k=128 --cluster_m=2 --cluster_n=4  \
                  --cluster_k=1 --cluster_m_fallback=0 --cluster_n_fallback=0 --cluster_k_fallback=0 --stages=11 --warps_m=4  \
                  --warps_n=1 --warps_k=1 --inst_m=64 --inst_n=16 --inst_k=16 --min_cc=90 --max_cc=90

           Bytes: 117440512  bytes
           FLOPs: 171840634880  flops
           FLOPs/Byte: 1463

         Runtime: 0.793133  ms
          Memory: 137.903 GiB/s

            Math: 216661 GFLOP/s



=============================
  Problem ID: 1

        Provider: [1;37mCUTLASS[0m
   OperationKind: [1;37mgemm[0m
       Operation: cutlass3x_sm90_tensorop_gemm_f16_f16_f32_f16_f16_64x16x128_2x4x1_0_tnn_align8_warpspecialized_pingpong_epi_nosmem

          Status: [1;37mSuccess[0m
    Verification: [1;37mON[0m
     Disposition: [1;32mPassed[0m

reference_device: Passed
          cuBLAS: Not run
           cuDNN: Not run

       Arguments: --gemm_kind=universal --m=4096 --n=5120 --k=4096 --A=f16:row --B=f16:column --C=f16:column --D=f16:column  \
                  --alpha=1 --beta=0 --split_k_mode=serial --split_k_slices=1 --batch_count=1 --raster_order=heuristic  \
                  --runtime_input_datatype_a=invalid --runtime_input_datatype_b=invalid --use_pdl=false --enable_sm90_mixed_dtype_shuffle_test=false  \
                  --swizzle_size=1 --op_class=tensorop --accum=f32 --cta_m=64 --cta_n=16 --cta_k=128 --cluster_m=2 --cluster_n=4  \
                  --cluster_k=1 --cluster_m_fallback=0 --cluster_n_fallback=0 --cluster_k_fallback=0 --stages=11 --warps_m=4  \
                  --warps_n=1 --warps_k=1 --inst_m=64 --inst_n=16 --inst_k=16 --min_cc=90 --max_cc=90

           Bytes: 117440512  bytes
           FLOPs: 171840634880  flops
           FLOPs/Byte: 1463

         Runtime: 0.785162  ms
          Memory: 139.302 GiB/s

            Math: 218860 GFLOP/s



=============================
  Problem ID: 1

        Provider: [1;37mCUTLASS[0m
   OperationKind: [1;37mgemm[0m
       Operation: cutlass3x_sm90_tensorop_gemm_f16_f16_f32_f16_f16_64x16x128_4x2x1_0_tnn_align8

          Status: [1;37mSuccess[0m
    Verification: [1;37mON[0m
     Disposition: [1;32mPassed[0m

reference_device: Passed
          cuBLAS: Not run
           cuDNN: Not run

       Arguments: --gemm_kind=universal --m=4096 --n=5120 --k=4096 --A=f16:row --B=f16:column --C=f16:column --D=f16:column  \
                  --alpha=1 --beta=0 --split_k_mode=serial --split_k_slices=1 --batch_count=1 --raster_order=heuristic  \
                  --runtime_input_datatype_a=invalid --runtime_input_datatype_b=invalid --use_pdl=false --enable_sm90_mixed_dtype_shuffle_test=false  \
                  --swizzle_size=1 --op_class=tensorop --accum=f32 --cta_m=64 --cta_n=16 --cta_k=128 --cluster_m=4 --cluster_n=2  \
                  --cluster_k=1 --cluster_m_fallback=0 --cluster_n_fallback=0 --cluster_k_fallback=0 --stages=11 --warps_m=4  \
                  --warps_n=1 --warps_k=1 --inst_m=64 --inst_n=16 --inst_k=16 --min_cc=90 --max_cc=90

           Bytes: 117440512  bytes
           FLOPs: 171840634880  flops
           FLOPs/Byte: 1463

         Runtime: 0.859606  ms
          Memory: 127.239 GiB/s

            Math: 199906 GFLOP/s



=============================
  Problem ID: 1

        Provider: [1;37mCUTLASS[0m
   OperationKind: [1;37mgemm[0m
       Operation: cutlass3x_sm90_tensorop_gemm_f16_f16_f32_f16_f16_64x16x128_4x2x1_0_tnn_align8_warpspecialized_epi_nosmem

          Status: [1;37mSuccess[0m
    Verification: [1;37mON[0m
     Disposition: [1;32mPassed[0m

reference_device: Passed
          cuBLAS: Not run
           cuDNN: Not run

       Arguments: --gemm_kind=universal --m=4096 --n=5120 --k=4096 --A=f16:row --B=f16:column --C=f16:column --D=f16:column  \
                  --alpha=1 --beta=0 --split_k_mode=serial --split_k_slices=1 --batch_count=1 --raster_order=heuristic  \
                  --runtime_input_datatype_a=invalid --runtime_input_datatype_b=invalid --use_pdl=false --enable_sm90_mixed_dtype_shuffle_test=false  \
                  --swizzle_size=1 --op_class=tensorop --accum=f32 --cta_m=64 --cta_n=16 --cta_k=128 --cluster_m=4 --cluster_n=2  \
                  --cluster_k=1 --cluster_m_fallback=0 --cluster_n_fallback=0 --cluster_k_fallback=0 --stages=11 --warps_m=4  \
                  --warps_n=1 --warps_k=1 --inst_m=64 --inst_n=16 --inst_k=16 --min_cc=90 --max_cc=90

           Bytes: 117440512  bytes
           FLOPs: 171840634880  flops
           FLOPs/Byte: 1463

         Runtime: 1.18277  ms
          Memory: 92.4734 GiB/s

            Math: 145286 GFLOP/s



=============================
  Problem ID: 1

        Provider: [1;37mCUTLASS[0m
   OperationKind: [1;37mgemm[0m
       Operation: cutlass3x_sm90_tensorop_gemm_f16_f16_f32_f16_f16_64x16x128_4x2x1_0_tnn_align8_warpspecialized_pingpong_epi_tma

          Status: [1;37mSuccess[0m
    Verification: [1;37mON[0m
     Disposition: [1;32mPassed[0m

reference_device: Passed
          cuBLAS: Not run
           cuDNN: Not run

       Arguments: --gemm_kind=universal --m=4096 --n=5120 --k=4096 --A=f16:row --B=f16:column --C=f16:column --D=f16:column  \
                  --alpha=1 --beta=0 --split_k_mode=serial --split_k_slices=1 --batch_count=1 --raster_order=heuristic  \
                  --runtime_input_datatype_a=invalid --runtime_input_datatype_b=invalid --use_pdl=false --enable_sm90_mixed_dtype_shuffle_test=false  \
                  --swizzle_size=1 --op_class=tensorop --accum=f32 --cta_m=64 --cta_n=16 --cta_k=128 --cluster_m=4 --cluster_n=2  \
                  --cluster_k=1 --cluster_m_fallback=0 --cluster_n_fallback=0 --cluster_k_fallback=0 --stages=11 --warps_m=4  \
                  --warps_n=1 --warps_k=1 --inst_m=64 --inst_n=16 --inst_k=16 --min_cc=90 --max_cc=90

           Bytes: 117440512  bytes
           FLOPs: 171840634880  flops
           FLOPs/Byte: 1463

         Runtime: 0.861611  ms
          Memory: 126.943 GiB/s

            Math: 199441 GFLOP/s



=============================
  Problem ID: 1

        Provider: [1;37mCUTLASS[0m
   OperationKind: [1;37mgemm[0m
       Operation: cutlass3x_sm90_tensorop_gemm_f16_f16_f32_f16_f16_64x16x128_4x2x1_0_tnn_align8_warpspecialized_pingpong_epi_nosmem

          Status: [1;37mSuccess[0m
    Verification: [1;37mON[0m
     Disposition: [1;32mPassed[0m

reference_device: Passed
          cuBLAS: Not run
           cuDNN: Not run

       Arguments: --gemm_kind=universal --m=4096 --n=5120 --k=4096 --A=f16:row --B=f16:column --C=f16:column --D=f16:column  \
                  --alpha=1 --beta=0 --split_k_mode=serial --split_k_slices=1 --batch_count=1 --raster_order=heuristic  \
                  --runtime_input_datatype_a=invalid --runtime_input_datatype_b=invalid --use_pdl=false --enable_sm90_mixed_dtype_shuffle_test=false  \
                  --swizzle_size=1 --op_class=tensorop --accum=f32 --cta_m=64 --cta_n=16 --cta_k=128 --cluster_m=4 --cluster_n=2  \
                  --cluster_k=1 --cluster_m_fallback=0 --cluster_n_fallback=0 --cluster_k_fallback=0 --stages=11 --warps_m=4  \
                  --warps_n=1 --warps_k=1 --inst_m=64 --inst_n=16 --inst_k=16 --min_cc=90 --max_cc=90

           Bytes: 117440512  bytes
           FLOPs: 171840634880  flops
           FLOPs/Byte: 1463

         Runtime: 0.859959  ms
          Memory: 127.186 GiB/s

            Math: 199824 GFLOP/s



=============================
  Problem ID: 1

        Provider: [1;37mCUTLASS[0m
   OperationKind: [1;37mgemm[0m
       Operation: cutlass3x_sm90_tensorop_gemm_f16_f16_f32_f16_f16_64x16x128_1x8x1_0_tnn_align8

          Status: [1;37mSuccess[0m
    Verification: [1;37mON[0m
     Disposition: [1;32mPassed[0m

reference_device: Passed
          cuBLAS: Not run
           cuDNN: Not run

       Arguments: --gemm_kind=universal --m=4096 --n=5120 --k=4096 --A=f16:row --B=f16:column --C=f16:column --D=f16:column  \
                  --alpha=1 --beta=0 --split_k_mode=serial --split_k_slices=1 --batch_count=1 --raster_order=heuristic  \
                  --runtime_input_datatype_a=invalid --runtime_input_datatype_b=invalid --use_pdl=false --enable_sm90_mixed_dtype_shuffle_test=false  \
                  --swizzle_size=1 --op_class=tensorop --accum=f32 --cta_m=64 --cta_n=16 --cta_k=128 --cluster_m=1 --cluster_n=8  \
                  --cluster_k=1 --cluster_m_fallback=0 --cluster_n_fallback=0 --cluster_k_fallback=0 --stages=11 --warps_m=4  \
                  --warps_n=1 --warps_k=1 --inst_m=64 --inst_n=16 --inst_k=16 --min_cc=90 --max_cc=90

           Bytes: 117440512  bytes
           FLOPs: 171840634880  flops
           FLOPs/Byte: 1463

         Runtime: 0.751732  ms
          Memory: 145.497 GiB/s

            Math: 228593 GFLOP/s



=============================
  Problem ID: 1

        Provider: [1;37mCUTLASS[0m
   OperationKind: [1;37mgemm[0m
       Operation: cutlass3x_sm90_tensorop_gemm_f16_f16_f32_f16_f16_64x16x128_1x8x1_0_tnn_align8_warpspecialized_epi_nosmem

          Status: [1;37mSuccess[0m
    Verification: [1;37mON[0m
     Disposition: [1;32mPassed[0m

reference_device: Passed
          cuBLAS: Not run
           cuDNN: Not run

       Arguments: --gemm_kind=universal --m=4096 --n=5120 --k=4096 --A=f16:row --B=f16:column --C=f16:column --D=f16:column  \
                  --alpha=1 --beta=0 --split_k_mode=serial --split_k_slices=1 --batch_count=1 --raster_order=heuristic  \
                  --runtime_input_datatype_a=invalid --runtime_input_datatype_b=invalid --use_pdl=false --enable_sm90_mixed_dtype_shuffle_test=false  \
                  --swizzle_size=1 --op_class=tensorop --accum=f32 --cta_m=64 --cta_n=16 --cta_k=128 --cluster_m=1 --cluster_n=8  \
                  --cluster_k=1 --cluster_m_fallback=0 --cluster_n_fallback=0 --cluster_k_fallback=0 --stages=11 --warps_m=4  \
                  --warps_n=1 --warps_k=1 --inst_m=64 --inst_n=16 --inst_k=16 --min_cc=90 --max_cc=90

           Bytes: 117440512  bytes
           FLOPs: 171840634880  flops
           FLOPs/Byte: 1463

         Runtime: 0.988349  ms
          Memory: 110.664 GiB/s

            Math: 173866 GFLOP/s



=============================
  Problem ID: 1

        Provider: [1;37mCUTLASS[0m
   OperationKind: [1;37mgemm[0m
       Operation: cutlass3x_sm90_tensorop_gemm_f16_f16_f32_f16_f16_64x16x128_1x8x1_0_tnn_align8_warpspecialized_pingpong_epi_tma

          Status: [1;37mSuccess[0m
    Verification: [1;37mON[0m
     Disposition: [1;32mPassed[0m

reference_device: Passed
          cuBLAS: Not run
           cuDNN: Not run

       Arguments: --gemm_kind=universal --m=4096 --n=5120 --k=4096 --A=f16:row --B=f16:column --C=f16:column --D=f16:column  \
                  --alpha=1 --beta=0 --split_k_mode=serial --split_k_slices=1 --batch_count=1 --raster_order=heuristic  \
                  --runtime_input_datatype_a=invalid --runtime_input_datatype_b=invalid --use_pdl=false --enable_sm90_mixed_dtype_shuffle_test=false  \
                  --swizzle_size=1 --op_class=tensorop --accum=f32 --cta_m=64 --cta_n=16 --cta_k=128 --cluster_m=1 --cluster_n=8  \
                  --cluster_k=1 --cluster_m_fallback=0 --cluster_n_fallback=0 --cluster_k_fallback=0 --stages=11 --warps_m=4  \
                  --warps_n=1 --warps_k=1 --inst_m=64 --inst_n=16 --inst_k=16 --min_cc=90 --max_cc=90

           Bytes: 117440512  bytes
           FLOPs: 171840634880  flops
           FLOPs/Byte: 1463

         Runtime: 0.748932  ms
          Memory: 146.041 GiB/s

            Math: 229447 GFLOP/s



=============================
  Problem ID: 1

        Provider: [1;37mCUTLASS[0m
   OperationKind: [1;37mgemm[0m
       Operation: cutlass3x_sm90_tensorop_gemm_f16_f16_f32_f16_f16_64x16x128_1x8x1_0_tnn_align8_warpspecialized_pingpong_epi_nosmem

          Status: [1;37mSuccess[0m
    Verification: [1;37mON[0m
     Disposition: [1;32mPassed[0m

reference_device: Passed
          cuBLAS: Not run
           cuDNN: Not run

       Arguments: --gemm_kind=universal --m=4096 --n=5120 --k=4096 --A=f16:row --B=f16:column --C=f16:column --D=f16:column  \
                  --alpha=1 --beta=0 --split_k_mode=serial --split_k_slices=1 --batch_count=1 --raster_order=heuristic  \
                  --runtime_input_datatype_a=invalid --runtime_input_datatype_b=invalid --use_pdl=false --enable_sm90_mixed_dtype_shuffle_test=false  \
                  --swizzle_size=1 --op_class=tensorop --accum=f32 --cta_m=64 --cta_n=16 --cta_k=128 --cluster_m=1 --cluster_n=8  \
                  --cluster_k=1 --cluster_m_fallback=0 --cluster_n_fallback=0 --cluster_k_fallback=0 --stages=11 --warps_m=4  \
                  --warps_n=1 --warps_k=1 --inst_m=64 --inst_n=16 --inst_k=16 --min_cc=90 --max_cc=90

           Bytes: 117440512  bytes
           FLOPs: 171840634880  flops
           FLOPs/Byte: 1463

         Runtime: 0.752607  ms
          Memory: 145.328 GiB/s

            Math: 228327 GFLOP/s



=============================
  Problem ID: 1

        Provider: [1;37mCUTLASS[0m
   OperationKind: [1;37mgemm[0m
       Operation: cutlass3x_sm90_tensorop_gemm_f16_f16_f32_f16_f16_64x16x128_8x1x1_0_tnn_align8

          Status: [1;37mSuccess[0m
    Verification: [1;37mON[0m
     Disposition: [1;32mPassed[0m

reference_device: Passed
          cuBLAS: Not run
           cuDNN: Not run

       Arguments: --gemm_kind=universal --m=4096 --n=5120 --k=4096 --A=f16:row --B=f16:column --C=f16:column --D=f16:column  \
                  --alpha=1 --beta=0 --split_k_mode=serial --split_k_slices=1 --batch_count=1 --raster_order=heuristic  \
                  --runtime_input_datatype_a=invalid --runtime_input_datatype_b=invalid --use_pdl=false --enable_sm90_mixed_dtype_shuffle_test=false  \
                  --swizzle_size=1 --op_class=tensorop --accum=f32 --cta_m=64 --cta_n=16 --cta_k=128 --cluster_m=8 --cluster_n=1  \
                  --cluster_k=1 --cluster_m_fallback=0 --cluster_n_fallback=0 --cluster_k_fallback=0 --stages=11 --warps_m=4  \
                  --warps_n=1 --warps_k=1 --inst_m=64 --inst_n=16 --inst_k=16 --min_cc=90 --max_cc=90

           Bytes: 117440512  bytes
           FLOPs: 171840634880  flops
           FLOPs/Byte: 1463

         Runtime: 1.44148  ms
          Memory: 75.8771 GiB/s

            Math: 119212 GFLOP/s



=============================
  Problem ID: 1

        Provider: [1;37mCUTLASS[0m
   OperationKind: [1;37mgemm[0m
       Operation: cutlass3x_sm90_tensorop_gemm_f16_f16_f32_f16_f16_64x16x128_8x1x1_0_tnn_align8_warpspecialized_epi_nosmem

          Status: [1;37mSuccess[0m
    Verification: [1;37mON[0m
     Disposition: [1;32mPassed[0m

reference_device: Passed
          cuBLAS: Not run
           cuDNN: Not run

       Arguments: --gemm_kind=universal --m=4096 --n=5120 --k=4096 --A=f16:row --B=f16:column --C=f16:column --D=f16:column  \
                  --alpha=1 --beta=0 --split_k_mode=serial --split_k_slices=1 --batch_count=1 --raster_order=heuristic  \
                  --runtime_input_datatype_a=invalid --runtime_input_datatype_b=invalid --use_pdl=false --enable_sm90_mixed_dtype_shuffle_test=false  \
                  --swizzle_size=1 --op_class=tensorop --accum=f32 --cta_m=64 --cta_n=16 --cta_k=128 --cluster_m=8 --cluster_n=1  \
                  --cluster_k=1 --cluster_m_fallback=0 --cluster_n_fallback=0 --cluster_k_fallback=0 --stages=11 --warps_m=4  \
                  --warps_n=1 --warps_k=1 --inst_m=64 --inst_n=16 --inst_k=16 --min_cc=90 --max_cc=90

           Bytes: 117440512  bytes
           FLOPs: 171840634880  flops
           FLOPs/Byte: 1463

         Runtime: 1.83859  ms
          Memory: 59.4884 GiB/s

            Math: 93463.1 GFLOP/s



=============================
  Problem ID: 1

        Provider: [1;37mCUTLASS[0m
   OperationKind: [1;37mgemm[0m
       Operation: cutlass3x_sm90_tensorop_gemm_f16_f16_f32_f16_f16_64x16x128_8x1x1_0_tnn_align8_warpspecialized_pingpong_epi_tma

          Status: [1;37mSuccess[0m
    Verification: [1;37mON[0m
     Disposition: [1;32mPassed[0m

reference_device: Passed
          cuBLAS: Not run
           cuDNN: Not run

       Arguments: --gemm_kind=universal --m=4096 --n=5120 --k=4096 --A=f16:row --B=f16:column --C=f16:column --D=f16:column  \
                  --alpha=1 --beta=0 --split_k_mode=serial --split_k_slices=1 --batch_count=1 --raster_order=heuristic  \
                  --runtime_input_datatype_a=invalid --runtime_input_datatype_b=invalid --use_pdl=false --enable_sm90_mixed_dtype_shuffle_test=false  \
                  --swizzle_size=1 --op_class=tensorop --accum=f32 --cta_m=64 --cta_n=16 --cta_k=128 --cluster_m=8 --cluster_n=1  \
                  --cluster_k=1 --cluster_m_fallback=0 --cluster_n_fallback=0 --cluster_k_fallback=0 --stages=11 --warps_m=4  \
                  --warps_n=1 --warps_k=1 --inst_m=64 --inst_n=16 --inst_k=16 --min_cc=90 --max_cc=90

           Bytes: 117440512  bytes
           FLOPs: 171840634880  flops
           FLOPs/Byte: 1463

         Runtime: 1.4299  ms
          Memory: 76.4912 GiB/s

            Math: 120176 GFLOP/s



=============================
  Problem ID: 1

        Provider: [1;37mCUTLASS[0m
   OperationKind: [1;37mgemm[0m
       Operation: cutlass3x_sm90_tensorop_gemm_f16_f16_f32_f16_f16_64x16x128_8x1x1_0_tnn_align8_warpspecialized_pingpong_epi_nosmem

          Status: [1;37mSuccess[0m
    Verification: [1;37mON[0m
     Disposition: [1;32mPassed[0m

reference_device: Passed
          cuBLAS: Not run
           cuDNN: Not run

       Arguments: --gemm_kind=universal --m=4096 --n=5120 --k=4096 --A=f16:row --B=f16:column --C=f16:column --D=f16:column  \
                  --alpha=1 --beta=0 --split_k_mode=serial --split_k_slices=1 --batch_count=1 --raster_order=heuristic  \
                  --runtime_input_datatype_a=invalid --runtime_input_datatype_b=invalid --use_pdl=false --enable_sm90_mixed_dtype_shuffle_test=false  \
                  --swizzle_size=1 --op_class=tensorop --accum=f32 --cta_m=64 --cta_n=16 --cta_k=128 --cluster_m=8 --cluster_n=1  \
                  --cluster_k=1 --cluster_m_fallback=0 --cluster_n_fallback=0 --cluster_k_fallback=0 --stages=11 --warps_m=4  \
                  --warps_n=1 --warps_k=1 --inst_m=64 --inst_n=16 --inst_k=16 --min_cc=90 --max_cc=90

           Bytes: 117440512  bytes
           FLOPs: 171840634880  flops
           FLOPs/Byte: 1463

         Runtime: 1.42787  ms
          Memory: 76.6003 GiB/s

            Math: 120348 GFLOP/s



=============================
  Problem ID: 1

        Provider: [1;37mCUTLASS[0m
   OperationKind: [1;37mgemm[0m
       Operation: cutlass3x_sm90_tensorop_gemm_f16_f16_f32_f16_f16_64x16x128_4x4x1_0_tnn_align8

          Status: [1;37mSuccess[0m
    Verification: [1;37mON[0m
     Disposition: [1;32mPassed[0m

reference_device: Passed
          cuBLAS: Not run
           cuDNN: Not run

       Arguments: --gemm_kind=universal --m=4096 --n=5120 --k=4096 --A=f16:row --B=f16:column --C=f16:column --D=f16:column  \
                  --alpha=1 --beta=0 --split_k_mode=serial --split_k_slices=1 --batch_count=1 --raster_order=heuristic  \
                  --runtime_input_datatype_a=invalid --runtime_input_datatype_b=invalid --use_pdl=false --enable_sm90_mixed_dtype_shuffle_test=false  \
                  --swizzle_size=1 --op_class=tensorop --accum=f32 --cta_m=64 --cta_n=16 --cta_k=128 --cluster_m=4 --cluster_n=4  \
                  --cluster_k=1 --cluster_m_fallback=0 --cluster_n_fallback=0 --cluster_k_fallback=0 --stages=11 --warps_m=4  \
                  --warps_n=1 --warps_k=1 --inst_m=64 --inst_n=16 --inst_k=16 --min_cc=90 --max_cc=90

           Bytes: 117440512  bytes
           FLOPs: 171840634880  flops
           FLOPs/Byte: 1463

         Runtime: 0.841908  ms
          Memory: 129.913 GiB/s

            Math: 204109 GFLOP/s



=============================
  Problem ID: 1

        Provider: [1;37mCUTLASS[0m
   OperationKind: [1;37mgemm[0m
       Operation: cutlass3x_sm90_tensorop_gemm_f16_f16_f32_f16_f16_64x16x128_4x4x1_0_tnn_align8_warpspecialized_epi_nosmem

          Status: [1;37mSuccess[0m
    Verification: [1;37mON[0m
     Disposition: [1;32mPassed[0m

reference_device: Passed
          cuBLAS: Not run
           cuDNN: Not run

       Arguments: --gemm_kind=universal --m=4096 --n=5120 --k=4096 --A=f16:row --B=f16:column --C=f16:column --D=f16:column  \
                  --alpha=1 --beta=0 --split_k_mode=serial --split_k_slices=1 --batch_count=1 --raster_order=heuristic  \
                  --runtime_input_datatype_a=invalid --runtime_input_datatype_b=invalid --use_pdl=false --enable_sm90_mixed_dtype_shuffle_test=false  \
                  --swizzle_size=1 --op_class=tensorop --accum=f32 --cta_m=64 --cta_n=16 --cta_k=128 --cluster_m=4 --cluster_n=4  \
                  --cluster_k=1 --cluster_m_fallback=0 --cluster_n_fallback=0 --cluster_k_fallback=0 --stages=11 --warps_m=4  \
                  --warps_n=1 --warps_k=1 --inst_m=64 --inst_n=16 --inst_k=16 --min_cc=90 --max_cc=90

           Bytes: 117440512  bytes
           FLOPs: 171840634880  flops
           FLOPs/Byte: 1463

         Runtime: 1.09213  ms
          Memory: 100.149 GiB/s

            Math: 157345 GFLOP/s



=============================
  Problem ID: 1

        Provider: [1;37mCUTLASS[0m
   OperationKind: [1;37mgemm[0m
       Operation: cutlass3x_sm90_tensorop_gemm_f16_f16_f32_f16_f16_64x16x128_4x4x1_0_tnn_align8_warpspecialized_pingpong_epi_tma

          Status: [1;37mSuccess[0m
    Verification: [1;37mON[0m
     Disposition: [1;32mPassed[0m

reference_device: Passed
          cuBLAS: Not run
           cuDNN: Not run

       Arguments: --gemm_kind=universal --m=4096 --n=5120 --k=4096 --A=f16:row --B=f16:column --C=f16:column --D=f16:column  \
                  --alpha=1 --beta=0 --split_k_mode=serial --split_k_slices=1 --batch_count=1 --raster_order=heuristic  \
                  --runtime_input_datatype_a=invalid --runtime_input_datatype_b=invalid --use_pdl=false --enable_sm90_mixed_dtype_shuffle_test=false  \
                  --swizzle_size=1 --op_class=tensorop --accum=f32 --cta_m=64 --cta_n=16 --cta_k=128 --cluster_m=4 --cluster_n=4  \
                  --cluster_k=1 --cluster_m_fallback=0 --cluster_n_fallback=0 --cluster_k_fallback=0 --stages=11 --warps_m=4  \
                  --warps_n=1 --warps_k=1 --inst_m=64 --inst_n=16 --inst_k=16 --min_cc=90 --max_cc=90

           Bytes: 117440512  bytes
           FLOPs: 171840634880  flops
           FLOPs/Byte: 1463

         Runtime: 0.848871  ms
          Memory: 128.848 GiB/s

            Math: 202434 GFLOP/s



=============================
  Problem ID: 1

        Provider: [1;37mCUTLASS[0m
   OperationKind: [1;37mgemm[0m
       Operation: cutlass3x_sm90_tensorop_gemm_f16_f16_f32_f16_f16_64x16x128_4x4x1_0_tnn_align8_warpspecialized_pingpong_epi_nosmem

          Status: [1;37mSuccess[0m
    Verification: [1;37mON[0m
     Disposition: [1;32mPassed[0m

reference_device: Passed
          cuBLAS: Not run
           cuDNN: Not run

       Arguments: --gemm_kind=universal --m=4096 --n=5120 --k=4096 --A=f16:row --B=f16:column --C=f16:column --D=f16:column  \
                  --alpha=1 --beta=0 --split_k_mode=serial --split_k_slices=1 --batch_count=1 --raster_order=heuristic  \
                  --runtime_input_datatype_a=invalid --runtime_input_datatype_b=invalid --use_pdl=false --enable_sm90_mixed_dtype_shuffle_test=false  \
                  --swizzle_size=1 --op_class=tensorop --accum=f32 --cta_m=64 --cta_n=16 --cta_k=128 --cluster_m=4 --cluster_n=4  \
                  --cluster_k=1 --cluster_m_fallback=0 --cluster_n_fallback=0 --cluster_k_fallback=0 --stages=11 --warps_m=4  \
                  --warps_n=1 --warps_k=1 --inst_m=64 --inst_n=16 --inst_k=16 --min_cc=90 --max_cc=90

           Bytes: 117440512  bytes
           FLOPs: 171840634880  flops
           FLOPs/Byte: 1463

         Runtime: 0.841603  ms
          Memory: 129.96 GiB/s

            Math: 204183 GFLOP/s



=============================
  Problem ID: 1

        Provider: [1;37mCUTLASS[0m
   OperationKind: [1;37mgemm[0m
       Operation: cutlass3x_sm90_tensorop_gemm_f16_f16_f32_f16_f16_128x32x128_1x2x1_0_tnn_align8

          Status: [1;37mSuccess[0m
    Verification: [1;37mON[0m
     Disposition: [1;32mPassed[0m

reference_device: Passed
          cuBLAS: Not run
           cuDNN: Not run

       Arguments: --gemm_kind=universal --m=4096 --n=5120 --k=4096 --A=f16:row --B=f16:column --C=f16:column --D=f16:column  \
                  --alpha=1 --beta=0 --split_k_mode=serial --split_k_slices=1 --batch_count=1 --raster_order=heuristic  \
                  --runtime_input_datatype_a=invalid --runtime_input_datatype_b=invalid --use_pdl=false --enable_sm90_mixed_dtype_shuffle_test=false  \
                  --swizzle_size=1 --op_class=tensorop --accum=f32 --cta_m=128 --cta_n=32 --cta_k=128 --cluster_m=1 --cluster_n=2  \
                  --cluster_k=1 --cluster_m_fallback=0 --cluster_n_fallback=0 --cluster_k_fallback=0 --stages=5 --warps_m=4  \
                  --warps_n=2 --warps_k=1 --inst_m=64 --inst_n=32 --inst_k=16 --min_cc=90 --max_cc=90

           Bytes: 117440512  bytes
           FLOPs: 171840634880  flops
           FLOPs/Byte: 1463

         Runtime: 0.523862  ms
          Memory: 208.786 GiB/s

            Math: 328026 GFLOP/s



=============================
  Problem ID: 1

        Provider: [1;37mCUTLASS[0m
   OperationKind: [1;37mgemm[0m
       Operation: cutlass3x_sm90_tensorop_gemm_f16_f16_f32_f16_f16_128x32x128_1x2x1_0_tnn_align8_warpspecialized_epi_nosmem

          Status: [1;37mSuccess[0m
    Verification: [1;37mON[0m
     Disposition: [1;32mPassed[0m

reference_device: Passed
          cuBLAS: Not run
           cuDNN: Not run

       Arguments: --gemm_kind=universal --m=4096 --n=5120 --k=4096 --A=f16:row --B=f16:column --C=f16:column --D=f16:column  \
                  --alpha=1 --beta=0 --split_k_mode=serial --split_k_slices=1 --batch_count=1 --raster_order=heuristic  \
                  --runtime_input_datatype_a=invalid --runtime_input_datatype_b=invalid --use_pdl=false --enable_sm90_mixed_dtype_shuffle_test=false  \
                  --swizzle_size=1 --op_class=tensorop --accum=f32 --cta_m=128 --cta_n=32 --cta_k=128 --cluster_m=1 --cluster_n=2  \
                  --cluster_k=1 --cluster_m_fallback=0 --cluster_n_fallback=0 --cluster_k_fallback=0 --stages=5 --warps_m=4  \
                  --warps_n=1 --warps_k=1 --inst_m=64 --inst_n=32 --inst_k=16 --min_cc=90 --max_cc=90

           Bytes: 117440512  bytes
           FLOPs: 171840634880  flops
           FLOPs/Byte: 1463

         Runtime: 0.559586  ms
          Memory: 195.457 GiB/s

            Math: 307085 GFLOP/s



=============================
  Problem ID: 1

        Provider: [1;37mCUTLASS[0m
   OperationKind: [1;37mgemm[0m
       Operation: cutlass3x_sm90_tensorop_gemm_f16_f16_f32_f16_f16_128x32x128_1x2x1_0_tnn_align8_warpspecialized_pingpong_epi_tma

          Status: [1;37mSuccess[0m
    Verification: [1;37mON[0m
     Disposition: [1;32mPassed[0m

reference_device: Passed
          cuBLAS: Not run
           cuDNN: Not run

       Arguments: --gemm_kind=universal --m=4096 --n=5120 --k=4096 --A=f16:row --B=f16:column --C=f16:column --D=f16:column  \
                  --alpha=1 --beta=0 --split_k_mode=serial --split_k_slices=1 --batch_count=1 --raster_order=heuristic  \
                  --runtime_input_datatype_a=invalid --runtime_input_datatype_b=invalid --use_pdl=false --enable_sm90_mixed_dtype_shuffle_test=false  \
                  --swizzle_size=1 --op_class=tensorop --accum=f32 --cta_m=128 --cta_n=32 --cta_k=128 --cluster_m=1 --cluster_n=2  \
                  --cluster_k=1 --cluster_m_fallback=0 --cluster_n_fallback=0 --cluster_k_fallback=0 --stages=5 --warps_m=4  \
                  --warps_n=1 --warps_k=1 --inst_m=64 --inst_n=32 --inst_k=16 --min_cc=90 --max_cc=90

           Bytes: 117440512  bytes
           FLOPs: 171840634880  flops
           FLOPs/Byte: 1463

         Runtime: 0.522052  ms
          Memory: 209.51 GiB/s

            Math: 329164 GFLOP/s



=============================
  Problem ID: 1

        Provider: [1;37mCUTLASS[0m
   OperationKind: [1;37mgemm[0m
       Operation: cutlass3x_sm90_tensorop_gemm_f16_f16_f32_f16_f16_128x32x128_1x2x1_0_tnn_align8_warpspecialized_pingpong_epi_nosmem

          Status: [1;37mSuccess[0m
    Verification: [1;37mON[0m
     Disposition: [1;32mPassed[0m

reference_device: Passed
          cuBLAS: Not run
           cuDNN: Not run

       Arguments: --gemm_kind=universal --m=4096 --n=5120 --k=4096 --A=f16:row --B=f16:column --C=f16:column --D=f16:column  \
                  --alpha=1 --beta=0 --split_k_mode=serial --split_k_slices=1 --batch_count=1 --raster_order=heuristic  \
                  --runtime_input_datatype_a=invalid --runtime_input_datatype_b=invalid --use_pdl=false --enable_sm90_mixed_dtype_shuffle_test=false  \
                  --swizzle_size=1 --op_class=tensorop --accum=f32 --cta_m=128 --cta_n=32 --cta_k=128 --cluster_m=1 --cluster_n=2  \
                  --cluster_k=1 --cluster_m_fallback=0 --cluster_n_fallback=0 --cluster_k_fallback=0 --stages=5 --warps_m=4  \
                  --warps_n=1 --warps_k=1 --inst_m=64 --inst_n=32 --inst_k=16 --min_cc=90 --max_cc=90

           Bytes: 117440512  bytes
           FLOPs: 171840634880  flops
           FLOPs/Byte: 1463

         Runtime: 0.523796  ms
          Memory: 208.812 GiB/s

            Math: 328068 GFLOP/s



=============================
  Problem ID: 1

        Provider: [1;37mCUTLASS[0m
   OperationKind: [1;37mgemm[0m
       Operation: cutlass3x_sm90_tensorop_gemm_f16_f16_f32_f16_f16_128x32x128_1x2x1_0_tnn_align8_warpspecialized_cooperative_epi_nosmem

          Status: [1;37mSuccess[0m
    Verification: [1;37mON[0m
     Disposition: [1;32mPassed[0m

reference_device: Passed
          cuBLAS: Not run
           cuDNN: Not run

       Arguments: --gemm_kind=universal --m=4096 --n=5120 --k=4096 --A=f16:row --B=f16:column --C=f16:column --D=f16:column  \
                  --alpha=1 --beta=0 --split_k_mode=serial --split_k_slices=1 --batch_count=1 --raster_order=heuristic  \
                  --runtime_input_datatype_a=invalid --runtime_input_datatype_b=invalid --use_pdl=false --enable_sm90_mixed_dtype_shuffle_test=false  \
                  --swizzle_size=1 --op_class=tensorop --accum=f32 --cta_m=128 --cta_n=32 --cta_k=128 --cluster_m=1 --cluster_n=2  \
                  --cluster_k=1 --cluster_m_fallback=0 --cluster_n_fallback=0 --cluster_k_fallback=0 --stages=5 --warps_m=4  \
                  --warps_n=2 --warps_k=1 --inst_m=64 --inst_n=32 --inst_k=16 --min_cc=90 --max_cc=90

           Bytes: 117440512  bytes
           FLOPs: 171840634880  flops
           FLOPs/Byte: 1463

         Runtime: 0.525114  ms
          Memory: 208.288 GiB/s

            Math: 327244 GFLOP/s



=============================
  Problem ID: 1

        Provider: [1;37mCUTLASS[0m
   OperationKind: [1;37mgemm[0m
       Operation: cutlass3x_sm90_tensorop_gemm_f16_f16_f32_f16_f16_128x32x128_1x2x1_0_tnn_align8_warpspecialized_cooperative_epi_tma

          Status: [1;37mSuccess[0m
    Verification: [1;37mON[0m
     Disposition: [1;32mPassed[0m

reference_device: Passed
          cuBLAS: Not run
           cuDNN: Not run

       Arguments: --gemm_kind=universal --m=4096 --n=5120 --k=4096 --A=f16:row --B=f16:column --C=f16:column --D=f16:column  \
                  --alpha=1 --beta=0 --split_k_mode=serial --split_k_slices=1 --batch_count=1 --raster_order=heuristic  \
                  --runtime_input_datatype_a=invalid --runtime_input_datatype_b=invalid --use_pdl=false --enable_sm90_mixed_dtype_shuffle_test=false  \
                  --swizzle_size=1 --op_class=tensorop --accum=f32 --cta_m=128 --cta_n=32 --cta_k=128 --cluster_m=1 --cluster_n=2  \
                  --cluster_k=1 --cluster_m_fallback=0 --cluster_n_fallback=0 --cluster_k_fallback=0 --stages=5 --warps_m=4  \
                  --warps_n=2 --warps_k=1 --inst_m=64 --inst_n=32 --inst_k=16 --min_cc=90 --max_cc=90

           Bytes: 117440512  bytes
           FLOPs: 171840634880  flops
           FLOPs/Byte: 1463

         Runtime: 0.52417  ms
          Memory: 208.663 GiB/s

            Math: 327834 GFLOP/s



=============================
  Problem ID: 1

        Provider: [1;37mCUTLASS[0m
   OperationKind: [1;37mgemm[0m
       Operation: cutlass3x_sm90_tensorop_gemm_f16_f16_f32_f16_f16_128x32x128_1x2x1_0_tnn_align8_stream_k_warpspecialized_cooperative_epi_nosmem

          Status: [1;37mSuccess[0m
    Verification: [1;37mON[0m
     Disposition: [1;32mPassed[0m

reference_device: Passed
          cuBLAS: Not run
           cuDNN: Not run

       Arguments: --gemm_kind=universal --m=4096 --n=5120 --k=4096 --A=f16:row --B=f16:column --C=f16:column --D=f16:column  \
                  --alpha=1 --beta=0 --split_k_mode=serial --split_k_slices=1 --batch_count=1 --raster_order=heuristic  \
                  --runtime_input_datatype_a=invalid --runtime_input_datatype_b=invalid --use_pdl=false --enable_sm90_mixed_dtype_shuffle_test=false  \
                  --swizzle_size=1 --op_class=tensorop --accum=f32 --cta_m=128 --cta_n=32 --cta_k=128 --cluster_m=1 --cluster_n=2  \
                  --cluster_k=1 --cluster_m_fallback=0 --cluster_n_fallback=0 --cluster_k_fallback=0 --stages=5 --warps_m=4  \
                  --warps_n=2 --warps_k=1 --inst_m=64 --inst_n=32 --inst_k=16 --min_cc=90 --max_cc=90

           Bytes: 117440512  bytes
           FLOPs: 171840634880  flops
           FLOPs/Byte: 1463

         Runtime: 0.52592  ms
          Memory: 207.969 GiB/s

            Math: 326743 GFLOP/s



=============================
  Problem ID: 1

        Provider: [1;37mCUTLASS[0m
   OperationKind: [1;37mgemm[0m
       Operation: cutlass3x_sm90_tensorop_gemm_f16_f16_f32_f16_f16_128x32x128_1x2x1_0_tnn_align8_stream_k_warpspecialized_cooperative_epi_tma

          Status: [1;37mSuccess[0m
    Verification: [1;37mON[0m
     Disposition: [1;32mPassed[0m

reference_device: Passed
          cuBLAS: Not run
           cuDNN: Not run

       Arguments: --gemm_kind=universal --m=4096 --n=5120 --k=4096 --A=f16:row --B=f16:column --C=f16:column --D=f16:column  \
                  --alpha=1 --beta=0 --split_k_mode=serial --split_k_slices=1 --batch_count=1 --raster_order=heuristic  \
                  --runtime_input_datatype_a=invalid --runtime_input_datatype_b=invalid --use_pdl=false --enable_sm90_mixed_dtype_shuffle_test=false  \
                  --swizzle_size=1 --op_class=tensorop --accum=f32 --cta_m=128 --cta_n=32 --cta_k=128 --cluster_m=1 --cluster_n=2  \
                  --cluster_k=1 --cluster_m_fallback=0 --cluster_n_fallback=0 --cluster_k_fallback=0 --stages=5 --warps_m=4  \
                  --warps_n=2 --warps_k=1 --inst_m=64 --inst_n=32 --inst_k=16 --min_cc=90 --max_cc=90

           Bytes: 117440512  bytes
           FLOPs: 171840634880  flops
           FLOPs/Byte: 1463

         Runtime: 0.529142  ms
          Memory: 206.702 GiB/s

            Math: 324753 GFLOP/s



=============================
  Problem ID: 1

        Provider: [1;37mCUTLASS[0m
   OperationKind: [1;37mgemm[0m
       Operation: cutlass3x_sm90_tensorop_gemm_f16_f16_f32_f16_f16_128x32x128_2x1x1_0_tnn_align8

          Status: [1;37mSuccess[0m
    Verification: [1;37mON[0m
     Disposition: [1;32mPassed[0m

reference_device: Passed
          cuBLAS: Not run
           cuDNN: Not run

       Arguments: --gemm_kind=universal --m=4096 --n=5120 --k=4096 --A=f16:row --B=f16:column --C=f16:column --D=f16:column  \
                  --alpha=1 --beta=0 --split_k_mode=serial --split_k_slices=1 --batch_count=1 --raster_order=heuristic  \
                  --runtime_input_datatype_a=invalid --runtime_input_datatype_b=invalid --use_pdl=false --enable_sm90_mixed_dtype_shuffle_test=false  \
                  --swizzle_size=1 --op_class=tensorop --accum=f32 --cta_m=128 --cta_n=32 --cta_k=128 --cluster_m=2 --cluster_n=1  \
                  --cluster_k=1 --cluster_m_fallback=0 --cluster_n_fallback=0 --cluster_k_fallback=0 --stages=5 --warps_m=4  \
                  --warps_n=2 --warps_k=1 --inst_m=64 --inst_n=32 --inst_k=16 --min_cc=90 --max_cc=90

           Bytes: 117440512  bytes
           FLOPs: 171840634880  flops
           FLOPs/Byte: 1463

         Runtime: 0.76725  ms
          Memory: 142.555 GiB/s

            Math: 223969 GFLOP/s



=============================
  Problem ID: 1

        Provider: [1;37mCUTLASS[0m
   OperationKind: [1;37mgemm[0m
       Operation: cutlass3x_sm90_tensorop_gemm_f16_f16_f32_f16_f16_128x32x128_2x1x1_0_tnn_align8_warpspecialized_epi_nosmem

          Status: [1;37mSuccess[0m
    Verification: [1;37mON[0m
     Disposition: [1;32mPassed[0m

reference_device: Passed
          cuBLAS: Not run
           cuDNN: Not run

       Arguments: --gemm_kind=universal --m=4096 --n=5120 --k=4096 --A=f16:row --B=f16:column --C=f16:column --D=f16:column  \
                  --alpha=1 --beta=0 --split_k_mode=serial --split_k_slices=1 --batch_count=1 --raster_order=heuristic  \
                  --runtime_input_datatype_a=invalid --runtime_input_datatype_b=invalid --use_pdl=false --enable_sm90_mixed_dtype_shuffle_test=false  \
                  --swizzle_size=1 --op_class=tensorop --accum=f32 --cta_m=128 --cta_n=32 --cta_k=128 --cluster_m=2 --cluster_n=1  \
                  --cluster_k=1 --cluster_m_fallback=0 --cluster_n_fallback=0 --cluster_k_fallback=0 --stages=5 --warps_m=4  \
                  --warps_n=1 --warps_k=1 --inst_m=64 --inst_n=32 --inst_k=16 --min_cc=90 --max_cc=90

           Bytes: 117440512  bytes
           FLOPs: 171840634880  flops
           FLOPs/Byte: 1463

         Runtime: 0.787506  ms
          Memory: 138.888 GiB/s

            Math: 218209 GFLOP/s



=============================
  Problem ID: 1

        Provider: [1;37mCUTLASS[0m
   OperationKind: [1;37mgemm[0m
       Operation: cutlass3x_sm90_tensorop_gemm_f16_f16_f32_f16_f16_128x32x128_2x1x1_0_tnn_align8_warpspecialized_pingpong_epi_tma

          Status: [1;37mSuccess[0m
    Verification: [1;37mON[0m
     Disposition: [1;32mPassed[0m

reference_device: Passed
          cuBLAS: Not run
           cuDNN: Not run

       Arguments: --gemm_kind=universal --m=4096 --n=5120 --k=4096 --A=f16:row --B=f16:column --C=f16:column --D=f16:column  \
                  --alpha=1 --beta=0 --split_k_mode=serial --split_k_slices=1 --batch_count=1 --raster_order=heuristic  \
                  --runtime_input_datatype_a=invalid --runtime_input_datatype_b=invalid --use_pdl=false --enable_sm90_mixed_dtype_shuffle_test=false  \
                  --swizzle_size=1 --op_class=tensorop --accum=f32 --cta_m=128 --cta_n=32 --cta_k=128 --cluster_m=2 --cluster_n=1  \
                  --cluster_k=1 --cluster_m_fallback=0 --cluster_n_fallback=0 --cluster_k_fallback=0 --stages=5 --warps_m=4  \
                  --warps_n=1 --warps_k=1 --inst_m=64 --inst_n=32 --inst_k=16 --min_cc=90 --max_cc=90

           Bytes: 117440512  bytes
           FLOPs: 171840634880  flops
           FLOPs/Byte: 1463

         Runtime: 0.753489  ms
          Memory: 145.158 GiB/s

            Math: 228060 GFLOP/s



=============================
  Problem ID: 1

        Provider: [1;37mCUTLASS[0m
   OperationKind: [1;37mgemm[0m
       Operation: cutlass3x_sm90_tensorop_gemm_f16_f16_f32_f16_f16_128x32x128_2x1x1_0_tnn_align8_warpspecialized_pingpong_epi_nosmem

          Status: [1;37mSuccess[0m
    Verification: [1;37mON[0m
     Disposition: [1;32mPassed[0m

reference_device: Passed
          cuBLAS: Not run
           cuDNN: Not run

       Arguments: --gemm_kind=universal --m=4096 --n=5120 --k=4096 --A=f16:row --B=f16:column --C=f16:column --D=f16:column  \
                  --alpha=1 --beta=0 --split_k_mode=serial --split_k_slices=1 --batch_count=1 --raster_order=heuristic  \
                  --runtime_input_datatype_a=invalid --runtime_input_datatype_b=invalid --use_pdl=false --enable_sm90_mixed_dtype_shuffle_test=false  \
                  --swizzle_size=1 --op_class=tensorop --accum=f32 --cta_m=128 --cta_n=32 --cta_k=128 --cluster_m=2 --cluster_n=1  \
                  --cluster_k=1 --cluster_m_fallback=0 --cluster_n_fallback=0 --cluster_k_fallback=0 --stages=5 --warps_m=4  \
                  --warps_n=1 --warps_k=1 --inst_m=64 --inst_n=32 --inst_k=16 --min_cc=90 --max_cc=90

           Bytes: 117440512  bytes
           FLOPs: 171840634880  flops
           FLOPs/Byte: 1463

         Runtime: 0.766517  ms
          Memory: 142.691 GiB/s

            Math: 224184 GFLOP/s



=============================
  Problem ID: 1

        Provider: [1;37mCUTLASS[0m
   OperationKind: [1;37mgemm[0m
       Operation: cutlass3x_sm90_tensorop_gemm_f16_f16_f32_f16_f16_128x32x128_2x1x1_0_tnn_align8_warpspecialized_cooperative_epi_nosmem

          Status: [1;37mSuccess[0m
    Verification: [1;37mON[0m
     Disposition: [1;32mPassed[0m

reference_device: Passed
          cuBLAS: Not run
           cuDNN: Not run

       Arguments: --gemm_kind=universal --m=4096 --n=5120 --k=4096 --A=f16:row --B=f16:column --C=f16:column --D=f16:column  \
                  --alpha=1 --beta=0 --split_k_mode=serial --split_k_slices=1 --batch_count=1 --raster_order=heuristic  \
                  --runtime_input_datatype_a=invalid --runtime_input_datatype_b=invalid --use_pdl=false --enable_sm90_mixed_dtype_shuffle_test=false  \
                  --swizzle_size=1 --op_class=tensorop --accum=f32 --cta_m=128 --cta_n=32 --cta_k=128 --cluster_m=2 --cluster_n=1  \
                  --cluster_k=1 --cluster_m_fallback=0 --cluster_n_fallback=0 --cluster_k_fallback=0 --stages=5 --warps_m=4  \
                  --warps_n=2 --warps_k=1 --inst_m=64 --inst_n=32 --inst_k=16 --min_cc=90 --max_cc=90

           Bytes: 117440512  bytes
           FLOPs: 171840634880  flops
           FLOPs/Byte: 1463

         Runtime: 0.767076  ms
          Memory: 142.587 GiB/s

            Math: 224020 GFLOP/s



=============================
  Problem ID: 1

        Provider: [1;37mCUTLASS[0m
   OperationKind: [1;37mgemm[0m
       Operation: cutlass3x_sm90_tensorop_gemm_f16_f16_f32_f16_f16_128x32x128_2x1x1_0_tnn_align8_warpspecialized_cooperative_epi_tma

          Status: [1;37mSuccess[0m
    Verification: [1;37mON[0m
     Disposition: [1;32mPassed[0m

reference_device: Passed
          cuBLAS: Not run
           cuDNN: Not run

       Arguments: --gemm_kind=universal --m=4096 --n=5120 --k=4096 --A=f16:row --B=f16:column --C=f16:column --D=f16:column  \
                  --alpha=1 --beta=0 --split_k_mode=serial --split_k_slices=1 --batch_count=1 --raster_order=heuristic  \
                  --runtime_input_datatype_a=invalid --runtime_input_datatype_b=invalid --use_pdl=false --enable_sm90_mixed_dtype_shuffle_test=false  \
                  --swizzle_size=1 --op_class=tensorop --accum=f32 --cta_m=128 --cta_n=32 --cta_k=128 --cluster_m=2 --cluster_n=1  \
                  --cluster_k=1 --cluster_m_fallback=0 --cluster_n_fallback=0 --cluster_k_fallback=0 --stages=5 --warps_m=4  \
                  --warps_n=2 --warps_k=1 --inst_m=64 --inst_n=32 --inst_k=16 --min_cc=90 --max_cc=90

           Bytes: 117440512  bytes
           FLOPs: 171840634880  flops
           FLOPs/Byte: 1463

         Runtime: 0.752141  ms
          Memory: 145.418 GiB/s

            Math: 228469 GFLOP/s



=============================
  Problem ID: 1

        Provider: [1;37mCUTLASS[0m
   OperationKind: [1;37mgemm[0m
       Operation: cutlass3x_sm90_tensorop_gemm_f16_f16_f32_f16_f16_128x32x128_2x1x1_0_tnn_align8_stream_k_warpspecialized_cooperative_epi_nosmem

          Status: [1;37mSuccess[0m
    Verification: [1;37mON[0m
     Disposition: [1;32mPassed[0m

reference_device: Passed
          cuBLAS: Not run
           cuDNN: Not run

       Arguments: --gemm_kind=universal --m=4096 --n=5120 --k=4096 --A=f16:row --B=f16:column --C=f16:column --D=f16:column  \
                  --alpha=1 --beta=0 --split_k_mode=serial --split_k_slices=1 --batch_count=1 --raster_order=heuristic  \
                  --runtime_input_datatype_a=invalid --runtime_input_datatype_b=invalid --use_pdl=false --enable_sm90_mixed_dtype_shuffle_test=false  \
                  --swizzle_size=1 --op_class=tensorop --accum=f32 --cta_m=128 --cta_n=32 --cta_k=128 --cluster_m=2 --cluster_n=1  \
                  --cluster_k=1 --cluster_m_fallback=0 --cluster_n_fallback=0 --cluster_k_fallback=0 --stages=5 --warps_m=4  \
                  --warps_n=2 --warps_k=1 --inst_m=64 --inst_n=32 --inst_k=16 --min_cc=90 --max_cc=90

           Bytes: 117440512  bytes
           FLOPs: 171840634880  flops
           FLOPs/Byte: 1463

         Runtime: 0.772786  ms
          Memory: 141.533 GiB/s

            Math: 222365 GFLOP/s



=============================
  Problem ID: 1

        Provider: [1;37mCUTLASS[0m
   OperationKind: [1;37mgemm[0m
       Operation: cutlass3x_sm90_tensorop_gemm_f16_f16_f32_f16_f16_128x32x128_2x1x1_0_tnn_align8_stream_k_warpspecialized_cooperative_epi_tma

          Status: [1;37mSuccess[0m
    Verification: [1;37mON[0m
     Disposition: [1;32mPassed[0m

reference_device: Passed
          cuBLAS: Not run
           cuDNN: Not run

       Arguments: --gemm_kind=universal --m=4096 --n=5120 --k=4096 --A=f16:row --B=f16:column --C=f16:column --D=f16:column  \
                  --alpha=1 --beta=0 --split_k_mode=serial --split_k_slices=1 --batch_count=1 --raster_order=heuristic  \
                  --runtime_input_datatype_a=invalid --runtime_input_datatype_b=invalid --use_pdl=false --enable_sm90_mixed_dtype_shuffle_test=false  \
                  --swizzle_size=1 --op_class=tensorop --accum=f32 --cta_m=128 --cta_n=32 --cta_k=128 --cluster_m=2 --cluster_n=1  \
                  --cluster_k=1 --cluster_m_fallback=0 --cluster_n_fallback=0 --cluster_k_fallback=0 --stages=5 --warps_m=4  \
                  --warps_n=2 --warps_k=1 --inst_m=64 --inst_n=32 --inst_k=16 --min_cc=90 --max_cc=90

           Bytes: 117440512  bytes
           FLOPs: 171840634880  flops
           FLOPs/Byte: 1463

         Runtime: 0.759713  ms
          Memory: 143.969 GiB/s

            Math: 226192 GFLOP/s



=============================
  Problem ID: 1

        Provider: [1;37mCUTLASS[0m
   OperationKind: [1;37mgemm[0m
       Operation: cutlass3x_sm90_tensorop_gemm_f16_f16_f32_f16_f16_128x32x128_1x1x1_0_tnn_align8

          Status: [1;37mSuccess[0m
    Verification: [1;37mON[0m
     Disposition: [1;32mPassed[0m

reference_device: Passed
          cuBLAS: Not run
           cuDNN: Not run

       Arguments: --gemm_kind=universal --m=4096 --n=5120 --k=4096 --A=f16:row --B=f16:column --C=f16:column --D=f16:column  \
                  --alpha=1 --beta=0 --split_k_mode=serial --split_k_slices=1 --batch_count=1 --raster_order=heuristic  \
                  --runtime_input_datatype_a=invalid --runtime_input_datatype_b=invalid --use_pdl=false --enable_sm90_mixed_dtype_shuffle_test=false  \
                  --swizzle_size=1 --op_class=tensorop --accum=f32 --cta_m=128 --cta_n=32 --cta_k=128 --cluster_m=1 --cluster_n=1  \
                  --cluster_k=1 --cluster_m_fallback=0 --cluster_n_fallback=0 --cluster_k_fallback=0 --stages=5 --warps_m=4  \
                  --warps_n=2 --warps_k=1 --inst_m=64 --inst_n=32 --inst_k=16 --min_cc=90 --max_cc=90

           Bytes: 117440512  bytes
           FLOPs: 171840634880  flops
           FLOPs/Byte: 1463

         Runtime: 0.830904  ms
          Memory: 131.634 GiB/s

            Math: 206812 GFLOP/s



=============================
  Problem ID: 1

        Provider: [1;37mCUTLASS[0m
   OperationKind: [1;37mgemm[0m
       Operation: cutlass3x_sm90_tensorop_gemm_f16_f16_f32_f16_f16_128x32x128_1x1x1_0_tnn_align8_warpspecialized_epi_nosmem

          Status: [1;37mSuccess[0m
    Verification: [1;37mON[0m
     Disposition: [1;32mPassed[0m

reference_device: Passed
          cuBLAS: Not run
           cuDNN: Not run

       Arguments: --gemm_kind=universal --m=4096 --n=5120 --k=4096 --A=f16:row --B=f16:column --C=f16:column --D=f16:column  \
                  --alpha=1 --beta=0 --split_k_mode=serial --split_k_slices=1 --batch_count=1 --raster_order=heuristic  \
                  --runtime_input_datatype_a=invalid --runtime_input_datatype_b=invalid --use_pdl=false --enable_sm90_mixed_dtype_shuffle_test=false  \
                  --swizzle_size=1 --op_class=tensorop --accum=f32 --cta_m=128 --cta_n=32 --cta_k=128 --cluster_m=1 --cluster_n=1  \
                  --cluster_k=1 --cluster_m_fallback=0 --cluster_n_fallback=0 --cluster_k_fallback=0 --stages=5 --warps_m=4  \
                  --warps_n=1 --warps_k=1 --inst_m=64 --inst_n=32 --inst_k=16 --min_cc=90 --max_cc=90

           Bytes: 117440512  bytes
           FLOPs: 171840634880  flops
           FLOPs/Byte: 1463

         Runtime: 0.803756  ms
          Memory: 136.08 GiB/s

