profiler_out/no_search/4096x5120x4096.gemm.csv
Problem,Provider,OperationKind,Operation,Disposition,Status,gemm_kind,m,n,k,A,B,C,D,alpha,beta,split_k_mode,split_k_slices,batch_count,raster_order,runtime_input_datatype_a,runtime_input_datatype_b,use_pdl,enable_sm90_mixed_dtype_shuffle_test,swizzle_size,op_class,accum,cta_m,cta_n,cta_k,cluster_m,cluster_n,cluster_k,cluster_m_fallback,cluster_n_fallback,cluster_k_fallback,stages,warps_m,warps_n,warps_k,inst_m,inst_n,inst_k,min_cc,max_cc,Bytes,Flops,Flops/Byte,Runtime,GB/s,GFLOPs
1,CUTLASS,gemm,cutlass3x_sm90_tensorop_gemm_f16_f16_f32_f16_f16_64x16x128_1x4x1_0_tnn_align8,passed,success,universal,4096,5120,4096,f16:row,f16:column,f16:column,f16:column,1,0,serial,1,1,heuristic,invalid,invalid,false,false,1,tensorop,f32,64,16,128,1,4,1,0,0,0,11,4,1,1,64,16,16,90,90,117440512,171840634880,1463,0.78049,140.136,220170
1,CUTLASS,gemm,cutlass3x_sm90_tensorop_gemm_f16_f16_f32_f16_f16_64x16x128_1x4x1_0_tnn_align8_warpspecialized_epi_nosmem,passed,success,universal,4096,5120,4096,f16:row,f16:column,f16:column,f16:column,1,0,serial,1,1,heuristic,invalid,invalid,false,false,1,tensorop,f32,64,16,128,1,4,1,0,0,0,11,4,1,1,64,16,16,90,90,117440512,171840634880,1463,1.07739,101.518,159496
1,CUTLASS,gemm,cutlass3x_sm90_tensorop_gemm_f16_f16_f32_f16_f16_64x16x128_1x4x1_0_tnn_align8_warpspecialized_pingpong_epi_tma,passed,success,universal,4096,5120,4096,f16:row,f16:column,f16:column,f16:column,1,0,serial,1,1,heuristic,invalid,invalid,false,false,1,tensorop,f32,64,16,128,1,4,1,0,0,0,11,4,1,1,64,16,16,90,90,117440512,171840634880,1463,0.777025,140.761,221152
1,CUTLASS,gemm,cutlass3x_sm90_tensorop_gemm_f16_f16_f32_f16_f16_64x16x128_1x4x1_0_tnn_align8_warpspecialized_pingpong_epi_nosmem,passed,success,universal,4096,5120,4096,f16:row,f16:column,f16:column,f16:column,1,0,serial,1,1,heuristic,invalid,invalid,false,false,1,tensorop,f32,64,16,128,1,4,1,0,0,0,11,4,1,1,64,16,16,90,90,117440512,171840634880,1463,0.776396,140.875,221331
1,CUTLASS,gemm,cutlass3x_sm90_tensorop_gemm_f16_f16_f32_f16_f16_64x16x128_4x1x1_0_tnn_align8,passed,success,universal,4096,5120,4096,f16:row,f16:column,f16:column,f16:column,1,0,serial,1,1,heuristic,invalid,invalid,false,false,1,tensorop,f32,64,16,128,4,1,1,0,0,0,11,4,1,1,64,16,16,90,90,117440512,171840634880,1463,1.4932,73.249,115082
1,CUTLASS,gemm,cutlass3x_sm90_tensorop_gemm_f16_f16_f32_f16_f16_64x16x128_4x1x1_0_tnn_align8_warpspecialized_epi_nosmem,passed,success,universal,4096,5120,4096,f16:row,f16:column,f16:column,f16:column,1,0,serial,1,1,heuristic,invalid,invalid,false,false,1,tensorop,f32,64,16,128,4,1,1,0,0,0,11,4,1,1,64,16,16,90,90,117440512,171840634880,1463,1.75178,62.4366,98095
1,CUTLASS,gemm,cutlass3x_sm90_tensorop_gemm_f16_f16_f32_f16_f16_64x16x128_4x1x1_0_tnn_align8_warpspecialized_pingpong_epi_tma,passed,success,universal,4096,5120,4096,f16:row,f16:column,f16:column,f16:column,1,0,serial,1,1,heuristic,invalid,invalid,false,false,1,tensorop,f32,64,16,128,4,1,1,0,0,0,11,4,1,1,64,16,16,90,90,117440512,171840634880,1463,1.49595,73.114,114870
1,CUTLASS,gemm,cutlass3x_sm90_tensorop_gemm_f16_f16_f32_f16_f16_64x16x128_4x1x1_0_tnn_align8_warpspecialized_pingpong_epi_nosmem,passed,success,universal,4096,5120,4096,f16:row,f16:column,f16:column,f16:column,1,0,serial,1,1,heuristic,invalid,invalid,false,false,1,tensorop,f32,64,16,128,4,1,1,0,0,0,11,4,1,1,64,16,16,90,90,117440512,171840634880,1463,1.49787,73.0202,114723
1,CUTLASS,gemm,cutlass3x_sm90_tensorop_gemm_f16_f16_f32_f16_f16_64x16x128_2x4x1_0_tnn_align8,passed,success,universal,4096,5120,4096,f16:row,f16:column,f16:column,f16:column,1,0,serial,1,1,heuristic,invalid,invalid,false,false,1,tensorop,f32,64,16,128,2,4,1,0,0,0,11,4,1,1,64,16,16,90,90,117440512,171840634880,1463,0.78335,139.625,219366
1,CUTLASS,gemm,cutlass3x_sm90_tensorop_gemm_f16_f16_f32_f16_f16_64x16x128_2x4x1_0_tnn_align8_warpspecialized_epi_nosmem,passed,success,universal,4096,5120,4096,f16:row,f16:column,f16:column,f16:column,1,0,serial,1,1,heuristic,invalid,invalid,false,false,1,tensorop,f32,64,16,128,2,4,1,0,0,0,11,4,1,1,64,16,16,90,90,117440512,171840634880,1463,1.10503,98.9795,155508
1,CUTLASS,gemm,cutlass3x_sm90_tensorop_gemm_f16_f16_f32_f16_f16_64x16x128_2x4x1_0_tnn_align8_warpspecialized_pingpong_epi_tma,passed,success,universal,4096,5120,4096,f16:row,f16:column,f16:column,f16:column,1,0,serial,1,1,heuristic,invalid,invalid,false,false,1,tensorop,f32,64,16,128,2,4,1,0,0,0,11,4,1,1,64,16,16,90,90,117440512,171840634880,1463,0.793133,137.903,216661
1,CUTLASS,gemm,cutlass3x_sm90_tensorop_gemm_f16_f16_f32_f16_f16_64x16x128_2x4x1_0_tnn_align8_warpspecialized_pingpong_epi_nosmem,passed,success,universal,4096,5120,4096,f16:row,f16:column,f16:column,f16:column,1,0,serial,1,1,heuristic,invalid,invalid,false,false,1,tensorop,f32,64,16,128,2,4,1,0,0,0,11,4,1,1,64,16,16,90,90,117440512,171840634880,1463,0.785162,139.302,218860
1,CUTLASS,gemm,cutlass3x_sm90_tensorop_gemm_f16_f16_f32_f16_f16_64x16x128_4x2x1_0_tnn_align8,passed,success,universal,4096,5120,4096,f16:row,f16:column,f16:column,f16:column,1,0,serial,1,1,heuristic,invalid,invalid,false,false,1,tensorop,f32,64,16,128,4,2,1,0,0,0,11,4,1,1,64,16,16,90,90,117440512,171840634880,1463,0.859606,127.239,199906
1,CUTLASS,gemm,cutlass3x_sm90_tensorop_gemm_f16_f16_f32_f16_f16_64x16x128_4x2x1_0_tnn_align8_warpspecialized_epi_nosmem,passed,success,universal,4096,5120,4096,f16:row,f16:column,f16:column,f16:column,1,0,serial,1,1,heuristic,invalid,invalid,false,false,1,tensorop,f32,64,16,128,4,2,1,0,0,0,11,4,1,1,64,16,16,90,90,117440512,171840634880,1463,1.18277,92.4734,145286
1,CUTLASS,gemm,cutlass3x_sm90_tensorop_gemm_f16_f16_f32_f16_f16_64x16x128_4x2x1_0_tnn_align8_warpspecialized_pingpong_epi_tma,passed,success,universal,4096,5120,4096,f16:row,f16:column,f16:column,f16:column,1,0,serial,1,1,heuristic,invalid,invalid,false,false,1,tensorop,f32,64,16,128,4,2,1,0,0,0,11,4,1,1,64,16,16,90,90,117440512,171840634880,1463,0.861611,126.943,199441
1,CUTLASS,gemm,cutlass3x_sm90_tensorop_gemm_f16_f16_f32_f16_f16_64x16x128_4x2x1_0_tnn_align8_warpspecialized_pingpong_epi_nosmem,passed,success,universal,4096,5120,4096,f16:row,f16:column,f16:column,f16:column,1,0,serial,1,1,heuristic,invalid,invalid,false,false,1,tensorop,f32,64,16,128,4,2,1,0,0,0,11,4,1,1,64,16,16,90,90,117440512,171840634880,1463,0.859959,127.186,199824
1,CUTLASS,gemm,cutlass3x_sm90_tensorop_gemm_f16_f16_f32_f16_f16_64x16x128_1x8x1_0_tnn_align8,passed,success,universal,4096,5120,4096,f16:row,f16:column,f16:column,f16:column,1,0,serial,1,1,heuristic,invalid,invalid,false,false,1,tensorop,f32,64,16,128,1,8,1,0,0,0,11,4,1,1,64,16,16,90,90,117440512,171840634880,1463,0.751732,145.497,228593
1,CUTLASS,gemm,cutlass3x_sm90_tensorop_gemm_f16_f16_f32_f16_f16_64x16x128_1x8x1_0_tnn_align8_warpspecialized_epi_nosmem,passed,success,universal,4096,5120,4096,f16:row,f16:column,f16:column,f16:column,1,0,serial,1,1,heuristic,invalid,invalid,false,false,1,tensorop,f32,64,16,128,1,8,1,0,0,0,11,4,1,1,64,16,16,90,90,117440512,171840634880,1463,0.988349,110.664,173866
1,CUTLASS,gemm,cutlass3x_sm90_tensorop_gemm_f16_f16_f32_f16_f16_64x16x128_1x8x1_0_tnn_align8_warpspecialized_pingpong_epi_tma,passed,success,universal,4096,5120,4096,f16:row,f16:column,f16:column,f16:column,1,0,serial,1,1,heuristic,invalid,invalid,false,false,1,tensorop,f32,64,16,128,1,8,1,0,0,0,11,4,1,1,64,16,16,90,90,117440512,171840634880,1463,0.748932,146.041,229447
1,CUTLASS,gemm,cutlass3x_sm90_tensorop_gemm_f16_f16_f32_f16_f16_64x16x128_1x8x1_0_tnn_align8_warpspecialized_pingpong_epi_nosmem,passed,success,universal,4096,5120,4096,f16:row,f16:column,f16:column,f16:column,1,0,serial,1,1,heuristic,invalid,invalid,false,false,1,tensorop,f32,64,16,128,1,8,1,0,0,0,11,4,1,1,64,16,16,90,90,117440512,171840634880,1463,0.752607,145.328,228327
1,CUTLASS,gemm,cutlass3x_sm90_tensorop_gemm_f16_f16_f32_f16_f16_64x16x128_8x1x1_0_tnn_align8,passed,success,universal,4096,5120,4096,f16:row,f16:column,f16:column,f16:column,1,0,serial,1,1,heuristic,invalid,invalid,false,false,1,tensorop,f32,64,16,128,8,1,1,0,0,0,11,4,1,1,64,16,16,90,90,117440512,171840634880,1463,1.44148,75.8771,119212
1,CUTLASS,gemm,cutlass3x_sm90_tensorop_gemm_f16_f16_f32_f16_f16_64x16x128_8x1x1_0_tnn_align8_warpspecialized_epi_nosmem,passed,success,universal,4096,5120,4096,f16:row,f16:column,f16:column,f16:column,1,0,serial,1,1,heuristic,invalid,invalid,false,false,1,tensorop,f32,64,16,128,8,1,1,0,0,0,11,4,1,1,64,16,16,90,90,117440512,171840634880,1463,1.83859,59.4884,93463.1
1,CUTLASS,gemm,cutlass3x_sm90_tensorop_gemm_f16_f16_f32_f16_f16_64x16x128_8x1x1_0_tnn_align8_warpspecialized_pingpong_epi_tma,passed,success,universal,4096,5120,4096,f16:row,f16:column,f16:column,f16:column,1,0,serial,1,1,heuristic,invalid,invalid,false,false,1,tensorop,f32,64,16,128,8,1,1,0,0,0,11,4,1,1,64,16,16,90,90,117440512,171840634880,1463,1.4299,76.4912,120176
1,CUTLASS,gemm,cutlass3x_sm90_tensorop_gemm_f16_f16_f32_f16_f16_64x16x128_8x1x1_0_tnn_align8_warpspecialized_pingpong_epi_nosmem,passed,success,universal,4096,5120,4096,f16:row,f16:column,f16:column,f16:column,1,0,serial,1,1,heuristic,invalid,invalid,false,false,1,tensorop,f32,64,16,128,8,1,1,0,0,0,11,4,1,1,64,16,16,90,90,117440512,171840634880,1463,1.42787,76.6003,120348
1,CUTLASS,gemm,cutlass3x_sm90_tensorop_gemm_f16_f16_f32_f16_f16_64x16x128_4x4x1_0_tnn_align8,passed,success,universal,4096,5120,4096,f16:row,f16:column,f16:column,f16:column,1,0,serial,1,1,heuristic,invalid,invalid,false,false,1,tensorop,f32,64,16,128,4,4,1,0,0,0,11,4,1,1,64,16,16,90,90,117440512,171840634880,1463,0.841908,129.913,204109
1,CUTLASS,gemm,cutlass3x_sm90_tensorop_gemm_f16_f16_f32_f16_f16_64x16x128_4x4x1_0_tnn_align8_warpspecialized_epi_nosmem,passed,success,universal,4096,5120,4096,f16:row,f16:column,f16:column,f16:column,1,0,serial,1,1,heuristic,invalid,invalid,false,false,1,tensorop,f32,64,16,128,4,4,1,0,0,0,11,4,1,1,64,16,16,90,90,117440512,171840634880,1463,1.09213,100.149,157345
1,CUTLASS,gemm,cutlass3x_sm90_tensorop_gemm_f16_f16_f32_f16_f16_64x16x128_4x4x1_0_tnn_align8_warpspecialized_pingpong_epi_tma,passed,success,universal,4096,5120,4096,f16:row,f16:column,f16:column,f16:column,1,0,serial,1,1,heuristic,invalid,invalid,false,false,1,tensorop,f32,64,16,128,4,4,1,0,0,0,11,4,1,1,64,16,16,90,90,117440512,171840634880,1463,0.848871,128.848,202434
1,CUTLASS,gemm,cutlass3x_sm90_tensorop_gemm_f16_f16_f32_f16_f16_64x16x128_4x4x1_0_tnn_align8_warpspecialized_pingpong_epi_nosmem,passed,success,universal,4096,5120,4096,f16:row,f16:column,f16:column,f16:column,1,0,serial,1,1,heuristic,invalid,invalid,false,false,1,tensorop,f32,64,16,128,4,4,1,0,0,0,11,4,1,1,64,16,16,90,90,117440512,171840634880,1463,0.841603,129.96,204183
1,CUTLASS,gemm,cutlass3x_sm90_tensorop_gemm_f16_f16_f32_f16_f16_128x32x128_1x2x1_0_tnn_align8,passed,success,universal,4096,5120,4096,f16:row,f16:column,f16:column,f16:column,1,0,serial,1,1,heuristic,invalid,invalid,false,false,1,tensorop,f32,128,32,128,1,2,1,0,0,0,5,4,2,1,64,32,16,90,90,117440512,171840634880,1463,0.523862,208.786,328026
1,CUTLASS,gemm,cutlass3x_sm90_tensorop_gemm_f16_f16_f32_f16_f16_128x32x128_1x2x1_0_tnn_align8_warpspecialized_epi_nosmem,passed,success,universal,4096,5120,4096,f16:row,f16:column,f16:column,f16:column,1,0,serial,1,1,heuristic,invalid,invalid,false,false,1,tensorop,f32,128,32,128,1,2,1,0,0,0,5,4,1,1,64,32,16,90,90,117440512,171840634880,1463,0.559586,195.457,307085
1,CUTLASS,gemm,cutlass3x_sm90_tensorop_gemm_f16_f16_f32_f16_f16_128x32x128_1x2x1_0_tnn_align8_warpspecialized_pingpong_epi_tma,passed,success,universal,4096,5120,4096,f16:row,f16:column,f16:column,f16:column,1,0,serial,1,1,heuristic,invalid,invalid,false,false,1,tensorop,f32,128,32,128,1,2,1,0,0,0,5,4,1,1,64,32,16,90,90,117440512,171840634880,1463,0.522052,209.51,329164
1,CUTLASS,gemm,cutlass3x_sm90_tensorop_gemm_f16_f16_f32_f16_f16_128x32x128_1x2x1_0_tnn_align8_warpspecialized_pingpong_epi_nosmem,passed,success,universal,4096,5120,4096,f16:row,f16:column,f16:column,f16:column,1,0,serial,1,1,heuristic,invalid,invalid,false,false,1,tensorop,f32,128,32,128,1,2,1,0,0,0,5,4,1,1,64,32,16,90,90,117440512,171840634880,1463,0.523796,208.812,328068
1,CUTLASS,gemm,cutlass3x_sm90_tensorop_gemm_f16_f16_f32_f16_f16_128x32x128_1x2x1_0_tnn_align8_warpspecialized_cooperative_epi_nosmem,passed,success,universal,4096,5120,4096,f16:row,f16:column,f16:column,f16:column,1,0,serial,1,1,heuristic,invalid,invalid,false,false,1,tensorop,f32,128,32,128,1,2,1,0,0,0,5,4,2,1,64,32,16,90,90,117440512,171840634880,1463,0.525114,208.288,327244
1,CUTLASS,gemm,cutlass3x_sm90_tensorop_gemm_f16_f16_f32_f16_f16_128x32x128_1x2x1_0_tnn_align8_warpspecialized_cooperative_epi_tma,passed,success,universal,4096,5120,4096,f16:row,f16:column,f16:column,f16:column,1,0,serial,1,1,heuristic,invalid,invalid,false,false,1,tensorop,f32,128,32,128,1,2,1,0,0,0,5,4,2,1,64,32,16,90,90,117440512,171840634880,1463,0.52417,208.663,327834
1,CUTLASS,gemm,cutlass3x_sm90_tensorop_gemm_f16_f16_f32_f16_f16_128x32x128_1x2x1_0_tnn_align8_stream_k_warpspecialized_cooperative_epi_nosmem,passed,success,universal,4096,5120,4096,f16:row,f16:column,f16:column,f16:column,1,0,serial,1,1,heuristic,invalid,invalid,false,false,1,tensorop,f32,128,32,128,1,2,1,0,0,0,5,4,2,1,64,32,16,90,90,117440512,171840634880,1463,0.52592,207.969,326743
1,CUTLASS,gemm,cutlass3x_sm90_tensorop_gemm_f16_f16_f32_f16_f16_128x32x128_1x2x1_0_tnn_align8_stream_k_warpspecialized_cooperative_epi_tma,passed,success,universal,4096,5120,4096,f16:row,f16:column,f16:column,f16:column,1,0,serial,1,1,heuristic,invalid,invalid,false,false,1,tensorop,f32,128,32,128,1,2,1,0,0,0,5,4,2,1,64,32,16,90,90,117440512,171840634880,1463,0.529142,206.702,324753
1,CUTLASS,gemm,cutlass3x_sm90_tensorop_gemm_f16_f16_f32_f16_f16_128x32x128_2x1x1_0_tnn_align8,passed,success,universal,4096,5120,4096,f16:row,f16:column,f16:column,f16:column,1,0,serial,1,1,heuristic,invalid,invalid,false,false,1,tensorop,f32,128,32,128,2,1,1,0,0,0,5,4,2,1,64,32,16,90,90,117440512,171840634880,1463,0.76725,142.555,223969
1,CUTLASS,gemm,cutlass3x_sm90_tensorop_gemm_f16_f16_f32_f16_f16_128x32x128_2x1x1_0_tnn_align8_warpspecialized_epi_nosmem,passed,success,universal,4096,5120,4096,f16:row,f16:column,f16:column,f16:column,1,0,serial,1,1,heuristic,invalid,invalid,false,false,1,tensorop,f32,128,32,128,2,1,1,0,0,0,5,4,1,1,64,32,16,90,90,117440512,171840634880,1463,0.787506,138.888,218209
1,CUTLASS,gemm,cutlass3x_sm90_tensorop_gemm_f16_f16_f32_f16_f16_128x32x128_2x1x1_0_tnn_align8_warpspecialized_pingpong_epi_tma,passed,success,universal,4096,5120,4096,f16:row,f16:column,f16:column,f16:column,1,0,serial,1,1,heuristic,invalid,invalid,false,false,1,tensorop,f32,128,32,128,2,1,1,0,0,0,5,4,1,1,64,32,16,90,90,117440512,171840634880,1463,0.753489,145.158,228060
1,CUTLASS,gemm,cutlass3x_sm90_tensorop_gemm_f16_f16_f32_f16_f16_128x32x128_2x1x1_0_tnn_align8_warpspecialized_pingpong_epi_nosmem,passed,success,universal,4096,5120,4096,f16:row,f16:column,f16:column,f16:column,1,0,serial,1,1,heuristic,invalid,invalid,false,false,1,tensorop,f32,128,32,128,2,1,1,0,0,0,5,4,1,1,64,32,16,90,90,117440512,171840634880,1463,0.766517,142.691,224184
1,CUTLASS,gemm,cutlass3x_sm90_tensorop_gemm_f16_f16_f32_f16_f16_128x32x128_2x1x1_0_tnn_align8_warpspecialized_cooperative_epi_nosmem,passed,success,universal,4096,5120,4096,f16:row,f16:column,f16:column,f16:column,1,0,serial,1,1,heuristic,invalid,invalid,false,false,1,tensorop,f32,128,32,128,2,1,1,0,0,0,5,4,2,1,64,32,16,90,90,117440512,171840634880,1463,0.767076,142.587,224020
1,CUTLASS,gemm,cutlass3x_sm90_tensorop_gemm_f16_f16_f32_f16_f16_128x32x128_2x1x1_0_tnn_align8_warpspecialized_cooperative_epi_tma,passed,success,universal,4096,5120,4096,f16:row,f16:column,f16:column,f16:column,1,0,serial,1,1,heuristic,invalid,invalid,false,false,1,tensorop,f32,128,32,128,2,1,1,0,0,0,5,4,2,1,64,32,16,90,90,117440512,171840634880,1463,0.752141,145.418,228469
1,CUTLASS,gemm,cutlass3x_sm90_tensorop_gemm_f16_f16_f32_f16_f16_128x32x128_2x1x1_0_tnn_align8_stream_k_warpspecialized_cooperative_epi_nosmem,passed,success,universal,4096,5120,4096,f16:row,f16:column,f16:column,f16:column,1,0,serial,1,1,heuristic,invalid,invalid,false,false,1,tensorop,f32,128,32,128,2,1,1,0,0,0,5,4,2,1,64,32,16,90,90,117440512,171840634880,1463,0.772786,141.533,222365
1,CUTLASS,gemm,cutlass3x_sm90_tensorop_gemm_f16_f16_f32_f16_f16_128x32x128_2x1x1_0_tnn_align8_stream_k_warpspecialized_cooperative_epi_tma,passed,success,universal,4096,5120,4096,f16:row,f16:column,f16:column,f16:column,1,0,serial,1,1,heuristic,invalid,invalid,false,false,1,tensorop,f32,128,32,128,2,1,1,0,0,0,5,4,2,1,64,32,16,90,90,117440512,171840634880,1463,0.759713,143.969,226192
1,CUTLASS,gemm,cutlass3x_sm90_tensorop_gemm_f16_f16_f32_f16_f16_128x32x128_1x1x1_0_tnn_align8,passed,success,universal,4096,5120,4096,f16:row,f16:column,f16:column,f16:column,1,0,serial,1,1,heuristic,invalid,invalid,false,false,1,tensorop,f32,128,32,128,1,1,1,0,0,0,5,4,2,1,64,32,16,90,90,117440512,171840634880,1463,0.830904,131.634,206812
1,CUTLASS,gemm,cutlass3x_sm90_tensorop_gemm_f16_f16_f32_f16_f16_128x32x128_1x1x1_0_tnn_align8_warpspecialized_epi_nosmem,passed,success,universal,4096,5120,4096,f16:row,f16:column,f16:column,f16:column,1,0,serial,1,1,heuristic,invalid,invalid,false,false,1,tensorop,f32,128,32,128,1,1,1,0,0,0,5,4,1,1,64,32,16,90,90,117440512,171840634880,1463,0.803756,136.08,213797
1,CUTLASS,gemm,cutlass3x_sm90_tensorop_gemm_f16_f16_f32_f16_f16_128x32x128_1x1x1_0_tnn_align8_warpspecialized_pingpong_epi_tma,passed,success,universal,4096,5120,4096,f16:row,f16:column,f16:column,f16:column,1,0,serial,1,1,heuristic,invalid,invalid,false,false,1,tensorop,f32,128,32,128,1,1,1,0,0,0,5,4,1,1,64,32,16,90,90,117440512,171840634880,1463,0.806383,135.637,213101
1,CUTLASS,gemm,cutlass3x_sm90_tensorop_gemm_f16_f16_f32_f16_f16_128x32x128_1x1x1_0_tnn_align8_warpspecialized_pingpong_epi_nosmem,passed,success,universal,4096,5120,4096,f16:row,f16:column,f16:column,f16:column,1,0,serial,1,1,heuristic,invalid,invalid,false,false,1,tensorop,f32,128,32,128,1,1,1,0,0,0,5,4,1,1,64,32,16,90,90,117440512,171840634880,1463,0.829963,131.783,207046
1,CUTLASS,gemm,cutlass3x_sm90_tensorop_gemm_f16_f16_f32_f16_f16_128x32x128_1x1x1_0_tnn_align8_warpspecialized_cooperative_epi_nosmem,passed,success,universal,4096,5120,4096,f16:row,f16:column,f16:column,f16:column,1,0,serial,1,1,heuristic,invalid,invalid,false,false,1,tensorop,f32,128,32,128,1,1,1,0,0,0,5,4,2,1,64,32,16,90,90,117440512,171840634880,1463,0.837195,130.645,205258
1,CUTLASS,gemm,cutlass3x_sm90_tensorop_gemm_f16_f16_f32_f16_f16_128x32x128_1x1x1_0_tnn_align8_warpspecialized_cooperative_epi_tma,passed,success,universal,4096,5120,4096,f16:row,f16:column,f16:column,f16:column,1,0,serial,1,1,heuristic,invalid,invalid,false,false,1,tensorop,f32,128,32,128,1,1,1,0,0,0,5,4,2,1,64,32,16,90,90,117440512,171840634880,1463,0.804989,135.871,213470
1,CUTLASS,gemm,cutlass3x_sm90_tensorop_gemm_f16_f16_f32_f16_f16_128x32x128_1x1x1_0_tnn_align8_stream_k_warpspecialized_cooperative_epi_nosmem,passed,success,universal,4096,5120,4096,f16:row,f16:column,f16:column,f16:column,1,0,serial,1,1,heuristic,invalid,invalid,false,false,1,tensorop,f32,128,32,128,1,1,1,0,0,0,5,4,2,1,64,32,16,90,90,117440512,171840634880,1463,0.824439,132.666,208433
1,CUTLASS,gemm,cutlass3x_sm90_tensorop_gemm_f16_f16_f32_f16_f16_128x32x128_1x1x1_0_tnn_align8_stream_k_warpspecialized_cooperative_epi_tma,passed,success,universal,4096,5120,4096,f16:row,f16:column,f16:column,f16:column,1,0,serial,1,1,heuristic,invalid,invalid,false,false,1,tensorop,f32,128,32,128,1,1,1,0,0,0,5,4,2,1,64,32,16,90,90,117440512,171840634880,1463,0.806943,135.542,212953
1,CUTLASS,gemm,cutlass3x_sm90_tensorop_gemm_f16_f16_f32_f16_f16_128x32x128_2x2x1_0_tnn_align8,passed,success,universal,4096,5120,4096,f16:row,f16:column,f16:column,f16:column,1,0,serial,1,1,heuristic,invalid,invalid,false,false,1,tensorop,f32,128,32,128,2,2,1,0,0,0,5,4,2,1,64,32,16,90,90,117440512,171840634880,1463,0.508538,215.077,337911
1,CUTLASS,gemm,cutlass3x_sm90_tensorop_gemm_f16_f16_f32_f16_f16_128x32x128_2x2x1_0_tnn_align8_warpspecialized_epi_nosmem,passed,success,universal,4096,5120,4096,f16:row,f16:column,f16:column,f16:column,1,0,serial,1,1,heuristic,invalid,invalid,false,false,1,tensorop,f32,128,32,128,2,2,1,0,0,0,5,4,1,1,64,32,16,90,90,117440512,171840634880,1463,0.661352,165.381,259832
1,CUTLASS,gemm,cutlass3x_sm90_tensorop_gemm_f16_f16_f32_f16_f16_128x32x128_2x2x1_0_tnn_align8_warpspecialized_pingpong_epi_tma,passed,success,universal,4096,5120,4096,f16:row,f16:column,f16:column,f16:column,1,0,serial,1,1,heuristic,invalid,invalid,false,false,1,tensorop,f32,128,32,128,2,2,1,0,0,0,5,4,1,1,64,32,16,90,90,117440512,171840634880,1463,0.507535,215.502,338579
1,CUTLASS,gemm,cutlass3x_sm90_tensorop_gemm_f16_f16_f32_f16_f16_128x32x128_2x2x1_0_tnn_align8_warpspecialized_pingpong_epi_nosmem,passed,success,universal,4096,5120,4096,f16:row,f16:column,f16:column,f16:column,1,0,serial,1,1,heuristic,invalid,invalid,false,false,1,tensorop,f32,128,32,128,2,2,1,0,0,0,5,4,1,1,64,32,16,90,90,117440512,171840634880,1463,0.504842,216.652,340385
1,CUTLASS,gemm,cutlass3x_sm90_tensorop_gemm_f16_f16_f32_f16_f16_128x32x128_2x2x1_0_tnn_align8_warpspecialized_cooperative_epi_nosmem,passed,success,universal,4096,5120,4096,f16:row,f16:column,f16:column,f16:column,1,0,serial,1,1,heuristic,invalid,invalid,false,false,1,tensorop,f32,128,32,128,2,2,1,0,0,0,5,4,2,1,64,32,16,90,90,117440512,171840634880,1463,0.510408,214.289,336673
1,CUTLASS,gemm,cutlass3x_sm90_tensorop_gemm_f16_f16_f32_f16_f16_128x32x128_2x2x1_0_tnn_align8_warpspecialized_cooperative_epi_tma,passed,success,universal,4096,5120,4096,f16:row,f16:column,f16:column,f16:column,1,0,serial,1,1,heuristic,invalid,invalid,false,false,1,tensorop,f32,128,32,128,2,2,1,0,0,0,5,4,2,1,64,32,16,90,90,117440512,171840634880,1463,0.511093,214.002,336222
1,CUTLASS,gemm,cutlass3x_sm90_tensorop_gemm_f16_f16_f32_f16_f16_128x32x128_2x2x1_0_tnn_align8_stream_k_warpspecialized_cooperative_epi_nosmem,passed,success,universal,4096,5120,4096,f16:row,f16:column,f16:column,f16:column,1,0,serial,1,1,heuristic,invalid,invalid,false,false,1,tensorop,f32,128,32,128,2,2,1,0,0,0,5,4,2,1,64,32,16,90,90,117440512,171840634880,1463,0.511201,213.957,336151
1,CUTLASS,gemm,cutlass3x_sm90_tensorop_gemm_f16_f16_f32_f16_f16_128x32x128_2x2x1_0_tnn_align8_stream_k_warpspecialized_cooperative_epi_tma,passed,success,universal,4096,5120,4096,f16:row,f16:column,f16:column,f16:column,1,0,serial,1,1,heuristic,invalid,invalid,false,false,1,tensorop,f32,128,32,128,2,2,1,0,0,0,5,4,2,1,64,32,16,90,90,117440512,171840634880,1463,0.514857,212.438,333764
1,CUTLASS,gemm,cutlass3x_sm90_tensorop_gemm_f16_f16_f32_f16_f16_128x32x128_1x4x1_0_tnn_align8,passed,success,universal,4096,5120,4096,f16:row,f16:column,f16:column,f16:column,1,0,serial,1,1,heuristic,invalid,invalid,false,false,1,tensorop,f32,128,32,128,1,4,1,0,0,0,5,4,2,1,64,32,16,90,90,117440512,171840634880,1463,0.43782,249.817,392492
1,CUTLASS,gemm,cutlass3x_sm90_tensorop_gemm_f16_f16_f32_f16_f16_128x32x128_1x4x1_0_tnn_align8_warpspecialized_epi_nosmem,passed,success,universal,4096,5120,4096,f16:row,f16:column,f16:column,f16:column,1,0,serial,1,1,heuristic,invalid,invalid,false,false,1,tensorop,f32,128,32,128,1,4,1,0,0,0,5,4,1,1,64,32,16,90,90,117440512,171840634880,1463,0.500053,218.727,343645
1,CUTLASS,gemm,cutlass3x_sm90_tensorop_gemm_f16_f16_f32_f16_f16_128x32x128_1x4x1_0_tnn_align8_warpspecialized_pingpong_epi_tma,passed,success,universal,4096,5120,4096,f16:row,f16:column,f16:column,f16:column,1,0,serial,1,1,heuristic,invalid,invalid,false,false,1,tensorop,f32,128,32,128,1,4,1,0,0,0,5,4,1,1,64,32,16,90,90,117440512,171840634880,1463,0.429412,254.709,400176
1,CUTLASS,gemm,cutlass3x_sm90_tensorop_gemm_f16_f16_f32_f16_f16_128x32x128_1x4x1_0_tnn_align8_warpspecialized_pingpong_epi_nosmem,passed,success,universal,4096,5120,4096,f16:row,f16:column,f16:column,f16:column,1,0,serial,1,1,heuristic,invalid,invalid,false,false,1,tensorop,f32,128,32,128,1,4,1,0,0,0,5,4,1,1,64,32,16,90,90,117440512,171840634880,1463,0.431332,253.575,398395
1,CUTLASS,gemm,cutlass3x_sm90_tensorop_gemm_f16_f16_f32_f16_f16_128x32x128_1x4x1_0_tnn_align8_warpspecialized_cooperative_epi_nosmem,passed,success,universal,4096,5120,4096,f16:row,f16:column,f16:column,f16:column,1,0,serial,1,1,heuristic,invalid,invalid,false,false,1,tensorop,f32,128,32,128,1,4,1,0,0,0,5,4,2,1,64,32,16,90,90,117440512,171840634880,1463,0.437672,249.902,392625
1,CUTLASS,gemm,cutlass3x_sm90_tensorop_gemm_f16_f16_f32_f16_f16_128x32x128_1x4x1_0_tnn_align8_warpspecialized_cooperative_epi_tma,passed,success,universal,4096,5120,4096,f16:row,f16:column,f16:column,f16:column,1,0,serial,1,1,heuristic,invalid,invalid,false,false,1,tensorop,f32,128,32,128,1,4,1,0,0,0,5,4,2,1,64,32,16,90,90,117440512,171840634880,1463,0.443109,246.835,387807
1,CUTLASS,gemm,cutlass3x_sm90_tensorop_gemm_f16_f16_f32_f16_f16_128x32x128_1x4x1_0_tnn_align8_stream_k_warpspecialized_cooperative_epi_nosmem,passed,success,universal,4096,5120,4096,f16:row,f16:column,f16:column,f16:column,1,0,serial,1,1,heuristic,invalid,invalid,false,false,1,tensorop,f32,128,32,128,1,4,1,0,0,0,5,4,2,1,64,32,16,90,90,117440512,171840634880,1463,0.4519,242.034,380263
1,CUTLASS,gemm,cutlass3x_sm90_tensorop_gemm_f16_f16_f32_f16_f16_128x32x128_1x4x1_0_tnn_align8_stream_k_warpspecialized_cooperative_epi_tma,passed,success,universal,4096,5120,4096,f16:row,f16:column,f16:column,f16:column,1,0,serial,1,1,heuristic,invalid,invalid,false,false,1,tensorop,f32,128,32,128,1,4,1,0,0,0,5,4,2,1,64,32,16,90,90,117440512,171840634880,1463,0.45591,239.905,376918
1,CUTLASS,gemm,cutlass3x_sm90_tensorop_gemm_f16_f16_f32_f16_f16_128x32x128_4x1x1_0_tnn_align8,passed,success,universal,4096,5120,4096,f16:row,f16:column,f16:column,f16:column,1,0,serial,1,1,heuristic,invalid,invalid,false,false,1,tensorop,f32,128,32,128,4,1,1,0,0,0,5,4,2,1,64,32,16,90,90,117440512,171840634880,1463,0.682072,160.357,251939
1,CUTLASS,gemm,cutlass3x_sm90_tensorop_gemm_f16_f16_f32_f16_f16_128x32x128_4x1x1_0_tnn_align8_warpspecialized_epi_nosmem,passed,success,universal,4096,5120,4096,f16:row,f16:column,f16:column,f16:column,1,0,serial,1,1,heuristic,invalid,invalid,false,false,1,tensorop,f32,128,32,128,4,1,1,0,0,0,5,4,1,1,64,32,16,90,90,117440512,171840634880,1463,0.812618,134.596,211466
1,CUTLASS,gemm,cutlass3x_sm90_tensorop_gemm_f16_f16_f32_f16_f16_128x32x128_4x1x1_0_tnn_align8_warpspecialized_pingpong_epi_tma,passed,success,universal,4096,5120,4096,f16:row,f16:column,f16:column,f16:column,1,0,serial,1,1,heuristic,invalid,invalid,false,false,1,tensorop,f32,128,32,128,4,1,1,0,0,0,5,4,1,1,64,32,16,90,90,117440512,171840634880,1463,0.747737,146.275,229814
1,CUTLASS,gemm,cutlass3x_sm90_tensorop_gemm_f16_f16_f32_f16_f16_128x32x128_4x1x1_0_tnn_align8_warpspecialized_pingpong_epi_nosmem,passed,success,universal,4096,5120,4096,f16:row,f16:column,f16:column,f16:column,1,0,serial,1,1,heuristic,invalid,invalid,false,false,1,tensorop,f32,128,32,128,4,1,1,0,0,0,5,4,1,1,64,32,16,90,90,117440512,171840634880,1463,0.750995,145.64,228817
1,CUTLASS,gemm,cutlass3x_sm90_tensorop_gemm_f16_f16_f32_f16_f16_128x32x128_4x1x1_0_tnn_align8_warpspecialized_cooperative_epi_nosmem,passed,success,universal,4096,5120,4096,f16:row,f16:column,f16:column,f16:column,1,0,serial,1,1,heuristic,invalid,invalid,false,false,1,tensorop,f32,128,32,128,4,1,1,0,0,0,5,4,2,1,64,32,16,90,90,117440512,171840634880,1463,0.75165,145.513,228618
1,CUTLASS,gemm,cutlass3x_sm90_tensorop_gemm_f16_f16_f32_f16_f16_128x32x128_4x1x1_0_tnn_align8_warpspecialized_cooperative_epi_tma,passed,success,universal,4096,5120,4096,f16:row,f16:column,f16:column,f16:column,1,0,serial,1,1,heuristic,invalid,invalid,false,false,1,tensorop,f32,128,32,128,4,1,1,0,0,0,5,4,2,1,64,32,16,90,90,117440512,171840634880,1463,0.755596,144.753,227424
1,CUTLASS,gemm,cutlass3x_sm90_tensorop_gemm_f16_f16_f32_f16_f16_128x32x128_4x1x1_0_tnn_align8_stream_k_warpspecialized_cooperative_epi_nosmem,passed,success,universal,4096,5120,4096,f16:row,f16:column,f16:column,f16:column,1,0,serial,1,1,heuristic,invalid,invalid,false,false,1,tensorop,f32,128,32,128,4,1,1,0,0,0,5,4,2,1,64,32,16,90,90,117440512,171840634880,1463,0.764382,143.089,224810
1,CUTLASS,gemm,cutlass3x_sm90_tensorop_gemm_f16_f16_f32_f16_f16_128x32x128_4x1x1_0_tnn_align8_stream_k_warpspecialized_cooperative_epi_tma,passed,success,universal,4096,5120,4096,f16:row,f16:column,f16:column,f16:column,1,0,serial,1,1,heuristic,invalid,invalid,false,false,1,tensorop,f32,128,32,128,4,1,1,0,0,0,5,4,2,1,64,32,16,90,90,117440512,171840634880,1463,0.753213,145.211,228143
1,CUTLASS,gemm,cutlass3x_sm90_tensorop_gemm_f16_f16_f32_f16_f16_128x32x128_2x4x1_0_tnn_align8,passed,success,universal,4096,5120,4096,f16:row,f16:column,f16:column,f16:column,1,0,serial,1,1,heuristic,invalid,invalid,false,false,1,tensorop,f32,128,32,128,2,4,1,0,0,0,5,4,2,1,64,32,16,90,90,117440512,171840634880,1463,0.441285,247.856,389410
1,CUTLASS,gemm,cutlass3x_sm90_tensorop_gemm_f16_f16_f32_f16_f16_128x32x128_2x4x1_0_tnn_align8_warpspecialized_epi_nosmem,passed,success,universal,4096,5120,4096,f16:row,f16:column,f16:column,f16:column,1,0,serial,1,1,heuristic,invalid,invalid,false,false,1,tensorop,f32,128,32,128,2,4,1,0,0,0,5,4,1,1,64,32,16,90,90,117440512,171840634880,1463,0.490636,222.925,350241
1,CUTLASS,gemm,cutlass3x_sm90_tensorop_gemm_f16_f16_f32_f16_f16_128x32x128_2x4x1_0_tnn_align8_warpspecialized_pingpong_epi_tma,passed,success,universal,4096,5120,4096,f16:row,f16:column,f16:column,f16:column,1,0,serial,1,1,heuristic,invalid,invalid,false,false,1,tensorop,f32,128,32,128,2,4,1,0,0,0,5,4,1,1,64,32,16,90,90,117440512,171840634880,1463,0.430911,253.823,398784
1,CUTLASS,gemm,cutlass3x_sm90_tensorop_gemm_f16_f16_f32_f16_f16_128x32x128_2x4x1_0_tnn_align8_warpspecialized_pingpong_epi_nosmem,passed,success,universal,4096,5120,4096,f16:row,f16:column,f16:column,f16:column,1,0,serial,1,1,heuristic,invalid,invalid,false,false,1,tensorop,f32,128,32,128,2,4,1,0,0,0,5,4,1,1,64,32,16,90,90,117440512,171840634880,1463,0.432777,252.728,397065
1,CUTLASS,gemm,cutlass3x_sm90_tensorop_gemm_f16_f16_f32_f16_f16_128x32x128_2x4x1_0_tnn_align8_warpspecialized_cooperative_epi_nosmem,passed,success,universal,4096,5120,4096,f16:row,f16:column,f16:column,f16:column,1,0,serial,1,1,heuristic,invalid,invalid,false,false,1,tensorop,f32,128,32,128,2,4,1,0,0,0,5,4,2,1,64,32,16,90,90,117440512,171840634880,1463,0.443672,246.522,387315
1,CUTLASS,gemm,cutlass3x_sm90_tensorop_gemm_f16_f16_f32_f16_f16_128x32x128_2x4x1_0_tnn_align8_warpspecialized_cooperative_epi_tma,passed,success,universal,4096,5120,4096,f16:row,f16:column,f16:column,f16:column,1,0,serial,1,1,heuristic,invalid,invalid,false,false,1,tensorop,f32,128,32,128,2,4,1,0,0,0,5,4,2,1,64,32,16,90,90,117440512,171840634880,1463,0.44594,245.268,385344
1,CUTLASS,gemm,cutlass3x_sm90_tensorop_gemm_f16_f16_f32_f16_f16_128x32x128_2x4x1_0_tnn_align8_stream_k_warpspecialized_cooperative_epi_nosmem,passed,success,universal,4096,5120,4096,f16:row,f16:column,f16:column,f16:column,1,0,serial,1,1,heuristic,invalid,invalid,false,false,1,tensorop,f32,128,32,128,2,4,1,0,0,0,5,4,2,1,64,32,16,90,90,117440512,171840634880,1463,0.454558,240.618,378039
1,CUTLASS,gemm,cutlass3x_sm90_tensorop_gemm_f16_f16_f32_f16_f16_128x32x128_2x4x1_0_tnn_align8_stream_k_warpspecialized_cooperative_epi_tma,passed,success,universal,4096,5120,4096,f16:row,f16:column,f16:column,f16:column,1,0,serial,1,1,heuristic,invalid,invalid,false,false,1,tensorop,f32,128,32,128,2,4,1,0,0,0,5,4,2,1,64,32,16,90,90,117440512,171840634880,1463,0.455333,240.209,377396
1,CUTLASS,gemm,cutlass3x_sm90_tensorop_gemm_f16_f16_f32_f16_f16_128x32x128_4x2x1_0_tnn_align8,passed,success,universal,4096,5120,4096,f16:row,f16:column,f16:column,f16:column,1,0,serial,1,1,heuristic,invalid,invalid,false,false,1,tensorop,f32,128,32,128,4,2,1,0,0,0,5,4,2,1,64,32,16,90,90,117440512,171840634880,1463,0.489051,223.647,351376
1,CUTLASS,gemm,cutlass3x_sm90_tensorop_gemm_f16_f16_f32_f16_f16_128x32x128_4x2x1_0_tnn_align8_warpspecialized_epi_nosmem,passed,success,universal,4096,5120,4096,f16:row,f16:column,f16:column,f16:column,1,0,serial,1,1,heuristic,invalid,invalid,false,false,1,tensorop,f32,128,32,128,4,2,1,0,0,0,5,4,1,1,64,32,16,90,90,117440512,171840634880,1463,0.648859,168.565,264835
1,CUTLASS,gemm,cutlass3x_sm90_tensorop_gemm_f16_f16_f32_f16_f16_128x32x128_4x2x1_0_tnn_align8_warpspecialized_pingpong_epi_tma,passed,success,universal,4096,5120,4096,f16:row,f16:column,f16:column,f16:column,1,0,serial,1,1,heuristic,invalid,invalid,false,false,1,tensorop,f32,128,32,128,4,2,1,0,0,0,5,4,1,1,64,32,16,90,90,117440512,171840634880,1463,0.482752,226.565,355960
1,CUTLASS,gemm,cutlass3x_sm90_tensorop_gemm_f16_f16_f32_f16_f16_128x32x128_4x2x1_0_tnn_align8_warpspecialized_pingpong_epi_nosmem,passed,success,universal,4096,5120,4096,f16:row,f16:column,f16:column,f16:column,1,0,serial,1,1,heuristic,invalid,invalid,false,false,1,tensorop,f32,128,32,128,4,2,1,0,0,0,5,4,1,1,64,32,16,90,90,117440512,171840634880,1463,0.480261,227.741,357806
1,CUTLASS,gemm,cutlass3x_sm90_tensorop_gemm_f16_f16_f32_f16_f16_128x32x128_4x2x1_0_tnn_align8_warpspecialized_cooperative_epi_nosmem,passed,success,universal,4096,5120,4096,f16:row,f16:column,f16:column,f16:column,1,0,serial,1,1,heuristic,invalid,invalid,false,false,1,tensorop,f32,128,32,128,4,2,1,0,0,0,5,4,2,1,64,32,16,90,90,117440512,171840634880,1463,0.488639,223.836,351672
1,CUTLASS,gemm,cutlass3x_sm90_tensorop_gemm_f16_f16_f32_f16_f16_128x32x128_4x2x1_0_tnn_align8_warpspecialized_cooperative_epi_tma,passed,success,universal,4096,5120,4096,f16:row,f16:column,f16:column,f16:column,1,0,serial,1,1,heuristic,invalid,invalid,false,false,1,tensorop,f32,128,32,128,4,2,1,0,0,0,5,4,2,1,64,32,16,90,90,117440512,171840634880,1463,0.492742,221.972,348744
1,CUTLASS,gemm,cutlass3x_sm90_tensorop_gemm_f16_f16_f32_f16_f16_128x32x128_4x2x1_0_tnn_align8_stream_k_warpspecialized_cooperative_epi_nosmem,passed,success,universal,4096,5120,4096,f16:row,f16:column,f16:column,f16:column,1,0,serial,1,1,heuristic,invalid,invalid,false,false,1,tensorop,f32,128,32,128,4,2,1,0,0,0,5,4,2,1,64,32,16,90,90,117440512,171840634880,1463,0.496842,220.14,345866
1,CUTLASS,gemm,cutlass3x_sm90_tensorop_gemm_f16_f16_f32_f16_f16_128x32x128_4x2x1_0_tnn_align8_stream_k_warpspecialized_cooperative_epi_tma,passed,success,universal,4096,5120,4096,f16:row,f16:column,f16:column,f16:column,1,0,serial,1,1,heuristic,invalid,invalid,false,false,1,tensorop,f32,128,32,128,4,2,1,0,0,0,5,4,2,1,64,32,16,90,90,117440512,171840634880,1463,0.499885,218.8,343760
1,CUTLASS,gemm,cutlass3x_sm90_tensorop_gemm_f16_f16_f32_f16_f16_128x256x64_1x2x1_0_tnn_align8,passed,success,universal,4096,5120,4096,f16:row,f16:column,f16:column,f16:column,1,0,serial,1,1,heuristic,invalid,invalid,false,false,1,tensorop,f32,128,256,64,1,2,1,0,0,0,4,4,2,1,64,256,16,90,90,117440512,171840634880,1463,0.234409,466.6,733081
1,CUTLASS,gemm,cutlass3x_sm90_tensorop_gemm_f16_f16_f32_f16_f16_128x256x64_1x2x1_0_tnn_align8_warpspecialized_epi_nosmem,passed,success,universal,4096,5120,4096,f16:row,f16:column,f16:column,f16:column,1,0,serial,1,1,heuristic,invalid,invalid,false,false,1,tensorop,f32,128,256,64,1,2,1,0,0,0,4,4,1,1,64,256,16,90,90,117440512,171840634880,1463,3.80653,28.7335,45143.6
1,CUTLASS,gemm,cutlass3x_sm90_tensorop_gemm_f16_f16_f32_f16_f16_128x256x64_1x2x1_0_tnn_align8_warpspecialized_pingpong_epi_tma,passed,success,universal,4096,5120,4096,f16:row,f16:column,f16:column,f16:column,1,0,serial,1,1,heuristic,invalid,invalid,false,false,1,tensorop,f32,128,256,64,1,2,1,0,0,0,4,4,1,1,64,256,16,90,90,117440512,171840634880,1463,4.37177,25.0185,39306.9
1,CUTLASS,gemm,cutlass3x_sm90_tensorop_gemm_f16_f16_f32_f16_f16_128x256x64_1x2x1_0_tnn_align8_warpspecialized_pingpong_epi_nosmem,passed,success,universal,4096,5120,4096,f16:row,f16:column,f16:column,f16:column,1,0,serial,1,1,heuristic,invalid,invalid,false,false,1,tensorop,f32,128,256,64,1,2,1,0,0,0,4,4,1,1,64,256,16,90,90,117440512,171840634880,1463,4.18116,26.159,41098.8
1,CUTLASS,gemm,cutlass3x_sm90_tensorop_gemm_f16_f16_f32_f16_f16_128x256x64_1x2x1_0_tnn_align8_warpspecialized_cooperative_epi_nosmem,passed,success,universal,4096,5120,4096,f16:row,f16:column,f16:column,f16:column,1,0,serial,1,1,heuristic,invalid,invalid,false,false,1,tensorop,f32,128,256,64,1,2,1,0,0,0,4,4,2,1,64,256,16,90,90,117440512,171840634880,1463,0.237184,461.14,724504
1,CUTLASS,gemm,cutlass3x_sm90_tensorop_gemm_f16_f16_f32_f16_f16_128x256x64_1x2x1_0_tnn_align8_warpspecialized_cooperative_epi_tma,passed,success,universal,4096,5120,4096,f16:row,f16:column,f16:column,f16:column,1,0,serial,1,1,heuristic,invalid,invalid,false,false,1,tensorop,f32,128,256,64,1,2,1,0,0,0,4,4,2,1,64,256,16,90,90,117440512,171840634880,1463,0.222298,492.021,773021
1,CUTLASS,gemm,cutlass3x_sm90_tensorop_gemm_f16_f16_f32_f16_f16_128x256x64_1x2x1_0_tnn_align8_stream_k_warpspecialized_cooperative_epi_nosmem,passed,success,universal,4096,5120,4096,f16:row,f16:column,f16:column,f16:column,1,0,serial,1,1,heuristic,invalid,invalid,false,false,1,tensorop,f32,128,256,64,1,2,1,0,0,0,4,4,2,1,64,256,16,90,90,117440512,171840634880,1463,0.242211,451.569,709466
1,CUTLASS,gemm,cutlass3x_sm90_tensorop_gemm_f16_f16_f32_f16_f16_128x256x64_1x2x1_0_tnn_align8_stream_k_warpspecialized_cooperative_epi_tma,passed,success,universal,4096,5120,4096,f16:row,f16:column,f16:column,f16:column,1,0,serial,1,1,heuristic,invalid,invalid,false,false,1,tensorop,f32,128,256,64,1,2,1,0,0,0,4,4,2,1,64,256,16,90,90,117440512,171840634880,1463,0.227139,481.534,756545
1,CUTLASS,gemm,cutlass3x_sm90_tensorop_gemm_f16_f16_f32_f16_f16_128x32x128_1x8x1_0_tnn_align8,passed,success,universal,4096,5120,4096,f16:row,f16:column,f16:column,f16:column,1,0,serial,1,1,heuristic,invalid,invalid,false,false,1,tensorop,f32,128,32,128,1,8,1,0,0,0,5,4,2,1,64,32,16,90,90,117440512,171840634880,1463,0.425495,257.053,403860
1,CUTLASS,gemm,cutlass3x_sm90_tensorop_gemm_f16_f16_f32_f16_f16_128x32x128_1x8x1_0_tnn_align8_warpspecialized_epi_nosmem,passed,success,universal,4096,5120,4096,f16:row,f16:column,f16:column,f16:column,1,0,serial,1,1,heuristic,invalid,invalid,false,false,1,tensorop,f32,128,32,128,1,8,1,0,0,0,5,4,1,1,64,32,16,90,90,117440512,171840634880,1463,0.473652,230.918,362799
1,CUTLASS,gemm,cutlass3x_sm90_tensorop_gemm_f16_f16_f32_f16_f16_128x32x128_1x8x1_0_tnn_align8_warpspecialized_pingpong_epi_tma,passed,success,universal,4096,5120,4096,f16:row,f16:column,f16:column,f16:column,1,0,serial,1,1,heuristic,invalid,invalid,false,false,1,tensorop,f32,128,32,128,1,8,1,0,0,0,5,4,1,1,64,32,16,90,90,117440512,171840634880,1463,0.415889,262.991,413189
1,CUTLASS,gemm,cutlass3x_sm90_tensorop_gemm_f16_f16_f32_f16_f16_128x32x128_1x8x1_0_tnn_align8_warpspecialized_pingpong_epi_nosmem,passed,success,universal,4096,5120,4096,f16:row,f16:column,f16:column,f16:column,1,0,serial,1,1,heuristic,invalid,invalid,false,false,1,tensorop,f32,128,32,128,1,8,1,0,0,0,5,4,1,1,64,32,16,90,90,117440512,171840634880,1463,0.414745,263.716,414328
1,CUTLASS,gemm,cutlass3x_sm90_tensorop_gemm_f16_f16_f32_f16_f16_128x32x128_1x8x1_0_tnn_align8_warpspecialized_cooperative_epi_nosmem,passed,success,universal,4096,5120,4096,f16:row,f16:column,f16:column,f16:column,1,0,serial,1,1,heuristic,invalid,invalid,false,false,1,tensorop,f32,128,32,128,1,8,1,0,0,0,5,4,2,1,64,32,16,90,90,117440512,171840634880,1463,0.426152,256.657,403238
1,CUTLASS,gemm,cutlass3x_sm90_tensorop_gemm_f16_f16_f32_f16_f16_128x32x128_1x8x1_0_tnn_align8_warpspecialized_cooperative_epi_tma,passed,success,universal,4096,5120,4096,f16:row,f16:column,f16:column,f16:column,1,0,serial,1,1,heuristic,invalid,invalid,false,false,1,tensorop,f32,128,32,128,1,8,1,0,0,0,5,4,2,1,64,32,16,90,90,117440512,171840634880,1463,0.432693,252.777,397142
1,CUTLASS,gemm,cutlass3x_sm90_tensorop_gemm_f16_f16_f32_f16_f16_128x32x128_1x8x1_0_tnn_align8_stream_k_warpspecialized_cooperative_epi_nosmem,passed,success,universal,4096,5120,4096,f16:row,f16:column,f16:column,f16:column,1,0,serial,1,1,heuristic,invalid,invalid,false,false,1,tensorop,f32,128,32,128,1,8,1,0,0,0,5,4,2,1,64,32,16,90,90,117440512,171840634880,1463,0.438451,249.458,391926
1,CUTLASS,gemm,cutlass3x_sm90_tensorop_gemm_f16_f16_f32_f16_f16_128x32x128_1x8x1_0_tnn_align8_stream_k_warpspecialized_cooperative_epi_tma,passed,success,universal,4096,5120,4096,f16:row,f16:column,f16:column,f16:column,1,0,serial,1,1,heuristic,invalid,invalid,false,false,1,tensorop,f32,128,32,128,1,8,1,0,0,0,5,4,2,1,64,32,16,90,90,117440512,171840634880,1463,0.44165,247.651,389088
1,CUTLASS,gemm,cutlass3x_sm90_tensorop_gemm_f16_f16_f32_f16_f16_128x256x128_1x1x1_0_tnn_align8,passed,success,universal,4096,5120,4096,f16:row,f16:column,f16:column,f16:column,1,0,serial,1,1,heuristic,invalid,invalid,false,false,1,tensorop,f32,128,256,128,1,1,1,0,0,0,2,4,2,1,64,256,16,90,90,117440512,171840634880,1463,0.357916,305.588,480114
1,CUTLASS,gemm,cutlass3x_sm90_tensorop_gemm_f16_f16_f32_f16_f16_128x256x128_1x1x1_0_tnn_align8_warpspecialized_epi_nosmem,passed,success,universal,4096,5120,4096,f16:row,f16:column,f16:column,f16:column,1,0,serial,1,1,heuristic,invalid,invalid,false,false,1,tensorop,f32,128,256,128,1,1,1,0,0,0,2,4,1,1,64,256,16,90,90,117440512,171840634880,1463,3.88051,28.1857,44283
1,CUTLASS,gemm,cutlass3x_sm90_tensorop_gemm_f16_f16_f32_f16_f16_128x256x128_1x1x1_0_tnn_align8_warpspecialized_pingpong_epi_tma,passed,success,universal,4096,5120,4096,f16:row,f16:column,f16:column,f16:column,1,0,serial,1,1,heuristic,invalid,invalid,false,false,1,tensorop,f32,128,256,128,1,1,1,0,0,0,2,4,1,1,64,256,16,90,90,117440512,171840634880,1463,4.50132,24.2984,38175.6
1,CUTLASS,gemm,cutlass3x_sm90_tensorop_gemm_f16_f16_f32_f16_f16_128x256x128_1x1x1_0_tnn_align8_warpspecialized_pingpong_epi_nosmem,passed,success,universal,4096,5120,4096,f16:row,f16:column,f16:column,f16:column,1,0,serial,1,1,heuristic,invalid,invalid,false,false,1,tensorop,f32,128,256,128,1,1,1,0,0,0,2,4,1,1,64,256,16,90,90,117440512,171840634880,1463,4.40088,24.853,39046.9
1,CUTLASS,gemm,cutlass3x_sm90_tensorop_gemm_f16_f16_f32_f16_f16_128x256x128_1x1x1_0_tnn_align8_warpspecialized_cooperative_epi_nosmem,passed,success,universal,4096,5120,4096,f16:row,f16:column,f16:column,f16:column,1,0,serial,1,1,heuristic,invalid,invalid,false,false,1,tensorop,f32,128,256,128,1,1,1,0,0,0,2,4,2,1,64,256,16,90,90,117440512,171840634880,1463,0.362515,301.712,474023
1,CUTLASS,gemm,cutlass3x_sm90_tensorop_gemm_f16_f16_f32_f16_f16_128x256x128_1x1x1_0_tnn_align8_warpspecialized_cooperative_epi_tma,passed,success,universal,4096,5120,4096,f16:row,f16:column,f16:column,f16:column,1,0,serial,1,1,heuristic,invalid,invalid,false,false,1,tensorop,f32,128,256,128,1,1,1,0,0,0,2,4,2,1,64,256,16,90,90,117440512,171840634880,1463,0.359843,303.952,477544
1,CUTLASS,gemm,cutlass3x_sm90_tensorop_gemm_f16_f16_f32_f16_f16_128x256x128_1x1x1_0_tnn_align8_stream_k_warpspecialized_cooperative_epi_nosmem,passed,success,universal,4096,5120,4096,f16:row,f16:column,f16:column,f16:column,1,0,serial,1,1,heuristic,invalid,invalid,false,false,1,tensorop,f32,128,256,128,1,1,1,0,0,0,2,4,2,1,64,256,16,90,90,117440512,171840634880,1463,0.356893,306.465,481491
1,CUTLASS,gemm,cutlass3x_sm90_tensorop_gemm_f16_f16_f32_f16_f16_128x256x128_1x1x1_0_tnn_align8_stream_k_warpspecialized_cooperative_epi_tma,passed,success,universal,4096,5120,4096,f16:row,f16:column,f16:column,f16:column,1,0,serial,1,1,heuristic,invalid,invalid,false,false,1,tensorop,f32,128,256,128,1,1,1,0,0,0,2,4,2,1,64,256,16,90,90,117440512,171840634880,1463,0.358785,304.849,478952
1,CUTLASS,gemm,cutlass3x_sm90_tensorop_gemm_f16_f16_f32_f16_f16_128x256x64_1x1x1_0_tnn_align8,passed,success,universal,4096,5120,4096,f16:row,f16:column,f16:column,f16:column,1,0,serial,1,1,heuristic,invalid,invalid,false,false,1,tensorop,f32,128,256,64,1,1,1,0,0,0,4,4,2,1,64,256,16,90,90,117440512,171840634880,1463,0.252012,434.007,681874
1,CUTLASS,gemm,cutlass3x_sm90_tensorop_gemm_f16_f16_f32_f16_f16_128x256x64_1x1x1_0_tnn_align8_warpspecialized_epi_nosmem,passed,success,universal,4096,5120,4096,f16:row,f16:column,f16:column,f16:column,1,0,serial,1,1,heuristic,invalid,invalid,false,false,1,tensorop,f32,128,256,64,1,1,1,0,0,0,4,4,1,1,64,256,16,90,90,117440512,171840634880,1463,3.82162,28.62,44965.4
1,CUTLASS,gemm,cutlass3x_sm90_tensorop_gemm_f16_f16_f32_f16_f16_128x256x64_1x1x1_0_tnn_align8_warpspecialized_pingpong_epi_tma,passed,success,universal,4096,5120,4096,f16:row,f16:column,f16:column,f16:column,1,0,serial,1,1,heuristic,invalid,invalid,false,false,1,tensorop,f32,128,256,64,1,1,1,0,0,0,4,4,1,1,64,256,16,90,90,117440512,171840634880,1463,4.41133,24.7941,38954.4
1,CUTLASS,gemm,cutlass3x_sm90_tensorop_gemm_f16_f16_f32_f16_f16_128x256x64_1x1x1_0_tnn_align8_warpspecialized_pingpong_epi_nosmem,passed,success,universal,4096,5120,4096,f16:row,f16:column,f16:column,f16:column,1,0,serial,1,1,heuristic,invalid,invalid,false,false,1,tensorop,f32,128,256,64,1,1,1,0,0,0,4,4,1,1,64,256,16,90,90,117440512,171840634880,1463,4.33763,25.2154,39616.2
1,CUTLASS,gemm,cutlass3x_sm90_tensorop_gemm_f16_f16_f32_f16_f16_128x256x64_1x1x1_0_tnn_align8_warpspecialized_cooperative_epi_nosmem,passed,success,universal,4096,5120,4096,f16:row,f16:column,f16:column,f16:column,1,0,serial,1,1,heuristic,invalid,invalid,false,false,1,tensorop,f32,128,256,64,1,1,1,0,0,0,4,4,2,1,64,256,16,90,90,117440512,171840634880,1463,0.258496,423.121,664772
1,CUTLASS,gemm,cutlass3x_sm90_tensorop_gemm_f16_f16_f32_f16_f16_128x256x64_1x1x1_0_tnn_align8_warpspecialized_cooperative_epi_tma,passed,success,universal,4096,5120,4096,f16:row,f16:column,f16:column,f16:column,1,0,serial,1,1,heuristic,invalid,invalid,false,false,1,tensorop,f32,128,256,64,1,1,1,0,0,0,4,4,2,1,64,256,16,90,90,117440512,171840634880,1463,0.236259,462.946,727341
1,CUTLASS,gemm,cutlass3x_sm90_tensorop_gemm_f16_f16_f32_f16_f16_128x256x64_1x1x1_0_tnn_align8_stream_k_warpspecialized_cooperative_epi_nosmem,passed,success,universal,4096,5120,4096,f16:row,f16:column,f16:column,f16:column,1,0,serial,1,1,heuristic,invalid,invalid,false,false,1,tensorop,f32,128,256,64,1,1,1,0,0,0,4,4,2,1,64,256,16,90,90,117440512,171840634880,1463,0.258685,422.811,664285
1,CUTLASS,gemm,cutlass3x_sm90_tensorop_gemm_f16_f16_f32_f16_f16_128x256x64_1x1x1_0_tnn_align8_stream_k_warpspecialized_cooperative_epi_tma,passed,success,universal,4096,5120,4096,f16:row,f16:column,f16:column,f16:column,1,0,serial,1,1,heuristic,invalid,invalid,false,false,1,tensorop,f32,128,256,64,1,1,1,0,0,0,4,4,2,1,64,256,16,90,90,117440512,171840634880,1463,0.245154,446.148,700949
1,CUTLASS,gemm,cutlass3x_sm90_tensorop_gemm_f16_f16_f32_f16_f16_128x32x128_8x1x1_0_tnn_align8,passed,success,universal,4096,5120,4096,f16:row,f16:column,f16:column,f16:column,1,0,serial,1,1,heuristic,invalid,invalid,false,false,1,tensorop,f32,128,32,128,8,1,1,0,0,0,5,4,2,1,64,32,16,90,90,117440512,171840634880,1463,0.742848,147.237,231327
1,CUTLASS,gemm,cutlass3x_sm90_tensorop_gemm_f16_f16_f32_f16_f16_128x32x128_8x1x1_0_tnn_align8_warpspecialized_epi_nosmem,passed,success,universal,4096,5120,4096,f16:row,f16:column,f16:column,f16:column,1,0,serial,1,1,heuristic,invalid,invalid,false,false,1,tensorop,f32,128,32,128,8,1,1,0,0,0,5,4,1,1,64,32,16,90,90,117440512,171840634880,1463,0.839766,130.245,204629
1,CUTLASS,gemm,cutlass3x_sm90_tensorop_gemm_f16_f16_f32_f16_f16_128x32x128_8x1x1_0_tnn_align8_warpspecialized_pingpong_epi_tma,passed,success,universal,4096,5120,4096,f16:row,f16:column,f16:column,f16:column,1,0,serial,1,1,heuristic,invalid,invalid,false,false,1,tensorop,f32,128,32,128,8,1,1,0,0,0,5,4,1,1,64,32,16,90,90,117440512,171840634880,1463,0.760941,143.737,225827
1,CUTLASS,gemm,cutlass3x_sm90_tensorop_gemm_f16_f16_f32_f16_f16_128x32x128_8x1x1_0_tnn_align8_warpspecialized_pingpong_epi_nosmem,passed,success,universal,4096,5120,4096,f16:row,f16:column,f16:column,f16:column,1,0,serial,1,1,heuristic,invalid,invalid,false,false,1,tensorop,f32,128,32,128,8,1,1,0,0,0,5,4,1,1,64,32,16,90,90,117440512,171840634880,1463,0.771959,141.685,222603
1,CUTLASS,gemm,cutlass3x_sm90_tensorop_gemm_f16_f16_f32_f16_f16_128x32x128_8x1x1_0_tnn_align8_warpspecialized_cooperative_epi_nosmem,passed,success,universal,4096,5120,4096,f16:row,f16:column,f16:column,f16:column,1,0,serial,1,1,heuristic,invalid,invalid,false,false,1,tensorop,f32,128,32,128,8,1,1,0,0,0,5,4,2,1,64,32,16,90,90,117440512,171840634880,1463,0.772846,141.522,222348
1,CUTLASS,gemm,cutlass3x_sm90_tensorop_gemm_f16_f16_f32_f16_f16_128x32x128_8x1x1_0_tnn_align8_warpspecialized_cooperative_epi_tma,passed,success,universal,4096,5120,4096,f16:row,f16:column,f16:column,f16:column,1,0,serial,1,1,heuristic,invalid,invalid,false,false,1,tensorop,f32,128,32,128,8,1,1,0,0,0,5,4,2,1,64,32,16,90,90,117440512,171840634880,1463,0.74494,146.824,230677
1,CUTLASS,gemm,cutlass3x_sm90_tensorop_gemm_f16_f16_f32_f16_f16_128x32x128_8x1x1_0_tnn_align8_stream_k_warpspecialized_cooperative_epi_nosmem,passed,success,universal,4096,5120,4096,f16:row,f16:column,f16:column,f16:column,1,0,serial,1,1,heuristic,invalid,invalid,false,false,1,tensorop,f32,128,32,128,8,1,1,0,0,0,5,4,2,1,64,32,16,90,90,117440512,171840634880,1463,0.770158,142.016,223124
1,CUTLASS,gemm,cutlass3x_sm90_tensorop_gemm_f16_f16_f32_f16_f16_128x32x128_8x1x1_0_tnn_align8_stream_k_warpspecialized_cooperative_epi_tma,passed,success,universal,4096,5120,4096,f16:row,f16:column,f16:column,f16:column,1,0,serial,1,1,heuristic,invalid,invalid,false,false,1,tensorop,f32,128,32,128,8,1,1,0,0,0,5,4,2,1,64,32,16,90,90,117440512,171840634880,1463,0.752148,145.417,228467
1,CUTLASS,gemm,cutlass3x_sm90_tensorop_gemm_f16_f16_f32_f16_f16_128x256x128_1x4x1_0_tnn_align8,passed,success,universal,4096,5120,4096,f16:row,f16:column,f16:column,f16:column,1,0,serial,1,1,heuristic,invalid,invalid,false,false,1,tensorop,f32,128,256,128,1,4,1,0,0,0,2,4,2,1,64,256,16,90,90,117440512,171840634880,1463,0.369641,295.895,464885
1,CUTLASS,gemm,cutlass3x_sm90_tensorop_gemm_f16_f16_f32_f16_f16_128x256x128_1x4x1_0_tnn_align8_warpspecialized_epi_nosmem,passed,success,universal,4096,5120,4096,f16:row,f16:column,f16:column,f16:column,1,0,serial,1,1,heuristic,invalid,invalid,false,false,1,tensorop,f32,128,256,128,1,4,1,0,0,0,2,4,1,1,64,256,16,90,90,117440512,171840634880,1463,4.38587,24.9381,39180.6
1,CUTLASS,gemm,cutlass3x_sm90_tensorop_gemm_f16_f16_f32_f16_f16_128x256x128_1x4x1_0_tnn_align8_warpspecialized_pingpong_epi_tma,passed,success,universal,4096,5120,4096,f16:row,f16:column,f16:column,f16:column,1,0,serial,1,1,heuristic,invalid,invalid,false,false,1,tensorop,f32,128,256,128,1,4,1,0,0,0,2,4,1,1,64,256,16,90,90,117440512,171840634880,1463,5.29518,20.6556,32452.3
1,CUTLASS,gemm,cutlass3x_sm90_tensorop_gemm_f16_f16_f32_f16_f16_128x256x128_1x4x1_0_tnn_align8_warpspecialized_pingpong_epi_nosmem,passed,success,universal,4096,5120,4096,f16:row,f16:column,f16:column,f16:column,1,0,serial,1,1,heuristic,invalid,invalid,false,false,1,tensorop,f32,128,256,128,1,4,1,0,0,0,2,4,1,1,64,256,16,90,90,117440512,171840634880,1463,5.0056,21.8505,34329.7
1,CUTLASS,gemm,cutlass3x_sm90_tensorop_gemm_f16_f16_f32_f16_f16_128x256x128_1x4x1_0_tnn_align8_warpspecialized_cooperative_epi_nosmem,passed,success,universal,4096,5120,4096,f16:row,f16:column,f16:column,f16:column,1,0,serial,1,1,heuristic,invalid,invalid,false,false,1,tensorop,f32,128,256,128,1,4,1,0,0,0,2,4,2,1,64,256,16,90,90,117440512,171840634880,1463,0.368513,296.801,466309
1,CUTLASS,gemm,cutlass3x_sm90_tensorop_gemm_f16_f16_f32_f16_f16_128x256x128_1x4x1_0_tnn_align8_warpspecialized_cooperative_epi_tma,passed,success,universal,4096,5120,4096,f16:row,f16:column,f16:column,f16:column,1,0,serial,1,1,heuristic,invalid,invalid,false,false,1,tensorop,f32,128,256,128,1,4,1,0,0,0,2,4,2,1,64,256,16,90,90,117440512,171840634880,1463,0.358272,305.285,479638
1,CUTLASS,gemm,cutlass3x_sm90_tensorop_gemm_f16_f16_f32_f16_f16_128x256x128_1x4x1_0_tnn_align8_stream_k_warpspecialized_cooperative_epi_nosmem,passed,success,universal,4096,5120,4096,f16:row,f16:column,f16:column,f16:column,1,0,serial,1,1,heuristic,invalid,invalid,false,false,1,tensorop,f32,128,256,128,1,4,1,0,0,0,2,4,2,1,64,256,16,90,90,117440512,171840634880,1463,0.343394,318.511,500418
1,CUTLASS,gemm,cutlass3x_sm90_tensorop_gemm_f16_f16_f32_f16_f16_128x256x128_1x4x1_0_tnn_align8_stream_k_warpspecialized_cooperative_epi_tma,passed,success,universal,4096,5120,4096,f16:row,f16:column,f16:column,f16:column,1,0,serial,1,1,heuristic,invalid,invalid,false,false,1,tensorop,f32,128,256,128,1,4,1,0,0,0,2,4,2,1,64,256,16,90,90,117440512,171840634880,1463,0.331799,329.643,517906
1,CUTLASS,gemm,cutlass3x_sm90_tensorop_gemm_f16_f16_f32_f16_f16_128x32x128_4x4x1_0_tnn_align8,passed,success,universal,4096,5120,4096,f16:row,f16:column,f16:column,f16:column,1,0,serial,1,1,heuristic,invalid,invalid,false,false,1,tensorop,f32,128,32,128,4,4,1,0,0,0,5,4,2,1,64,32,16,90,90,117440512,171840634880,1463,0.473792,230.85,362692
1,CUTLASS,gemm,cutlass3x_sm90_tensorop_gemm_f16_f16_f32_f16_f16_128x32x128_4x4x1_0_tnn_align8_warpspecialized_epi_nosmem,passed,success,universal,4096,5120,4096,f16:row,f16:column,f16:column,f16:column,1,0,serial,1,1,heuristic,invalid,invalid,false,false,1,tensorop,f32,128,32,128,4,4,1,0,0,0,5,4,1,1,64,32,16,90,90,117440512,171840634880,1463,0.521709,209.648,329380
1,CUTLASS,gemm,cutlass3x_sm90_tensorop_gemm_f16_f16_f32_f16_f16_128x32x128_4x4x1_0_tnn_align8_warpspecialized_pingpong_epi_tma,passed,success,universal,4096,5120,4096,f16:row,f16:column,f16:column,f16:column,1,0,serial,1,1,heuristic,invalid,invalid,false,false,1,tensorop,f32,128,32,128,4,4,1,0,0,0,5,4,1,1,64,32,16,90,90,117440512,171840634880,1463,0.458954,238.314,374418
1,CUTLASS,gemm,cutlass3x_sm90_tensorop_gemm_f16_f16_f32_f16_f16_128x32x128_4x4x1_0_tnn_align8_warpspecialized_pingpong_epi_nosmem,passed,success,universal,4096,5120,4096,f16:row,f16:column,f16:column,f16:column,1,0,serial,1,1,heuristic,invalid,invalid,false,false,1,tensorop,f32,128,32,128,4,4,1,0,0,0,5,4,1,1,64,32,16,90,90,117440512,171840634880,1463,0.460406,237.562,373237
1,CUTLASS,gemm,cutlass3x_sm90_tensorop_gemm_f16_f16_f32_f16_f16_128x32x128_4x4x1_0_tnn_align8_warpspecialized_cooperative_epi_nosmem,passed,success,universal,4096,5120,4096,f16:row,f16:column,f16:column,f16:column,1,0,serial,1,1,heuristic,invalid,invalid,false,false,1,tensorop,f32,128,32,128,4,4,1,0,0,0,5,4,2,1,64,32,16,90,90,117440512,171840634880,1463,0.474644,230.436,362041
1,CUTLASS,gemm,cutlass3x_sm90_tensorop_gemm_f16_f16_f32_f16_f16_128x32x128_4x4x1_0_tnn_align8_warpspecialized_cooperative_epi_tma,passed,success,universal,4096,5120,4096,f16:row,f16:column,f16:column,f16:column,1,0,serial,1,1,heuristic,invalid,invalid,false,false,1,tensorop,f32,128,32,128,4,4,1,0,0,0,5,4,2,1,64,32,16,90,90,117440512,171840634880,1463,0.4785,228.579,359123
1,CUTLASS,gemm,cutlass3x_sm90_tensorop_gemm_f16_f16_f32_f16_f16_128x32x128_4x4x1_0_tnn_align8_stream_k_warpspecialized_cooperative_epi_nosmem,passed,success,universal,4096,5120,4096,f16:row,f16:column,f16:column,f16:column,1,0,serial,1,1,heuristic,invalid,invalid,false,false,1,tensorop,f32,128,32,128,4,4,1,0,0,0,5,4,2,1,64,32,16,90,90,117440512,171840634880,1463,0.487368,224.42,352589
1,CUTLASS,gemm,cutlass3x_sm90_tensorop_gemm_f16_f16_f32_f16_f16_128x32x128_4x4x1_0_tnn_align8_stream_k_warpspecialized_cooperative_epi_tma,passed,success,universal,4096,5120,4096,f16:row,f16:column,f16:column,f16:column,1,0,serial,1,1,heuristic,invalid,invalid,false,false,1,tensorop,f32,128,32,128,4,4,1,0,0,0,5,4,2,1,64,32,16,90,90,117440512,171840634880,1463,0.488956,223.691,351444
1,CUTLASS,gemm,cutlass3x_sm90_tensorop_gemm_f16_f16_f32_f16_f16_128x256x64_2x1x1_0_tnn_align8,passed,success,universal,4096,5120,4096,f16:row,f16:column,f16:column,f16:column,1,0,serial,1,1,heuristic,invalid,invalid,false,false,1,tensorop,f32,128,256,64,2,1,1,0,0,0,4,4,2,1,64,256,16,90,90,117440512,171840634880,1463,0.211545,517.03,812313
1,CUTLASS,gemm,cutlass3x_sm90_tensorop_gemm_f16_f16_f32_f16_f16_128x256x64_2x1x1_0_tnn_align8_warpspecialized_epi_nosmem,passed,success,universal,4096,5120,4096,f16:row,f16:column,f16:column,f16:column,1,0,serial,1,1,heuristic,invalid,invalid,false,false,1,tensorop,f32,128,256,64,2,1,1,0,0,0,4,4,1,1,64,256,16,90,90,117440512,171840634880,1463,3.81656,28.658,45025
1,CUTLASS,gemm,cutlass3x_sm90_tensorop_gemm_f16_f16_f32_f16_f16_128x256x64_2x1x1_0_tnn_align8_warpspecialized_pingpong_epi_tma,passed,success,universal,4096,5120,4096,f16:row,f16:column,f16:column,f16:column,1,0,serial,1,1,heuristic,invalid,invalid,false,false,1,tensorop,f32,128,256,64,2,1,1,0,0,0,4,4,1,1,64,256,16,90,90,117440512,171840634880,1463,4.41499,24.7735,38922.1
1,CUTLASS,gemm,cutlass3x_sm90_tensorop_gemm_f16_f16_f32_f16_f16_128x256x64_2x1x1_0_tnn_align8_warpspecialized_pingpong_epi_nosmem,passed,success,universal,4096,5120,4096,f16:row,f16:column,f16:column,f16:column,1,0,serial,1,1,heuristic,invalid,invalid,false,false,1,tensorop,f32,128,256,64,2,1,1,0,0,0,4,4,1,1,64,256,16,90,90,117440512,171840634880,1463,4.1957,26.0683,40956.3
1,CUTLASS,gemm,cutlass3x_sm90_tensorop_gemm_f16_f16_f32_f16_f16_128x256x64_2x1x1_0_tnn_align8_warpspecialized_cooperative_epi_nosmem,passed,success,universal,4096,5120,4096,f16:row,f16:column,f16:column,f16:column,1,0,serial,1,1,heuristic,invalid,invalid,false,false,1,tensorop,f32,128,256,64,2,1,1,0,0,0,4,4,2,1,64,256,16,90,90,117440512,171840634880,1463,0.211466,517.222,812615
1,CUTLASS,gemm,cutlass3x_sm90_tensorop_gemm_f16_f16_f32_f16_f16_128x256x64_2x1x1_0_tnn_align8_warpspecialized_cooperative_epi_tma,passed,success,universal,4096,5120,4096,f16:row,f16:column,f16:column,f16:column,1,0,serial,1,1,heuristic,invalid,invalid,false,false,1,tensorop,f32,128,256,64,2,1,1,0,0,0,4,4,2,1,64,256,16,90,90,117440512,171840634880,1463,0.203123,538.468,845995
1,CUTLASS,gemm,cutlass3x_sm90_tensorop_gemm_f16_f16_f32_f16_f16_128x256x64_2x1x1_0_tnn_align8_stream_k_warpspecialized_cooperative_epi_nosmem,passed,success,universal,4096,5120,4096,f16:row,f16:column,f16:column,f16:column,1,0,serial,1,1,heuristic,invalid,invalid,false,false,1,tensorop,f32,128,256,64,2,1,1,0,0,0,4,4,2,1,64,256,16,90,90,117440512,171840634880,1463,0.216572,505.027,793456
1,CUTLASS,gemm,cutlass3x_sm90_tensorop_gemm_f16_f16_f32_f16_f16_128x256x64_2x1x1_0_tnn_align8_stream_k_warpspecialized_cooperative_epi_tma,passed,success,universal,4096,5120,4096,f16:row,f16:column,f16:column,f16:column,1,0,serial,1,1,heuristic,invalid,invalid,false,false,1,tensorop,f32,128,256,64,2,1,1,0,0,0,4,4,2,1,64,256,16,90,90,117440512,171840634880,1463,0.206355,530.033,832742
1,CUTLASS,gemm,cutlass3x_sm90_tensorop_gemm_f16_f16_f32_f16_f16_128x256x64_2x2x1_0_tnn_align8,passed,success,universal,4096,5120,4096,f16:row,f16:column,f16:column,f16:column,1,0,serial,1,1,heuristic,invalid,invalid,false,false,1,tensorop,f32,128,256,64,2,2,1,0,0,0,4,4,2,1,64,256,16,90,90,117440512,171840634880,1463,0.255442,428.18,672719
1,CUTLASS,gemm,cutlass3x_sm90_tensorop_gemm_f16_f16_f32_f16_f16_128x256x64_2x2x1_0_tnn_align8_warpspecialized_epi_nosmem,passed,success,universal,4096,5120,4096,f16:row,f16:column,f16:column,f16:column,1,0,serial,1,1,heuristic,invalid,invalid,false,false,1,tensorop,f32,128,256,64,2,2,1,0,0,0,4,4,1,1,64,256,16,90,90,117440512,171840634880,1463,4.175,26.1976,41159.4
1,CUTLASS,gemm,cutlass3x_sm90_tensorop_gemm_f16_f16_f32_f16_f16_128x256x64_2x2x1_0_tnn_align8_warpspecialized_pingpong_epi_tma,passed,success,universal,4096,5120,4096,f16:row,f16:column,f16:column,f16:column,1,0,serial,1,1,heuristic,invalid,invalid,false,false,1,tensorop,f32,128,256,64,2,2,1,0,0,0,4,4,1,1,64,256,16,90,90,117440512,171840634880,1463,5.05353,21.6433,34004.1
1,CUTLASS,gemm,cutlass3x_sm90_tensorop_gemm_f16_f16_f32_f16_f16_128x256x64_2x2x1_0_tnn_align8_warpspecialized_pingpong_epi_nosmem,passed,success,universal,4096,5120,4096,f16:row,f16:column,f16:column,f16:column,1,0,serial,1,1,heuristic,invalid,invalid,false,false,1,tensorop,f32,128,256,64,2,2,1,0,0,0,4,4,1,1,64,256,16,90,90,117440512,171840634880,1463,4.82255,22.6799,35632.7
1,CUTLASS,gemm,cutlass3x_sm90_tensorop_gemm_f16_f16_f32_f16_f16_128x256x64_2x2x1_0_tnn_align8_warpspecialized_cooperative_epi_nosmem,passed,success,universal,4096,5120,4096,f16:row,f16:column,f16:column,f16:column,1,0,serial,1,1,heuristic,invalid,invalid,false,false,1,tensorop,f32,128,256,64,2,2,1,0,0,0,4,4,2,1,64,256,16,90,90,117440512,171840634880,1463,0.256036,427.187,671159
1,CUTLASS,gemm,cutlass3x_sm90_tensorop_gemm_f16_f16_f32_f16_f16_128x256x64_2x2x1_0_tnn_align8_warpspecialized_cooperative_epi_tma,passed,success,universal,4096,5120,4096,f16:row,f16:column,f16:column,f16:column,1,0,serial,1,1,heuristic,invalid,invalid,false,false,1,tensorop,f32,128,256,64,2,2,1,0,0,0,4,4,2,1,64,256,16,90,90,117440512,171840634880,1463,0.241978,452.004,710150
1,CUTLASS,gemm,cutlass3x_sm90_tensorop_gemm_f16_f16_f32_f16_f16_128x256x64_2x2x1_0_tnn_align8_stream_k_warpspecialized_cooperative_epi_nosmem,passed,success,universal,4096,5120,4096,f16:row,f16:column,f16:column,f16:column,1,0,serial,1,1,heuristic,invalid,invalid,false,false,1,tensorop,f32,128,256,64,2,2,1,0,0,0,4,4,2,1,64,256,16,90,90,117440512,171840634880,1463,0.238458,458.676,720632
1,CUTLASS,gemm,cutlass3x_sm90_tensorop_gemm_f16_f16_f32_f16_f16_128x256x64_2x2x1_0_tnn_align8_stream_k_warpspecialized_cooperative_epi_tma,passed,success,universal,4096,5120,4096,f16:row,f16:column,f16:column,f16:column,1,0,serial,1,1,heuristic,invalid,invalid,false,false,1,tensorop,f32,128,256,64,2,2,1,0,0,0,4,4,2,1,64,256,16,90,90,117440512,171840634880,1463,0.227286,481.222,756054
1,CUTLASS,gemm,cutlass3x_sm90_tensorop_gemm_f16_f16_f32_f16_f16_128x256x64_1x4x1_0_tnn_align8,passed,success,universal,4096,5120,4096,f16:row,f16:column,f16:column,f16:column,1,0,serial,1,1,heuristic,invalid,invalid,false,false,1,tensorop,f32,128,256,64,1,4,1,0,0,0,4,4,2,1,64,256,16,90,90,117440512,171840634880,1463,0.253643,431.217,677490
1,CUTLASS,gemm,cutlass3x_sm90_tensorop_gemm_f16_f16_f32_f16_f16_128x256x64_1x4x1_0_tnn_align8_warpspecialized_epi_nosmem,passed,success,universal,4096,5120,4096,f16:row,f16:column,f16:column,f16:column,1,0,serial,1,1,heuristic,invalid,invalid,false,false,1,tensorop,f32,128,256,64,1,4,1,0,0,0,4,4,1,1,64,256,16,90,90,117440512,171840634880,1463,4.17954,26.1692,41114.7
1,CUTLASS,gemm,cutlass3x_sm90_tensorop_gemm_f16_f16_f32_f16_f16_128x256x64_1x4x1_0_tnn_align8_warpspecialized_pingpong_epi_tma,passed,success,universal,4096,5120,4096,f16:row,f16:column,f16:column,f16:column,1,0,serial,1,1,heuristic,invalid,invalid,false,false,1,tensorop,f32,128,256,64,1,4,1,0,0,0,4,4,1,1,64,256,16,90,90,117440512,171840634880,1463,5.0596,21.6173,33963.3
1,CUTLASS,gemm,cutlass3x_sm90_tensorop_gemm_f16_f16_f32_f16_f16_128x256x64_1x4x1_0_tnn_align8_warpspecialized_pingpong_epi_nosmem,passed,success,universal,4096,5120,4096,f16:row,f16:column,f16:column,f16:column,1,0,serial,1,1,heuristic,invalid,invalid,false,false,1,tensorop,f32,128,256,64,1,4,1,0,0,0,4,4,1,1,64,256,16,90,90,117440512,171840634880,1463,4.82705,22.6588,35599.5
1,CUTLASS,gemm,cutlass3x_sm90_tensorop_gemm_f16_f16_f32_f16_f16_128x256x64_1x4x1_0_tnn_align8_warpspecialized_cooperative_epi_nosmem,passed,success,universal,4096,5120,4096,f16:row,f16:column,f16:column,f16:column,1,0,serial,1,1,heuristic,invalid,invalid,false,false,1,tensorop,f32,128,256,64,1,4,1,0,0,0,4,4,2,1,64,256,16,90,90,117440512,171840634880,1463,0.254366,429.991,675564
1,CUTLASS,gemm,cutlass3x_sm90_tensorop_gemm_f16_f16_f32_f16_f16_128x256x64_1x4x1_0_tnn_align8_warpspecialized_cooperative_epi_tma,passed,success,universal,4096,5120,4096,f16:row,f16:column,f16:column,f16:column,1,0,serial,1,1,heuristic,invalid,invalid,false,false,1,tensorop,f32,128,256,64,1,4,1,0,0,0,4,4,2,1,64,256,16,90,90,117440512,171840634880,1463,0.242643,450.765,708204
